{
  "metadata": {
    "title": "The effect of alkali metal oxide modified γ-Al<ce:inf loc=post>2</ce:inf>O<ce:inf loc=post>3</ce:inf> on the highly selective preparation of α-Olefin from Fatty Alcohol",
    "authors": "; ; ",
    "journal": "Molecular Catalysis",
    "date": "2025-06-15",
    "doi": "10.1016/j.mcat.2025.115142",
    "abstract": "",
    "uri": "https://api.elsevier.com/content/article/pii/S246882312500327X",
    "pii": "S246882312500327X"
  },
  "fulltext": {
    "full-text-retrieval-response": {
      "scopus-eid": "2-s2.0-105003177292",
      "originalText": "serial JL 315758 291210 291744 291790 291809 31 Molecular Catalysis MOLECULARCATALYSIS 2025-04-23 2025-04-23 2025-04-23 2025-04-23 2025-05-07T07:56:13 1-s2.0-S246882312500327X S2468-8231(25)00327-X S246882312500327X 10.1016/j.mcat.2025.115142 S300 S300.1 FULL-TEXT 1-s2.0-S2468823125X00080 2025-05-07T07:05:45.870547Z 0 0 20250615 2025 2025-04-23T21:50:52.120199Z absattachment articleinfo articlenumber articletitlenorm authfirstinitialnorm authfirstsurnamenorm cid cids contenttype copyright crossmark dateloaded dateloadedtxt datesearch datesort dateupdated dco docsubtype doctype doi eid ewtransactionid hubeid indexeddate issn issnnorm itemstage itemtransactionid itemweight openaccess openarchive pg pgfirst pii piinorm pubdatestart pubdatetxt pubyr sectiontitle sortorder srctitle srctitlenorm srctype ssids alllist content subj subheadings suppl tomb volfirst volissue volumelist webpdf webpdfpagecount yearnav figure table e-component body mmlmath acknowledge affil appendices articletitle auth authfirstini authfull authkeywords authlast grantnumber grantsponsor highlightsabst orcid primabst pubtype ref specialabst 2468-8231 24688231 true 581 581 C Volume 581 9 115142 115142 115142 20250615 15 June 2025 2025-06-15 2025 Regular Papers article fla © 2025 Elsevier B.V. All rights are reserved, including those for text and data mining, AI training, and similar technologies. EFFECTALKALIMETALOXIDEMODIFIEDAL2O3HIGHLYSELECTIVEPREPARATIONOLEFINFATTYALCOHOL ZHANG H 1 Introduction 2 Experimental 2.1 Materials 2.2 Catalyst preparation 2.3 Catalyst characterizations 2.4 Computational methods 2.5 Activity test and product analysis 3 Results and discussion 3.1 Catalytic performance 3.2 Catalyst characterizations 3.3 Reaction mechanism 4 Conclusion CRediT authorship contribution statement Acknowledgments Appendix Supplementary materials References VENNESTROM 2011 10502 10509 P FRANKE 2012 5675 5732 R ITTEL 2000 1169 1204 S MASHAYEKHI 2023 113403 M KARRE 2022 967 987 A GHOGIA 2021 117906 A ZEPEDA 2025 114870 T IVANEZ 2023 1381 1390 O YANG 2019 14176 14187 S MANYIK 1977 197 209 R DIXON 2004 3641 3668 J ALFEROV 2017 71 124 K XU 2018 2488 2497 Z ALZAMLY 2022 214522 A ZHAO 2021 12970 12977 L ZHANG 2022 e202202017 Z NOOTO 2025 114898 C KRAUS 2012 3003 3005 G MILLER 1993 18 20 J MAETANI 2011 1389 1394 S MURRAY 2014 3517 3520 R ZHANG 2020 4456 4459 Z HIDAJAT 2022 7556 7573 M WU 2017 4287 4296 C WU 2009 67 70 L LARSEN 1997 67 75 G MACHT 2004 479 491 J SUN 2017 21 28 D MIN 2022 131766 H ZHAO 2022 795 803 Z WANG 2022 10073 10080 R ALI 2020 3701 3708 A KIM 2020 118791 Y CHEN 2020 4388 4396 M KRESSE 1996 11169 11186 G KRESSE 1999 1758 1775 G PERDEW 1996 3865 3868 J PINTO 2004 125402 H CHEN 2009 277 281 Y HENKELMAN 2000 9901 9904 G WANG 2019 166 179 X LIU 2008 5066 5073 X BARZETTI 1996 1401 1407 T BASILA 1964 3197 3207 M EMEIS 1993 347 354 C WU 2024 112174 P YANG 2016 2041821 W JIAO 2014 47012 47020 X YIN 2023 1256 1267 L ZHU 2019 2636 2644 Q LEE 2021 2850 H LIU 2023 1264 1276 C EZHOVA 2020 459 470 N JORKE 2017 10 14 A HIDAJAT 2023 145376 M ZHANGX2025X115142 ZHANGX2025X115142XH 2027-04-23T00:00:00.000Z 2027-04-23T00:00:00.000Z http://creativecommons.org/licenses/by-nc-nd/4.0/ © 2025 Elsevier B.V. All rights are reserved, including those for text and data mining, AI training, and similar technologies. 2025-04-26T01:45:14.727Z http://vtw.elsevier.com/data/voc/AddOnTypes/50.7/aggregated-refined Natural Science Foundation of Sichuan Province 2024NSFSC1109 B17030 Natural Science Foundation of Sichuan Province http://data.elsevier.com/vocabulary/SciValFunders/501100018542 http://sws.geonames.org/1814991/ National Natural Science Foundation of China 22272113 22202224 National Natural Science Foundation of China http://data.elsevier.com/vocabulary/SciValFunders/501100001809 http://sws.geonames.org/1814991 This work was supported by National Natural Science Foundation of China (22272113 and 22202224), Natural Science Foundation of Sichuan Province, China (No. 2024NSFSC1109) and 111 project (B17030). https://doi.org/10.15223/policy-017 https://doi.org/10.15223/policy-037 https://doi.org/10.15223/policy-012 https://doi.org/10.15223/policy-029 https://doi.org/10.15223/policy-004 item S2468-8231(25)00327-X S246882312500327X 1-s2.0-S246882312500327X 10.1016/j.mcat.2025.115142 315758 2025-05-07T07:05:45.870547Z 2025-06-15 1-s2.0-S246882312500327X-main.pdf https://s3-eu-west-1.amazonaws.com/prod-ucs-content-store-eu-west/content/pii:S246882312500327X/MAIN/application/pdf/78303014520545e77cd98fbb93333e48/main.pdf main.pdf pdf true 3835726 MAIN 8 1-s2.0-S246882312500327X-main_1.png https://s3-eu-west-1.amazonaws.com/prod-ucs-content-store-eu-west/content/pii:S246882312500327X/PREVIEW/image/png/b6d361a3ca3e4a28da8493a2aa8b45f4/main_1.png main_1.png png 58494 849 656 IMAGE-WEB-PDF 1 1-s2.0-S246882312500327X-gr2.jpg https://s3-eu-west-1.amazonaws.com/prod-ucs-content-store-eu-west/content/pii:S246882312500327X/gr2/DOWNSAMPLED/image/jpeg/9987a03e8af72eddff79385412738dab/gr2.jpg gr2 gr2.jpg jpg 57408 299 527 IMAGE-DOWNSAMPLED 1-s2.0-S246882312500327X-ga1.jpg https://s3-eu-west-1.amazonaws.com/prod-ucs-content-store-eu-west/content/pii:S246882312500327X/ga1/DOWNSAMPLED/image/jpeg/76d286b4deff2a02f9db5745385aa34b/ga1.jpg ga1 true ga1.jpg jpg 28351 183 500 IMAGE-DOWNSAMPLED 1-s2.0-S246882312500327X-gr1.jpg https://s3-eu-west-1.amazonaws.com/prod-ucs-content-store-eu-west/content/pii:S246882312500327X/gr1/DOWNSAMPLED/image/jpeg/3655c6553ad984809dcc5986c4ece20f/gr1.jpg gr1 gr1.jpg jpg 77869 318 781 IMAGE-DOWNSAMPLED 1-s2.0-S246882312500327X-gr6.jpg https://s3-eu-west-1.amazonaws.com/prod-ucs-content-store-eu-west/content/pii:S246882312500327X/gr6/DOWNSAMPLED/image/jpeg/4bc57c50b4a98d0a016e44a09ab3f7cf/gr6.jpg gr6 gr6.jpg jpg 52102 287 781 IMAGE-DOWNSAMPLED 1-s2.0-S246882312500327X-gr5.jpg https://s3-eu-west-1.amazonaws.com/prod-ucs-content-store-eu-west/content/pii:S246882312500327X/gr5/DOWNSAMPLED/image/jpeg/8f1f43d53762885dc12e6bbbef2fb399/gr5.jpg gr5 gr5.jpg jpg 43839 222 393 IMAGE-DOWNSAMPLED 1-s2.0-S246882312500327X-gr4.jpg https://s3-eu-west-1.amazonaws.com/prod-ucs-content-store-eu-west/content/pii:S246882312500327X/gr4/DOWNSAMPLED/image/jpeg/3ef4ba869d4d87c788f3a2b081b1a161/gr4.jpg gr4 gr4.jpg jpg 158649 651 772 IMAGE-DOWNSAMPLED 1-s2.0-S246882312500327X-gr3.jpg https://s3-eu-west-1.amazonaws.com/prod-ucs-content-store-eu-west/content/pii:S246882312500327X/gr3/DOWNSAMPLED/image/jpeg/5cd94e97750ad790b488a90d2289cbd1/gr3.jpg gr3 gr3.jpg jpg 38772 268 389 IMAGE-DOWNSAMPLED 1-s2.0-S246882312500327X-gr2.sml https://s3-eu-west-1.amazonaws.com/prod-ucs-content-store-eu-west/content/pii:S246882312500327X/gr2/THUMBNAIL/image/gif/726bcf292b860800d607a8d936d7ee98/gr2.sml gr2 gr2.sml sml 13444 124 219 IMAGE-THUMBNAIL 1-s2.0-S246882312500327X-ga1.sml https://s3-eu-west-1.amazonaws.com/prod-ucs-content-store-eu-west/content/pii:S246882312500327X/ga1/THUMBNAIL/image/gif/28bc50fd85aab4a80c5533110f256c07/ga1.sml ga1 true ga1.sml sml 8322 80 219 IMAGE-THUMBNAIL 1-s2.0-S246882312500327X-gr1.sml https://s3-eu-west-1.amazonaws.com/prod-ucs-content-store-eu-west/content/pii:S246882312500327X/gr1/THUMBNAIL/image/gif/f7abcd427bb730e711dccf8a4364e21c/gr1.sml gr1 gr1.sml sml 11961 89 219 IMAGE-THUMBNAIL 1-s2.0-S246882312500327X-gr6.sml https://s3-eu-west-1.amazonaws.com/prod-ucs-content-store-eu-west/content/pii:S246882312500327X/gr6/THUMBNAIL/image/gif/8f60ff43723e277df92905796f7ae627/gr6.sml gr6 gr6.sml sml 7862 80 219 IMAGE-THUMBNAIL 1-s2.0-S246882312500327X-gr5.sml https://s3-eu-west-1.amazonaws.com/prod-ucs-content-store-eu-west/content/pii:S246882312500327X/gr5/THUMBNAIL/image/gif/e04fa470bfb218413f1ffb2074c557be/gr5.sml gr5 gr5.sml sml 14015 124 219 IMAGE-THUMBNAIL 1-s2.0-S246882312500327X-gr4.sml https://s3-eu-west-1.amazonaws.com/prod-ucs-content-store-eu-west/content/pii:S2468823125003232/gr4/THUMBNAIL/image/gif/dcea9184f1956214b2567d13cd22fa31/gr4.sml gr4 gr4.sml sml 15174 164 194 IMAGE-THUMBNAIL 1-s2.0-S246882312500327X-gr3.sml https://s3-eu-west-1.amazonaws.com/prod-ucs-content-store-eu-west/content/pii:S246882312500327X/gr3/THUMBNAIL/image/gif/0863ac11b1d3244ed730bc758fd54204/gr3.sml gr3 gr3.sml sml 16026 151 219 IMAGE-THUMBNAIL 1-s2.0-S246882312500327X-gr2_lrg.jpg https://s3-eu-west-1.amazonaws.com/prod-ucs-content-store-eu-west/content/pii:S246882312500327X/HIGHRES/image/jpeg/d1fdc75afc37f608bd246ed1b9d62e80/gr2_lrg.jpg gr2 gr2_lrg.jpg jpg 451048 1323 2333 IMAGE-HIGH-RES 1-s2.0-S246882312500327X-ga1_lrg.jpg https://s3-eu-west-1.amazonaws.com/prod-ucs-content-store-eu-west/content/pii:S246882312500327X/HIGHRES/image/jpeg/4bf83aa57c5095d0d9e01d2ae5d9705a/ga1_lrg.jpg ga1 true ga1_lrg.jpg jpg 220455 809 2213 IMAGE-HIGH-RES 1-s2.0-S246882312500327X-gr1_lrg.jpg https://s3-eu-west-1.amazonaws.com/prod-ucs-content-store-eu-west/content/pii:S246882312500327X/HIGHRES/image/jpeg/bb5fb029321198b3dc2334e9ffa6baaa/gr1_lrg.jpg gr1 gr1_lrg.jpg jpg 653750 1408 3458 IMAGE-HIGH-RES 1-s2.0-S246882312500327X-gr6_lrg.jpg https://s3-eu-west-1.amazonaws.com/prod-ucs-content-store-eu-west/content/pii:S246882312500327X/HIGHRES/image/jpeg/666d6ca02edbdde2ca2c694125679be5/gr6_lrg.jpg gr6 gr6_lrg.jpg jpg 407052 1270 3458 IMAGE-HIGH-RES 1-s2.0-S246882312500327X-gr5_lrg.jpg https://s3-eu-west-1.amazonaws.com/prod-ucs-content-store-eu-west/content/pii:S246882312500327X/HIGHRES/image/jpeg/402c9b5d01d56bfabffe294cc5f649f0/gr5_lrg.jpg gr5 gr5_lrg.jpg jpg 371357 983 1742 IMAGE-HIGH-RES 1-s2.0-S246882312500327X-gr4_lrg.jpg https://s3-eu-west-1.amazonaws.com/prod-ucs-content-store-eu-west/content/pii:S2468823125003372/HIGHRES/image/jpeg/24eb5c106623d2b159c5606c6bd83bb2/gr4_lrg.jpg gr4 gr4_lrg.jpg jpg 1173114 2880 3417 IMAGE-HIGH-RES 1-s2.0-S246882312500327X-gr3_lrg.jpg https://s3-eu-west-1.amazonaws.com/prod-ucs-content-store-eu-west/content/pii:S2468823125003244/HIGHRES/image/jpeg/ed781e551eb1074cfb4f25a010a71cc5/gr3_lrg.jpg gr3 gr3_lrg.jpg jpg 296025 1189 1725 IMAGE-HIGH-RES 1-s2.0-S246882312500327X-mmc1.docx https://s3-eu-west-1.amazonaws.com/prod-ucs-content-store-eu-west/content/pii:S246882312500327X/mmc1/MAIN/application/vnd.openxmlformats-officedocument.wordprocessingml.document/df882f84bedf28ec69ac772aa86c5893/mmc1.docx mmc1 mmc1.docx docx 2829684 APPLICATION 1-s2.0-S246882312500327X-si1.svg https://s3-eu-west-1.amazonaws.com/prod-ucs-content-store-eu-west/content/pii:S246882312500327X/image/svg+xml/853b9d80a9e6a0f340dd24f3de8fce7a/si1.svg si1 si1.svg svg 7860 ALTIMG 1-s2.0-S246882312500327X-si2.svg https://s3-eu-west-1.amazonaws.com/prod-ucs-content-store-eu-west/content/pii:S246882312500327X/image/svg+xml/2b68f9caf055ba504b407db7795772c8/si2.svg si2 si2.svg svg 4427 ALTIMG 1-s2.0-S246882312500327X-si3.svg https://s3-eu-west-1.amazonaws.com/prod-ucs-content-store-eu-west/content/pii:S246882312500327X/image/svg+xml/f3705d2b21110b4b5ee62ff442069bdd/si3.svg si3 si3.svg svg 4807 ALTIMG 1-s2.0-S246882312500327X-si4.svg https://s3-eu-west-1.amazonaws.com/prod-ucs-content-store-eu-west/content/pii:S246882312500327X/image/svg+xml/c78e4bb950f684abc7c1d720fb96b561/si4.svg si4 si4.svg svg 21887 ALTIMG 1-s2.0-S246882312500327X-si5.svg https://s3-eu-west-1.amazonaws.com/prod-ucs-content-store-eu-west/content/pii:S246882312500327X/image/svg+xml/18f72bf99c4f6cc25724c427016fcf7d/si5.svg si5 si5.svg svg 19335 ALTIMG 1-s2.0-S246882312500327X-si6.svg https://s3-eu-west-1.amazonaws.com/prod-ucs-content-store-eu-west/content/pii:S246882312500327X/image/svg+xml/2de1d3d4b5c76f635efa50af624bf2bd/si6.svg si6 si6.svg svg 22039 ALTIMG MCAT 115142 115142 S2468-8231(25)00327-X 10.1016/j.mcat.2025.115142 Fig. 1 (a) Catalytic performance of K2O/γ-Al2O3, Na2O/γ-Al2O3, BaO/γ-Al2O3, CaO/γ-Al2O3, MgO/γ-Al2O3 and γ-Al2O3 catalysts in the conversion of 1-decanol. (b) GC diagrams of different catalysts. (c) Stability test of the K2O/γ-Al2O3 catalyst. Reaction conditions: 3 g of catalyst, 300 °C, 5 h, 0.1 MPa N2, LHSV = 0.3 h-1, GHSV = 1400 h-1. Fig 1 Fig. 2 (a) XRD patterns of K2O/γ-Al2O3, Na2O/γ-Al2O3, BaO/γ-Al2O3, CaO/γ-Al2O3, MgO/γ-Al2O3 and γ-Al2O3 catalysts. (b) enlarged XRD patterns (from 63° to 70°) of different catalysts. (c) Nitrogen adsorption-desorption isotherms of different catalysts. Fig 2 Fig. 3 (a) Py-IR and (b) CO2-TPD profiles for K2O/γ-Al2O3, Na2O/γ-Al2O3, BaO/γ-Al2O3, CaO/γ-Al2O3, MgO/γ-Al2O3 and γ-Al2O3 catalysts. Fig 3 Fig. 4 in situ DRIFTS spectra of 1-decanol absorption on (a) K2O/γ-Al2O3, (b) BaO/γ-Al2O3, (c) MgO/γ-Al2O3 catalysts from 3300 to 2000 cm-1 and (d) decyl ether absorption on the K2O/γ-Al2O3 catalyst from 3300 to 1000 cm-1 at 50–300 °C (with enlarged spectra). Fig 4 Fig. 5 The energy profile of dehydration of 1-butanol to form butene on K2O/γ-Al2O3, BaO/γ-Al2O3 and MgO/γ-Al2O3 catalysts. Fig 5 Fig. 6 The schematic diagrams of the fatty alcohol dehydration process on the surface of alkali and alkaline earth metal oxides impregnated γ-Al2O3-based catalysts. Fig 6 Table 1 The activity results and physicochemical properties of K2O/γ-Al2O3, Na2O/γ-Al2O3, BaO/γ-Al2O3, CaO/γ-Al2O3, MgO/γ-Al2O3 and γ-Al2O3 catalysts. Table 1 Catalyst 1-Decanol Conversion ( %) α-Decene selectivity ( %) BET Surface Area (m2 g-1) Lewis Acid (mmol g-1) Weak Base (mmol g-1) Medium Base (mmol g-1) K2O/γ-Al2O3 100.0 92.6 184.0 0.049 0.058 0.030 Na2O/γ-Al2O3 100.0 89.3 182.1 0.103 0.089 0.013 BaO/γ-Al2O3 100.0 76.7 178.0 0.131 0.093 0.011 CaO/γ-Al2O3 100.0 55.6 177.4 0.136 0.095 0.010 MgO/γ-Al2O3 100.0 12.6 170.3 0.158 0.097 0.009 γ-Al2O3 100.0 7.7 171.2 0.208 0.346 0.097 Research Paper The effect of alkali metal oxide modified γ-Al2O3 on the highly selective preparation of α-Olefin from Fatty Alcohol Hualong Zhang Writing – review & editing Writing – original draft Methodology Investigation Data curation Conceptualization a Liying An Formal analysis b d Jinjia Liu Writing – review & editing Formal analysis b d ⁎ Jiwei Tan Investigation a Longyao Li Investigation a Chao Juan Formal analysis a Hui Xin Writing – review & editing c ⁎⁎ Cuncun Xiao Investigation a Mengyuan Ren Investigation a Xiaodong Wen Writing – review & editing b d Dan Li Writing – review & editing Supervision Project administration Funding acquisition a ⁎⁎⁎ Changwei Hu Writing – review & editing a a Key Laboratory of Green Chemistry and Technology, Ministry of Education; National and Local Joint Engineering Laboratory of Energy Plant Biofuel Preparation and Utilization, College of Chemistry, Sichuan University, Chengdu, Sichuan, 610064, PR China Key Laboratory of Green Chemistry and Technology, Ministry of Education; National and Local Joint Engineering Laboratory of Energy Plant Biofuel Preparation and Utilization College of Chemistry, Sichuan University Chengdu Sichuan 610064 PR China aKey Laboratory of Green Chemistry and Technology, Ministry of Education; National and Local Joint Engineering Laboratory of Energy Plant Biofuel Preparation and Utilization, College of Chemistry, Sichuan University, Chengdu, Sichuan, 610064, PR China b State Key Laboratory of Coal Conversion, Institute of Coal Chemistry, Chinese Academy of Sciences, Taiyuan, 030001, PR China State Key Laboratory of Coal Conversion, Institute of Coal Chemistry, Chinese Academy of Sciences Taiyuan 030001 PR China bState Key Laboratory of Coal Conversion, Institute of Coal Chemistry, Chinese Academy of Sciences, Taiyuan, 030001, PR China c Analytical & Testing Center, Sichuan University, Chengdu, Sichuan, 610064, PR China Analytical & Testing Center, Sichuan University Chengdu Sichuan 610064 PR China cAnalytical & Testing Center, Sichuan University, Chengdu, Sichuan, 610064, PR China d National Energy Center for Coal to Clean Fuels, Synfuels China Co., Ltd, Beijing, 101400, PR China National Energy Center for Coal to Clean Fuels, Synfuels China Co., Ltd Beijing 101400 PR China dNational Energy Center for Coal to Clean Fuels, Synfuels China Co., Ltd, Beijing, 101400, PR China ⁎ Corresponding author at: State Key Laboratory of Coal Conversion, Institute of Coal Chemistry, Chinese Academy of Sciences, Taiyuan, 030001, People’s Republic of China; National Energy Center for Coal to Clean Fuels, Synfuels China Co., Ltd, Beijing, 101400, PR China. State Key Laboratory of Coal Conversion, Institute of Coal Chemistry, Chinese Academy of Sciences, Taiyuan, 030001, People’s Republic of China; National Energy Center for Coal to Clean Fuels, Synfuels China Co., Ltd Beijing 101400 PR China ⁎⁎ Corresponding author at: Analytical & Testing Center, Sichuan University, Chengdu, Sichuan, 610064, PR China. Analytical & Testing Center, Sichuan University Chengdu Sichuan 610064 PR China ⁎⁎⁎ Corresponding author at: Key Laboratory of Green Chemistry and Technology, Ministry of Education; National and Local Joint Engineering Laboratory of Energy Plant Biofuel Preparation and Utilization, College of Chemistry, Sichuan University, Chengdu, Sichuan, 610064, PR China. Key Laboratory of Green Chemistry and Technology Ministry of Education; National and Local Joint Engineering Laboratory of Energy Plant Biofuel Preparation and Utilization College of Chemistry Sichuan University Chengdu Sichuan 610064 PR China Linear α-olefins (LAOs) are high-value chemicals primarily derived from fossil-based resources. Therefore, the dehydration of biomass-derived fatty alcohols to produce LAOs has received widespread attention for its sustainability. However, achieving high selectivity for LAOs remains a significant challenge due to the higher thermodynamic stability of internal olefins. Additionally, there is still a lack of molecular-level understanding of the mechanism for the high-selectivity dehydration of long-chain fatty alcohols to produce LAOs. In this study, 1-decanol was selected as the model compound to investigate the dehydration process over a series of alkali metal oxides (K2O and Na2O) and alkaline earth metal oxides (BaO, CaO and MgO) modified γ-Al2O3 catalysts. Activity results showed that the K2O/γ-Al2O3 catalyst achieved the highest α-decene selectivity (92.6 %) among all catalysts under mild reaction conditions. Characterization results illustrated that a small amount of loaded metal oxides had little impact on the texture properties of γ-Al2O3, but significantly altered its surface acid/base properties. In situ DRIFTS and control experiment results demonstrated that the bimolecular dehydration process involving the intermediate decyl ether was the dominant reaction pathway. DFT calculation results indicated that K2O modified γ-Al2O3 catalyst could lower the dissociation energy barrier of the hydroxyl group while raising the energy barrier of β-hydrogen migration compared to BaO and MgO modified γ-Al2O3 catalysts, thereby effectively inhibiting the isomerization of α-olefin into internal olefins. Graphical abstract Image, graphical abstract Key Words Fatty alcohol Linear α-olefin Dehydration γ-Al2O3 Alkali metal oxide Heterogeneous catalysis Data availability The data that has been used is confidential. 1 Introduction Linear α-olefins (LAOs), with a terminal C=C bond in linear carbon chain (C8-C12), are significant organic feedstocks and intermediates, which are widely used as monomers for copolymer production as well as in the manufacture of polyolefins, surfactants, lubricants, plasticizers, and fine chemicals [1–4]. Currently, the main strategies for LAOs production are Fischer-Tropsch synthesis (F-T) and ethylene oligomerization. The former process uses iron or cobalt catalysts to convert syngas into α-olefins. Unfortunately, the selectivity of α-olefins is relatively low, and the high temperature and pressure conditions increase both capital and operational costs of the F-T process [5–7]. Meanwhile, both iron and cobalt catalysts always suffer from deactivation during reaction process due to the harsh reaction conditions [8,9]. For the ethylene oligomerization method, Ziegler-Natta catalysts are used to catalyze the polymerization of ethylene to produce LAOs with even carbon chain lengths [10–12]. However, controlling carbon chain growth to produce α-olefin with a specific and uniform chain length is quite challenging and the ethylene feedstock is primarily derived from fossil resources, which is an unsustainable method to manufacture LAOs [13,14]. Biomass, as a sustainable and renewable feedstock, has been used to prepare LAOs [15,16]. At present, this process mainly uses long-chain fatty acids and alcohols as feedstock [17]. Homogeneous catalysts such as Pd [18], Rh [19], Ir [20] and Ru [21] have been extensively studied for the fatty acids decarbonylative dehydration to produce LAOs. These methods employ ligands and a certain amount of sacrificial anhydride additives, combined with in situ distillation techniques to inhibit the formation of internal olefins. However, these noble-metal catalysts are difficult to recycle and reuse, making them economically unfeasible and far from meeting the industrial-scale requirements. Subsequently, Zhang et al. [22] used MoO x as a heterogeneous catalyst to perform the decarbonylative dehydration of fatty acids under solvent-free conditions, successfully achieving high α-olefin selectivity. However, the reaction still required stoichiometric amounts of acetic anhydride and phosphine ligands inevitably. Recent studies suggest that LAOs can be synthesized through the process of hydrogenating biomass-based fatty acids into fatty alcohols and then dehydrating fatty alcohols into LAOs [23]. As an alternative method, biomass-derived alcohol dehydration for the preparation of α-olefins has the advantages of high conversion and easy separation compared with fatty acids. Moreover, dehydration catalysts have been broadly studied for short-chain alcohols, such as the dehydration of ethanol to produce ethylene [24,25]. Among them, metal oxides are considered as promising catalysts [26–29], while Al2O3-based catalysts exhibit excellent performance in the catalytic preparation of α-olefins due to their porous structure and acid/base properties [30,31]. Ali et al. [32] prepared a physical mixture of nano-Al2O3 and ThO2 catalyst. When the mass ratio of Al2O3 and ThO2 was 6 : 1, 1-octadecanol was completely converted with a yield of 92 % for α-octadecene at 300 °C and 0.1 MPa N2. They believed that ThO2 hindered the isomerization and oligomerization of α-octadecene at high temperature, resulting in high α-olefin selectivity. Kim et al. [33] explored the effect of barium loaded on Al2O3 on the selectivity for α-octene. When the mass fraction of barium on the Ba/Al2O3 catalyst was 1.5 wt %, the highest conversion of 1-octanol was achieved with a selectivity of 85 % for 1-octene at 350 °C. The impregnated barium eliminated the strong Lewis acid sites, thereby inhibiting side reactions due to the re-adsorption of α-octene. Additionally, Chen et al. [34] developed a sodium-modified γ-Al2O3 catalyst, which could completely convert 1-decanol and achieve a high yield of α-decene under optimal reaction conditions. They believed that the modification with a small amount of sodium inhibited the strong acid sites and provided additional base sites, thus enhancing the selectivity of α-olefin. Although the high yield of LAOs has achieved from the dehydration of long-chain fatty alcohols, there are still some ambiguities among these investigated works. Firstly, although there have been reports on the modification of Al2O3 with alkali and alkaline earth metals separately for the production of α-olefins, the systematic studies are lacking in the current literature. Secondly, the mechanism of long-chain fatty alcohol dehydration, especially the formation of ether intermediate and the trade-offs between α-olefin and internal olefins, remains imprecise at the experimental level. In particular, the mechanism by which alkali metal modified γ-Al2O3 catalyst effectively hinders the formation of internal olefins has not been elucidated. In this work, we prepared a series of γ-Al2O3-based catalysts impregnated by alkali metal oxides (K2O and Na2O) and alkaline earth metal oxides (BaO, CaO and MgO) and investigated their catalytic performance and the mechanism for the conversion of 1-decanol to α-decene. Characterization results exhibited that γ-Al2O3 loaded with a small amount of alkali metal oxide (K2O) had relatively low Lewis acidity and high medium basicity without changing its intrinsic structure, achieving the highest α-decene selectivity (92.6 %). While on alkaline earth metal oxides modified γ-Al2O3 catalysts, 1-decanol dehydration primarily produced internal olefins. In situ DRIFTS results demonstrated that the conversion of 1-decanol to α-decene involved two sequential steps: first, the transformation of 1-decanol into decyl ether, followed by the conversion of decyl ether into α-decene. DFT calculation results revealed that the K2O/γ-Al2O3 catalyst had the lowest dissociation energy barrier of hydroxyl group and the highest β-hydrogen transfer energy barrier, which effectively suppressed the formation of internal olefins, thereby exhibiting high α-olefin selectivity. 2 Experimental 2.1 Materials γ-Al2O3 was purchased from Nanjing Xianfeng Nanotechnology Company, China. Analytical grade KNO3, NaNO3, Ba(NO3)2, Ca(NO3)2·4H2O and Mg(NO3)2·6H2O were purchased from Chengdu Cologne Chemical Company, China and other reagents including 1-decanol (99 %), α-decene (99 %) and n-decyl ether (95 %) were purchased from Shanghai Macklin Biochemical Technology Company, China. 2.2 Catalyst preparation The catalysts were synthesized using the incipient-wetness impregnation method. Typically, 0.001 mol of KNO3 was dissolved in 46.2 mL deionized water, the resulting solution was slowly added to 10 g of the γ-Al2O3 (γ-Al2O3 was pretreated at 500 °C for 4 h before impregnation). The mixture was stirred uniformly and then left to stand for 12 h. Subsequently, the sample was evaporated in an oil bath at 80 °C and placed in an oven at 110 °C for 12 h. After drying, the sample was ground into fine powder and calcined at 600 °C in static air for 4 h. The resulting sample was denoted as K2O/γ-Al2O3. The preparation procedure of Na2O/γ-Al2O3, BaO/γ-Al2O3, CaO/γ-Al2O3 and MgO/γ-Al2O3 catalysts was the same as that of K2O/γ-Al2O3, and NaNO3, Ba(NO3)2, Ca(NO3)2·4H2O and Mg(NO3)2·6H2O were used as the source of metal, respectively. 2.3 Catalyst characterizations Powder X-ray diffraction (XRD) data was obtained using a Shimazu XRD-6100 diffractometer with Cu-Kα radiation (λ=1.5406 Å) at 40 kV and 30 mA. The scanning angle and speed were 30 – 80 ° and 5 ° min-1, respectively. The XRD patterns were used to analyze the crystal phase structure of the catalysts by Jade 9 software. Nitrogen adsorption-desorption experiments were conducted on a Micromeritics Tristar II 3020 analyzer. The samples were degassed under vacuum at 120 °C for 2 h and then heated to 300 °C for 2 h before testing. The specific surface area was obtained by Brunauer-Emmett-Teller (BET) equation, and the average pore size and volume were obtained by Barrett-Joyner-Halenda (BJH) method. Pyridine adsorption infrared spectroscopy (Py-IR) was performed on a BRUKER VERTEX 70 FT-IR spectrometer. A certain amount of sample was pretreated at 300 °C under vacuum for 1 h and then the background spectra were recorded during the cooling process. After adsorbing pyridine for 30 min at room temperature, the desorption spectra were obtained. All spectra were recorded at 4 cm-1 resolution with 16 co-added scans. CO2 temperature programmed desorption (CO2-TPD) was performed at Micromeritics Autochem II 2920 instrument. Approximately 0.1 g of sample was pretreated by heating to 300 °C under high-purity He gas flow (25 mL min-1) for 1 h and then cooling to 50 °C. CO2-He mixture (10 % CO2/He) was used to substitute He gas flow, where the CO2 adsorption was performed at 50 °C for 1 h. Subsequently, the sample was purged with He gas flow for 1 h to remove physically adsorbed CO2 on the surface, and then heated to 500 °C at the heating rate of 10 °C min-1 in the He gas flow for CO2 desorption. The desorbed CO2 was detected by a thermal conductivity detector (TCD) to obtain the desorption curve and the amount of base was calculated using the calibration file obtained by a quantitative loop. In situ Diffuse Reflectance Infrared Fourier Transform Spectroscopy (in situ DRIFTS) was performed using the same instrument as Py-IR experiments. Firstly, the catalyst was pretreated at 300 °C for 1 h to remove impurities physically adsorbed on the surface and the background spectra were recorded during the cooling process. After the temperature was lowered to room temperature, 1-decanol was dropped on the surface of the catalyst for 30 min, and then the catalyst was heated to 300 °C to obtain the spectra (directly collected without remaining at every temperature point). The whole process was conducted in a nitrogen flow (100 mL min-1) and all spectra were recorded at 4 cm-1 resolution with 16 co-added scans. 2.4 Computational methods All spin-polarized calculations were conducted using the Vienna Ab initio Simulation Package (VASP) [35] with the projector augmented wave (PAW) method [36]. The electron interactions were treated using the Perdew-Burke-Ernzerhof (PBE) functional [37]. A cutoff of 400 eV was selected for the plane-wave basis set. In the calculation models, a supercell of γ-Al2O3 (001) was constructed, comprising 64 Al and 96 O atoms [38,39]. A vacuum layer of 15 Å was employed to eliminate periodic interactions. During the optimization calculations, the bottom four layers were fixed, while the top three layers were allowed to relax to their equilibrium positions. The Brillouin zone was sampled with a gamma-centered 2 × 2 × 1 k-point for all calculations. The convergence energy threshold was set to 10⁻5 eV, and the force on each atom was required to be within 0.02 eV/Å. The adsorption energy (E ads) was calculated using the following equation: (1) E a d s = E x / s l a b − E s l a b − E x where E x/slab represents the energy of the slab with adsorbates, E slab denotes the energy of the bare slab, and E x signifies the energy of the adsorbate in the free phase. Reaction energies (ΔE) were defined as (2) Δ E = E F S − E I S where EFS and EIS represents the final state energy and initial state energy, respectively. The reaction barrier (E a) was calculated using the following equation: (3) E a = E T S − E I S where ETS is the energy of the transition state and EIS is the energy of the initial state. All transition states were calculated using the climbing image nudged elastic band method (CI-NEB), [40] with the stretching frequencies analyzed to ascertain whether a stationary point is a minimum state with only one imaginary frequency. 2.5 Activity test and product analysis The conversion of 1-decanol was performed in a fixed-bed reactor (The diameter and length of fixed-bed reactor were 13 mm and 500 mm, respectively, and the constant temperature zone was 120 mm). The lower layer of the reaction tube was filled with 32 g of inert silicate filler and 3 g of catalyst (crushed and sieved to 20–40 mesh before the experiment) and 12 g of silicate filler were mixed to fill the upper layer. The catalyst was heated to 300 °C at a rate of 5 °C min-1 in a nitrogen flow (GHSV= 1400 h-1) at ambient pressure and then 1-decanol was injected into the reactor (LHSV= 0.3 h-1). After 5 h of reaction, the reaction system was cooled down and the product was collected. All the products were dehydrated by anhydrous CaCl2 for analysis and product yield calculation. The activity tests of all catalysts were repeated three times. The stability test of the catalyst was conducted under the same reaction conditions as the activity test for 10 runs and the catalyst was not regenerated or purified after each run. Liquid product was quantitatively analyzed by gas chromatography (Panna A91) with a TCD detector. A HP-5 column (30 m × 0.25 mm × 0.25 μm) was used to separate the products and the injection port and detector temperature are 280 °C. Tetradecane was chosen as the internal standard for the quantitative analysis. The conversion of 1-decanol and the yield and selectivity of α-denece were calculated by the following equation: (4) Conv ersi on ( % ) = ( W 1 − deca nol , inje cted − W 1 − deca nol , coll ected ) / W 1 − deca nol , inje cted × 100 % (5) Yield ( % ) = ( W α − dece ne , coll ected / W 1 − deca nol , inje cted ) × 100 % (6) Sele ctiv ity ( % ) = ( W α − dece ne , coll ected / W prod ucts , coll ected ) × 100 % where W represents the weight of the substance. 3 Results and discussion 3.1 Catalytic performance Fig. 1 shows the catalytic activity of K2O/γ-Al2O3, Na2O/γ-Al2O3, BaO/γ-Al2O3, CaO/γ-Al2O3, MgO/γ-Al2O3 and γ-Al2O3 catalysts. The results illustrated that all catalysts could fully convert 1-decanol under ambient pressure at 300 °C. Among them, the K2O/γ-Al2O3 catalyst exhibited an outstanding performance compared to other catalysts in Fig. 1 (a), achieving an α-decene selectivity of 92.6 %, while the Na2O/γ-Al2O3, BaO/γ-Al2O3, CaO/γ-Al2O3, MgO/γ-Al2O3 and γ-Al2O3 catalysts showed decreasing selectivity for α-decene (89.3 %, 76.7 %, 55.6 %, 12.6 % and 7.7 %, respectively). In addition to α-decene, we also detected the formation of internal decenes, including 2-decene, 3-decene and 5-decene, as shown in Fig. 1 (b). The activity results suggested that a small amount of K2O and Na2O played an important role in the selective conversion of 1-decanol into α-decene, whereas BaO, CaO and MgO impregnated on γ-Al2O3 had a tendency to produce more internal decenes. To systematically evaluate the effect of K₂O loading on catalytic performance, we tested both higher (0.01 mol) and lower (0.0005 mol) loadings. As demonstrated in Fig. S1, the catalyst with 0.001 mol K2O exhibited superior activity and α-decene selectivity compared to other loadings, confirming 0.001 mol as the optimal loading amount. Considering the excellent catalytic activity of the K2O/γ-Al2O3 catalyst, we conducted the stability test as shown in Fig. 1 (c). The experimental results showed that after a long-term reaction time of 50 h, the conversion of 1-decanol and the selectivity of α-decene maintained above 91.4 % and 88.0 %, respectively, demonstrating that the K2O/γ-Al2O3 catalyst possessed great stability. 3.2 Catalyst characterizations The structural information of K2O/γ-Al2O3, Na2O/γ-Al2O3, BaO/γ-Al2O3, CaO/γ-Al2O3, MgO/γ-Al2O3 and γ-Al2O3 catalysts was characterized by XRD and BET, as shown in Fig. 2 . For the catalysts, the diffraction peaks were observed at 37.5 °, 39.3 °, 45.8 °, 60.7 ° and 67.0 °, which were the characteristic diffraction peaks of γ-Al2O3 (JCPDS 00–050–0741) (Fig. 2 (a)). Additionally, the characteristic diffraction peaks of K2O, Na2O, BaO, CaO and MgO were not observed and the main peak at 67.0 ° for all catalysts did not shift compared to the main peak of γ-Al2O3, as shown in Fig. 2 (b), indicating that the loaded alkali and alkaline earth metal oxides were highly dispersed on the γ-Al2O3. In Fig. 2 (c), all samples displayed Ⅳ-type adsorption isotherms with distinct H2-type hysteresis loops, and the ratio of P/P0 ranged from 0.6 to 1.0, proving that they were mesoporous materials. Moreover, the pore size distribution of the samples was primarily around 11 nm, further confirming their mesoporous property (Fig. S2). Table 1 lists the physicochemical properties of the catalysts, where the K2O/γ-Al2O3 catalyst had the largest surface area (184.0 m2 g-1), and the surface area of Na2O/γ-Al2O3, BaO/γ-Al2O3, CaO/γ-Al2O3, MgO/γ- Al2O3 and γ-Al2O3 catalysts were 182.1, 178.0, 177.4, 170.3 and 171.2 m2 g-1, respectively. These results suggested that K2O, Na2O, BaO, CaO and MgO had little effect on the texture properties of γ-Al2O3. The surface acid/base properties of K2O/γ-Al2O3, Na2O/γ-Al2O3, BaO/γ-Al2O3, CaO/γ-Al2O3, MgO/γ-Al2O3 and γ-Al2O3 catalysts were investigated by Py-IR and CO2-TPD experiments in Fig. 3 , respectively. In the Py-IR experiments shown in Fig. 3 (a), all catalysts exhibited similar acid distribution compared to the γ-Al2O3. The bands around 1445 cm-1 (including the shoulder band at 1452 cm-1), 1576 cm-1, 1612 cm-1 were attributed to Lewis acid sites (LAS) [41–43]. The band at 1490 cm−1 was also attributed to LAS due to the absence of Brønsted acid site (BAS) [34]. The band at 1594 cm-1 was attributed to the hydrogen band for the combination of pyridine and the hydroxyl group on the surface of γ-Al2O3 [44]. These results demonstrated that there were only LAS on the surface of γ-Al2O3-based catalysts. Furthermore, the acid amount of catalysts was calculated by the integration of LAS band around 1445 cm-1 [45]. As displayed in Table 1, the K2O/γ-Al2O3 catalyst had the least Lewis acid amount (0.049 mmol g-1) among all catalysts. The Lewis acid amount of Na2O/γ-Al2O3, BaO/γ-Al2O3, CaO/γ-Al2O3, MgO/γ-Al2O3 and γ-Al2O3 catalysts were 0.103, 0.131, 0.136, 0.158 and 0.208 mmol g-1, respectively. For the base properties of catalysts measured by CO2-TPD in Fig. 3 (b), the base sites were classified into two types according to the CO2 desorption temperature. The peak between 50 and 300 °C was assigned to the weak base site derived from the surface hydroxyl group of γ-Al2O3 [46,47] and the peak between 300 and 500 °C was attributed to the medium base site caused by the impregnation of K2O, Na2O, BaO, CaO and MgO [48,49]. The corresponding base amount is listed in Table 1. The weak base amount of K2O/γ-Al2O3, Na2O/γ-Al2O3, BaO/γ-Al2O3, CaO/γ-Al2O3, MgO/γ-Al2O3 and γ-Al2O3 catalysts was 0.058, 0.089, 0.093, 0.095, 0.097 and 0.346 mmol g-1, respectively, while the medium base amount was 0.030, 0.013, 0.011, 0.010, 0.009 and 0.097 mmol g-1, respectively. As the alkalinity of the impregnated metal oxides increased, the amount of weak base site decreased, while the amount of medium base site increased. This indicated that the impregnated metal oxides interacted with the surface of γ-Al2O3, resulting in the formation of M-O-Al bonds [50]. The impregnation of alkali and alkaline earth metal oxides altered the surface acid/base properties of γ-Al2O3. Combined with the catalytic activity results, it could be inferred that the selectivity of α-decene was closely related to the amount of Lewis acid and medium base. The highest selectivity of α-decene was achieved on the K2O/γ-Al2O3 catalyst when Lewis acid amount was the lowest and the medium basic amount was the highest compared with other metal oxide loaded catalysts. In contrast, higher Lewis acid amount and lower medium base amount would lead to lower selectivity of α-decene. Based on the above results and reported works [51], it could be concluded the acid/base sites played a synergistic role in the conversion of 1-decanol, and the loading alkali metal oxides weakened the acidity of γ-Al2O3, preventing olefin isomerization, thus resulting in the high selectivity of α-olefin. 3.3 Reaction mechanism In order to gain insight into the mechanism of 1-decanol conversion into α-decene, in situ DRIFTS measurements were carried out on K2O/γ-Al2O3, BaO/γ-Al2O3 and MgO/γ-Al2O3 catalysts. For simulating the reaction environment, 1-decanol was dropped onto the catalyst surface under the nitrogen atmosphere. As shown in Fig. 4 (a), the bands at 2963, 2924, and 2856 cm-1 were assigned to the CHx stretching vibration of 1-decanol [52]. When the temperature was raised to 150 °C, a new band appeared at 2734 cm-1, which was ascribed to the vibrational band of C-O-C in decyl ether [53]. Moreover, this band was observed in the in situ DRIFTS spectra of all catalysts (seen in Fig. 4 (b), Fig. 4 (c) and Fig. S3), thus it could be speculated that the dehydration process of 1-decanol was similar on γ-Al2O3-based catalysts, which involved the generation of decyl ether as intermediate product. For further investigation of the mechanism of decyl ether conversion into decene, decyl ether was dropped onto the K2O/γ-Al2O3 catalyst under the identical experimental conditions. Surprisingly, the intensity of the band at 2734 cm-1 significantly weakened at 230 °C, and a new band appeared at 1668 cm-1 (shown in Fig. 4 (d)), which was attributed to the C=C stretching vibration [54], indicating that decyl ether was ultimately transformed into decene. We also conducted in situ DRIFTS experiment for α-decene absorption on the K2O/γ-Al2O3 catalyst, which confirmed that the band at 1668 cm-1 (shown in Fig. S4) was corresponded to the C=C stretching vibration. To further confirm the intermediate product in this reaction, the control experiments of the conversion of 1-decanol were carried out on the K2O/γ- Al2O3 catalyst. To lower the conversion of the reaction, LHSV was increased by 10 times and 20 times, respectively. The decyl ether was evidently detected in the reaction products according to the GC spectra and activity performance, as displayed in Fig. S5, which was consistent with the in situ DRIFTS results. Therefore, the results above implied that the generation of decene involved bimolecular dehydration of 1-decanol with decyl ether as an intermediate on K2O/γ-Al2O3, BaO/γ-Al2O3 and MgO/γ-Al2O3 catalysts. To further demonstrate the reaction mechanism on K2O/γ-Al2O3, BaO/γ-Al2O3 and MgO/γ-Al2O3 catalysts, we performed DFT calculations. For the sake of convenience in calculation, the dehydration of 1-butanol to form butane was chosen as the probe reaction and the adsorption configurations of intermediates on K2O/γ-Al2O3, BaO/γ-Al2O3 and MgO/γ-Al2O3 catalysts were shown in Fig. S6-S8. The energy profile of bimolecular dehydration of 1-butanol to form butyl ether was displayed in Fig. S9. The energy barriers on K2O/γ-Al2O3, BaO/γ-Al2O3, and MgO/γ-Al2O3 were 0.27 eV, 0.46 eV, and 0.39 eV, respectively. These results indicated that the bimolecular dehydration pathway was more favorable on the K2O/γ-Al2O3 catalyst. Since the reaction mechanism of 1-decanol dehydration was the same on K2O/γ-Al2O3, BaO/γ-Al2O3 and MgO/γ-Al2O3 catalysts, but the activity results showed significant selectivity difference for α-decene. The highest α-decene selectivity was obtained on the K2O/γ-Al2O3 catalyst while BaO/γ-Al2O3 and MgO/γ-Al2O3 catalysts preferred to produce more internal decenes. Therefore, DFT calculations on K2O/γ-Al2O3, BaO/γ-Al2O3 and MgO/γ-Al2O3 catalysts were performed to uncover the isomerization process of α-decene, the adsorption configurations of intermediates on K2O/γ-Al2O3, BaO/γ-Al2O3 and MgO/γ-Al2O3 catalysts were also shown in Fig. S6-S8. The potential energy profile was shown in Fig. 5 . The energy barrier on the K2O/γ-Al2O3 catalyst for removing the hydroxyl group from 1-butanol was 0.85 eV, and the heat released was 1.87 eV. Subsequently, the energy barrier for the removal of the β-hydrogen was 2.66 eV, and the energy barriers for intramolecular hydrogen migration were 3.23 eV and 1.68 eV, respectively. On the BaO/γ-Al2O3 and MgO/γ-Al2O3 surfaces, the energy barriers for hydroxyl removal from 1-butanol were 1.51 eV and 1.14 eV, respectively, and the barriers for dehydrogenation to form butene were 1.13 eV and 1.55 eV, respectively. For BaO/γ-Al2O3, the energy barriers for intramolecular hydrogen migration were 2.80 eV and 2.04 eV, while for MgO/γ-Al2O3, the energy barriers for intramolecular hydrogen migration were 2.01 eV and 2.38 eV, respectively. Therefore, we could conclude that the K2O/γ-Al2O3 catalyst not only facilitated the dissociation of the hydroxyl group but also hindered the migration of the β-hydrogen, which made the product remain at α-olefin rather than internal olefins. While BaO/γ-Al2O3 and MgO/γ-Al2O3 catalysts could also completely convert 1-decanol to decene at a relatively high temperature, however, they were more inclined to produce internal decenes due to the lower energy barrier required for β-hydrogen migration, resulting in a lower selectivity for α-decene. Based on the above results, we propose the possible reaction mechanism for the preparation of α-decene from 1-decanol on alkali and alkaline earth metal oxides modified γ-Al2O3 catalysts, as shown in Fig. 6 . The dehydration of 1-decanol was divided into two pathways: bimolecular and unimolecular dehydration [55], respectively. According to the generation of decyl ether from the in situ DRIFTS experiments and control experiments (Fig. 4 and Fig. S4), it was supposed that bimolecular dehydration was the dominant reaction pathway. Through the synergistic effect of acid/base sites on the catalyst, the hydroxyl group of the long-chain fatty alcohol adsorbed on the acid site, while the β-hydrogen interacted with the base site. This interaction facilitated the formation of decyl ether via bimolecular dehydration, which subsequently underwent further dehydration to produce decene. For alkali metal oxide (K2O, Na2O) modified γ-Al2O3, the acidity was weakened according to the Py-IR results (Fig. 3), thus the C=C double-bond was difficult to shift and remained at the terminal to form α-decene. Based on the DFT calculation results, the α-olefin remained non-isomerization into internal olefins because the energy barrier for β-hydrogen migration was too high on the alkali metal oxide (K2O) modified γ-Al2O3. However, for BaO/γ-Al2O3 and MgO/γ-Al2O3 catalysts, the generated α-olefin isomerized to internal olefins due to the low energy barrier for β-hydrogen migration. 4 Conclusion In summary, we have reported alkali metal oxides modified γ-Al2O3 for highly selective preparation of α-decene from 1-decanol compared to alkaline earth metal oxides modified γ-Al2O3. The alkali metal oxides (K2O and Na2O) could decrease the acidity of γ-Al2O3, and the acid/base sites played a synergistic role in the conversion of 1-decanol. The dehydration pathways of long-chain fatty alcohol on K2O/γ-Al2O3, Na2O/γ-Al2O3, BaO/γ-Al2O3, CaO/γ-Al2O3 and MgO/γ-Al2O3 catalysts were identical, proceeding via bimolecular dehydration. The impregnation of alkali metal oxide (K2O) on γ-Al2O3 also increased the energy barrier for β-hydrogen migration, leading to the C=C double-bond remaining at the terminal position, thereby achieving the high selectivity for α-olefin. While alkaline earth metal oxides (BaO and MgO) were impregnated, the energy barriers for β-hydrogen migration were lower, which ultimately lead to the generation of a large amount of internal olefins. Therefore, alkali metal oxide modified γ-Al2O3 exhibited superior selectivity for α-decene in the conversion of fatty alcohol, outperforming γ-Al2O3 modified with alkaline earth metal oxides. This work revealed the essence of achieving high selectivity for α-olefin in the dehydration of long-chain fatty alcohol catalyzed by the alkali metal oxides modified γ-Al2O3 catalysts, and also provided a reliable method for green production of α-olefin. CRediT authorship contribution statement Hualong Zhang: Writing – review & editing, Writing – original draft, Methodology, Investigation, Data curation, Conceptualization. Liying An: Formal analysis. Jinjia Liu: Writing – review & editing, Formal analysis. Jiwei Tan: Investigation. Longyao Li: Investigation. Chao Juan: Formal analysis. Hui Xin: Writing – review & editing. Cuncun Xiao: Investigation. Mengyuan Ren: Investigation. Xiaodong Wen: Writing – review & editing. Dan Li: Writing – review & editing, Supervision, Project administration, Funding acquisition. Changwei Hu: Writing – review & editing. Declaration of competing interest The authors declare that they have no known competing financial interests or personal relationships that could have appeared to influence the work reported in this paper. Acknowledgments This work was supported by National Natural Science Foundation of China (22272113 and 22202224), Natural Science Foundation of Sichuan Province, China (No. 2024NSFSC1109) and 111 project (B17030). Supplementary materials Supplementary material associated with this article can be found, in the online version, at doi:10.1016/j.mcat.2025.115142. Appendix Supplementary materials Supporting information: Additional characterizations (including BJH pore-size distribution, in situ DRIFTS spectra, GC diagrams and catalytic performance of control experiments, adsorption configurations for DFT calculations and energy profile of bimolecular dehydration) as mentioned in the text. (Figures S1-S9) Image, application 1 References [1] P.N.R. Vennestrøm C.M. Osmundsen C.H. Christensen E. Taarning Beyond petrochemicals: the renewable chemicals industry Angewandte Chemie International Edition 50 2011 10502 10509 10.1002/anie.201102117 P.N.R. Vennestrøm, C.M. Osmundsen, C.H. Christensen, E. Taarning, Beyond petrochemicals: the renewable chemicals industry, Angewandte Chemie International Edition, 50 (2011) 10502–10509. https://doi.org/10.1002/anie.201102117 [2] R. Franke D. Selent A. Börner Applied hydroformylation Chem. Rev. 112 2012 5675 5732 10.1021/cr3001803 R. Franke, D. Selent, A. Börner, Applied hydroformylation, Chem. Rev., 112 (2012) 5675–5732. https://doi.org/10.1021/cr3001803 [3] S.D. Ittel L.K. Johnson M. Brookhart Late-metal catalysts for ethylene homo- and copolymerization Chem. Rev. 100 2000 1169 1204 10.1021/cr9804644 S.D. Ittel, L.K. Johnson, M. Brookhart, Late-metal catalysts for ethylene homo- and copolymerization, Chem. Rev., 100 (2000) 1169–1204. https://doi.org/10.1021/cr9804644 [4] M. Mashayekhi L. Moballegh N. Bahri-Laleh S. Sadjadi A. Poater Ionic liquids as modifier for the oligomerization of α-olefins to reactive poly (α-olefins) via traditional AlCl3 catalyst Molecular Catalysis 547 2023 113403 10.1016/j.mcat.2023.113403 M. Mashayekhi, L. Moballegh, N. Bahri-Laleh, S. Sadjadi, A. Poater, Ionic liquids as modifier for the oligomerization of α-olefins to reactive poly (α-olefins) via traditional AlCl3 catalyst, Molecular Catalysis, 547 (2023) 113403. https://doi.org/10.1016/j.mcat.2023.113403 [5] A.V. Karre D.B. Dadyburjor Review of iron-based catalysts with and without zeolite supports used in fischer-tropsch processes Chem. Eng. Commun. 209 2022 967 987 10.1080/00986445.2021.1935252 A.V. Karre, D.B. Dadyburjor, Review of iron-based catalysts with and without zeolite supports used in fischer-tropsch processes, Chem. Eng. Commun., 209 (2022) 967–987. https://doi.org/10.1080/00986445.2021.1935252 [6] A.C. Ghogia A. Nzihou P. Serp K. Soulantica D. Pham Minh Cobalt catalysts on carbon-based materials for Fischer-Tropsch synthesis: a review Applied Catalysis A: General 609 2021 117906 10.1016/j.apcata.2020.117906 A.C. Ghogia, A. Nzihou, P. Serp, K. Soulantica, D. Pham Minh, Cobalt catalysts on carbon-based materials for Fischer-Tropsch synthesis: a review, Applied Catalysis A: General, 609 (2021) 117906. https://doi.org/10.1016/j.apcata.2020.117906 [7] T.A. Zepeda Insights into active iron phosphide as Fischer-Tropsch synthesis catalyst for sustainable light olefins production Molecular Catalysis 574 2025 114870 10.1016/j.mcat.2025.114870 T.A. Zepeda, Insights into active iron phosphide as Fischer-Tropsch synthesis catalyst for sustainable light olefins production, Molecular Catalysis, 574 (2025) 114870. https://doi.org/10.1016/j.mcat.2025.114870 [8] O. Ivanez A.S. Groven K.R. Rout E.A. Blekkan Phosphorus deactivation on Co-based catalysts for Fischer-Tropsch Top. Catal. 66 2023 1381 1390 10.1007/s11244-022-01778-0 O. Ivanez, A.S. Groven, K.R. Rout, E.A. Blekkan, Phosphorus deactivation on Co-based catalysts for Fischer-Tropsch, Top. Catal., 66 (2023) 1381–1390. https://doi.org/10.1007/s11244-022-01778-0 [9] S. Yang S. Lee S.C. Kang S.J. Han K.-W. Jun K.-Y. Lee Y.T. Kim Linear α-olefin production with Na-promoted Fe–Zn catalysts via Fischer–Tropsch synthesis RSC. Adv. 9 2019 14176 14187 10.1039/C9RA02471A S. Yang, S. Lee, S.C. Kang, S.J. Han, K.-W. Jun, K.-Y. Lee, Y.T. Kim, Linear α-olefin production with Na-promoted Fe–Zn catalysts via Fischer–Tropsch synthesis, RSC. Adv., 9 (2019) 14176–14187. https://doi.org/10.1039/C9RA02471A [10] R.M. Manyik W.E. Walker T.P. Wilson A soluble chromium-based catalyst for ethylene trimerization and polymerization J. Catal. 47 1977 197 209 10.1016/0021-9517(77)90167-1 R.M. Manyik, W.E. Walker, T.P. Wilson, A soluble chromium-based catalyst for ethylene trimerization and polymerization, J. Catal., 47 (1977) 197–209. https://doi.org/10.1016/0021-9517(77)90167-1 [11] J.T. Dixon M.J. Green F.M. Hess D.H. Morgan Advances in selective ethylene trimerisation – a critical overview J. Organomet. Chem. 689 2004 3641 3668 10.1016/j.jorganchem.2004.06.008 J.T. Dixon, M.J. Green, F.M. Hess, D.H. Morgan, Advances in selective ethylene trimerisation – a critical overview, J. Organomet. Chem., 689 (2004) 3641–3668. https://doi.org/10.1016/j.jorganchem.2004.06.008 [12] K.A. Alferov G.P. Belov Y. Meng Chromium catalysts for selective ethylene oligomerization to 1-hexene and 1-octene: recent results Applied Catalysis A: General 542 2017 71 124 10.1016/j.apcata.2017.05.014 K.A. Alferov, G.P. Belov, Y. Meng, Chromium catalysts for selective ethylene oligomerization to 1-hexene and 1-octene: recent results, Applied Catalysis A: General, 542 (2017) 71–124. https://doi.org/10.1016/j.apcata.2017.05.014 [13] Z. Xu J.P. Chada L. Xu D. Zhao D.C. Rosenfeld J.L. Rogers I. Hermans M. Mavrikakis G.W. Huber Ethylene dimerization and oligomerization to 1-butene and higher olefins with chromium-promoted cobalt on carbon catalyst ACS. Catal. 8 2018 2488 2497 10.1021/acscatal.7b03205 Z. Xu, J.P. Chada, L. Xu, D. Zhao, D.C. Rosenfeld, J.L. Rogers, I. Hermans, M. Mavrikakis, G.W. Huber, Ethylene dimerization and oligomerization to 1-butene and higher olefins with chromium-promoted cobalt on carbon catalyst, ACS. Catal., 8 (2018) 2488–2497. https://doi.org/10.1021/acscatal.7b03205 [14] A. Alzamly M. Bakiro S. Hussein Ahmed L.A. Siddig H.L. Nguyen Linear α-olefin oligomerization and polymerization catalyzed by metal-organic frameworks Coord. Chem. Rev. 462 2022 214522 10.1016/j.ccr.2022.214522 A. Alzamly, M. Bakiro, S. Hussein Ahmed, L.A. Siddig, H.L. Nguyen, Linear α-olefin oligomerization and polymerization catalyzed by metal-organic frameworks, Coord. Chem. Rev., 462 (2022) 214522. https://doi.org/10.1016/j.ccr.2022.214522 [15] L. Zhao B. Li C. Zhao Selective decarbonylation of fatty acids to long-chain alkenes via PtSn/SnO x -induced C–O activation ACS. Sustain. Chem. Eng. 9 2021 12970 12977 10.1021/acssuschemeng.1c04452 L. Zhao, B. Li, C. Zhao, Selective decarbonylation of fatty acids to long-chain alkenes via PtSn/SnOx-induced C–O activation, ACS. Sustain. Chem. Eng., 9 (2021) 12970–12977. https://doi.org/10.1021/acssuschemeng.1c04452 [16] Z. Zhang J. Tian Y. Lu X. Gou J. Li W. Hu W. Lin R.S. Kim J. Fu Exceptional selectivity to olefins in the deoxygenation of fatty acids over an intermetallic platinum–Zinc alloy Angewandte Chemie International Edition 61 2022 e202202017 10.1002/anie.202202017 Z. Zhang, J. Tian, Y. Lu, X. Gou, J. Li, W. Hu, W. Lin, R.S. Kim, J. Fu, Exceptional selectivity to olefins in the deoxygenation of fatty acids over an intermetallic platinum–Zinc alloy, Angewandte Chemie International Edition, 61 (2022) e202202017. https://doi.org/10.1002/anie.202202017 [17] C. Nooto P. Chuaykaew P. Singthuen T. Solos Y. Preedawichitkun K. Khosukwiwat K. Wengwirat P. Promchana R. Kumar P.-W. Chung Y. Poo-arporn W. Limphirat K. Choojun T. Sooknoi Reversibly interconverted Cu+/Cu+-H species as active sites for selective hydrogenation of fatty acid methyl esters to fatty alcohol over layered double hydroxide derived CuMgAlO x catalysts Molecular Catalysis 575 2025 114898 10.1016/j.mcat.2025.114898 C. Nooto, P. Chuaykaew, P. Singthuen, T. Solos, Y. Preedawichitkun, K. Khosukwiwat, K. Wengwirat, P. Promchana, R. Kumar, P.-W. Chung, Y. Poo-arporn, W. Limphirat, K. Choojun, T. Sooknoi, Reversibly interconverted Cu+/Cu+-H species as active sites for selective hydrogenation of fatty acid methyl esters to fatty alcohol over layered double hydroxide derived CuMgAlOx catalysts, Molecular Catalysis, 575 (2025) 114898. https://doi.org/10.1016/j.mcat.2025.114898 [18] G.A. Kraus S. Riley A large-scale synthesis of α-olefins and α,ω-dienes Synthesis. (Mass) 44 2012 3003 3005 10.1055/s-0031-1290400 G.A. Kraus, S. Riley, A large-scale synthesis of α-olefins and α,ω-dienes, Synthesis. (Mass), 44 (2012) 3003–3005. https://doi.org/10.1055/s-0031-1290400 [19] J.A. Miller J.A. Nelson M.P. Byrne A highly catalytic and selective conversion of carboxylic acids to 1-alkenes of one less carbon atom J. Org. Chem. 58 1993 18 20 10.1021/jo00053a008 J.A. Miller, J.A. Nelson, M.P. Byrne, A highly catalytic and selective conversion of carboxylic acids to 1-alkenes of one less carbon atom, J. Org. Chem., 58 (1993) 18–20. https://doi.org/10.1021/jo00053a008 [20] S. Maetani T. Fukuyama N. Suzuki D. Ishihara I. Ryu Efficient iridium-catalyzed decarbonylation reaction of aliphatic carboxylic acids leading to internal or terminal alkenes Organometallics. 30 2011 1389 1394 10.1021/om1009268 S. Maetani, T. Fukuyama, N. Suzuki, D. Ishihara, I. Ryu, Efficient iridium-catalyzed decarbonylation reaction of aliphatic carboxylic acids leading to internal or terminal alkenes, Organometallics., 30 (2011) 1389–1394. https://doi.org/10.1021/om1009268 [21] R.E. Murray E.L. Walter K.M. Doll Tandem isomerization-decarboxylation for converting alkenoic fatty acids into Alkenes ACS. Catal. 4 2014 3517 3520 10.1021/cs501019t R.E. Murray, E.L. Walter, K.M. Doll, Tandem isomerization-decarboxylation for converting alkenoic fatty acids into Alkenes, ACS. Catal., 4 (2014) 3517–3520. https://doi.org/10.1021/cs501019t [22] Z. Zhang Y. Li F. Okejiri M. Liu H. Chen J. Liu K. Chen X. Lu P. Ouyang J. Fu Highly selective production of linear 1-heptadecene from stearic acid over a partially reduced MoO x catalyst Chemical Communications 56 2020 4456 4459 10.1039/D0CC01307B Z. Zhang, Y. Li, F. Okejiri, M. Liu, H. Chen, J. Liu, K. Chen, X. Lu, P. Ouyang, J. Fu, Highly selective production of linear 1-heptadecene from stearic acid over a partially reduced MoOx catalyst, Chemical Communications, 56 (2020) 4456–4459. https://doi.org/10.1039/D0CC01307B [23] M.J. Hidajat O. Kwon H. Park J. Han G.-N. Yun D.W. Hwang Highly selective, energy-free, and environmentally friendly one-pot production of linear α-olefin from biomass-derived organic acid in a dual-bed catalyst system Green Chemistry 24 2022 7556 7573 10.1039/D2GC02777A M.J. Hidajat, O. Kwon, H. Park, J. Han, G.-N. Yun, D.W. Hwang, Highly selective, energy-free, and environmentally friendly one-pot production of linear α-olefin from biomass-derived organic acid in a dual-bed catalyst system, Green Chemistry, 24 (2022) 7556–7573. https://doi.org/10.1039/D2GC02777A [24] C.-Y. Wu H.-S. Wu Ethylene formation from ethanol dehydration using ZSM-5 catalyst ACS. Omega 2 2017 4287 4296 10.1021/acsomega.7b00680 C.-Y. Wu, H.-S. Wu, Ethylene formation from ethanol dehydration using ZSM-5 catalyst, ACS. Omega, 2 (2017) 4287–4296. https://doi.org/10.1021/acsomega.7b00680 [25] L.-P. Wu X.-J. Li Z.-H. Yuan Y. Chen The fabrication of TiO2-supported zeolite with core/shell heterostructure for ethanol dehydration to ethylene Catal. Commun. 11 2009 67 70 10.1016/j.catcom.2009.08.013 L.-P. Wu, X.-J. Li, Z.-H. Yuan, Y. Chen, The fabrication of TiO2-supported zeolite with core/shell heterostructure for ethanol dehydration to ethylene, Catal. Commun., 11 (2009) 67–70. https://doi.org/10.1016/j.catcom.2009.08.013 [26] G. Larsen E. Lotero L.a.M. Petkovic D.S. Shobe Alcohol dehydration reactions over tungstated zirconia catalysts J. Catal. 169 1997 67 75 10.1006/jcat.1997.1698 G. Larsen, E. Lotero, L.a.M. Petkovic, D.S. Shobe, Alcohol dehydration reactions over tungstated zirconia catalysts, J. Catal., 169 (1997) 67–75. https://doi.org/10.1006/jcat.1997.1698 [27] J. Macht C.D. Baertsch M. May-Lozano S.L. Soled Y. Wang E. Iglesia Support effects on Brønsted acid site densities and alcohol dehydration turnover rates on tungsten oxide domains J. Catal. 227 2004 479 491 10.1016/j.jcat.2004.08.014 J. Macht, C.D. Baertsch, M. May-Lozano, S.L. Soled, Y. Wang, E. Iglesia, Support effects on Brønsted acid site densities and alcohol dehydration turnover rates on tungsten oxide domains, J. Catal., 227 (2004) 479–491. https://doi.org/10.1016/j.jcat.2004.08.014 [28] D. Sun S. Arai H. Duan Y. Yamada S. Sato Vapor-phase dehydration of C4 unsaturated alcohols to 1,3-butadiene Applied Catalysis A: General 531 2017 21 28 10.1016/j.apcata.2016.11.035 D. Sun, S. Arai, H. Duan, Y. Yamada, S. Sato, Vapor-phase dehydration of C4 unsaturated alcohols to 1,3-butadiene, Applied Catalysis A: General, 531 (2017) 21–28. https://doi.org/10.1016/j.apcata.2016.11.035 [29] H.-K. Min Y.W. Kim C. Kim I.A.M. Ibrahim J.W. Han Y.-W. Suh K.-D. Jung M.B. Park C.-H. Shin Phase transformation of ZrO2 by Si incorporation and catalytic activity for isopropyl alcohol dehydration and dehydrogenation Chemical Engineering Journal 428 2022 131766 10.1016/j.cej.2021.131766 H.-K. Min, Y.W. Kim, C. Kim, I.A.M. Ibrahim, J.W. Han, Y.-W. Suh, K.-D. Jung, M.B. Park, C.-H. Shin, Phase transformation of ZrO2 by Si incorporation and catalytic activity for isopropyl alcohol dehydration and dehydrogenation, Chemical Engineering Journal, 428 (2022) 131766. https://doi.org/10.1016/j.cej.2021.131766 [30] Z. Zhao D. Xiao K. Chen R. Wang L. Liang Z. Liu I. Hung Z. Gan G. Hou Nature of five-coordinated Al in γ-Al2O3 revealed by ultra-high-field solid-State NMR ACS. Cent. Sci. 8 2022 795 803 10.1021/acscentsci.1c01497 Z. Zhao, D. Xiao, K. Chen, R. Wang, L. Liang, Z. Liu, I. Hung, Z. Gan, G. Hou, Nature of five-coordinated Al in γ-Al2O3 revealed by ultra-high-field solid-State NMR, ACS. Cent. Sci., 8 (2022) 795–803. https://doi.org/10.1021/acscentsci.1c01497 [31] R. Wang Z. Zhao P. Gao K. Chen Z. Gan Q. Fu G. Hou Impact of adsorption configurations on alcohol dehydration over alumina catalysts The Journal of Physical Chemistry C 126 2022 10073 10080 10.1021/acs.jpcc.2c03303 R. Wang, Z. Zhao, P. Gao, K. Chen, Z. Gan, Q. Fu, G. Hou, Impact of adsorption configurations on alcohol dehydration over alumina catalysts, The Journal of Physical Chemistry C, 126 (2022) 10073–10080. https://doi.org/10.1021/acs.jpcc.2c03303 [32] A. Ali C. Zhao Selective synthesis of α-olefins by dehydration of fatty alcohols over alumina–thoria mixed catalysts Catal. Sci. Technol. 10 2020 3701 3708 10.1039/D0CY00551G A. Ali, C. Zhao, Selective synthesis of α-olefins by dehydration of fatty alcohols over alumina–thoria mixed catalysts, Catal. Sci. Technol., 10 (2020) 3701–3708. https://doi.org/10.1039/D0CY00551G [33] Y.-e. Kim U. Jung D. Song H.B. Im J.C. Park M. Hye Youn H.-D. Jeong G.B. Rhim D.H. Chun D.-W. Lee K.B. Lee K.Y. Koo Effect of Ba impregnation on Al2O3 catalyst for 1-octene production by 1-octanol dehydration Fuel 281 2020 118791 10.1016/j.fuel.2020.118791 Y.-e. Kim, U. Jung, D. Song, H.B. Im, J.C. Park, M. Hye Youn, H.-D. Jeong, G.B. Rhim, D.H. Chun, D.-W. Lee, K.B. Lee, K.Y. Koo, Effect of Ba impregnation on Al2O3 catalyst for 1-octene production by 1-octanol dehydration, Fuel, 281 (2020) 118791. https://doi.org/10.1016/j.fuel.2020.118791 [34] M. Chen W. Lu H. Zhu L. Gong Z. Zhao Y. Ding Dehydration of long-chain n-alcohols to linear α-olefins using sodium-modified γ-Al2O3 Ind. Eng. Chem. Res. 59 2020 4388 4396 10.1021/acs.iecr.9b06951 M. Chen, W. Lu, H. Zhu, L. Gong, Z. Zhao, Y. Ding, Dehydration of long-chain n-alcohols to linear α-olefins using sodium-modified γ-Al2O3, Ind. Eng. Chem. Res., 59 (2020) 4388–4396. https://doi.org/10.1021/acs.iecr.9b06951 [35] G. Kresse J. Furthmüller Efficient iterative schemes for ab initio total-energy calculations using a plane-wave basis set Physical Review B 54 1996 11169 11186 10.1103/PhysRevB.54.11169 G. Kresse, J. Furthmüller, Efficient iterative schemes for ab initio total-energy calculations using a plane-wave basis set, Physical Review B, 54 (1996) 11169–11186. https://doi.org/10.1103/PhysRevB.54.11169 [36] G. Kresse D. Joubert From ultrasoft pseudopotentials to the projector augmented-wave method Physical Review B 59 1999 1758 1775 10.1103/PhysRevB.59.1758 G. Kresse, D. Joubert, From ultrasoft pseudopotentials to the projector augmented-wave method, Physical Review B, 59 (1999) 1758–1775. https://doi.org/10.1103/PhysRevB.59.1758 [37] J.P. Perdew K. Burke M. Ernzerhof Generalized gradient approximation made simple Phys. Rev. Lett. 77 1996 3865 3868 10.1103/PhysRevLett.77.3865 J.P. Perdew, K. Burke, M. Ernzerhof, Generalized gradient approximation made simple, Phys. Rev. Lett., 77 (1996) 3865–3868. https://doi.org/10.1103/PhysRevLett.77.3865 [38] H.P. Pinto R.M. Nieminen S.D. Elliott Ab initio study of γ-Al2O3 surfaces Physical Review B 70 2004 125402 10.1103/PhysRevB.70.125402 H.P. Pinto, R.M. Nieminen, S.D. Elliott, Ab initio study of γ-Al2O3 surfaces, Physical Review B, 70 (2004) 125402. https://doi.org/10.1103/PhysRevB.70.125402 [39] Y. Chen C. Ouyang S. Shi Z. Sun L. Song Density functional theory study of Ir atom deposited on γ-Al2O3 (001) surface Physics Letters A 373 2009 277 281 10.1016/j.physleta.2008.11.016 Y. Chen, C. Ouyang, S. Shi, Z. Sun, L. Song, Density functional theory study of Ir atom deposited on γ-Al2O3 (001) surface, Physics Letters A, 373 (2009) 277–281. https://doi.org/10.1016/j.physleta.2008.11.016 [40] G. Henkelman B.P. Uberuaga H. Jónsson A climbing image nudged elastic band method for finding saddle points and minimum energy paths J. Chem. Phys. 113 2000 9901 9904 10.1063/1.1329672 G. Henkelman, B.P. Uberuaga, H. Jónsson, A climbing image nudged elastic band method for finding saddle points and minimum energy paths, J. Chem. Phys., 113 (2000) 9901–9904. https://doi.org/10.1063/1.1329672 [41] X. Wang Q. Cong L. Chen Y. Shi Y. Shi S. Li W. Li The alkali resistance of CuNbTi catalyst for selective reduction of NO by NH3: a comparative investigation with VWTi catalyst Applied Catalysis B: Environmental 246 2019 166 179 10.1016/j.apcatb.2019.01.049 X. Wang, Q. Cong, L. Chen, Y. Shi, Y. Shi, S. Li, W. Li, The alkali resistance of CuNbTi catalyst for selective reduction of NO by NH3: a comparative investigation with VWTi catalyst, Applied Catalysis B: Environmental, 246 (2019) 166–179. https://doi.org/10.1016/j.apcatb.2019.01.049 [42] X. Liu DRIFTS study of surface of γ-alumina and its dehydroxylation The Journal of Physical Chemistry C 112 2008 5066 5073 10.1021/jp711901s X. Liu, DRIFTS study of surface of γ-alumina and its dehydroxylation, The Journal of Physical Chemistry C, 112 (2008) 5066–5073. https://doi.org/10.1021/jp711901s [43] T. Barzetti E. Selli D. Moscotti L. Forni Pyridine and ammonia as probes for FTIR analysis of solid acid catalysts Journal of the Chemical Society, Faraday Transactions 92 1996 1401 1407 10.1039/FT9969201401 T. Barzetti, E. Selli, D. Moscotti, L. Forni, Pyridine and ammonia as probes for FTIR analysis of solid acid catalysts, Journal of the Chemical Society, Faraday Transactions, 92 (1996) 1401–1407. https://doi.org/10.1039/FT9969201401 [44] M.R. Basila T.R. Kantner K.H. Rhee The nature of the acidic sites on a silica-alumina. Characterization by infrared spectroscopic studies of trimethylamine and pyridine Chemisorption1 J. Phys. Chem. 68 1964 3197 3207 10.1021/j100793a020 M.R. Basila, T.R. Kantner, K.H. Rhee, The nature of the acidic sites on a silica-alumina. Characterization by infrared spectroscopic studies of trimethylamine and pyridine Chemisorption1, J. Phys. Chem., 68 (1964) 3197–3207. https://doi.org/10.1021/j100793a020 [45] C.A. Emeis Determination of integrated molar extinction coefficients for infrared absorption bands of pyridine adsorbed on solid acid catalysts J. Catal. 141 1993 347 354 10.1006/jcat.1993.1145 C.A. Emeis, Determination of integrated molar extinction coefficients for infrared absorption bands of pyridine adsorbed on solid acid catalysts, J. Catal., 141 (1993) 347–354. https://doi.org/10.1006/jcat.1993.1145 [46] P. Wu S. Ding B. Wang K. Shen S. Zhang Y. Zhang Nitrogen-doping boosted the activity of K/Al2O3 catalysts in simultaneous removal of COS and CS2: an experimental and theoretical study J. Environ. Chem. Eng. 12 2024 112174 10.1016/j.jece.2024.112174 P. Wu, S. Ding, B. Wang, K. Shen, S. Zhang, Y. Zhang, Nitrogen-doping boosted the activity of K/Al2O3 catalysts in simultaneous removal of COS and CS2: an experimental and theoretical study, J. Environ. Chem. Eng., 12 (2024) 112174. https://doi.org/10.1016/j.jece.2024.112174 [47] W. Yang Y. Feng W. Chu Promotion effect of CaO modification on mesoporous Al2O3-supported Ni catalysts for CO2 methanation International Journal of Chemical Engineering 2016 2016 2041821 10.1155/2016/2041821 W. Yang, Y. Feng, W. Chu, Promotion effect of CaO modification on mesoporous Al2O3-supported Ni catalysts for CO2 methanation, International Journal of Chemical Engineering, 2016 (2016) 2041821. https://doi.org/10.1155/2016/2041821 [48] X. Jiao H. Li L. Li F. Xiao N. Zhao W. Wei Synthesis and CO2 capture properties of mesoporous MgAl(O) sorbent RSC. Adv. 4 2014 47012 47020 10.1039/C4RA07267G X. Jiao, H. Li, L. Li, F. Xiao, N. Zhao, W. Wei, Synthesis and CO2 capture properties of mesoporous MgAl(O) sorbent, RSC. Adv., 4 (2014) 47012–47020. https://doi.org/10.1039/C4RA07267G [49] L. Yin H.Y. Li T. Ge Y. Li C. Zuo M. Wang G. Cui H. Huang L. Guo Continuous heterogeneous isomerization of 3/4-methyltetrahydrophthalic anhydride (3/4-MTHPA) with acid- and base-modified γ-Al2O3 catalysts New Journal of Chemistry 47 2023 1256 1267 10.1039/D2NJ05002A L. Yin, H.Y. Li, T. Ge, Y. Li, C. Zuo, M. Wang, G. Cui, H. Huang, L. Guo, Continuous heterogeneous isomerization of 3/4-methyltetrahydrophthalic anhydride (3/4-MTHPA) with acid- and base-modified γ-Al2O3 catalysts, New Journal of Chemistry, 47 (2023) 1256–1267. https://doi.org/10.1039/D2NJ05002A [50] Q. Zhu H. Duan B. Lin Y. Zhu Y. Hu Y. Zhou Higher acetone conversion obtained over a TiO2–Pd bifunctional catalyst for liquid-phase synthesis of methyl isobutyl ketone: the role of Al2O3 support Catal. Letters. 149 2019 2636 2644 10.1007/s10562-019-02861-0 Q. Zhu, H. Duan, B. Lin, Y. Zhu, Y. Hu, Y. Zhou, Higher acetone conversion obtained over a TiO2–Pd bifunctional catalyst for liquid-phase synthesis of methyl isobutyl ketone: the role of Al2O3 support, Catal. Letters., 149 (2019) 2636–2644. https://doi.org/10.1007/s10562-019-02861-0 [51] H.-J. Lee I.-H. Choi S.-W. Kim K.-R. Hwang Selective production of bio-based linear alpha-olefin from wasted fatty alcohol on Al2O3 for bio-based chemicals Polymers. (Basel) 13 2021 2850 10.3390/polym13172850 H.-J. Lee, I.-H. Choi, S.-W. Kim, K.-R. Hwang, Selective production of bio-based linear alpha-olefin from wasted fatty alcohol on Al2O3 for bio-based chemicals, Polymers. (Basel), 13 (2021) 2850. https://doi.org/10.3390/polym13172850 [52] C. Liu Z. Chi Y. Yan Z. Lu X.-G. Li J.-M. Yan M. Luo W. Xiao Tunable transesterification of dimethyl carbonate with ethanol on K2CO3/Al2O3 catalysts: kinetic modeling Ind. Eng. Chem. Res. 62 2023 1264 1276 10.1021/acs.iecr.2c03505 C. Liu, Z. Chi, Y. Yan, Z. Lu, X.-G. Li, J.-M. Yan, M. Luo, W. Xiao, Tunable transesterification of dimethyl carbonate with ethanol on K2CO3/Al2O3 catalysts: kinetic modeling, Ind. Eng. Chem. Res., 62 (2023) 1264–1276. https://doi.org/10.1021/acs.iecr.2c03505 [53] N.N. Ezhova N.V. Kolesnichenko T.I. Batova Zeolite catalysts for the synthesis of lower olefins from dimethyl ether (a Review) Petroleum Chemistry 60 2020 459 470 10.1134/S0965544120040064 N.N. Ezhova, N.V. Kolesnichenko, T.I. Batova, Zeolite catalysts for the synthesis of lower olefins from dimethyl ether (a Review), Petroleum Chemistry, 60 (2020) 459–470. https://doi.org/10.1134/S0965544120040064 [54] A. Jörke A. Seidel-Morgenstern C. Hamel Rhodium-BiPhePhos catalyzed hydroformylation studied by operando FTIR spectroscopy: catalyst activation and rate determining step Journal of Molecular Catalysis A: Chemical 426 2017 10 14 10.1016/j.molcata.2016.10.028 A. Jörke, A. Seidel-Morgenstern, C. Hamel, Rhodium-BiPhePhos catalyzed hydroformylation studied by operando FTIR spectroscopy: catalyst activation and rate determining step, Journal of Molecular Catalysis A: Chemical, 426 (2017) 10–14. https://doi.org/10.1016/j.molcata.2016.10.028 [55] M.J. Hidajat G.-N. Yun D.W. Hwang Numerical and statistical determinations of the controlling factors in biomass-derived alcohol dehydration over La-incorporated γ-Al2O3 catalysts Chemical Engineering Journal 473 2023 145376 10.1016/j.cej.2023.145376 M.J. Hidajat, G.-N. Yun, D.W. Hwang, Numerical and statistical determinations of the controlling factors in biomass-derived alcohol dehydration over La-incorporated γ-Al2O3 catalysts, Chemical Engineering Journal, 473 (2023) 145376. https://doi.org/10.1016/j.cej.2023.145376",
      "scopus-id": "105003177292",
      "coredata": {
        "eid": "1-s2.0-S246882312500327X",
        "dc:description": "Linear α-olefins (LAOs) are high-value chemicals primarily derived from fossil-based resources. Therefore, the dehydration of biomass-derived fatty alcohols to produce LAOs has received widespread attention for its sustainability. However, achieving high selectivity for LAOs remains a significant challenge due to the higher thermodynamic stability of internal olefins. Additionally, there is still a lack of molecular-level understanding of the mechanism for the high-selectivity dehydration of long-chain fatty alcohols to produce LAOs. In this study, 1-decanol was selected as the model compound to investigate the dehydration process over a series of alkali metal oxides (K2O and Na2O) and alkaline earth metal oxides (BaO, CaO and MgO) modified γ-Al2O3 catalysts. Activity results showed that the K2O/γ-Al2O3 catalyst achieved the highest α-decene selectivity (92.6 %) among all catalysts under mild reaction conditions. Characterization results illustrated that a small amount of loaded metal oxides had little impact on the texture properties of γ-Al2O3, but significantly altered its surface acid/base properties. In situ DRIFTS and control experiment results demonstrated that the bimolecular dehydration process involving the intermediate decyl ether was the dominant reaction pathway. DFT calculation results indicated that K2O modified γ-Al2O3 catalyst could lower the dissociation energy barrier of the hydroxyl group while raising the energy barrier of β-hydrogen migration compared to BaO and MgO modified γ-Al2O3 catalysts, thereby effectively inhibiting the isomerization of α-olefin into internal olefins.",
        "openArchiveArticle": "false",
        "prism:coverDate": "2025-06-15",
        "openaccessUserLicense": null,
        "prism:aggregationType": "Journal",
        "prism:url": "https://api.elsevier.com/content/article/pii/S246882312500327X",
        "dc:creator": [
          {
            "@_fa": "true",
            "$": "Zhang, Hualong"
          },
          {
            "@_fa": "true",
            "$": "An, Liying"
          },
          {
            "@_fa": "true",
            "$": "Liu, Jinjia"
          },
          {
            "@_fa": "true",
            "$": "Tan, Jiwei"
          },
          {
            "@_fa": "true",
            "$": "Li, Longyao"
          },
          {
            "@_fa": "true",
            "$": "Juan, Chao"
          },
          {
            "@_fa": "true",
            "$": "Xin, Hui"
          },
          {
            "@_fa": "true",
            "$": "Xiao, Cuncun"
          },
          {
            "@_fa": "true",
            "$": "Ren, Mengyuan"
          },
          {
            "@_fa": "true",
            "$": "Wen, Xiaodong"
          },
          {
            "@_fa": "true",
            "$": "Li, Dan"
          },
          {
            "@_fa": "true",
            "$": "Hu, Changwei"
          }
        ],
        "link": [
          {
            "@_fa": "true",
            "@rel": "self",
            "@href": "https://api.elsevier.com/content/article/pii/S246882312500327X"
          },
          {
            "@_fa": "true",
            "@rel": "scidir",
            "@href": "https://www.sciencedirect.com/science/article/pii/S246882312500327X"
          }
        ],
        "dc:format": "application/json",
        "openaccessType": null,
        "pii": "S2468-8231(25)00327-X",
        "prism:volume": "581",
        "articleNumber": "115142",
        "prism:publisher": "Elsevier B.V. All rights are reserved, including those for text and data mining, AI training, and similar technologies.",
        "dc:title": "The effect of alkali metal oxide modified γ-Al2O3 on the highly selective preparation of α-Olefin from Fatty Alcohol",
        "prism:copyright": "© 2025 Elsevier B.V. All rights are reserved, including those for text and data mining, AI training, and similar technologies.",
        "openaccess": "0",
        "prism:issn": "24688231",
        "dcterms:subject": [
          {
            "@_fa": "true",
            "$": "Fatty alcohol"
          },
          {
            "@_fa": "true",
            "$": "Linear α-olefin"
          },
          {
            "@_fa": "true",
            "$": "Dehydration"
          },
          {
            "@_fa": "true",
            "$": "γ-Al2O3"
          },
          {
            "@_fa": "true",
            "$": "Alkali metal oxide"
          },
          {
            "@_fa": "true",
            "$": "Heterogeneous catalysis"
          }
        ],
        "openaccessArticle": "false",
        "prism:publicationName": "Molecular Catalysis",
        "openaccessSponsorType": null,
        "prism:pageRange": "115142",
        "pubType": "fla",
        "prism:coverDisplayDate": "15 June 2025",
        "prism:doi": "10.1016/j.mcat.2025.115142",
        "prism:startingPage": "115142",
        "dc:identifier": "doi:10.1016/j.mcat.2025.115142",
        "openaccessSponsorName": null
      },
      "objects": {
        "object": [
          {
            "@category": "standard",
            "@height": "299",
            "@width": "527",
            "@_fa": "true",
            "$": "https://api.elsevier.com/content/object/eid/1-s2.0-S246882312500327X-gr2.jpg?httpAccept=%2A%2F%2A",
            "@multimediatype": "JPEG image file",
            "@type": "IMAGE-DOWNSAMPLED",
            "@size": "57408",
            "@ref": "gr2",
            "@mimetype": "image/jpeg"
          },
          {
            "@category": "standard",
            "@height": "183",
            "@width": "500",
            "@_fa": "true",
            "$": "https://api.elsevier.com/content/object/eid/1-s2.0-S246882312500327X-ga1.jpg?httpAccept=%2A%2F%2A",
            "@multimediatype": "JPEG image file",
            "@type": "IMAGE-DOWNSAMPLED",
            "@size": "28351",
            "@ref": "ga1",
            "@mimetype": "image/jpeg"
          },
          {
            "@category": "standard",
            "@height": "318",
            "@width": "781",
            "@_fa": "true",
            "$": "https://api.elsevier.com/content/object/eid/1-s2.0-S246882312500327X-gr1.jpg?httpAccept=%2A%2F%2A",
            "@multimediatype": "JPEG image file",
            "@type": "IMAGE-DOWNSAMPLED",
            "@size": "77869",
            "@ref": "gr1",
            "@mimetype": "image/jpeg"
          },
          {
            "@category": "standard",
            "@height": "287",
            "@width": "781",
            "@_fa": "true",
            "$": "https://api.elsevier.com/content/object/eid/1-s2.0-S246882312500327X-gr6.jpg?httpAccept=%2A%2F%2A",
            "@multimediatype": "JPEG image file",
            "@type": "IMAGE-DOWNSAMPLED",
            "@size": "52102",
            "@ref": "gr6",
            "@mimetype": "image/jpeg"
          },
          {
            "@category": "standard",
            "@height": "222",
            "@width": "393",
            "@_fa": "true",
            "$": "https://api.elsevier.com/content/object/eid/1-s2.0-S246882312500327X-gr5.jpg?httpAccept=%2A%2F%2A",
            "@multimediatype": "JPEG image file",
            "@type": "IMAGE-DOWNSAMPLED",
            "@size": "43839",
            "@ref": "gr5",
            "@mimetype": "image/jpeg"
          },
          {
            "@category": "standard",
            "@height": "651",
            "@width": "772",
            "@_fa": "true",
            "$": "https://api.elsevier.com/content/object/eid/1-s2.0-S246882312500327X-gr4.jpg?httpAccept=%2A%2F%2A",
            "@multimediatype": "JPEG image file",
            "@type": "IMAGE-DOWNSAMPLED",
            "@size": "158649",
            "@ref": "gr4",
            "@mimetype": "image/jpeg"
          },
          {
            "@category": "standard",
            "@height": "268",
            "@width": "389",
            "@_fa": "true",
            "$": "https://api.elsevier.com/content/object/eid/1-s2.0-S246882312500327X-gr3.jpg?httpAccept=%2A%2F%2A",
            "@multimediatype": "JPEG image file",
            "@type": "IMAGE-DOWNSAMPLED",
            "@size": "38772",
            "@ref": "gr3",
            "@mimetype": "image/jpeg"
          },
          {
            "@category": "thumbnail",
            "@height": "124",
            "@width": "219",
            "@_fa": "true",
            "$": "https://api.elsevier.com/content/object/eid/1-s2.0-S246882312500327X-gr2.sml?httpAccept=%2A%2F%2A",
            "@multimediatype": "GIF image file",
            "@type": "IMAGE-THUMBNAIL",
            "@size": "13444",
            "@ref": "gr2",
            "@mimetype": "image/gif"
          },
          {
            "@category": "thumbnail",
            "@height": "80",
            "@width": "219",
            "@_fa": "true",
            "$": "https://api.elsevier.com/content/object/eid/1-s2.0-S246882312500327X-ga1.sml?httpAccept=%2A%2F%2A",
            "@multimediatype": "GIF image file",
            "@type": "IMAGE-THUMBNAIL",
            "@size": "8322",
            "@ref": "ga1",
            "@mimetype": "image/gif"
          },
          {
            "@category": "thumbnail",
            "@height": "89",
            "@width": "219",
            "@_fa": "true",
            "$": "https://api.elsevier.com/content/object/eid/1-s2.0-S246882312500327X-gr1.sml?httpAccept=%2A%2F%2A",
            "@multimediatype": "GIF image file",
            "@type": "IMAGE-THUMBNAIL",
            "@size": "11961",
            "@ref": "gr1",
            "@mimetype": "image/gif"
          },
          {
            "@category": "thumbnail",
            "@height": "80",
            "@width": "219",
            "@_fa": "true",
            "$": "https://api.elsevier.com/content/object/eid/1-s2.0-S246882312500327X-gr6.sml?httpAccept=%2A%2F%2A",
            "@multimediatype": "GIF image file",
            "@type": "IMAGE-THUMBNAIL",
            "@size": "7862",
            "@ref": "gr6",
            "@mimetype": "image/gif"
          },
          {
            "@category": "thumbnail",
            "@height": "124",
            "@width": "219",
            "@_fa": "true",
            "$": "https://api.elsevier.com/content/object/eid/1-s2.0-S246882312500327X-gr5.sml?httpAccept=%2A%2F%2A",
            "@multimediatype": "GIF image file",
            "@type": "IMAGE-THUMBNAIL",
            "@size": "14015",
            "@ref": "gr5",
            "@mimetype": "image/gif"
          },
          {
            "@category": "thumbnail",
            "@height": "164",
            "@width": "194",
            "@_fa": "true",
            "$": "https://api.elsevier.com/content/object/eid/1-s2.0-S246882312500327X-gr4.sml?httpAccept=%2A%2F%2A",
            "@multimediatype": "GIF image file",
            "@type": "IMAGE-THUMBNAIL",
            "@size": "15174",
            "@ref": "gr4",
            "@mimetype": "image/gif"
          },
          {
            "@category": "thumbnail",
            "@height": "151",
            "@width": "219",
            "@_fa": "true",
            "$": "https://api.elsevier.com/content/object/eid/1-s2.0-S246882312500327X-gr3.sml?httpAccept=%2A%2F%2A",
            "@multimediatype": "GIF image file",
            "@type": "IMAGE-THUMBNAIL",
            "@size": "16026",
            "@ref": "gr3",
            "@mimetype": "image/gif"
          },
          {
            "@category": "high",
            "@height": "1323",
            "@width": "2333",
            "@_fa": "true",
            "$": "https://api.elsevier.com/content/object/eid/1-s2.0-S246882312500327X-gr2_lrg.jpg?httpAccept=%2A%2F%2A",
            "@multimediatype": "JPEG image file",
            "@type": "IMAGE-HIGH-RES",
            "@size": "451048",
            "@ref": "gr2",
            "@mimetype": "image/jpeg"
          },
          {
            "@category": "high",
            "@height": "809",
            "@width": "2213",
            "@_fa": "true",
            "$": "https://api.elsevier.com/content/object/eid/1-s2.0-S246882312500327X-ga1_lrg.jpg?httpAccept=%2A%2F%2A",
            "@multimediatype": "JPEG image file",
            "@type": "IMAGE-HIGH-RES",
            "@size": "220455",
            "@ref": "ga1",
            "@mimetype": "image/jpeg"
          },
          {
            "@category": "high",
            "@height": "1408",
            "@width": "3458",
            "@_fa": "true",
            "$": "https://api.elsevier.com/content/object/eid/1-s2.0-S246882312500327X-gr1_lrg.jpg?httpAccept=%2A%2F%2A",
            "@multimediatype": "JPEG image file",
            "@type": "IMAGE-HIGH-RES",
            "@size": "653750",
            "@ref": "gr1",
            "@mimetype": "image/jpeg"
          },
          {
            "@category": "high",
            "@height": "1270",
            "@width": "3458",
            "@_fa": "true",
            "$": "https://api.elsevier.com/content/object/eid/1-s2.0-S246882312500327X-gr6_lrg.jpg?httpAccept=%2A%2F%2A",
            "@multimediatype": "JPEG image file",
            "@type": "IMAGE-HIGH-RES",
            "@size": "407052",
            "@ref": "gr6",
            "@mimetype": "image/jpeg"
          },
          {
            "@category": "high",
            "@height": "983",
            "@width": "1742",
            "@_fa": "true",
            "$": "https://api.elsevier.com/content/object/eid/1-s2.0-S246882312500327X-gr5_lrg.jpg?httpAccept=%2A%2F%2A",
            "@multimediatype": "JPEG image file",
            "@type": "IMAGE-HIGH-RES",
            "@size": "371357",
            "@ref": "gr5",
            "@mimetype": "image/jpeg"
          },
          {
            "@category": "high",
            "@height": "2880",
            "@width": "3417",
            "@_fa": "true",
            "$": "https://api.elsevier.com/content/object/eid/1-s2.0-S246882312500327X-gr4_lrg.jpg?httpAccept=%2A%2F%2A",
            "@multimediatype": "JPEG image file",
            "@type": "IMAGE-HIGH-RES",
            "@size": "1173114",
            "@ref": "gr4",
            "@mimetype": "image/jpeg"
          },
          {
            "@category": "high",
            "@height": "1189",
            "@width": "1725",
            "@_fa": "true",
            "$": "https://api.elsevier.com/content/object/eid/1-s2.0-S246882312500327X-gr3_lrg.jpg?httpAccept=%2A%2F%2A",
            "@multimediatype": "JPEG image file",
            "@type": "IMAGE-HIGH-RES",
            "@size": "296025",
            "@ref": "gr3",
            "@mimetype": "image/jpeg"
          },
          {
            "@category": "standard",
            "@_fa": "true",
            "$": "https://api.elsevier.com/content/object/eid/1-s2.0-S246882312500327X-mmc1.docx?httpAccept=%2A%2F%2A",
            "@multimediatype": "Microsoft Word file",
            "@type": "APPLICATION",
            "@size": "2829684",
            "@ref": "mmc1",
            "@mimetype": "application/word"
          },
          {
            "@category": "thumbnail",
            "@_fa": "true",
            "$": "https://api.elsevier.com/content/object/eid/1-s2.0-S246882312500327X-si1.svg?httpAccept=%2A%2F%2A",
            "@multimediatype": "Scalable Vector Graphics file",
            "@type": "ALTIMG",
            "@size": "7860",
            "@ref": "si1",
            "@mimetype": "image/svg+xml"
          },
          {
            "@category": "thumbnail",
            "@_fa": "true",
            "$": "https://api.elsevier.com/content/object/eid/1-s2.0-S246882312500327X-si2.svg?httpAccept=%2A%2F%2A",
            "@multimediatype": "Scalable Vector Graphics file",
            "@type": "ALTIMG",
            "@size": "4427",
            "@ref": "si2",
            "@mimetype": "image/svg+xml"
          },
          {
            "@category": "thumbnail",
            "@_fa": "true",
            "$": "https://api.elsevier.com/content/object/eid/1-s2.0-S246882312500327X-si3.svg?httpAccept=%2A%2F%2A",
            "@multimediatype": "Scalable Vector Graphics file",
            "@type": "ALTIMG",
            "@size": "4807",
            "@ref": "si3",
            "@mimetype": "image/svg+xml"
          },
          {
            "@category": "thumbnail",
            "@_fa": "true",
            "$": "https://api.elsevier.com/content/object/eid/1-s2.0-S246882312500327X-si4.svg?httpAccept=%2A%2F%2A",
            "@multimediatype": "Scalable Vector Graphics file",
            "@type": "ALTIMG",
            "@size": "21887",
            "@ref": "si4",
            "@mimetype": "image/svg+xml"
          },
          {
            "@category": "thumbnail",
            "@_fa": "true",
            "$": "https://api.elsevier.com/content/object/eid/1-s2.0-S246882312500327X-si5.svg?httpAccept=%2A%2F%2A",
            "@multimediatype": "Scalable Vector Graphics file",
            "@type": "ALTIMG",
            "@size": "19335",
            "@ref": "si5",
            "@mimetype": "image/svg+xml"
          },
          {
            "@category": "thumbnail",
            "@_fa": "true",
            "$": "https://api.elsevier.com/content/object/eid/1-s2.0-S246882312500327X-si6.svg?httpAccept=%2A%2F%2A",
            "@multimediatype": "Scalable Vector Graphics file",
            "@type": "ALTIMG",
            "@size": "22039",
            "@ref": "si6",
            "@mimetype": "image/svg+xml"
          }
        ]
      },
      "link": {
        "@rel": "abstract",
        "@href": "https://api.elsevier.com/content/abstract/scopus_id/105003177292"
      }
    }
  }
}