{
  "metadata": {
    "title": "HReO<ce:inf loc=post>4</ce:inf> as highly efficient and selective catalyst for the conversion of carbohydrates into value added chemicals",
    "authors": "; ; ",
    "journal": "Molecular Catalysis",
    "date": "2019-03-31",
    "doi": "10.1016/j.mcat.2019.01.003",
    "abstract": "",
    "uri": "https://api.elsevier.com/content/article/pii/S2468823118304735",
    "pii": "S2468823118304735"
  },
  "fulltext": {
    "full-text-retrieval-response": {
      "scopus-eid": "2-s2.0-85059665278",
      "originalText": "serial JL 315758 291210 291744 291790 291809 31 Molecular Catalysis MOLECULARCATALYSIS 2019-01-10 2019-01-10 2019-01-10 2019-01-10 2019-02-12T19:55:58 1-s2.0-S2468823118304735 S2468-8231(18)30473-5 S2468823118304735 10.1016/j.mcat.2019.01.003 S300 S300.1 FULL-TEXT 1-s2.0-S2468823118X00212 2019-02-12T23:00:30.485011Z 0 0 20190301 20190331 2019 2019-01-11T00:48:05.821767Z absattachment articleinfo articletitlenorm authfirstinitialnorm authfirstsurnamenorm cid cids contenttype copyright crossmark dateloaded dateloadedtxt datesearch datesort dateupdated dco docsubtype doctype doi eid ewtransactionid hubeid indexeddate issn issnnorm itemstage itemtransactionid itemweight openaccess openarchive pg pgfirst pglast pii piinorm pubdateend pubdatestart pubdatetxt pubyr sectiontitle sortorder srctitle srctitlenorm srctype ssids alllist content subj subheadings suppl tomb volfirst volissue volumelist webpdf webpdfpagecount yearnav figure table e-component body acknowledge affil appendices articletitle auth authfirstini authfull authkeywords authlast grantnumber grantsponsor highlightsabst orcid primabst ref specialabst 2468-8231 24688231 true 465 465 C Volume 465 11 87 94 87 94 201903 March 2019 2019-03-01 2019-03-31 2019 Regular Papers article fla © 2019 Elsevier B.V. All rights reserved. HREO4HIGHLYEFFICIENTSELECTIVECATALYSTFORCONVERSIONCARBOHYDRATESVALUEADDEDCHEMICALS BERNARDO J 1 Introduction 2 Methods 2.1 General information 2.2 Synthesis of EL 2.2.1 General procedure for the conversion of carbohydrates into EL 2.2.2 Use of catalyst HReO4 in several cycles 2.2.3 Synthesis of EL in gram scale 2.3 General procedure for the conversion of carbohydrates into EMF 2.4 General procedure for the conversion of carbohydrates into HMF 2.5 General procedure for the conversion of carbohydrates into LA 3 Results and discussion 3.1 Synthesis of alkyl levulinates 3.1.1 Effect of the catalyst 3.1.2 Effect of catalyst amount 3.1.3 Effect of reaction temperature 3.1.4 The effect of reaction time on the conversion of fructose 3.1.5 Synthesis of different alkyl levulinates 3.1.6 Synthesis of EL from different carbohydrates 3.1.7 Use of catalyst HReO4 in multiple cycles 3.1.8 Synthesis of EL in gram scale 3.1.9 Conversion of fructose in EL monitoring by LC-ESI-MS/MS technique 3.2 Synthesis of 5-alkoxymethylfurfural ethers 3.2.1 Effect of reaction temperature 3.2.2 The effect of different co-solvents 3.2.3 Synthesis of EMF from other carbohydrates 3.2.4 Synthesis of EMF in gram scale 3.3 Synthesis of HMF 3.3.1 Effect of solvent 3.3.2 Synthesis of HMF from different carbohydrates 3.3.3 Synthesis of LA from different carbohydrates 3.3.4 Synthesis of HMF and LA in gram scale 4 Conclusions Acknowledgements Appendix A Supplementary data References CHRISTENSEN 2011 5422 5428 E JOSHI 2011 3262 3266 H LI 2016 726 734 H AHMAD 2016 4804 4823 E TOMINAGA 2011 810 812 K PENG 2011 4590 4596 L PENG 2011 259 265 L SARAVANAMURUGAN 2011 723 726 S SARAVANAMURUGAN 2012 71 75 S SARAVANAMURUGAN 2013 1754 1757 S YANG 2012 80 84 Y WANG 2016 5884 5889 Z ROMANLESHKOV 2006 1933 1937 Y SALAKASGHARI 2006 2163 2173 F QI 2008 799 805 X SHIMIZU 2009 1849 1853 K YANG 2012 2986 2989 Z WATANABE 2005 150 156 M ROMANLESHKOV 2007 982 985 Y ORDOMSKY 2012 1812 1819 V LICHTENTHALER 2002 728 737 F LIU 2013 2895 2903 R SHU 1995 782 784 C BADER 1954 4465 4466 A PILEIDIS 2016 562 582 F CHA 2002 109 118 J MORONE 2015 548 565 A SOUSA 2015 67 92 S SOUSA 2014 1855 1859 S FERNANDES 2010 5517 5525 A REIS 2008 1727 1733 P SOUSA 2012 8194 8197 S CABRITA 2010 6132 6135 I SOUSA 2009 6872 6876 C ARTERBURN 1996 7941 7944 J ZHU 1995 87 94 Z GABLE 2000 944 946 K ARTERBURN 2002 3225 3236 J ZIEGLER 2009 9998 10000 J VKUTURI 2010 4744 4746 S AHMAD 2011 2810 2818 I SOUSA 2011 6960 6962 S DENORONHA 2009 6960 6964 R WANG 2000 3525 3536 Y COOK 1996 9448 9449 G SHIRAMIZU 2012 8082 8086 M YI 2012 1401 1404 J KORSTANJE 2010 695 697 T FERNANDES 2015 1177 1183 T BERNARDO 2016 2675 2681 J KENNEDYSMITH 2003 4056 4057 J CHATT 1962 4019 4033 J SHERRY 2004 4510 4511 B FLANNELLY 2015 7554 7565 T LIU 2013 12313 12319 B LIU 2013 625 631 B ZHU 2011 2016 2018 H LIU 2015 765 771 J BERNARDOX2019X87 BERNARDOX2019X87X94 BERNARDOX2019X87XJ BERNARDOX2019X87X94XJ 2021-01-10T00:00:00.000Z http://creativecommons.org/licenses/by-nc-nd/4.0/ © 2019 Elsevier B.V. All rights reserved. item S2468-8231(18)30473-5 S2468823118304735 1-s2.0-S2468823118304735 10.1016/j.mcat.2019.01.003 315758 2019-02-12T23:00:30.485011Z 2019-03-01 2019-03-31 1-s2.0-S2468823118304735-main.pdf https://s3.amazonaws.com/prod-ucs-content-store-us-east/content/pii:S2468823118304735/MAIN/application/pdf/c60758e1d7f13c40f7b47aba5647e9f8/main.pdf main.pdf pdf true 1772809 MAIN 8 1-s2.0-S2468823118304735-main_1.png https://s3.amazonaws.com/prod-ucs-content-store-us-east/content/pii:S2468823118304735/PREVIEW/image/png/480bdc3504713a7c3daff74227d72e85/main_1.png main_1.png png 55660 849 656 IMAGE-WEB-PDF 1 1-s2.0-S2468823118304735-ga1.sml https://s3.amazonaws.com/prod-ucs-content-store-us-east/content/pii:S2468823118304735/ga1/THUMBNAIL/image/gif/c8b2ff21c23dd03db4d88b7c22e880b4/ga1.sml ga1 true ga1.sml sml 8587 133 219 IMAGE-THUMBNAIL 1-s2.0-S2468823118304735-gr1.sml https://s3.amazonaws.com/prod-ucs-content-store-us-east/content/pii:S2468823118304735/gr1/THUMBNAIL/image/gif/3e15022f5f9de3e58d1cdd87c8823c7f/gr1.sml gr1 gr1.sml sml 4318 127 219 IMAGE-THUMBNAIL 1-s2.0-S2468823118304735-gr10.sml https://s3.amazonaws.com/prod-ucs-content-store-us-east/content/pii:S2468823118304735/gr10/THUMBNAIL/image/gif/0c1fee82d7c50f7fc13c8d77019fc4d9/gr10.sml gr10 gr10.sml sml 6106 105 219 IMAGE-THUMBNAIL 1-s2.0-S2468823118304735-gr11.sml https://s3.amazonaws.com/prod-ucs-content-store-us-east/content/pii:S2468823118304735/gr11/THUMBNAIL/image/gif/b280514af816ad2668fd7de8b007bc32/gr11.sml gr11 gr11.sml sml 4235 143 219 IMAGE-THUMBNAIL 1-s2.0-S2468823118304735-gr12.sml https://s3.amazonaws.com/prod-ucs-content-store-us-east/content/pii:S2468823118304735/gr12/THUMBNAIL/image/gif/fe1e2ad22dbcdd386e80bc096548fa6c/gr12.sml gr12 gr12.sml sml 6239 141 219 IMAGE-THUMBNAIL 1-s2.0-S2468823118304735-gr13.sml https://s3.amazonaws.com/prod-ucs-content-store-us-east/content/pii:S2468823118304735/gr13/THUMBNAIL/image/gif/f139d8da6bdc71b0e18d77505b2c256d/gr13.sml gr13 gr13.sml sml 3973 141 219 IMAGE-THUMBNAIL 1-s2.0-S2468823118304735-gr14.sml https://s3.amazonaws.com/prod-ucs-content-store-us-east/content/pii:S2468823118304735/gr14/THUMBNAIL/image/gif/6b29ab42dfef9d3e7b736f212573c79e/gr14.sml gr14 gr14.sml sml 4196 90 219 IMAGE-THUMBNAIL 1-s2.0-S2468823118304735-gr15.sml https://s3.amazonaws.com/prod-ucs-content-store-us-east/content/pii:S2468823118304735/gr15/THUMBNAIL/image/gif/3d6ddbab1fd32007f229e4bf3797024b/gr15.sml gr15 gr15.sml sml 4441 141 219 IMAGE-THUMBNAIL 1-s2.0-S2468823118304735-gr2.sml https://s3.amazonaws.com/prod-ucs-content-store-us-east/content/pii:S2468823118304735/gr2/THUMBNAIL/image/gif/e23107f69c43ab6a351a7316e3f4bd06/gr2.sml gr2 gr2.sml sml 3796 136 219 IMAGE-THUMBNAIL 1-s2.0-S2468823118304735-gr3.sml https://s3.amazonaws.com/prod-ucs-content-store-us-east/content/pii:S2468823118304735/gr3/THUMBNAIL/image/gif/789f8e67c2330b7a569a735993171a50/gr3.sml gr3 gr3.sml sml 5297 134 219 IMAGE-THUMBNAIL 1-s2.0-S2468823118304735-gr4.sml https://s3.amazonaws.com/prod-ucs-content-store-us-east/content/pii:S2468823118304735/gr4/THUMBNAIL/image/gif/00c56257076d1160734d877728451d22/gr4.sml gr4 gr4.sml sml 6660 137 219 IMAGE-THUMBNAIL 1-s2.0-S2468823118304735-gr5.sml https://s3.amazonaws.com/prod-ucs-content-store-us-east/content/pii:S2468823118304735/gr5/THUMBNAIL/image/gif/6690439df11c0e721d114da57f64139a/gr5.sml gr5 gr5.sml sml 3672 130 219 IMAGE-THUMBNAIL 1-s2.0-S2468823118304735-gr6.sml https://s3.amazonaws.com/prod-ucs-content-store-us-east/content/pii:S2468823118304735/gr6/THUMBNAIL/image/gif/0e86ae76919249e062e73d11332937c1/gr6.sml gr6 gr6.sml sml 6642 123 219 IMAGE-THUMBNAIL 1-s2.0-S2468823118304735-gr7.sml https://s3.amazonaws.com/prod-ucs-content-store-us-east/content/pii:S2468823118304735/gr7/THUMBNAIL/image/gif/b66c06a1d7f2265c1b236876bdb64db8/gr7.sml gr7 gr7.sml sml 5482 130 219 IMAGE-THUMBNAIL 1-s2.0-S2468823118304735-gr8.sml https://s3.amazonaws.com/prod-ucs-content-store-us-east/content/pii:S2468823118304735/gr8/THUMBNAIL/image/gif/42e97325d85ac8692d8d4bf1c2713adf/gr8.sml gr8 gr8.sml sml 3768 141 219 IMAGE-THUMBNAIL 1-s2.0-S2468823118304735-gr9.sml https://s3.amazonaws.com/prod-ucs-content-store-us-east/content/pii:S2468823118304735/gr9/THUMBNAIL/image/gif/bf06e1c356145cd00f2d6dca0ccac9ce/gr9.sml gr9 gr9.sml sml 9392 164 215 IMAGE-THUMBNAIL 1-s2.0-S2468823118304735-sc1.sml https://s3.amazonaws.com/prod-ucs-content-store-us-east/content/pii:S2468823118304735/sc1/THUMBNAIL/image/gif/8801c74697936001147f6ac9039e0b2e/sc1.sml sc1 sc1.sml sml 2854 83 219 IMAGE-THUMBNAIL 1-s2.0-S2468823118304735-sc2.sml https://s3.amazonaws.com/prod-ucs-content-store-us-east/content/pii:S2468823118304735/sc2/THUMBNAIL/image/gif/a9bfe6112b5d38a1a3aa0d03e97de46e/sc2.sml sc2 sc2.sml sml 3232 90 219 IMAGE-THUMBNAIL 1-s2.0-S2468823118304735-ga1.jpg https://s3.amazonaws.com/prod-ucs-content-store-us-east/content/pii:S2468823118304735/ga1/DOWNSAMPLED/image/jpeg/b21f42d192c7c443bdd0b37caef8f690/ga1.jpg ga1 true ga1.jpg jpg 19460 200 330 IMAGE-DOWNSAMPLED 1-s2.0-S2468823118304735-gr1.jpg https://s3.amazonaws.com/prod-ucs-content-store-us-east/content/pii:S2468823118304735/gr1/DOWNSAMPLED/image/jpeg/0fa15433a5b67f07a8fdb82df33c8f59/gr1.jpg gr1 gr1.jpg jpg 14183 218 376 IMAGE-DOWNSAMPLED 1-s2.0-S2468823118304735-gr10.jpg https://s3.amazonaws.com/prod-ucs-content-store-us-east/content/pii:S2468823118304735/gr10/DOWNSAMPLED/image/jpeg/81981f1aa97cbadc96055e1d36b955f1/gr10.jpg gr10 gr10.jpg jpg 27270 271 565 IMAGE-DOWNSAMPLED 1-s2.0-S2468823118304735-gr11.jpg https://s3.amazonaws.com/prod-ucs-content-store-us-east/content/pii:S2468823118304735/gr11/DOWNSAMPLED/image/jpeg/d993f7dd0e27983b200f7e4907cb7795/gr11.jpg gr11 gr11.jpg jpg 14018 245 376 IMAGE-DOWNSAMPLED 1-s2.0-S2468823118304735-gr12.jpg https://s3.amazonaws.com/prod-ucs-content-store-us-east/content/pii:S2468823118304735/gr12/DOWNSAMPLED/image/jpeg/e00051fc2405e7af59e4892e868eaf32/gr12.jpg gr12 gr12.jpg jpg 16089 242 376 IMAGE-DOWNSAMPLED 1-s2.0-S2468823118304735-gr13.jpg https://s3.amazonaws.com/prod-ucs-content-store-us-east/content/pii:S2468823118304735/gr13/DOWNSAMPLED/image/jpeg/e9b40146d4e88d7308ad7d314036ba64/gr13.jpg gr13 gr13.jpg jpg 14599 242 376 IMAGE-DOWNSAMPLED 1-s2.0-S2468823118304735-gr14.jpg https://s3.amazonaws.com/prod-ucs-content-store-us-east/content/pii:S2468823118304735/gr14/DOWNSAMPLED/image/jpeg/34f494e531fd02007f101d7ec700a547/gr14.jpg gr14 gr14.jpg jpg 24231 232 565 IMAGE-DOWNSAMPLED 1-s2.0-S2468823118304735-gr15.jpg https://s3.amazonaws.com/prod-ucs-content-store-us-east/content/pii:S2468823118304735/gr15/DOWNSAMPLED/image/jpeg/b67169694c1f20463ac6024f87d8da7b/gr15.jpg gr15 gr15.jpg jpg 14202 242 376 IMAGE-DOWNSAMPLED 1-s2.0-S2468823118304735-gr2.jpg https://s3.amazonaws.com/prod-ucs-content-store-us-east/content/pii:S2468823118304735/gr2/DOWNSAMPLED/image/jpeg/59d8b11dde62169c918a8dea1c5ca3c1/gr2.jpg gr2 gr2.jpg jpg 12707 233 376 IMAGE-DOWNSAMPLED 1-s2.0-S2468823118304735-gr3.jpg https://s3.amazonaws.com/prod-ucs-content-store-us-east/content/pii:S2468823118304735/gr3/DOWNSAMPLED/image/jpeg/56a251e4bfb871d5a201897fd6b59687/gr3.jpg gr3 gr3.jpg jpg 17226 230 376 IMAGE-DOWNSAMPLED 1-s2.0-S2468823118304735-gr4.jpg https://s3.amazonaws.com/prod-ucs-content-store-us-east/content/pii:S2468823118304735/gr4/DOWNSAMPLED/image/jpeg/000cf8cf81d0915be88a05226043c4e8/gr4.jpg gr4 gr4.jpg jpg 17779 236 376 IMAGE-DOWNSAMPLED 1-s2.0-S2468823118304735-gr5.jpg https://s3.amazonaws.com/prod-ucs-content-store-us-east/content/pii:S2468823118304735/gr5/DOWNSAMPLED/image/jpeg/db9398274c9758e6ee291b4d22e25b1d/gr5.jpg gr5 gr5.jpg jpg 12626 223 376 IMAGE-DOWNSAMPLED 1-s2.0-S2468823118304735-gr6.jpg https://s3.amazonaws.com/prod-ucs-content-store-us-east/content/pii:S2468823118304735/gr6/DOWNSAMPLED/image/jpeg/71bc26435c47593abede4fb1bb08f633/gr6.jpg gr6 gr6.jpg jpg 15383 211 376 IMAGE-DOWNSAMPLED 1-s2.0-S2468823118304735-gr7.jpg https://s3.amazonaws.com/prod-ucs-content-store-us-east/content/pii:S2468823118304735/gr7/DOWNSAMPLED/image/jpeg/2150e9baa27318e41bf5e8abcdcc68a6/gr7.jpg gr7 gr7.jpg jpg 17461 223 376 IMAGE-DOWNSAMPLED 1-s2.0-S2468823118304735-gr8.jpg https://s3.amazonaws.com/prod-ucs-content-store-us-east/content/pii:S2468823118304735/gr8/DOWNSAMPLED/image/jpeg/f13155edccf5c45e4fe268b4c37492c2/gr8.jpg gr8 gr8.jpg jpg 12390 242 376 IMAGE-DOWNSAMPLED 1-s2.0-S2468823118304735-gr9.jpg https://s3.amazonaws.com/prod-ucs-content-store-us-east/content/pii:S2468823118304735/gr9/DOWNSAMPLED/image/jpeg/b85fd2cf8757983cddb7544b8142fcdd/gr9.jpg gr9 gr9.jpg jpg 52689 432 567 IMAGE-DOWNSAMPLED 1-s2.0-S2468823118304735-sc1.jpg https://s3.amazonaws.com/prod-ucs-content-store-us-east/content/pii:S2468823118304735/sc1/DOWNSAMPLED/image/jpeg/ea9f7b975ea39b0c614473f441b74dc0/sc1.jpg sc1 sc1.jpg jpg 14435 215 565 IMAGE-DOWNSAMPLED 1-s2.0-S2468823118304735-sc2.jpg https://s3.amazonaws.com/prod-ucs-content-store-us-east/content/pii:S2468823118304735/sc2/DOWNSAMPLED/image/jpeg/3d668e29e23ecb3b45a0f5d613f84573/sc2.jpg sc2 sc2.jpg jpg 8893 155 376 IMAGE-DOWNSAMPLED 1-s2.0-S2468823118304735-mmc1.docx https://s3.amazonaws.com/prod-ucs-content-store-us-east/content/pii:S2468823118304735/mmc1/MAIN/application/vnd.openxmlformats-officedocument.wordprocessingml.document/e671104a4c93b33fa1fbb7b7d1687e7d/mmc1.docx mmc1 mmc1.docx docx 121185 APPLICATION 1-s2.0-S2468823118304735-am.pdf https://s3-eu-west-1.amazonaws.com/prod-ucs-content-store-eu-west/content/egi:106KQ0LX8WM/MAIN/application/pdf/b18a759b88e6a11f11fb7dad51c6c86e/am.pdf https://s3.amazonaws.com/prod-ucs-content-store-us-east/content/egi:106KQ0LX8WM/MAIN/application/pdf/b18a759b88e6a11f11fb7dad51c6c86e/am.pdf am am.pdf pdf false 716552 AAM-PDF MCAT 10283 S2468-8231(18)30473-5 10.1016/j.mcat.2019.01.003 Elsevier B.V. Scheme 1 Products obtained from the reaction of fructose with different alcohols. Scheme 1 Scheme 2 Selective synthesis of HMF and LA from fructose. Scheme 2 Fig. 1 Reaction of fructose catalyzed by different oxo-rhenium complexes: 1. HReO4; 2. [ReOCl3(SMe2)(OPPh3)]; 3. ReOCl3(PPh3)2; 4. ReIO2(PPh3)2; 5. MTO; 6. NaReO4. Reaction conditions: Fructose (1 mmol), catalyst (10 mol%), EtOH (5 mL), 160 °C, 16 h. Conversions and yields determined by 1H NMR spectroscopy. Fig. 1 Fig. 2 Effect of catalyst HReO4 amount on the conversion of fructose into EL. Reaction conditions: Fructose (1 mmol), EtOH (5 mL), 160 °C, 16 h. Conversions and yields determined by 1H NMR spectroscopy. Fig. 2 Fig. 3 Effect of reaction temperature on the conversion of fructose into EL. Reaction conditions: Fructose (1 mmol), HReO4 (10 mol%), EtOH (5 mL), 16 h. Conversions and yields determined by 1H NMR spectroscopy. Fig. 3 Fig. 4 Monitoring of fructose conversion. Reaction conditions: Fructose (1 mmol), HReO4 (10 mol%), EtOH (5 mL), 160 °C. Yields determined by 1H NMR spectroscopy. Fig. 4 Fig. 5 Conversion of several carbohydrates into EL. Reaction conditions: Carbohydrate (1 mmol of hexose), HReO4 (10 mol%), EtOH (5 mL), 160 °C, 16 h. Conversions and yields determined by 1HNMR spectroscopy. Fig. 5 Fig. 6 Monitoring of EL formation from different carbohydrates. Reaction conditions: Carbohydrate (1 mmol of hexose), HReO4 (10 mol%), EtOH (5 mL), 160 °C. Yields determined by 1H NMR spectroscopy. Fig. 6 Fig. 7 Use of catalyst HReO4 in multiple cycles. Reaction conditions: Fructose (0.5 mmol in each cycle); HReO4 (10 mol%), EtOH (5 mL), 160 °C, 16 h. Conversions and yields determined by 1H NMR spectroscopy. Fig. 7 Fig. 8 Synthesis of EL in gram scale. Reaction conditions: HReO4 (10 mol%), EtOH 160 °C, 16 h. Conversions and yields determined by 1H NMR spectroscopy. Fig. 8 Fig. 9 Monitoring of fructose conversion at different temperatures (120–150 °C) and different reaction times (30 min-2 h). Reaction conditions: Fructose (1 mmol); HReO4 (10 mol%); EtOH (5 mL). Yields determined by 1H NMR spectroscopy. Fig. 9 Fig. 10 Effect of different co-solvents on the conversion of fructose. Reaction conditions: Fructose (1 mmol); HReO4 (10 mol%), VTotal(5 mL), 140 °C, 1 h. Conversions and yields determined by 1H NMR spectroscopy. Fig. 10 Fig. 11 Synthesis of EMF from other carbohydrates. Reaction conditions: Carbohydrate (1 mmol of hexose), HReO4 (10 mol%), THF/EtOH = 3:7 (VTotal = 5 mL), 1 h, 140 °C. Conversions and yields determined by 1H NMR spectroscopy. Fig. 11 Fig. 12 Effect of solvent in the reaction of fructose. Reaction conditions: Fructose (1 mmol); HReO4 (10 mol%), VSolvent = 5 mL, 1 h, 140 °C. Conversions and yields determined by 1H NMR spectroscopy. Fig. 12 Fig. 13 Synthesis of HMF from different carbohydrates. Reactions conditions: Carbohydrate (1 mmol of hexose), HReO4 (10 mol%), VDMSO = 5 mL, 1 h, 140 °C. Conversions and yields determined by 1H NMR spectroscopy. Fig. 13 Fig. 14 Monitoring of HMF yield obtained from sucrose and glucose. Reaction conditions: Carbohydrate (1 mmol of hexose), HReO4 (10 mol%), DMSO (5 mL), 140 °C. Yields determined by 1H NMR spectroscopy. Fig. 14 Fig. 15 Synthesis of LA from different carbohydrates. Reaction conditions: Carbohydrate (1 mmol of hexose), HReO4 (10 mol%), VDMSO = 5 mL, 1 h, 140 °C. Conversions and yields determined by 1H NMR spectroscopy. Fig. 15 Table 1 Conversion of fructose catalyzed by different acids. Table 1 Entry Catalyst Catalyst amount (%) Temp.(ºC) Conversion (%) HMF (%) EMF (%) EL (%) AL (%) 1 H2SO4 10 100 92 0 33 10 ― 2 HCl 10 100 100 9 32 10 ― 3 DMSO/H2SO4 10 100 98 0 42 12 ― 4 DMSO/H2SO4 10 140 ― 0 55 26 ― 5 DMSO/H2SO4 10 160 ― 0 30 30 60 6 DMSO/HCl 10 100 99 10 36 10 ― 7 DMSO/HI 10 100 99 2 9 3 ― 8 DMSO/CH3SO3H 10 100 99 0 37 13 ― 9 HReO4/DMSO 10 140 100 100 ― ― ― 10 HReO4/dioxane 10 140 100 ― ― ― 100 11 HReO4/EtOH 10 160 100 ― ― 80 ― 12 HReO4/EtOH/THF 10 140 90 ― 73 ― ― HReO4 as highly efficient and selective catalyst for the conversion of carbohydrates into value added chemicals Joana R. Bernardo M. Conceição Oliveira Ana C. Fernandes ⁎ Centro de Química Estrutural, Instituto Superior Técnico, Universidade de Lisboa, Av. Rovisco Pais, 1049-001 Lisboa, Portugal Centro de Química Estrutural Instituto Superior Técnico Universidade de Lisboa Av. Rovisco Pais Lisboa 1049-001 Portugal ⁎ Corresponding author. Graphical abstract This work describes the first catalyst (HReO4) that promotes the efficient and selective conversion of several carbohydrates into four compounds, ethyl levulinate (EL), 5-ethoxymethylfurfural (EMF), 5-hydroxymethylfurfural (HMF) and levulinic acid (LA), through a one-pot reaction strategy adjusting the reaction conditions. The reaction of fructose in ethanol at 160 °C gave EL in 80% yield after 16 h and in a mixture of ethanol/THF at 140 °C produced EMF in 73% yield after 1 h. HMF and LA can also be obtained selectively with 100% yield from fructose at 140 °C after 1 h, in DMSO or 1,4-dioxane, respectively. EL, HMF, LA and EMF were also produced in moderate to good yields from other carbohydrates such as inulin and sucrose. The catalyst HReO4 can be used in gram scale for the production of EL, EMF, HMF and LA with good yields and in at least 8 catalytic cycles on the conversion of fructose into EL with no significant reduction in its activity. Keywords Oxo-rhenium complexes Ethyl levulinate 5-Ethoxymethylfurfural 5-Hydroxymethylfurfural Levulinic acid 1 Introduction Due to environmental concerns, diminishing fossil resources and the high price of petrochemicals, it is urgent to develop and use renewable resources. Biomass is the most attractive alternative and different biomass carbohydrate-derived chemicals including alkyl levulinate, 5-alkoxymethylfurfural ethers, 5-hydroxymethylfurfural and levulinic acid have been considered versatile platform compounds for the preparation of a diversity of fine chemicals, biofuels and biological compounds. Ethyl levulinate (EL) has been widely used as an additive for gasoline and diesel due to the similar properties with the biodiesel fatty acid methyl esters and also as solvent and plasticizer in food industry [1,2]. 5-Ethoxymethylfurfural (EMF) has attracted much attention as a potential biofuel alternative because of its high energy density of 30.3 MJ L−1, close to that of diesel (33.6 MJ L−1), gasoline (31.1 MJ L−1) and ethanol (23.5 MJ L−1), and also due to the high oxidation stability of EMF that can lead to the reduction of emission of soot, NOx and SOx [3]. Usually, the synthesis of EL or EMF involves the esterification of a biomass-derived substrate catalyzed by an acid catalyst [4]. For example, Tominaga group reported the direct conversion of cellulose into alkyl levulinates using mixed-acid systems, containing Lewis and Brønsted acids [5]. Lin and Liu studied the synthesis of EL from glucose employing SO4 2−/ZrO2 − based solid acid catalysts [6,7]. The production of EMF and EL catalyzed by sulfonic acid-functionalized ionic liquids [8] SBA-15 [9] and zeolites was investigated by Riisager group [10]. Different heteropolyacids were also employed for the conversion of biomass into biofuels. For example, EMF was obtained with 65% yield in the presence of H3PW12O40 under microwave heating [11], and Wang and Chen [12] reported the transformation of HMF into EMF (55%) and EL (11%) catalyzed by MOFs-based heteropolyacid materials. HMF, a sustainable and versatile precursor for petrochemical industry and biofuel chemistry, is produced mainly by dehydration of biomass-based carbohydrates catalyzed by mineral acids [13], organic acids [14], acidic resins [15–17], oxides [18], phosphates [19] and zeolites [20]. More recently, acidic ionic liquids (ILs) have also been employed as catalysts or as solvents for the synthesis of HMF [21,22]. Another important bioderived platform chemical, levulinic acid (LA), has been employed as plasticizer, food flavoring agent, solvent, resin intermediate and building block [23–25]. Usually, the synthesis of LA involves the reaction of carbohydrates with aqueous mineral acid (H2SO4 and HCl) at high temperature (100–250 °C), affording LA with low yields (∼40%). Using continuous flow conditions at higher temperatures and pressures, LA yield may be improved to 60–70% [26]. However, a major drawback in this process is the tedious work-up during the separation stages. Heterogeneous catalysts are very selective and do not present corrosion problems, but, until now, the use of heterogeneous catalysts for the synthesis of LA is still rare in comparison to homogeneous catalysts [27]. Due to the high importance of the conversion of carbohydrates into biofuels and value added chemicals, the research for efficient catalysts is a key target in organic chemistry and also in the chemical industry. In the last years, oxo-rhenium complexes have been applied in the deoxygenation of many organic compounds [28] such as sulfoxides [29–35], epoxides [36–42], aromatic nitro compounds [43], N-oxides [44], alcohols [45–48] and carbonyl compounds [49,50]. The synthesis of EL, EMF, and LA has never been studied using oxo-rhenium complexes as catalysts. In this work, we report the first methodology for the direct and selective conversion of carbohydrates into potential fuels and value added chemicals such as EL, EMF, HMF and LA catalyzed by oxo-rhenium complexes. 2 Methods 2.1 General information All the reactions were carried out under air atmosphere, without using any dry solvent. Carbohydrates and HReO4 (75–80 wt.% in H2O), MTO, NaReO4 were obtained from commercial suppliers and were used without further purification. ReIO2(PPh3)2 [51], ReOCl3(PPh3)2 [52] and [ReOCl3(SMe2)(OPPh3)] [53] were prepared according to literature procedures. Flash chromatography was performed on MN Kieselgel 60 M 230–400 mesh. 1H NMR and 13C NMR spectra were measured on a Bruker Avance II+ 400 MHz and 300 MHz spectrometers. Chemical shifts are reported in parts per million (ppm) downfield from an internal standard. 2.2 Synthesis of EL 2.2.1 General procedure for the conversion of carbohydrates into EL To a Schlenk flask equipped with a J. Young tap containing a solution of carbohydrate (0.180 g, 1.0 mmol of hexose) in ethanol (5 mL) was added HReO4 (0.025 g, 10 mol%). The reaction mixture was stirred in a closed Schlenk at 160 °C during 16 h. The yields of the products were determined by spectroscopy 1H NMR using mesitylene as internal standard. 2.2.2 Use of catalyst HReO4 in several cycles To a Schlenk flask equipped with a J. Young tap containing a solution of fructose (0.09 g, 0.5 mmol) in ethanol (5 mL) was added HReO4 (0.0126 g, 10 mol%). The reaction mixture was stirred in a closed Schlenk at 160 °C during 16 h. The reaction mixture was cooled and the yield was determined by 1H NMR spectroscopy using mesytilene (0.5 mmol) as internal standard. In the next catalytic cycles, fructose (0.5 mmol) and mesytilene (0.5 mmol) were added to the reaction mixture and stirred for 16 h at 160 °C. The reaction mixture was cooled and the yields were determined by 1H NMR spectroscopy. 2.2.3 Synthesis of EL in gram scale To a Schlenk flask equipped with a J. Young tap containing a solution of fructose (1.80 g, 10 mmol) in ethanol (50 mL) was added HReO4 (0.25 g, 10 mol%). The reaction mixture was stirred in a closed Schlenk at 160 °C during 16 h. The yields were determined by spectroscopy 1H NMR using mesitylene as internal standard. 2.3 General procedure for the conversion of carbohydrates into EMF To a Schlenk flask equipped with a J. Young tap containing a solution of carbohydrate (0.180 g, 1.0 mmol of hexose) in a mixture ethanol/THF (7/3) (Vtotal = 5 mL) was added HReO4 (0.025 g, 10 mol%). The reaction mixture was stirred in a closed Schlenk at 140 °C during 1 h. The yields were determined by spectroscopy 1H NMR using mesitylene as internal standard. 2.4 General procedure for the conversion of carbohydrates into HMF To a Schlenk flask equipped with a J. Young tap containing a solution of carbohydrate (0.180 g, 1.0 mmol of hexose) in DMSO (5 mL) was added HReO4 (0.025 g, 10 mol%). The reaction mixture was stirred in a closed Schlenk at 140 °C during 1 h. The yields were determined by spectroscopy 1H NMR using mesitylene as internal standard. 2.5 General procedure for the conversion of carbohydrates into LA To a Schlenk flask equipped with a J. Young tap containing a solution of carbohydrate (0.180 g, 1.0 mmol of hexose) in 1,4-dioxane (5 mL) was added HReO4 (0.025 g, 10 mol%). The reaction mixture was stirred in a closed Schlenk at 140 °C during 1 h. The yields were determined by spectroscopy 1H NMR using mesitylene as internal standard. 3 Results and discussion 3.1 Synthesis of alkyl levulinates Initially, we optimized the conversion of carbohydrates into ethyl levulinate using different reaction conditions. 3.1.1 Effect of the catalyst The conversion of fructose was studied using 10 mol% of different oxo-rhenium complexes as catalysts (Fig. 1 ). The best result was obtained in the presence of the Re(VII) complex HReO4 in ethanol at 160 °C, producing selectively EL with 80% yield after 16 h. The reactions catalyzed by [ReOCl3(OPPh3)(SMe2)] and MTO also gave selectively EL with 53% and 16% yields, respectively. In the presence of ReOCl3(PPh3)2, EL was afforded in 50% yield along with 12% yield of EMF. A mixture of EL (44%), EMF (5%) and HMF (8%) was obtained in the reaction catalyzed by the oxo-complex ReIO2(PPh3)2. Among the Re(V) complexes, the electronic properties of the halide ligands Cl and I can influence the activity of the catalysts, leading to a slight higher activity for the catalyst containing the Cl ligand. Finally, the weak chelate character of the ligands SMe2 and OPPh3 also enhances the catalytic activity of [ReOCl3(SMe2)(OPPh3)]. The conversion of fructose using NaReO4 as catalyst afforded only 11% of EL and 22% of EMF, confirming the importance of the presence of the Brønsted acid. Finally, no reaction was observed in the absence of catalyst. 3.1.2 Effect of catalyst amount The effect of catalyst (HReO4) amount on the conversion of fructose into EL is presented in Fig. 2 . The reaction performed with 5 mol% of HReO4 afforded a mixture of EL and EMF in 66% and 17% yields, respectively. The best result was obtained with 10 mol%, giving selectively EL with 80% yield. Using 20 mol% of HReO4, EL was produced selectively, but with slight lower yield (75%), observing the formation of insoluble humins. 3.1.3 Effect of reaction temperature The reaction of fructose catalyzed by HReO4 in ethanol was carried out at different temperatures from 80 to 180 °C. As evidenced by Fig. 3 , a significant effect of the reaction temperature on the products distribution was observed. Higher temperatures accelerated the rate of fructose conversion into EL. At low temperature (80 °C), a mixture of EMF (42%) and EL (16%) was formed. The reactions carried out between 100–140 °C also led to the formation of a mixture of EMF and EL, but an increase in the reaction temperature improves EL yield, as a result of decreasing of EMF. At 160 °C, EL was produced selectively with 80% yield. Finally, higher temperature (180 °C) led to a slight decrease of EL yield, probably due to the formation of humins. 3.1.4 The effect of reaction time on the conversion of fructose A typical time profile for fructose conversion catalyzed by HReO4 is shown in Fig. 4 . In the first 0.5 h, the maximum EMF yield (65%) was achieved along with a small amount of EL (10%). Then, EMF yield began to drop, while EL yield continued to rise to a maximum value (80%) after 16 h. 3.1.5 Synthesis of different alkyl levulinates Due to high chemical importance of alkyl levulinates, the conversion of fructose into different alkyl levulinates was also investigated with methanol and isopropanol under the same reaction conditions described before for the synthesis of ethyl levulinate (10 mol% of HReO4, 160 °C, 16 h). The reaction of fructose with methanol gave methyl levulinate (ML) with 76% yield (Scheme 1 ). In contrast, the reaction of fructose with isopropanol produced a mixture of alkyl levulinate (IL) (22%), alkoxymethylfurfural (IMF) (20%) and hydroxymethylfurfural (HMF) (4%) derivatives in low yields. This result demonstrated that isopropanol is not a good solvent for the selective conversion of fructose into the corresponding alkyl levulinate, leading also to the formation of furanosidic derivatives. 3.1.6 Synthesis of EL from different carbohydrates In order to test the scope and limitations of our catalytic system, the synthesis of EL from other carbohydrates was also explored. Under the same reaction conditions used for the conversion of fructose into EL (10 mol% HReO4, ethanol 160 °C, 16 h), this compound was obtained from inulin, sucrose and glucose with 65%, 52% and 27% yields, respectively and no formation of HMF or EMF was observed (Fig. 5 ). These results also demonstrate that HReO4 has also the ability to hydrolyze the glycosidic bonds of di- and polysaccharides to the corresponding monomers (fructose and glucose). The EL yield obtained from inulin is higher than the value obtained for sucrose because one molecule of inulin contains just one molecule of glucose and 1–59 molecules of fructose while one molecule of sucrose contains one molecule of glucose and only one molecule of fructose. To improve the EL yield obtained from inulin, sucrose and glucose, the formation of EL synthesized from these carbohydrates was monitored during 72 h. Fig. 6 shows that the reaction of glucose is slow, but after 72 h it is possible to obtain EL with 80% yield. In the reaction of sucrose was initially observed a rapid conversion of this disaccharide into EL, corresponding to about half of EL yield obtained in the reaction of fructose, which should result only from fructose conversion, after the sucrose hydrolysis. Thereafter, an increase of EL yield was observed as result of glucose conversion to give the maximum EL yield (80%). 3.1.7 Use of catalyst HReO4 in multiple cycles The possibility of using the catalyst HReO4 in multiple cycles was investigated on the conversion of fructose into EL in ethanol at 160 °C by successive additions of fructose to the reaction mixture, without separating the catalyst at the end of each cycle (Fig. 7 ). The yield obtained for each catalytic cycle was determined by 1H NMR spectroscopy using mesitylene as internal standard. The obtained results showed that the catalyst can be used in at least 8 cycles with good activity. 3.1.8 Synthesis of EL in gram scale The catalytic activity of HReO4 on the conversion of fructose was also tested in gram scale (Fig. 8 ). The reactions were performed using 10 and 20 mmol of fructose at 160 °C during 16 h, affording EL in 80% and 75% yield, respectively. These results are similar to the yield obtained from 1 mmol of fructose, showing that this catalyst can be used in gram scale. 3.1.9 Conversion of fructose in EL monitoring by LC-ESI-MS/MS technique As described in the literature [54], HMF and EMF are the most significant intermediate species in EL formation. The kinetic study performed for the conversion of fructose into EL catalyzed by HReO4 in ethanol at 160 °C (Fig. 4) demonstrated that EMF is an intermediate in the synthesis of EL, observing the decrease in its yield while increasing EL yield. However, the formation of HMF or other intermediates was not detected by 1H NMR spectroscopy. The conversion of fructose into EL, under the same reaction conditions, was also monitored by LC-ESI-MS/MS technique. After 5 min of reaction, traces of fructose were detected and after 15 min all the fructose had been consumed. The peaks corresponding to the formation of the intermediates HMF (Figure S1, Sup. Inf.), EMF (Figure S2, Sup. Inf.) and traces of HMF diethyl acetal (HMFda) were also observed by LC-ESI-MS/MS after 5 and 15 min, which disappeared during the reaction. The LC-ESI-MS/MS technique also detected the peak corresponding to the formation of EL, even after 5 min, which increased over the reaction (Figure S3, Sup. Inf.). These results suggested that the conversion of fructose into EL involves the dehydration of fructose into HMF, followed by etherification of HMF giving EMF, and re-hydration of EMF producing EL and ethyl formate. The conversion of glucose into EL catalyzed by HReO4 was also monitored by 1H NMR spectroscopy and LC-ESI-MS/MS techniques. Although, the glucose was converted into EL with 80% yield after 72 h (Fig. 6), the formation of HMF or EMF from glucose was never observed by 1H NMR spectroscopy. In acid medium, glucose can react with ethanol producing ethyl glucopyranoside [55,56]. The formation of this derivative as intermediate on the glucose conversion into EL was also detected by LC-ESI-MS/MS technique, along with the product EL, even after 24 h. Since the formation of HMF and EMF was not detected by 1H NMR and LC-ESI-MS/MS techniques, we believe that on the conversion of glucose into EL catalyzed by HReO4, ethyl glucopyranoside derivative should be transformed into other species that give rise to EL, unlike to other methods using Brønsted acids as catalysts, in which this derivative remains unchanged. 3.2 Synthesis of 5-alkoxymethylfurfural ethers The selective conversion of carbohydrates into 5-alkoxymethylfurfural ethers was also studied in this work using different temperatures, reaction times and solvents. 3.2.1 Effect of reaction temperature As described before, the reaction of fructose in ethanol at 160 °C gave EMF with 65% yield, along with 10% yield of EL, after 30 min (Fig. 4). In order to optimize the selective synthesis of EMF, we also studied the effect of the temperature on the synthesis of EMF. The conversion of fructose was performed at 120, 130, 140 and 150 °C and the reactions were monitored by 1H NMR spectroscopy after 30 min, 1 h, 1 h 30 min and 2 h (Fig. 9 ). At 120 °C, EMF yield decreased and the maximum EMF yield (56%) was observed only after 2 h. However, the reaction was not selective, producing also 12% of EL. EMF was selectively obtained with 60% yield after 1 h at 130 °C, but longer reaction times led to the decrease of EMF yield and to the formation of EL. At 140 °C, EMF was selectively obtained with the best yield (63%) after 1 h. Finally, at 150 °C, the formation of EMF was not selective. These results revealed that the best EMF yield was obtained at 140 °C after 1 h. 3.2.2 The effect of different co-solvents As described in the literature [57], the addition of a co-solvent to ethanol, such as THF, on the conversion of fructose can increases the EMF yield. Based on this result, the reaction of fructose catalyzed by HReO4 in ethanol was carried out using different organic co-solvents including THF, DMSO, n-hexane, toluene and 1,4-dioxane (Fig. 10 ). As reported before, the conversion of fructose performed in ethanol gave EMF in 63% yield at 140 °C after 1 h (Fig. 9). The addition of THF to ethanol (3:7, Vtotal = 5 mL) increased EMF yield to 73%. However, higher volumes of THF, for example, ethanol/THF (1:1) decreased the EMF yield (45%). The use of THF as co-solvent led to an increase in EMF yield, possibly because THF provides a more hydrophobic medium than ethanol, enabling the separation of EMF and also the reduction of humins formation. The addition of DMSO, a more polar co-solvent, decreased the rate of HMF etherification, producing a mixture of HMF (39%) and EMF (32%), while the use of apolar co-solvents, such as n-hexane and toluene, afforded a mixture of EL and EMF. Thus, it can be concluded that the use of a strongly apolar co-solvent accelerates the reaction rate, leading to the formation of large quantities of EL, even after 1 h of reaction. Finally, the conversion of fructose in ethanol using 1,4-dioxane as co-solvent gave a mixture of EMF (43%), EL (20%) and LA (25%). Based on these results, the mixture ethanol/THF (7:3) was chosen as the best solvent for the conversion of fructose into EMF. 3.2.3 Synthesis of EMF from other carbohydrates After optimizing the reaction conditions to synthesize EMF from fructose, the preparation of EMF from other carbohydrates such as inulin and sucrose was also investigated (Fig. 11 ). EMF was formed in 51% yield from inulin, along with 18% yield of EL, and in 36% yield from sucrose. 3.2.4 Synthesis of EMF in gram scale The applicability of HReO4 as catalyst for the synthesis of EMF in gram scale was also explored. The reaction of 10 mmol (1.8 g) of fructose was carried out in ethanol using 10 mol% of HReO4 at 140 °C during 1 h, affording EMF in 63% yield along with 13% yield of EL. 3.3 Synthesis of HMF In this work was also investigated the selective conversion of carbohydrates into HMF catalyzed by HReO4 using different reaction conditions. 3.3.1 Effect of solvent As described before, the conversion of fructose using DMSO as co-solvent in ethanol gave a mixture of HMF (39%) and EMF (32%) (Fig. 10). Based on this result, we performed the reaction of fructose catalyzed by 10 mol% of HReO4 in DMSO at 140 °C. After 1 h, all fructose was converted, producing HMF with 100% yield (Fig. 12 ). This reaction was also conducted in DMF and MeCN affording HMF with 50% and 25% yields, respectively. Using THF as solvent, the reaction was not selective, giving HMF in 30% yield and levulinic acid (LA) in 28% yield. In toluene, the HMF yield was residual, due to the formation of humins, probably related to the low solubility of fructose in this solvent. These results show that DMSO is the best solvent, producing HMF with 100% yield after 1 h at 140 °C. This result is similar to others described in the literature which reports that the use of polar organic solvent, such as DMSO, can suppress the formation of condensation products and diminish the rehydration of HMF. Finally, we also carried out the reaction of fructose in 1,4-dioxane catalyzed by HReO4 at 140 °C during 1 h and surprisingly LA was obtained with 100% yield, probably as result of the rehydration of HMF (Fig. 12). The solvent effect study showed that the choice of solvent is crucial for the nature of the product obtained in the reaction of fructose catalyzed by HReO4. Thus, it is possible to conclude that DMSO led to the selective formation of HMF with 100% yield and 1,4-dioxane allowed the selective synthesis of LA also in 100% yield (Scheme 2 ). 3.3.2 Synthesis of HMF from different carbohydrates The excellent HMF yield obtained from fructose using DMSO as solvent encouraged us to explore the synthesis of HMF from other carbohydrates (Fig. 13 ). HMF was formed with 78% and 66% yields from inulin and sucrose, respectively. In contrast, only 20% yield of HMF was obtained from glucose. To optimize the HMF yield obtained from sucrose and glucose, these reactions were monitored during 4 h and 8 h, respectively (Fig. 14 ). The analysis of Fig. 14 shows that the maximum HMF yield was obtained after 2 h from sucrose (79%) and after 6 h from glucose (64%). Longer reaction times decreased the HMF yield, probably due to the formation of humins. 3.3.3 Synthesis of LA from different carbohydrates The synthesis of LA from different carbohydrates was explored using 10 mol% of HReO4 in 1,4-dioxane at 140 °C during 1 h (Fig. 15 ). LA was obtained with 97% and 85% yields from inulin and sucrose, respectively. In contrast, the reaction of glucose only gave 50% yield of LA after 1 h, but after 3 h this yield increased to 89%. 3.3.4 Synthesis of HMF and LA in gram scale The catalytic activity of HReO4 was also evaluated in the synthesis of HMF and LA in gram scale. From the reaction of fructose (10 mmol) in DMSO at 140 °C, HMF was obtained in 78% yield after 1 h. Similarly, the reaction of fructose (10 mmol) in 1,4-dioxane at 140 °C gave LA with 75% yield after 1 h, along with traces of HMF. These yields are lower than the HMF yield (100%) and LA yield (100%) obtained from 1 mmol of fructose. In Table 1 are summarized the results reported in the literature using conventional acid as catalysts such as H2SO4, HCl, HI or CH3SO3H [58] and also the results reported in this work using HReO4, confirming the high efficiency and selectivity of this catalyst for the synthesis of EL, EMF, HMF and LA. 4 Conclusions This work describes the highly efficient and selective conversion of carbohydrates into EL, EMF, HMF and LA catalyzed by HReO4. This is the first catalyst that allows the selective conversion of different carbohydrates into four important compounds (fuels and added value chemicals) in good to excellent yields, only by changing the reaction parameters. This method has also the advantages of the catalyst HReO4 can be used in gram scale for the production of EL, EMF, HMF and LA with good yields and in at least 8 catalytic cycles for the conversion of fructose into EL, with no significant reduction in its activity. Among the oxo-rhenium complexes reported in the literature, HReO4 has relative low cost, is commercially available and air stable. These results extend the scope of the use of oxo-rhenium complexes as efficient catalysts for the synthesis of fuels and value added chemicals from renewable resource. Acknowledgements Authors thank the project UID/QUI/00100/2013 and the Portuguese NMR Network (IST-UTL Center) for providing access to the NMR facilities. J. R. B. thanks FCT for grant (SFRH/BD/90659/2012) and ACF (IF/00849/2012) acknowledges FCT for the “Investigador FCT” Program. Appendix A Supplementary data Supplementary data associated with this article can be found, in the online version, at https://doi.org/10.1016/j.mcat.2019.01.003. Appendix A Supplementary data The following is Supplementary data to this article: References [1] E. Christensen A. Williams S. Paul S. Burton R.L. McCormick Energy Fuels 25 2011 5422 5428 [2] H. Joshi B.R. Moser J. Toler W.F. Smith T. Walker Biomass Bioenerg 35 2011 3262 3266 [3] H. Li S. Saravanamurugan S. Yang A. Riisager Green Chem. 18 2016 726 734 [4] E. Ahmad M.I. Alam K.K. Pant M.A. Haider Green Chem. 18 2016 4804 4823 [5] K.-i Tominaga A. Mori Y. Fukushima S. Shimada K. Sato Green Chem. 13 2011 810 812 [6] L. Peng L. Lin H. Li Q. Yang Appl. Energy 88 2011 4590 4596 [7] L. Peng L. Lin J. Zhang J. Shi S. Liu Appl. Catal., A 397 2011 259 265 [8] S. Saravanamurugan O.N. Van Buu A. Riisager ChemSusChem 4 2011 723 726 [9] S. Saravanamurugan A. Riisager Catal. Commun. 17 2012 71 75 [10] S. Saravanamurugan A. Riisager ChemCatChem 5 2013 1754 1757 [11] Y. Yang M.M. Abu-Omar C. Hu Appl. Energy 99 2012 80 84 [12] Z. Wang Q. Chen Green Chem. 18 2016 5884 5889 [13] Y. Roman-Leshkov J.N. Chheda J.A. Dumesic Science 312 2006 1933 1937 [14] F. Salak Asghari H. Yoshida Ind. Eng. Chem. Res. 45 2006 2163 2173 [15] X. Qi M. Watanabe T.M. Aida J.R.L. Smith Green Chem. 10 2008 799 805 [16] K.-i. Shimizu R. Uozumi A. Satsuma Catal. Commun. 10 2009 1849 1853 [17] Z. Yang J. Deng T. Pan Q. Guo Y. Fu Green Chem. 14 2012 2986 2989 [18] M. Watanabe Y. Aizawa R. Nishimura H. Inomata Appl. Catal., A 295 2005 150 156 [19] Y. Roman-Leshkov C.J. Barrett Z.Y. Liu J.A. Dumesic Nature 447 2007 982 985 [20] V.V. Ordomsky J. van der Schaaf J.C. Schouten T.A. Nijhuis ChemSusChem 5 2012 1812 1819 [21] F.W. Lichtenthaler Acc. Chem. Res. 35 2002 728 737 [22] R. Liu J. Chen X. Huang L. Chen L. Ma X. Li Green Chem. 15 2013 2895 2903 [23] C.-K. Shu B.M. Lawrence J. Agric. Food Chem. 43 1995 782 784 [24] A.R. Bader A.D. Kontowicz J. Am. Chem. Soc. 76 1954 4465 4466 [25] F.D. Pileidis M.M. Titirici ChemSusChem 9 2016 562 582 [26] J.Y. Cha M.A. Hanna Ind. Crops Prod. 16 2002 109 118 [27] A. Morone M. Apte R.A. Pandey Renew. Sustain. Energy Rev. 51 2015 548 565 [28] S.C.A. Sousa A.C. Fernandes Coord. Chem. Rev. 284 2015 67 92 [29] S.C.A. Sousa J.R. Bernardo M. Wolff B. Machura A.C. Fernandes Eur. J. Org. Chem. 9 2014 1855 1859 [30] A.C. Fernandes J.A. Fernandes C.C. Romão L.F. Veiros M.J. Calhorda Organometallics 29 2010 5517 5525 [31] P.M. Reis P.J. Costa C.C. Romão J.A. Fernandes M.J. Calhorda B. Royo Dalton Trans. 49 2008 1727 1733 [32] S.C.A. Sousa J.R. Bernardo C.C. Romão A.C. Fernandes Tetrahedron 68 2012 8194 8197 [33] I. Cabrita S.C.A. Sousa A.C. Fernandes Tetrahedron Lett. 51 2010 6132 6135 [34] C.A. Sousa A.C. Fernandes Tetrahedron Lett. 50 2009 6872 6876 [35] J.B. Arterburn M.C. Perry Tetrahedron Lett. 37 1996 7941 7944 [36] Z. Zhu J.H. Espenson J. Mol. Catal. A Chem. 103 1995 87 94 [37] K.P. Gable E.C. Brown Organometallics 19 2000 944 946 [38] J.B. Arterburn M. Liu M.C. Perry Helv. Chim. Acta 85 2002 3225 3236 [39] J.E. Ziegler M.J. Zdilla A.J. Evans M.M. Abu-Omar Inorg. Chem. 48 2009 9998 10000 [40] S. Vkuturi G. Chapman I. Ahmad K.M. Nicholas Inorg. Chem. 49 2010 4744 4746 [41] I. Ahmad G. Chapman K.M. Nicholas Organometallics 30 2011 2810 2818 [42] S.C.A. Sousa A.C. Fernandes Tetrahedron Lett. 52 2011 6960 6962 [43] R.G. de Noronha C.C. Romão A.C. Fernandes J. Org. Chem. 74 2009 6960 6964 [44] Y. Wang J.H. Espenson Org. Lett. 2 2000 3525 3536 [45] G.K. Cook M.A. Andrews J. Am. Chem. Soc. 118 1996 9448 9449 [46] M. Shiramizu F.D. Toste Angew. Chem. Int. Ed. 51 2012 8082 8086 [47] J. Yi S. Liu M.M. Abu-Omar ChemSusChem 5 2012 1401 1404 [48] T.J. Korstanje J.T.B.H. Jastrzebski R.J.M.K. Gebbink ChemSusChem 3 2010 695 697 [49] T.A. Fernandes J.R. Bernardo A.C. Fernandes ChemCatChem 7 2015 1177 1183 [50] J.R. Bernardo A.C. Fernandes Green Chem. 18 2016 2675 2681 [51] J.J. Kennedy-Smith K.A. Nolin H.P. Gunterman F.D. Toste J. Am. Chem. Soc. 125 2003 4056 4057 [52] J. Chatt G.A. Rowe J. Chem. Soc. 1962 4019 4033 [53] B.D. Sherry R.N. Loy F.D. Toste J. Am. Chem. Soc. 126 2004 4510 4511 [54] T. Flannelly S. Dooley J.J. Leahy Energy Fuels 29 2015 7554 7565 [55] B. Liu Z. Zhang RSC Adv. 3 2013 12313 12319 [56] B. Liu Z. Zhang K. Huang Z. Fang Fuel 113 2013 625 631 [57] H. Zhu Q. Cao C. Li X. Mu Carbohydr. Res. 346 2011 2016 2018 [58] J. Liu Y. Tang X. Fua Starch/Stärke 67 2015 765 771",
      "scopus-id": "85059665278",
      "coredata": {
        "eid": "1-s2.0-S2468823118304735",
        "dc:description": "This work describes the first catalyst (HReO4) that promotes the efficient and selective conversion of several carbohydrates into four compounds, ethyl levulinate (EL), 5-ethoxymethylfurfural (EMF), 5-hydroxymethylfurfural (HMF) and levulinic acid (LA), through a one-pot reaction strategy adjusting the reaction conditions. The reaction of fructose in ethanol at 160 °C gave EL in 80% yield after 16 h and in a mixture of ethanol/THF at 140 °C produced EMF in 73% yield after 1 h. HMF and LA can also be obtained selectively with 100% yield from fructose at 140 °C after 1 h, in DMSO or 1,4-dioxane, respectively. EL, HMF, LA and EMF were also produced in moderate to good yields from other carbohydrates such as inulin and sucrose. The catalyst HReO4 can be used in gram scale for the production of EL, EMF, HMF and LA with good yields and in at least 8 catalytic cycles on the conversion of fructose into EL with no significant reduction in its activity.",
        "openArchiveArticle": "false",
        "prism:coverDate": "2019-03-31",
        "openaccessUserLicense": null,
        "prism:aggregationType": "Journal",
        "prism:url": "https://api.elsevier.com/content/article/pii/S2468823118304735",
        "dc:creator": [
          {
            "@_fa": "true",
            "$": "Bernardo, Joana R."
          },
          {
            "@_fa": "true",
            "$": "Oliveira, M. Conceição"
          },
          {
            "@_fa": "true",
            "$": "Fernandes, Ana C."
          }
        ],
        "link": [
          {
            "@_fa": "true",
            "@rel": "self",
            "@href": "https://api.elsevier.com/content/article/pii/S2468823118304735"
          },
          {
            "@_fa": "true",
            "@rel": "scidir",
            "@href": "https://www.sciencedirect.com/science/article/pii/S2468823118304735"
          }
        ],
        "dc:format": "application/json",
        "openaccessType": null,
        "pii": "S2468-8231(18)30473-5",
        "prism:volume": "465",
        "prism:publisher": "Elsevier B.V.",
        "dc:title": "HReO4 as highly efficient and selective catalyst for the conversion of carbohydrates into value added chemicals",
        "prism:copyright": "© 2019 Elsevier B.V. All rights reserved.",
        "openaccess": "0",
        "prism:issn": "24688231",
        "dcterms:subject": [
          {
            "@_fa": "true",
            "$": "Oxo-rhenium complexes"
          },
          {
            "@_fa": "true",
            "$": "Ethyl levulinate"
          },
          {
            "@_fa": "true",
            "$": "5-Ethoxymethylfurfural"
          },
          {
            "@_fa": "true",
            "$": "5-Hydroxymethylfurfural"
          },
          {
            "@_fa": "true",
            "$": "Levulinic acid"
          }
        ],
        "openaccessArticle": "false",
        "prism:publicationName": "Molecular Catalysis",
        "openaccessSponsorType": null,
        "prism:pageRange": "87-94",
        "prism:endingPage": "94",
        "pubType": "fla",
        "prism:coverDisplayDate": "March 2019",
        "prism:doi": "10.1016/j.mcat.2019.01.003",
        "prism:startingPage": "87",
        "dc:identifier": "doi:10.1016/j.mcat.2019.01.003",
        "openaccessSponsorName": null
      },
      "objects": {
        "object": [
          {
            "@category": "thumbnail",
            "@height": "133",
            "@width": "219",
            "@_fa": "true",
            "$": "https://api.elsevier.com/content/object/eid/1-s2.0-S2468823118304735-ga1.sml?httpAccept=%2A%2F%2A",
            "@multimediatype": "GIF image file",
            "@type": "IMAGE-THUMBNAIL",
            "@size": "8587",
            "@ref": "ga1",
            "@mimetype": "image/gif"
          },
          {
            "@category": "thumbnail",
            "@height": "127",
            "@width": "219",
            "@_fa": "true",
            "$": "https://api.elsevier.com/content/object/eid/1-s2.0-S2468823118304735-gr1.sml?httpAccept=%2A%2F%2A",
            "@multimediatype": "GIF image file",
            "@type": "IMAGE-THUMBNAIL",
            "@size": "4318",
            "@ref": "gr1",
            "@mimetype": "image/gif"
          },
          {
            "@category": "thumbnail",
            "@height": "105",
            "@width": "219",
            "@_fa": "true",
            "$": "https://api.elsevier.com/content/object/eid/1-s2.0-S2468823118304735-gr10.sml?httpAccept=%2A%2F%2A",
            "@multimediatype": "GIF image file",
            "@type": "IMAGE-THUMBNAIL",
            "@size": "6106",
            "@ref": "gr10",
            "@mimetype": "image/gif"
          },
          {
            "@category": "thumbnail",
            "@height": "143",
            "@width": "219",
            "@_fa": "true",
            "$": "https://api.elsevier.com/content/object/eid/1-s2.0-S2468823118304735-gr11.sml?httpAccept=%2A%2F%2A",
            "@multimediatype": "GIF image file",
            "@type": "IMAGE-THUMBNAIL",
            "@size": "4235",
            "@ref": "gr11",
            "@mimetype": "image/gif"
          },
          {
            "@category": "thumbnail",
            "@height": "141",
            "@width": "219",
            "@_fa": "true",
            "$": "https://api.elsevier.com/content/object/eid/1-s2.0-S2468823118304735-gr12.sml?httpAccept=%2A%2F%2A",
            "@multimediatype": "GIF image file",
            "@type": "IMAGE-THUMBNAIL",
            "@size": "6239",
            "@ref": "gr12",
            "@mimetype": "image/gif"
          },
          {
            "@category": "thumbnail",
            "@height": "141",
            "@width": "219",
            "@_fa": "true",
            "$": "https://api.elsevier.com/content/object/eid/1-s2.0-S2468823118304735-gr13.sml?httpAccept=%2A%2F%2A",
            "@multimediatype": "GIF image file",
            "@type": "IMAGE-THUMBNAIL",
            "@size": "3973",
            "@ref": "gr13",
            "@mimetype": "image/gif"
          },
          {
            "@category": "thumbnail",
            "@height": "90",
            "@width": "219",
            "@_fa": "true",
            "$": "https://api.elsevier.com/content/object/eid/1-s2.0-S2468823118304735-gr14.sml?httpAccept=%2A%2F%2A",
            "@multimediatype": "GIF image file",
            "@type": "IMAGE-THUMBNAIL",
            "@size": "4196",
            "@ref": "gr14",
            "@mimetype": "image/gif"
          },
          {
            "@category": "thumbnail",
            "@height": "141",
            "@width": "219",
            "@_fa": "true",
            "$": "https://api.elsevier.com/content/object/eid/1-s2.0-S2468823118304735-gr15.sml?httpAccept=%2A%2F%2A",
            "@multimediatype": "GIF image file",
            "@type": "IMAGE-THUMBNAIL",
            "@size": "4441",
            "@ref": "gr15",
            "@mimetype": "image/gif"
          },
          {
            "@category": "thumbnail",
            "@height": "136",
            "@width": "219",
            "@_fa": "true",
            "$": "https://api.elsevier.com/content/object/eid/1-s2.0-S2468823118304735-gr2.sml?httpAccept=%2A%2F%2A",
            "@multimediatype": "GIF image file",
            "@type": "IMAGE-THUMBNAIL",
            "@size": "3796",
            "@ref": "gr2",
            "@mimetype": "image/gif"
          },
          {
            "@category": "thumbnail",
            "@height": "134",
            "@width": "219",
            "@_fa": "true",
            "$": "https://api.elsevier.com/content/object/eid/1-s2.0-S2468823118304735-gr3.sml?httpAccept=%2A%2F%2A",
            "@multimediatype": "GIF image file",
            "@type": "IMAGE-THUMBNAIL",
            "@size": "5297",
            "@ref": "gr3",
            "@mimetype": "image/gif"
          },
          {
            "@category": "thumbnail",
            "@height": "137",
            "@width": "219",
            "@_fa": "true",
            "$": "https://api.elsevier.com/content/object/eid/1-s2.0-S2468823118304735-gr4.sml?httpAccept=%2A%2F%2A",
            "@multimediatype": "GIF image file",
            "@type": "IMAGE-THUMBNAIL",
            "@size": "6660",
            "@ref": "gr4",
            "@mimetype": "image/gif"
          },
          {
            "@category": "thumbnail",
            "@height": "130",
            "@width": "219",
            "@_fa": "true",
            "$": "https://api.elsevier.com/content/object/eid/1-s2.0-S2468823118304735-gr5.sml?httpAccept=%2A%2F%2A",
            "@multimediatype": "GIF image file",
            "@type": "IMAGE-THUMBNAIL",
            "@size": "3672",
            "@ref": "gr5",
            "@mimetype": "image/gif"
          },
          {
            "@category": "thumbnail",
            "@height": "123",
            "@width": "219",
            "@_fa": "true",
            "$": "https://api.elsevier.com/content/object/eid/1-s2.0-S2468823118304735-gr6.sml?httpAccept=%2A%2F%2A",
            "@multimediatype": "GIF image file",
            "@type": "IMAGE-THUMBNAIL",
            "@size": "6642",
            "@ref": "gr6",
            "@mimetype": "image/gif"
          },
          {
            "@category": "thumbnail",
            "@height": "130",
            "@width": "219",
            "@_fa": "true",
            "$": "https://api.elsevier.com/content/object/eid/1-s2.0-S2468823118304735-gr7.sml?httpAccept=%2A%2F%2A",
            "@multimediatype": "GIF image file",
            "@type": "IMAGE-THUMBNAIL",
            "@size": "5482",
            "@ref": "gr7",
            "@mimetype": "image/gif"
          },
          {
            "@category": "thumbnail",
            "@height": "141",
            "@width": "219",
            "@_fa": "true",
            "$": "https://api.elsevier.com/content/object/eid/1-s2.0-S2468823118304735-gr8.sml?httpAccept=%2A%2F%2A",
            "@multimediatype": "GIF image file",
            "@type": "IMAGE-THUMBNAIL",
            "@size": "3768",
            "@ref": "gr8",
            "@mimetype": "image/gif"
          },
          {
            "@category": "thumbnail",
            "@height": "164",
            "@width": "215",
            "@_fa": "true",
            "$": "https://api.elsevier.com/content/object/eid/1-s2.0-S2468823118304735-gr9.sml?httpAccept=%2A%2F%2A",
            "@multimediatype": "GIF image file",
            "@type": "IMAGE-THUMBNAIL",
            "@size": "9392",
            "@ref": "gr9",
            "@mimetype": "image/gif"
          },
          {
            "@category": "thumbnail",
            "@height": "83",
            "@width": "219",
            "@_fa": "true",
            "$": "https://api.elsevier.com/content/object/eid/1-s2.0-S2468823118304735-sc1.sml?httpAccept=%2A%2F%2A",
            "@multimediatype": "GIF image file",
            "@type": "IMAGE-THUMBNAIL",
            "@size": "2854",
            "@ref": "sc1",
            "@mimetype": "image/gif"
          },
          {
            "@category": "thumbnail",
            "@height": "90",
            "@width": "219",
            "@_fa": "true",
            "$": "https://api.elsevier.com/content/object/eid/1-s2.0-S2468823118304735-sc2.sml?httpAccept=%2A%2F%2A",
            "@multimediatype": "GIF image file",
            "@type": "IMAGE-THUMBNAIL",
            "@size": "3232",
            "@ref": "sc2",
            "@mimetype": "image/gif"
          },
          {
            "@category": "standard",
            "@height": "200",
            "@width": "330",
            "@_fa": "true",
            "$": "https://api.elsevier.com/content/object/eid/1-s2.0-S2468823118304735-ga1.jpg?httpAccept=%2A%2F%2A",
            "@multimediatype": "JPEG image file",
            "@type": "IMAGE-DOWNSAMPLED",
            "@size": "19460",
            "@ref": "ga1",
            "@mimetype": "image/jpeg"
          },
          {
            "@category": "standard",
            "@height": "218",
            "@width": "376",
            "@_fa": "true",
            "$": "https://api.elsevier.com/content/object/eid/1-s2.0-S2468823118304735-gr1.jpg?httpAccept=%2A%2F%2A",
            "@multimediatype": "JPEG image file",
            "@type": "IMAGE-DOWNSAMPLED",
            "@size": "14183",
            "@ref": "gr1",
            "@mimetype": "image/jpeg"
          },
          {
            "@category": "standard",
            "@height": "271",
            "@width": "565",
            "@_fa": "true",
            "$": "https://api.elsevier.com/content/object/eid/1-s2.0-S2468823118304735-gr10.jpg?httpAccept=%2A%2F%2A",
            "@multimediatype": "JPEG image file",
            "@type": "IMAGE-DOWNSAMPLED",
            "@size": "27270",
            "@ref": "gr10",
            "@mimetype": "image/jpeg"
          },
          {
            "@category": "standard",
            "@height": "245",
            "@width": "376",
            "@_fa": "true",
            "$": "https://api.elsevier.com/content/object/eid/1-s2.0-S2468823118304735-gr11.jpg?httpAccept=%2A%2F%2A",
            "@multimediatype": "JPEG image file",
            "@type": "IMAGE-DOWNSAMPLED",
            "@size": "14018",
            "@ref": "gr11",
            "@mimetype": "image/jpeg"
          },
          {
            "@category": "standard",
            "@height": "242",
            "@width": "376",
            "@_fa": "true",
            "$": "https://api.elsevier.com/content/object/eid/1-s2.0-S2468823118304735-gr12.jpg?httpAccept=%2A%2F%2A",
            "@multimediatype": "JPEG image file",
            "@type": "IMAGE-DOWNSAMPLED",
            "@size": "16089",
            "@ref": "gr12",
            "@mimetype": "image/jpeg"
          },
          {
            "@category": "standard",
            "@height": "242",
            "@width": "376",
            "@_fa": "true",
            "$": "https://api.elsevier.com/content/object/eid/1-s2.0-S2468823118304735-gr13.jpg?httpAccept=%2A%2F%2A",
            "@multimediatype": "JPEG image file",
            "@type": "IMAGE-DOWNSAMPLED",
            "@size": "14599",
            "@ref": "gr13",
            "@mimetype": "image/jpeg"
          },
          {
            "@category": "standard",
            "@height": "232",
            "@width": "565",
            "@_fa": "true",
            "$": "https://api.elsevier.com/content/object/eid/1-s2.0-S2468823118304735-gr14.jpg?httpAccept=%2A%2F%2A",
            "@multimediatype": "JPEG image file",
            "@type": "IMAGE-DOWNSAMPLED",
            "@size": "24231",
            "@ref": "gr14",
            "@mimetype": "image/jpeg"
          },
          {
            "@category": "standard",
            "@height": "242",
            "@width": "376",
            "@_fa": "true",
            "$": "https://api.elsevier.com/content/object/eid/1-s2.0-S2468823118304735-gr15.jpg?httpAccept=%2A%2F%2A",
            "@multimediatype": "JPEG image file",
            "@type": "IMAGE-DOWNSAMPLED",
            "@size": "14202",
            "@ref": "gr15",
            "@mimetype": "image/jpeg"
          },
          {
            "@category": "standard",
            "@height": "233",
            "@width": "376",
            "@_fa": "true",
            "$": "https://api.elsevier.com/content/object/eid/1-s2.0-S2468823118304735-gr2.jpg?httpAccept=%2A%2F%2A",
            "@multimediatype": "JPEG image file",
            "@type": "IMAGE-DOWNSAMPLED",
            "@size": "12707",
            "@ref": "gr2",
            "@mimetype": "image/jpeg"
          },
          {
            "@category": "standard",
            "@height": "230",
            "@width": "376",
            "@_fa": "true",
            "$": "https://api.elsevier.com/content/object/eid/1-s2.0-S2468823118304735-gr3.jpg?httpAccept=%2A%2F%2A",
            "@multimediatype": "JPEG image file",
            "@type": "IMAGE-DOWNSAMPLED",
            "@size": "17226",
            "@ref": "gr3",
            "@mimetype": "image/jpeg"
          },
          {
            "@category": "standard",
            "@height": "236",
            "@width": "376",
            "@_fa": "true",
            "$": "https://api.elsevier.com/content/object/eid/1-s2.0-S2468823118304735-gr4.jpg?httpAccept=%2A%2F%2A",
            "@multimediatype": "JPEG image file",
            "@type": "IMAGE-DOWNSAMPLED",
            "@size": "17779",
            "@ref": "gr4",
            "@mimetype": "image/jpeg"
          },
          {
            "@category": "standard",
            "@height": "223",
            "@width": "376",
            "@_fa": "true",
            "$": "https://api.elsevier.com/content/object/eid/1-s2.0-S2468823118304735-gr5.jpg?httpAccept=%2A%2F%2A",
            "@multimediatype": "JPEG image file",
            "@type": "IMAGE-DOWNSAMPLED",
            "@size": "12626",
            "@ref": "gr5",
            "@mimetype": "image/jpeg"
          },
          {
            "@category": "standard",
            "@height": "211",
            "@width": "376",
            "@_fa": "true",
            "$": "https://api.elsevier.com/content/object/eid/1-s2.0-S2468823118304735-gr6.jpg?httpAccept=%2A%2F%2A",
            "@multimediatype": "JPEG image file",
            "@type": "IMAGE-DOWNSAMPLED",
            "@size": "15383",
            "@ref": "gr6",
            "@mimetype": "image/jpeg"
          },
          {
            "@category": "standard",
            "@height": "223",
            "@width": "376",
            "@_fa": "true",
            "$": "https://api.elsevier.com/content/object/eid/1-s2.0-S2468823118304735-gr7.jpg?httpAccept=%2A%2F%2A",
            "@multimediatype": "JPEG image file",
            "@type": "IMAGE-DOWNSAMPLED",
            "@size": "17461",
            "@ref": "gr7",
            "@mimetype": "image/jpeg"
          },
          {
            "@category": "standard",
            "@height": "242",
            "@width": "376",
            "@_fa": "true",
            "$": "https://api.elsevier.com/content/object/eid/1-s2.0-S2468823118304735-gr8.jpg?httpAccept=%2A%2F%2A",
            "@multimediatype": "JPEG image file",
            "@type": "IMAGE-DOWNSAMPLED",
            "@size": "12390",
            "@ref": "gr8",
            "@mimetype": "image/jpeg"
          },
          {
            "@category": "standard",
            "@height": "432",
            "@width": "567",
            "@_fa": "true",
            "$": "https://api.elsevier.com/content/object/eid/1-s2.0-S2468823118304735-gr9.jpg?httpAccept=%2A%2F%2A",
            "@multimediatype": "JPEG image file",
            "@type": "IMAGE-DOWNSAMPLED",
            "@size": "52689",
            "@ref": "gr9",
            "@mimetype": "image/jpeg"
          },
          {
            "@category": "standard",
            "@height": "215",
            "@width": "565",
            "@_fa": "true",
            "$": "https://api.elsevier.com/content/object/eid/1-s2.0-S2468823118304735-sc1.jpg?httpAccept=%2A%2F%2A",
            "@multimediatype": "JPEG image file",
            "@type": "IMAGE-DOWNSAMPLED",
            "@size": "14435",
            "@ref": "sc1",
            "@mimetype": "image/jpeg"
          },
          {
            "@category": "standard",
            "@height": "155",
            "@width": "376",
            "@_fa": "true",
            "$": "https://api.elsevier.com/content/object/eid/1-s2.0-S2468823118304735-sc2.jpg?httpAccept=%2A%2F%2A",
            "@multimediatype": "JPEG image file",
            "@type": "IMAGE-DOWNSAMPLED",
            "@size": "8893",
            "@ref": "sc2",
            "@mimetype": "image/jpeg"
          },
          {
            "@category": "standard",
            "@_fa": "true",
            "$": "https://api.elsevier.com/content/object/eid/1-s2.0-S2468823118304735-mmc1.docx?httpAccept=%2A%2F%2A",
            "@multimediatype": "Microsoft Word file",
            "@type": "APPLICATION",
            "@size": "121185",
            "@ref": "mmc1",
            "@mimetype": "application/word"
          },
          {
            "@category": "standard",
            "@_fa": "true",
            "$": "https://api.elsevier.com/content/object/eid/1-s2.0-S2468823118304735-am.pdf?httpAccept=%2A%2F%2A",
            "@multimediatype": "Acrobat PDF file",
            "@type": "AAM-PDF",
            "@size": "716552",
            "@ref": "am",
            "@mimetype": "application/pdf"
          }
        ]
      },
      "link": {
        "@rel": "abstract",
        "@href": "https://api.elsevier.com/content/abstract/scopus_id/85059665278"
      }
    }
  }
}