{
  "metadata": {
    "title": "Red mud-mediated cross-coupling of alcohols and amines to imines over MnO<ce:italic><ce:inf loc=post>x</ce:inf></ce:italic> catalysts",
    "authors": "; ; ",
    "journal": "Molecular Catalysis",
    "date": "2023-01-15",
    "doi": "10.1016/j.mcat.2022.112883",
    "abstract": "",
    "uri": "https://api.elsevier.com/content/article/pii/S2468823122007696",
    "pii": "S2468823122007696"
  },
  "fulltext": {
    "full-text-retrieval-response": {
      "scopus-eid": "2-s2.0-85144383632",
      "originalText": "serial JL 315758 291210 291744 291790 291809 31 Molecular Catalysis MOLECULARCATALYSIS 2022-12-17 2022-12-17 2022-12-17 2022-12-17 2023-01-07T15:56:45 1-s2.0-S2468823122007696 S2468-8231(22)00769-6 S2468823122007696 10.1016/j.mcat.2022.112883 S300 S300.1 FULL-TEXT 1-s2.0-S2468823122X00187 2024-06-26T17:47:58.012062Z 0 0 20230115 2023 2022-12-17T22:56:20.896651Z absattachment articleinfo articlenumber articletitlenorm authfirstinitialnorm authfirstsurnamenorm cid cids contenttype copyright crossmark dateloaded dateloadedtxt datesearch datesort dateupdated dco docsubtype doctype doi eid ewtransactionid hubeid indexeddate issn issnnorm itemstage itemtransactionid itemweight openaccess openarchive pg pgfirst pii piinorm pubdatestart pubdatetxt pubyr sectiontitle sortorder srctitle srctitlenorm srctype ssids alllist content subj subheadings suppl tomb volfirst volissue volumelist webpdf webpdfpagecount yearnav figure table e-component body acknowledge affil appendices articletitle auth authfirstini authfull authkeywords authlast footnotes highlightsabst orcid primabst ref specialabst 2468-8231 24688231 true 535 535 C Volume 535 45 112883 112883 112883 20230115 15 January 2023 2023-01-15 2023 Regular Papers article fla © 2022 Elsevier B.V. All rights reserved. REDMUDMEDIATEDCROSSCOUPLINGALCOHOLSAMINESIMINESOVERMNOXCATALYSTS CAO Y 1 Introduction 2 Experimental 2.1 RM treatment 2.2 Preparation of MnO x 2.3 General procedure for the oxidative cross-coupling reaction 2.4 Condensation of benzaldehyde with amines to imines 2.5 Characterization of catalysts 3 Results and discussion 3.1 Characterization of the red mud and MnO x 3.2 MnO x /ARM synergistic catalysts 3.3 Insight into the mechanism of the MnO x /ARM synergistic catalysts 3.4 Substrate scope and stability of ARM catalysts 4 Conclusion CRediT authorship contribution statement Acknowledgments Appendix Supplementary materials References SUSHIL 2008 64 77 S WANG 2008 7055 7063 S SAPUTRA 2012 68 72 E BLISSETT 2012 1 23 R DEOLIVEIRA 2022 112504 A GALADIMA 2020 121358 A ZENG 2020 773 H WU 2018 35 J CHEN 2022 112761 D WANG 2021 125136 S ZHANG 2021 121419 J SWAIN 2022 520 570 B DAS 2019 1791 1811 B CAO 2014 5747 5755 J DERESENDE 2013 496 510 E OLIVEIRA 2017 89 95 A MUHAMMAD 2012 15351 15359 S KARIMI 2010 6586 6600 E SATO 1991 98 102 Y EBRAHIMINEJAD 2022 112056 M MISHRA 2021 111310 S NAITO 2008 1367 1383 T MERMER 2021 105076 A SONG 2020 19846 19850 S CHEN 2021 1711 1722 X CAO 2020 2080 2084 Y CAO 2022 e202102400 Y WU 2020 3637 3640 H WANG 2019 1935 1942 M LV 2022 121264 D ZHANG 2014 2523 2527 Z ZHANG 2021 3382 S GOGOI 2022 112458 G GUMUS 2021 111363 I PATIL 2013 726 744 R HAZRA 2020 1916 1936 S LARGERON 2013 5225 5235 M SUN 2009 4390 4393 H GENG 2016 1451 1460 L WU 2019 110 121 S ZHANG 2013 2680 2684 L CAO 2020 118958 X ZHANG 2015 1623 1630 Z HUANG 2017 769 777 X DUTTA 2018 3180 3185 B SITHAMBARAM 2008 269 277 S TAYLOR 2005 851 869 R BI 2020 360 371 X WANG 2022 136180 X BU 2018 46 54 J CHEN 2019 2282 2286 F MANDAL 2016 73906 73914 S CHEN 2014 3328 B CHENG 2017 e3659 S SUDARSANAM 2016 213 224 P BISWAS 2015 4394 4403 S BISWAS 2017 607 614 S SHEN 2020 1353 1359 H QIN 2020 5628 5640 J WU 2021 234 238 S WU 2021 810 822 S UMAR 2021 128851 A CAO 2014 361 368 J AHMED 2020 122711 M YANG 2021 2964 2971 J LI 2020 864 875 Y LIU 2019 374 385 Y ZHANG 2022 132740 L BI 2021 119141 X GANGWAR 2021 149693 D ZHANG 2019 17255 17264 X YANG 2017 378 387 J DAS 2020 6030 6044 B CHEN 2015 5851 5876 B CAO 2021 770 774 Y DEMIGUEL 1995 281 291 S DEMIGUEL 1994 87 94 S PINES 1960 2471 2483 H BERMEJODEVAL 2017 4437 4443 R WENG 2019 638 646 X YUN 2012 1771 1776 D CAOX2023X112883 CAOX2023X112883XY 2024-12-17T00:00:00.000Z 2024-12-17T00:00:00.000Z http://creativecommons.org/licenses/by-nc-nd/4.0/ © 2022 Elsevier B.V. All rights reserved. 2022-12-25T08:15:52.094Z http://vtw.elsevier.com/data/voc/AddOnTypes/50.7/aggregated-refined National Natural Science Foundation of China 21802151 21972152 NSFC National Natural Science Foundation of China http://data.elsevier.com/vocabulary/SciValFunders/501100001809 http://sws.geonames.org/1814991/ Natural Science Foundation of Jiangsu Province BK20211094 Natural Science Foundation of Jiangsu Province http://data.elsevier.com/vocabulary/SciValFunders/501100004608 http://sws.geonames.org/1814991/ This work was financially supported by the National Natural Science Foundation of China (No. 21802151, No. 21972152) and the Natural Science Foundation of Jiangsu Province (No. BK20211094). 0 https://doi.org/10.15223/policy-017 https://doi.org/10.15223/policy-037 https://doi.org/10.15223/policy-012 https://doi.org/10.15223/policy-029 https://doi.org/10.15223/policy-004 item S2468-8231(22)00769-6 S2468823122007696 1-s2.0-S2468823122007696 10.1016/j.mcat.2022.112883 315758 2023-01-07T16:15:48.580262Z 2023-01-15 1-s2.0-S2468823122007696-main.pdf https://s3-eu-west-1.amazonaws.com/prod-ucs-content-store-eu-west/content/pii:S2468823122007696/MAIN/application/pdf/6e6852f1130820fd61a0daa9da5fe993/main.pdf main.pdf pdf true 5157897 MAIN 10 1-s2.0-S2468823122007696-main_1.png https://s3-eu-west-1.amazonaws.com/prod-ucs-content-store-eu-west/content/pii:S2468823122007696/PREVIEW/image/png/b0395f2b65d9e41d00726f7a891e7db8/main_1.png main_1.png png 57219 849 656 IMAGE-WEB-PDF 1 1-s2.0-S2468823122007696-gr2.jpg https://s3-eu-west-1.amazonaws.com/prod-ucs-content-store-eu-west/content/pii:S2468823122007696/gr2/DOWNSAMPLED/image/jpeg/bbbf026d0b510e0d979301f726323acf/gr2.jpg gr2 gr2.jpg jpg 116964 520 621 IMAGE-DOWNSAMPLED 1-s2.0-S2468823122007696-gr3.jpg https://s3-eu-west-1.amazonaws.com/prod-ucs-content-store-eu-west/content/pii:S2468823122007696/gr3/DOWNSAMPLED/image/jpeg/a9db1d0a945ea21e7347d76b14bea6f4/gr3.jpg gr3 gr3.jpg jpg 82464 733 659 IMAGE-DOWNSAMPLED 1-s2.0-S2468823122007696-gr4.jpg https://s3-eu-west-1.amazonaws.com/prod-ucs-content-store-eu-west/content/pii:S2468823122007696/gr4/DOWNSAMPLED/image/jpeg/ca6aa6626e73417d46f952a7514da0f8/gr4.jpg gr4 gr4.jpg jpg 88637 520 621 IMAGE-DOWNSAMPLED 1-s2.0-S2468823122007696-gr5.jpg https://s3-eu-west-1.amazonaws.com/prod-ucs-content-store-eu-west/content/pii:S2468823122007696/gr5/DOWNSAMPLED/image/jpeg/a2123addcc1fa62f879051c0660c6ef8/gr5.jpg gr5 gr5.jpg jpg 38977 174 659 IMAGE-DOWNSAMPLED 1-s2.0-S2468823122007696-gr6.jpg https://s3-eu-west-1.amazonaws.com/prod-ucs-content-store-eu-west/content/pii:S2468823122007696/gr6/DOWNSAMPLED/image/jpeg/8e93752b2d9a456a332b67e9824887cf/gr6.jpg gr6 gr6.jpg jpg 46717 251 602 IMAGE-DOWNSAMPLED 1-s2.0-S2468823122007696-gr7.jpg https://s3-eu-west-1.amazonaws.com/prod-ucs-content-store-eu-west/content/pii:S2468823122007696/gr7/DOWNSAMPLED/image/jpeg/eb6dc7d8b7917c7cb2a22f2b3ef14d90/gr7.jpg gr7 gr7.jpg jpg 23425 272 385 IMAGE-DOWNSAMPLED 1-s2.0-S2468823122007696-sc1.jpg https://s3-eu-west-1.amazonaws.com/prod-ucs-content-store-eu-west/content/pii:S2468823122007696/sc1/DOWNSAMPLED/image/jpeg/457aabaed0d5498e33a5d7a50a4c0252/sc1.jpg sc1 sc1.jpg jpg 10669 87 659 IMAGE-DOWNSAMPLED 1-s2.0-S2468823122007696-sc2.jpg https://s3-eu-west-1.amazonaws.com/prod-ucs-content-store-eu-west/content/pii:S2468823122007696/sc2/DOWNSAMPLED/image/jpeg/634ae82c5402dc6c3f6a2d34b288ec6c/sc2.jpg sc2 sc2.jpg jpg 21727 151 452 IMAGE-DOWNSAMPLED 1-s2.0-S2468823122007696-sc3.jpg https://s3-eu-west-1.amazonaws.com/prod-ucs-content-store-eu-west/content/pii:S2468823122007696/sc3/DOWNSAMPLED/image/jpeg/73d087852fa7357f9fc5d7821c84f84b/sc3.jpg sc3 sc3.jpg jpg 73182 686 659 IMAGE-DOWNSAMPLED 1-s2.0-S2468823122007696-sc4.jpg https://s3-eu-west-1.amazonaws.com/prod-ucs-content-store-eu-west/content/pii:S2468823122007696/sc4/DOWNSAMPLED/image/jpeg/4b7ccb22c2c26fc6cd018846ba91b91f/sc4.jpg sc4 sc4.jpg jpg 24224 225 565 IMAGE-DOWNSAMPLED 1-s2.0-S2468823122007696-gr1.jpg https://s3-eu-west-1.amazonaws.com/prod-ucs-content-store-eu-west/content/pii:S2468823122007696/gr1/DOWNSAMPLED/image/jpeg/256ee19ae6d695b0f0b64a906aa936f7/gr1.jpg gr1 gr1.jpg jpg 102287 482 621 IMAGE-DOWNSAMPLED 1-s2.0-S2468823122007696-ga1.jpg https://s3-eu-west-1.amazonaws.com/prod-ucs-content-store-eu-west/content/pii:S2468823122007696/ga1/DOWNSAMPLED/image/jpeg/f210cc0931dcd21b69f336a6d831308e/ga1.jpg ga1 true ga1.jpg jpg 12171 200 227 IMAGE-DOWNSAMPLED 1-s2.0-S2468823122007696-gr2.sml https://s3-eu-west-1.amazonaws.com/prod-ucs-content-store-eu-west/content/pii:S2468823122007696/gr2/THUMBNAIL/image/gif/6a79ab939001550d3f9ce95b684cec51/gr2.sml gr2 gr2.sml sml 17037 164 196 IMAGE-THUMBNAIL 1-s2.0-S2468823122007696-gr3.sml https://s3-eu-west-1.amazonaws.com/prod-ucs-content-store-eu-west/content/pii:S2468823122007696/gr3/THUMBNAIL/image/gif/c1b3412403bd1443227a5ef6139060e3/gr3.sml gr3 gr3.sml sml 10291 163 147 IMAGE-THUMBNAIL 1-s2.0-S2468823122007696-gr4.sml https://s3-eu-west-1.amazonaws.com/prod-ucs-content-store-eu-west/content/pii:S2468823122007696/gr4/THUMBNAIL/image/gif/17df70590953235fa982538ae0390c8a/gr4.sml gr4 gr4.sml sml 13230 164 196 IMAGE-THUMBNAIL 1-s2.0-S2468823122007696-gr5.sml https://s3-eu-west-1.amazonaws.com/prod-ucs-content-store-eu-west/content/pii:S2468823122007696/gr5/THUMBNAIL/image/gif/c1f41a7b286368bef7ac7ef44113ddbf/gr5.sml gr5 gr5.sml sml 6397 58 219 IMAGE-THUMBNAIL 1-s2.0-S2468823122007696-gr6.sml https://s3-eu-west-1.amazonaws.com/prod-ucs-content-store-eu-west/content/pii:S2468823122007696/gr6/THUMBNAIL/image/gif/07db42220b572d0be92aee5d027baa4d/gr6.sml gr6 gr6.sml sml 8371 91 219 IMAGE-THUMBNAIL 1-s2.0-S2468823122007696-gr7.sml https://s3-eu-west-1.amazonaws.com/prod-ucs-content-store-eu-west/content/pii:S2468823122007696/gr7/THUMBNAIL/image/gif/4623deb18520841d8ab77e4647030739/gr7.sml gr7 gr7.sml sml 13247 155 219 IMAGE-THUMBNAIL 1-s2.0-S2468823122007696-sc1.sml https://s3-eu-west-1.amazonaws.com/prod-ucs-content-store-eu-west/content/pii:S2468823122007696/sc1/THUMBNAIL/image/gif/6b52d5e9f1b320580da14d610d62602e/sc1.sml sc1 sc1.sml sml 2075 29 219 IMAGE-THUMBNAIL 1-s2.0-S2468823122007696-sc2.sml https://s3-eu-west-1.amazonaws.com/prod-ucs-content-store-eu-west/content/pii:S2468823122007696/sc2/THUMBNAIL/image/gif/4c63b115c832ff208afb574d144a0d19/sc2.sml sc2 sc2.sml sml 6707 73 219 IMAGE-THUMBNAIL 1-s2.0-S2468823122007696-sc3.sml https://s3-eu-west-1.amazonaws.com/prod-ucs-content-store-eu-west/content/pii:S2468823122007696/sc3/THUMBNAIL/image/gif/5329726e1f4f22acfcf10c9fb7c4c51b/sc3.sml sc3 sc3.sml sml 5075 163 157 IMAGE-THUMBNAIL 1-s2.0-S2468823122007696-sc4.sml https://s3-eu-west-1.amazonaws.com/prod-ucs-content-store-eu-west/content/pii:S2468823122007696/sc4/THUMBNAIL/image/gif/f6e9500a610ad123dac49860bacc5b70/sc4.sml sc4 sc4.sml sml 3813 87 219 IMAGE-THUMBNAIL 1-s2.0-S2468823122007696-gr1.sml https://s3-eu-west-1.amazonaws.com/prod-ucs-content-store-eu-west/content/pii:S2468823122007696/gr1/THUMBNAIL/image/gif/9baea6b95274f50ee9cb484335fba684/gr1.sml gr1 gr1.sml sml 17362 164 211 IMAGE-THUMBNAIL 1-s2.0-S2468823122007696-ga1.sml https://s3-eu-west-1.amazonaws.com/prod-ucs-content-store-eu-west/content/pii:S2468823122007696/ga1/THUMBNAIL/image/gif/e37507f874c86e81fbc0f4399e4e3034/ga1.sml ga1 true ga1.sml sml 8537 164 186 IMAGE-THUMBNAIL 1-s2.0-S2468823122007696-gr2_lrg.jpg https://s3-eu-west-1.amazonaws.com/prod-ucs-content-store-eu-west/content/pii:S2468823122007696/HIGHRES/image/jpeg/930f1fbab4305f77d83c1809cbbde772/gr2_lrg.jpg gr2 gr2_lrg.jpg jpg 929842 2301 2750 IMAGE-HIGH-RES 1-s2.0-S2468823122007696-gr3_lrg.jpg https://s3-eu-west-1.amazonaws.com/prod-ucs-content-store-eu-west/content/pii:S2468823122007696/HIGHRES/image/jpeg/81c252ea465d78b669935bfd5f5db99e/gr3_lrg.jpg gr3 gr3_lrg.jpg jpg 580046 3243 2917 IMAGE-HIGH-RES 1-s2.0-S2468823122007696-gr4_lrg.jpg https://s3-eu-west-1.amazonaws.com/prod-ucs-content-store-eu-west/content/pii:S2468823122007696/HIGHRES/image/jpeg/600a988e8a3df917cdaed1fc73e14fc5/gr4_lrg.jpg gr4 gr4_lrg.jpg jpg 628712 2303 2750 IMAGE-HIGH-RES 1-s2.0-S2468823122007696-gr5_lrg.jpg https://s3-eu-west-1.amazonaws.com/prod-ucs-content-store-eu-west/content/pii:S2468823122007696/HIGHRES/image/jpeg/9ceb22fe6dcd660db1050f3ea43caa9f/gr5_lrg.jpg gr5 gr5_lrg.jpg jpg 240757 771 2917 IMAGE-HIGH-RES 1-s2.0-S2468823122007696-gr6_lrg.jpg https://s3-eu-west-1.amazonaws.com/prod-ucs-content-store-eu-west/content/pii:S2468823122007696/HIGHRES/image/jpeg/04207fedc9a4977a381ff2bb4cd57578/gr6_lrg.jpg gr6 gr6_lrg.jpg jpg 303179 1111 2667 IMAGE-HIGH-RES 1-s2.0-S2468823122007696-gr7_lrg.jpg https://s3-eu-west-1.amazonaws.com/prod-ucs-content-store-eu-west/content/pii:S2468823122007696/HIGHRES/image/jpeg/c740b7ff35f783a154c28d61121e3eba/gr7_lrg.jpg gr7 gr7_lrg.jpg jpg 154064 1207 1707 IMAGE-HIGH-RES 1-s2.0-S2468823122007696-sc1_lrg.jpg https://s3-eu-west-1.amazonaws.com/prod-ucs-content-store-eu-west/content/pii:S2468823122007696/HIGHRES/image/jpeg/9a9d9d22bc47738d65820c370597b0c1/sc1_lrg.jpg sc1 sc1_lrg.jpg jpg 84546 386 2916 IMAGE-HIGH-RES 1-s2.0-S2468823122007696-sc2_lrg.jpg https://s3-eu-west-1.amazonaws.com/prod-ucs-content-store-eu-west/content/pii:S2468823122007696/HIGHRES/image/jpeg/141a136840e8764426c55ee925166e4f/sc2_lrg.jpg sc2 sc2_lrg.jpg jpg 145285 670 2001 IMAGE-HIGH-RES 1-s2.0-S2468823122007696-sc3_lrg.jpg https://s3-eu-west-1.amazonaws.com/prod-ucs-content-store-eu-west/content/pii:S2468823122007696/HIGHRES/image/jpeg/b1ca356e78772dec749848e3dbb5f741/sc3_lrg.jpg sc3 sc3_lrg.jpg jpg 595777 3036 2917 IMAGE-HIGH-RES 1-s2.0-S2468823122007696-sc4_lrg.jpg https://s3-eu-west-1.amazonaws.com/prod-ucs-content-store-eu-west/content/pii:S2468823122007696/HIGHRES/image/jpeg/26f70e93eb1d13b7d94f85e2131f34a0/sc4_lrg.jpg sc4 sc4_lrg.jpg jpg 190254 996 2500 IMAGE-HIGH-RES 1-s2.0-S2468823122007696-gr1_lrg.jpg https://s3-eu-west-1.amazonaws.com/prod-ucs-content-store-eu-west/content/pii:S2468823122007696/HIGHRES/image/jpeg/af2c02e4499c2c1f0a5328424fa64735/gr1_lrg.jpg gr1 gr1_lrg.jpg jpg 879188 2133 2750 IMAGE-HIGH-RES 1-s2.0-S2468823122007696-ga1_lrg.jpg https://s3-eu-west-1.amazonaws.com/prod-ucs-content-store-eu-west/content/pii:S2468823122007696/HIGHRES/image/jpeg/cf61bb8c3aad69df984b8e0f977d46ef/ga1_lrg.jpg ga1 true ga1_lrg.jpg jpg 75062 886 1007 IMAGE-HIGH-RES 1-s2.0-S2468823122007696-mmc1.docx https://s3-eu-west-1.amazonaws.com/prod-ucs-content-store-eu-west/content/pii:S2468823122007696/mmc1/MAIN/application/vnd.openxmlformats-officedocument.wordprocessingml.document/805fa912e8466d4e2f5e452c6d39758d/mmc1.docx mmc1 mmc1.docx docx 4138135 APPLICATION 1-s2.0-S2468823122007696-am.pdf https://s3-eu-west-1.amazonaws.com/prod-ucs-content-store-eu-west/content/egi:10FS1F7W44Q/MAIN/application/pdf/65df0b5dfd5fcbbbff204658ce4dbf2b/am.pdf am am.pdf pdf false 1812954 AAM-PDF MCAT 112883 112883 S2468-8231(22)00769-6 10.1016/j.mcat.2022.112883 Elsevier B.V. Scheme 1 Imines synthesis via oxidation process and condensation process. Scheme 1 Fig. 1 Structure and morphology of RM and ARM. (a). XRD, 1. cancrinite (Na6CaAl6Si6(CO3), 2. gibbsite (Al(OH)3), 3. hematite (Fe2O3), 4. quartz (SiO2), 5. diaspore (AlO(OH)), 6. rutile (TiO2) 7. Na2CO3, 8. goethite (FeOOH), 9. NaOH, 10. corundum (Al2O3), (b) N2 isotherm plots (c). SEM of RM; (d) SEM of ARM. Fig 1 Fig. 2 XRD patterns of the various MnO x material (a); SEM of the MnO x -400 (b); XPS spectra of the various MnOx materials, C1s (c); O1s (d). Fig 2 Fig. 3 a. Imine synthesis over MnO x catalysts: MnO2-com1, commercial MnO2 purchased from Aladdin without any treatment, MnO2-com2, commercial MnO2 activated at above 400 °C or RM catalysts, conditions: benzyl alcohol 0.5 mmol, aniline 0.6 mmol, toluene 2 mL, MnO x or RM10 mg, 60 °C, 8 h, air balloon. b. Imine synthesis over various MnO x and (A)RM synergistic catalysis, conditions: benzyl alcohol 0.5 mmol, aniline 0.6 mmol, toluene 2 mL, MnO x 10 mg, (A)RM 10 mg, 60 °C, 8 h, air balloon. Fig 3 Fig. 4 Time dependence of imine formation from benzyl alcohol and aniline with different ARM loading. a. benzyl alcohol conversion; b. imine yield. Conditions: benzyl alcohol 0.5 mmol, aniline 0.6 mmol, toluene 2 mL, 60 °C, air balloon. Time dependence for imine formation from benzyl alcohol and aniline over MnO x -400 and MnO x -400/ARM synergistic catalysis c. Oxidative cross-coupling of benzyl alcohol and aniline over MnO x -400 for 2 or 3 h. Conditions: benzyl alcohol 0.5 mmol, aniline 0.6 mmol, toluene 2 mL, MnO x -400 10 mg, 60 °C, air. d. Oxidative cross-coupling of benzyl alcohol and aniline over MnO x for 2 h and then ARM is added to the mixture for another 1 h. Conditions: benzyl alcohol 0.5 mmol, aniline 0.6 mmol, toluene 2 mL, MnO x -400 10 mg, 60 °C, air, 2 h, then 10 mg ARM is added to the mixture for another 1 h. Fig 4 Fig. 5 a. Oxidation of benzyl alcohol to benzaldehyde. (0.5 mmol of benzyl alcohol (∼52 μL), toluene 2 mL, MnO x -400 10 mg or MnO x -400/ARM (1:1), 60 °C, air); b. Condensation results of benzaldehyde and aniline with ARM or MnO x or without catalysts. (Benzyl alcohol 0.05 M in toluene, 2 mL, aniline 0.6 mmol, ∼55 μL, MnO x -400 10 mg or ARM 10 mg or blank); c. Condensation results of benzaldehyde and aniline with ARM or without catalysts (benzyl alcohol 0.01 M in toluene, 2 mL, aniline 0.6 mmol, ∼55 μL, ARM 10 mg or blank). Fig 5 Fig. 6 a. NH3-TPD results of ARM and no ARM. b. Pyridine-IR spectra of ARM and no ARM at 30 °C. Fig 6 Scheme 2 Proposed synergistic mechanism for the MnO x /ARM synergistic catalysts. Scheme 2 Scheme 3 Potential and widespread applicability of the synergistic catalysis. Scheme 3 Scheme 4 Potential and widespread applicability of the ARM catalysts. Scheme 4 Fig. 7 Stability of ARM catalysts in the condensation process (Benzyl alcohol 0.01 M in toluene, 2 mL, aniline 0.6 mmol). Fig 7 Table 1 XRF results of RM and ARM. Table 1 Sample Elemental composition (wt%) Fe2O3 Al2O3 SiO2 Na2O TiO2 CaO Red mud (RM) 41.2 19.3 16.9 14.4 6.2 0.6 Active red mud (ARM) 52.6 20.6 17.6 0.3 7.3 0.4 Table 2 Comparison of catalytic results of Mn-based catalysts in this transformation. Table 2 No. Catalyst Loadings (mg) Alcohols T (°C) T (h) Yield (%) Refs. 1 MnO x -400 + ARM 10 + 1 = 11 0.5 mmol 60 8 98 This work 2 20 + 2 = 22 1 mmol 8 92 3 40 + 4 = 44 2 mmol 3 88 4 γ-MnO2 50 1 mmol 60 12 98 [50] 4 Ce/MnO2 50 1 mmol 60 6 99 [58] 5 Fe5Mn5-100 50 1 mmol 60 3 97 [59] 7 MnCo2O4-500 35 0.5 mmol 80 12 96 [44] 8 MnOx/HAP 172 1 mmol 80 24 93 [53] 9 MnOx/TiO2@SBA-15 100 1 mmol 80 24 93 [52] 10 Mn1Zr0.5Oy 60 1 mmol 80 3 99 [61] 11 α‐MnO2/GO 20 2 mmol 80 12 84 [54] 12 K-OMS-2 50 1 mmol 110 12 99 [46] Red mud-mediated cross-coupling of alcohols and amines to imines over MnO x catalysts Yanwei Cao Conceptualization Data curation Formal analysis Methodology Writing – original draft Writing – review & editing a 1 Dilong Chen Formal analysis Data curation Investigation a 1 Yaowei Wang Investigation b Huibing Shi Investigation b Baolin Feng Investigation b Chungu Xia Investigation a Yuxiao Ding Investigation Writing – original draft Writing – review & editing a ⁎ Lin He Funding acquisition Supervision Writing – review & editing a ⁎ a State Key Laboratory for Oxo Synthesis and Selective Oxidation (OSSO), Suzhou Research Institute of LICP, Lanzhou Institute of Chemical Physics (LICP), Chinese Academy of Sciences (CAS), Lanzhou 730000, China State Key Laboratory for Oxo Synthesis and Selective Oxidation (OSSO), Suzhou Research Institute of LICP, Lanzhou Institute of Chemical Physics (LICP) Chinese Academy of Sciences (CAS) Lanzhou 730000 China aState Key Laboratory for Oxo Synthesis and Selective Oxidation (OSSO), Suzhou Research Institute of LICP, Lanzhou Institute of Chemical Physics (LICP), Chinese Academy of Sciences (CAS), Lanzhou 730000, China b Shandong Chambroad Petrochemicals Co., Ltd, Binzhou 256500, China Shandong Chambroad Petrochemicals Co., Ltd Binzhou 256500 China bShandong Chambroad Petrochemicals Co., Ltd, Binzhou 256500, China ⁎ Corresponding authors. 1 These authors contributed equally to this work. The development of new application scenarios for the red mud, a huge by-product from the aluminum manufacture, has become urgent because of the increasingly stringent demands of environmental protection. Herein, a very simple and sustainable approach to the design of a synergistic catalytic system for the direct oxidative cross-coupling of alcohols and amines to (un)symmetric imines by physically mixing MnO x and red mud is presented. With the catalysis of active red mud, the synthesis of imines over MnO x can achieve an excellent (>98%) yield at 60 °C, air as oxidant for 8 h Without this catalysis, the imine yield reaches only 25%. The red mud clearly assists the reaction, resulting in a 4 ∼ 10-folds higher increase over reactions using only MnO x . From detailed experiments and characterizations, the synergistic effects of the extraordinary performance of this catalytic system were confirmed to be a combination of the reactivity of MnO x in the oxidation of alcohols and the enhancement by the active red mud in the condensation of aldehydes and amines. This work demonstrates a facile strategy for revival of the hazardous red mud. It could turn “waste” into wealth and greatly promote the catalytic applications of red mud. Graphical abstract Image, graphical abstract Keywords MnO x Red mud Synergistic catalysis Imine synthesis Cross-coupling Data Availability Data will be made available on request. 1 Introduction With the rapid utilization of natural resources, the industrial hazardous waste output increases over years, and it is a material which is freely available to be used as catalysts or supports [1–6]. Among industrial wastes, red mud (RM) from the aluminum industry, with main components such as Fe2O3, Al2O3, SiO2, Na2O, CaO and TiO2 etc., is produced in the highest amounts (1.5 ∼ 2.5 tons RM per 1 ton alumina) and has the lowest reutilization rate (< 10%) [7–9]. Most of the RM is disposed in landfills or dams without any pretreatment [10,11], but the high alkalinity and harmful metals in RM can cause drastic destroy to the health of all living things and environment problems. Thus, there is an urgent need for clean, safe and valuable technologies for the valorization of RM [12]. In the past decades, a great deal of effort has been made to the utilize RM as catalysts in different transformations, including Fe-based catalysis (hydrogenation, oxidation, Fenton-like process), base catalysis (catalytic cracking, catalytic pyrolysis) or as catalyst supports [1,13–21]. Such achievements have the potential to resolve the RM-based catalyst problems. Nitrogen-containing organic compounds are widely applications in many aspects of our daily life [22–27]. Imines, as a class of important nitrogen-containing compounds, have been attracted much concerns with their key roles in synthesis of various dyes, pharmaceuticals, agrochemicals and biologically active compounds as well as an intermediates in the production of secondary amines [28–34]. Owing to their importance, versatile methods for imine synthesis have been developed, including condensation of aldehydes and amines, oxidative dehydrogenation of secondary amines, oxidative coupling of primary alkylamine and the direct cross-coupling of alcohol and primary amines [35–38]. Of all the above strategies, direct cross-coupling of alcohols and amines is highly-focused because the unsymmetric imines are readily formed from alcohols and amines, water is the only by-product of the reaction and air can be used as a gratis oxidant. These advantages promise that the transformation should be environmentally benign [30,39–43]. This reaction is a representative tandem process, which includes an oxidation process with redox catalysts and a condensation process with acidic catalysts (Scheme 1 ). Thus, to acquire considerable selectivity and yield of the imine in this transformation, three strategies have received attention: (1) loading more catalysts [44,45]; (2) raising the reaction temperature or prolonging the reaction time [45,46]; and (3) designing an dual-sites catalysts with redox and acid sites [42]. MnO x is a cheap and effective catalyst for various catalytic oxidation reactions [47–49]. Selecting self-coupling of amines or cross-coupling of alcohols and amines to imines as examples, unmodified manganese oxide as a catalyst has unsatisfactory catalytic activity, leading to operate the reaction at relatively harsh conditions such as high catalysis loadings and reaction temperatures, long reaction times, oxidants other than air and complicated control of the morphology or crystal structure of the MnO2 [50,51]. To overcome these difficulties and develop high performance Mn-based catalysts, different strategies such as impregnation of MnO x into materials with large specific surface areas or with different functionalities, such as MnO x /TiO2@SBA-15 [52], MnO x /HAP [53], MnO2/GO [54], MnO2/CeO2 [55], metal-doped MnO2 (Cs/MnO x [56,57], Co/MnO2 [45], Ce/MnO2 [58]), Mn-based composite oxides (MnCo2O4 [44], Fe5Mn5-100 [59]) and solid solution (Mn1Zr x O y ) [60,61] have been studied. Despite numerous reports highlighting the Mn-based catalysts for the imine synthesis, the search for milder, cheaper and more scalable adjustment of the Mn-based catalysts is still in high demand. Herein, a simple and cheap strategy of combining MnO x as a redox catalyst and the treated RM as Lewis acidic catalyst for the tandem oxidative cross-coupling of alcohols and amines is developed. The abundant Lewis acidic sites in RM can significantly speed-up the benzaldehyde-aniline condensation process, even at low concentrations of benzaldehyde. Consequently, the efficiency of the entire reaction can be improved. These inspiring results not only exhibit a sustainable approach to turn hazardous RM into valuable catalytic materials but also provide a promising direction to solve the issues associated with pollution by RM. 2 Experimental 2.1 RM treatment Three different batches of RM samples were collected from Zibo city, Shandong Provinces, China. RM was treated by nitric acid digestion and ammonium hydroxide reprecipitation procedure adopted from our previous literature without any change [9]. The dried precipitate was treated at 400 °C in a muffle oven for 3 h, termed active RM (ARM). Similarly, another two red muds were treated by same procedure and denote as ARM-2, ARM-3. 2.2 Preparation of MnO x MnO x was prepared by prepared by calcination of MnCO3 at 300–600 °C in muffle oven for 3 h with the temperature increasing at 5 °C·min−1. Accordingly, the samples were denoted as MnO x -T (T = 300, 400, 500, 600). 2.3 General procedure for the oxidative cross-coupling reaction ARM (10 mg), MnO x -400 (10 mg), benzyl alcohol (0.5 mmol, ∼52 μL), aniline (1.2 equiv., ∼55 μL) and toluene (2 mL) were mixed in a 10 mL Shrek tube containing a stir bar, then connected with an air balloon at 60 °C for 8 h. After time's up, the reaction liquid was analyzed by GC with dodecane as internal standard and GC-MS (Supporting Information, Figs. S1–S3). 2.4 Condensation of benzaldehyde with amines to imines ARM (10 mg), benzaldehyde (0.5 mmol, ∼51 μL), aniline (0.5 mmol, ∼46 μL) and toluene (2 mL) were mixed in a 10 mL Shrek tube containing a stir bar, then connected with an air balloon at 60 °C for 8 h. The reaction operation at rt. for 30 min. After time's up, the reaction liquid was analyzed by GC with dodecane as internal standard and GC-MS. 2.5 Characterization of catalysts X-ray fluorescence (XRF) spectrometer, X-ray diffraction (XRD) patterns, N2 adsorption/desorption, scanning electron microscopy (SEM), NH3 temperature programmed desorption (NH3-TPD) and Pyridine-IR were applied to characterize the physico-chemical property of the red mud, active red mud and MnO x . 3 Results and discussion 3.1 Characterization of the red mud and MnO x XRF was used to analysis the chemical composition of the RM and ARM. As shown in Table 1 , after the acid digestion and the alkali reprecipitation procedure, most of Na2O was removed and the final composition of the ARM was Fe2O3 (52.6%), Al2O3 (20.7%), SiO2 (17.2%), Na2O (0.3%), TiO2 (7.3%) and CaO (0.4%). XPS was also applied to analysis the different between RM and ARM, the main elements and valence state of RM and ARM were nearly unchanged, except sodium (Fig. S4). After the treatment, typical XRD peaks of the hematite (Fe2O3), quartz (SiO2), rutile (TiO2) and corundum (Al2O3) were still present in the ARM. Meanwhile, the characteristic peaks of the cancrinite (Na6CaAl6Si6(CO3)O24·2H2O), gibbsite (Al(OH)3), sodium carbonate (Na2CO3), goethite (FeOOH), diaspore (AlO(OH)), sodium hydroxide (NaOH) disappeared [14,62–64]. The surface area and pore volume were confirmed by N2 adsorption-desorption measurements. The RM has Brunauer-Emmett-Teller (BET) surface area of 25.5 m2·g−1 and Barrett-Joyner-Halenda (BJH) pore volume of 0.08 cm3·g−1. The ARM showed an improvement of both BET surface area and BJH pore volume to 53.5 m2·g−1 and 0.12 cm3·g−1, respectively (Fig. 1 b). SEM images confirmed that smaller particles in nanoscale formed after the treatment (Fig. 1c and d), which might be the reason for the enlargement of the surface area and pore volume. A high surface area and pore volume may provide more active sites in catalytic reactions. XRD was employed for the structural transformation of the MnO x based samples. The representative XRD diffraction peaks of MnCO3 disappeared after calcination at 300 °C, and no crystallinity was seen in the MnO x -300 that was formed. After treatment at 400 °C, a small peak appeared at 2θ = 37o, which was attributed to the formation of crystalline MnO2. Various sharp peaks appeared in the XRD patterns of MnO x -500, which were assigned to the formed β-MnO2 structure [50,65]. After treatment at 600 °C, representative diffraction peaks of Mn2O3 were detected [66,67] (Fig. 2 a). The morphology of the as-prepared MnO x based materials were investigated by SEM (Figs. 2b and S5,6). After the MnCO3 was calcinated to form MnO x , a peach-like structure was clearly observed with particles ∼1 μm diameter. The surface elemental compositions and transformation was also analyzed by XPS. Fig. 2c demonstrates the C1s core-level photoelectron spectra of MnCO3 and the MnOx samples. The C1s peaks centered at 289.5 and 284.8 eV correspond to the photoelectron spectra of carbonate (CO3 2−) and adventitious carbon, respectively. After calcination, the characteristic band of CO3 2− was significantly diminished, indicating that the MnCO3 had decomposed during the calcination process [67]. The C1s results were in accord with and XRD data. The O1s peaks centered at 533.6, 531.9, 531.6 and 529.6 eV correspond to the characteristic bands of the hydroxyl group, surface adsorbed oxygen, oxygen in CO3 2− and lattice oxygen, respectively (Fig. 2d). Calcination at 400 °C caused remarkable transformations in the O1s spectra. A new fraction appeared in the O1s band at ∼531.9 eV, and was associated with the surface adsorbed oxygen [67–71]. However, the portions of the surface adsorbed oxygen in MnO x decreased with further treating MnCO3 at 500 and 600 °C. The highest concentration of surface adsorbed oxygen was obtained with MnO x -400, which demonstrated that the amorphous structures provided more sites for the oxygen adsorption. This characteristic might be suitable for the catalysis in the selective oxidation reaction. 3.2 MnO x /ARM synergistic catalysts The direct oxidative cross-coupling of benzyl alcohol and aniline forming an imine, N-benzylideneaniline, was selected as a model reaction to screen the catalytic activity of different MnO x species in RM and ARM and their mixture at 60 °C. As shown in Fig. 3 a, the amorphous MnO x -300 and MnO x -400 showed better activities than others, delivering yields of 25 ∼ 27% in this oxidative cross-coupling reaction with poor selectivity. The abundant of surface oxygen species in the amorphous MnO x was the main reason for the better performance. The MnCO3 and commercial MnO2 did not show any obvious catalytic effect under the same condition, because they appear to lack the ability to activate the oxygen. Loading more catalysts did improve the yield of imines, but the reaction was still uneconomical (Fig. S7). RM and ARM were both nearly inactive in the reaction (Fig. 3a), demonstrating no oxidative activity with the reaction. Surprisingly, an inspiring enhancement for the Mn-based samples was observed, especially for those with MnO x (Fig. 3b). The results demonstrated a synergistic effect in this reaction between the MnO x and the ARM. The physical mixture of original RM and MnO x also showed signs of promoting the reaction, but the synergistic effect was obviously lower when compared to the reaction with ARM. When the MnO x -400 and ARM was used as a combined catalytic system, the yield of N-benzylideneaniline was reached 98%. As Fig. S8 shows, the different calcination temperature of the ARM has less affected to the catalytic activity. In addition, we further use another two red muds with different batches and ingredients, obvious synergistic effects are also existed between active red mud and MnO x -400 (Tables S1 and S2). These results suggest that the existence of some differences on the content and the composition of the red mud has less affected to the catalytic activity. Fe2O3, Al2O3, SiO2, Na2O and TiO2 are the five major constituents in our red mud sample. We then tested individual oxides impact on the oxidative cross-coupling of alcohol and amines. Firstly, in the ARM sample, more than 99.9% of Na2O was removed through medication process. Catalytic results have shown that the ARM can greatly promoting the yield of imines and therefore, the possibility of the Na2O catalyzed this reaction was excluded (Fig. 3b). Then, Fe2O3, Al2O3, SiO2, and TiO2 were also tested based on their ratio in ARM and found to be effective up to a point, but the efficiency gap between individual oxide and ARM was obvious (Fig. S9). These results indicate that ARM is the most effective promoter for the imine synthesis among the single components. Then, the ARM loadings in these transformations with a range of 0 ∼ 10 mg were explored. The transformation of benzyl alcohol and the yield of imine increased immediately with 1 mg of ARM in the reaction (Fig. 4 a and b). Further increases in the amount of ARM that was used improved the reaction efficiency. To show a comparative aspect, a control experiments were runs over MnO x -400 catalysts for 2 or 3 h and over MnO x -400 catalysts for 2 h then 10 mg ARM added to the mixture for another 1 h (Fig. 4c and d). For the MnO x -400 catalyst, both the conversion and yield were increased by extending the reaction time, but the activity and selectivity were still unsatisfactory. Surprisingly, once the ARM was added into the reaction system for another 1 h, the selectivity of imine was significantly increased to 96%, and the conversion reached 51%. Based on all these results, it was concluded that the ARM is important for this transformation. Ma et al. reported that amorphous Fe2O3, the main component of ARM, improving the active oxygen transfer in Mn3O4, and improved the catalytic activity of Mn based catalysts [59]. Previous results indicated that abundant Lewis acid sites exist in red mud-based materials and Lewis acid was a catalyst for the condensation of amines with aldehydes to imines [72–74]. Thus, there are two possible roles for ARM in the catalytic process: it may behave as an oxygen mediator or a Lewis acid catalyst. 3.3 Insight into the mechanism of the MnO x /ARM synergistic catalysts According to a previous report, oxidative cross-coupling of alcohol and amine to imines proceeds in two steps: 1. selective oxidation of benzyl alcohol into benzaldehyde, 2. imine generation from benzaldehyde and amines [74]. Thus, to clarify the contribution from ARM, the oxidation part and condensation part of this cascade process were examined separately. Benzyl alcohol oxidation over MnO x -400 or MnO x -400/ARM catalyst are performed, MnO x -400 clearly catalyzed the reaction, while ARM showed no enhancement of the oxidation process (Fig. 5 a). Therefore, we confirmed that ARM was not an oxygen mediator in the mechanism. Fig. 5b shows the condensation results of benzaldehyde and aniline with different catalytic systems. A low concentration of benzaldehyde was felt to be suitable and was used because the initial concentration of benzaldehyde was relatively low during the reaction. With 0.05 M of benzaldehyde for example, ARM showed better performance than MnO x in the condensation step. With ARM, the complete conversion of benzaldehyde only in 2 h at rt., and the 100% conversion of benzaldehyde over the MnO x -400 was required tripling times (6 h). Compared with the result of the reaction with no catalyst, the MnO x obviously had no catalytic activity in this step. At a concentration of 0.01 M, the ARM provided the 100% conversion in 25 min, and under the same conditions, only 10% conversion of benzaldehyde took place in the absence of catalysts (Fig. 5c). Therefore, it can be considered that the Lewis acid sites in ARM greatly accelerate the condensation step even in the low concentration range, The benzaldehyde generated in the oxidation step is consumed quickly, and consequently the oxidation of benzyl alcohol to benzaldehyde can also be accelerated based on the chemical equilibria. To proof of the catalytic results, NH3-TPD and pyridine-IR are chosen to assess the acidity in the RM and ARM. Firstly, the acidic sites in the RM and the ARM are identified by NH3-TPD. As shown in Fig. 6 a, both samples showed two NH3 desorption peaks at 146 and 512 °C, which can be ascribed to weak and strong acidic sites, respectively. Apparently, the ARM possesses many more acidic sites than the RM. Then, the nature of Brønsted and Lewis acids in the two samples were also identified by the pyridine-IR analyzes [75]. The ARM manifested abundant Lewis acid sites, as shown by the appearance of bands at 1445, 1490 and 1594 cm−1 (Fig. 6b). In the RM sample, however, the pyridine-IR results did not contain large amounts of Lewis or Brønsted acid sites, which might be caused by the blocking effect of the abundant alkaline ions [76–79]. This could also explain why the RM is not a good catalyst in this reaction. The pyridine-IR analysis also showed the weak nature of the Lewis acid in MnO x -400 (Fig. S10), which demonstrates the necessity of MnO x /ARM synergistic catalysis in this transformation [80,81]. Based on these results, a proposed reaction mechanism over MnO x /ARM synergistic catalytic system was developed and is displayed in Scheme 2 , where MnO x catalyzes the oxidation step and the ARM enhances the condensation step. 3.4 Substrate scope and stability of ARM catalysts To demonstrate the potential and widespread applicability of the synergistic catalysis, arylamines with diversity functional groups were investigated (Scheme 3 ). The synergistic catalytic system is efficient with various substituted arylamines, including 4-methyl, ethyl, isopropyl, tert-butyl, methoxy, 4-isopropoxy, fluoro, chloro, bromo, iodo and trifluoro, giving the imines in good to excellent yields. Aniline was used as the substrate to observe the general nature of benzyl alcohol derivatives. Methyl- and methoxy-substituted benzyl alcohols were reacted and produced the desired imines in good yield; chloro- and bromo-functionalized benzyl alcohol were also reacted and formed imines in good yields. The excellent activity of ARM in the condensation process was further highlighted by the synthesis of imines from aldehydes and amines. In all cases, the desired imines were obtained in excellent yields (80 ∼ 99%) at rt in 30 min (Scheme 4 ). These broad substrate scopes results demonstrated the universality of the MnO x /ARM atalytic system in a divergent preparation of imines from the reaction of alcohols or aldehydes with amines. To proof the stability of ARM catalysts in the condensation process, a recycling experiment was carried out. The experiments demonstrated that the activity of ARM decreased only slightly from the first measurement even after 7 cycles (Fig. 7 ). To further illustrate the simple preparation and excellent activity of the MnO x -400/ARM catalytic system, the comparison of catalytic results of various reported Mn-based catalysts are shown in Table 2 . The fabrication of MnO x /ARM is quite simple and exhibits commensurable performance when compared to the reported excellent Mn-based catalysts, such as Fe5Mn5-100 and Mn1Zr0.5Oy. This present study describes the first example of simple MnO x /ARM as a synergistic catalyst in the oxidative cross-coupling of alcohol and amine. 4 Conclusion We have demonstrated an oxidative cross-coupling of alcohols and amines via a simple mixing MnO x /ARM catalysts which produces various imines under mild conditions. MnO x was proved to be responsible only for the selective alcohol oxidation to aldehydes and ARM enhanced the condensation of aldehyde and amines to give the desired products. The unprecedented MnO x /ARM synergistic catalysis in our study not only provides a highly effective approach for the preparation of imines, but also greatly promotes the potential transformation of the key hazardous industrial wastes into valuable materials. Further experiments are being explored to diversify the use of the RM in catalysis based on the core of sustainable development and environmental economy. CRediT authorship contribution statement Yanwei Cao: Conceptualization, Data curation, Formal analysis, Methodology, Writing – original draft, Writing – review & editing. Dilong Chen: Formal analysis, Data curation, Investigation. Yaowei Wang: Investigation. Huibing Shi: Investigation. Baolin Feng: Investigation. Chungu Xia: Investigation. Yuxiao Ding: Investigation, Writing – original draft, Writing – review & editing. Lin He: Funding acquisition, Supervision, Writing – review & editing. Declaration of Competing Interest The authors declare that they have no known competing financial interests or personal relationships that could have appeared to influence the work reported in this paper. Acknowledgments This work was financially supported by the National Natural Science Foundation of China (No. 21802151, No. 21972152) and the Natural Science Foundation of Jiangsu Province (No. BK20211094). Supplementary materials Supplementary material associated with this article can be found, in the online version, at doi:10.1016/j.mcat.2022.112883. Appendix Supplementary materials Image, application 1 References [1] S. Sushil V.S. Batra Catalytic applications of red mud, an aluminium industry waste: a review Appl. Catal. B Environ. 81 2008 64 77 S. Sushil, V.S. Batra, Catalytic applications of red mud, an aluminium industry waste: a review, Appl. Catal. B Environ. 81 (2008) 64–77. [2] S. Wang Application of solid ash based catalysts in heterogeneous catalysis Environ. Sci. Technol. 42 2008 7055 7063 S. Wang, Application of solid ash based catalysts in heterogeneous catalysis, Environ. Sci. Technol., 42 (2008) 7055–7063. [3] E. Saputra S. Muhammad H. Sun H.M. Ang M.O. Tadé S. Wang Red mud and fly ash supported Co catalysts for phenol oxidation Catal. Today 190 2012 68 72 E. Saputra, S. Muhammad, H. Sun, H.M. Ang, M.O. Tadé, S. Wang, Red mud and fly ash supported Co catalysts for phenol oxidation, Catal. Today, 190 (2012) 68–72. [4] R.S. Blissett N.A. Rowson A review of the multi-component utilisation of coal fly ash Fuel 97 2012 1 23 R.S. Blissett, N.A. Rowson, A review of the multi-component utilisation of coal fly ash, Fuel, 97 (2012) 1–23. [5] A.D.N. de Oliveira I.M. Ferreira D.E.Q. Jimenez L.S. da Silva A.A.F. da Costa E.T.L. Lima F.F. Costa P.T.S. da Luz G.N.D.R. Filho S.M. Osman R. Luque L.A.S.D. Nascimento Mining waste valorisation to catalytically active mesoporous materials for the esterification of fatty acid palm oil waste Mol. Catal. 528 2022 112504 A.D.N. de Oliveira, I.M. Ferreira, D.E.Q. Jimenez, L.S. da Silva, A.A.F. da Costa, E.T.L. Lima, F.F. Costa, P.T.S. da Luz, G.N.D.R. Filho, S.M. Osman, R. Luque, L.A.S.D. Nascimento, Mining waste valorisation to catalytically active mesoporous materials for the esterification of fatty acid palm oil waste, Mol. Catal., 528 (2022) 112504. [6] A. Galadima O. Muraza Waste materials for production of biodiesel catalysts: technological status and prospects J. Clean. Prod. 263 2020 121358 A. Galadima, O. Muraza, Waste materials for production of biodiesel catalysts: technological status and prospects, J. Clean. Prod., 263 (2020) 121358. [7] H. Zeng F. Lyu W. Sun H. Zhang L. Wang Y.X. Wang Progress on the industrial applications of red mud with a focus on China Minerals 10 2020 773 H. Zeng, F. Lyu, W. Sun, H. Zhang, L. Wang, Y.X. Wang, Progress on the industrial applications of red mud with a focus on China, Minerals, 10 (2020) 773. [8] J. Wu Z. Gong C. Lu S. Niu K. Ding L. Xu K. Zhang Preparation and performance of modified red mud-based catalysts for selective catalytic reduction of NOx with NH3 Catalysts 8 2018 35 J. Wu, Z. Gong, C. Lu, S. Niu, K. Ding, L. Xu, K. Zhang, Preparation and performance of modified red mud-based catalysts for selective catalytic reduction of NOx with NH3, Catalysts, 8 (2018) 35. [9] D. Chen Y. Ding C. Xia L. He Y. Cao Turning hazardous red mud into useful catalysts for the carbonylation of amines to N-formamides Mol. Catal. 533 2022 112761 D. Chen, Y. Ding, C. Xia, L. He, Y. Cao, Turning hazardous red mud into useful catalysts for the carbonylation of amines to N-formamides, Mol. Catal., 533 (2022) 112761. [10] S. Wang H. Jin Y. Deng Y. Xiao Comprehensive utilization status of red mud in China: a critical review J. Clean. Prod. 289 2021 125136 S. Wang, H. Jin, Y. Deng, Y. Xiao, Comprehensive utilization status of red mud in China: a critical review, J. Clean. Prod., 289 (2021) 125136. [11] J. Zhang Z. Yao K. Wang F. Wang H. Jiang M. Liang J. Wei G. Airey Sustainable utilization of bauxite residue (red mud) as a road material in pavements: a critical review Constr. Build. Mater. 270 2021 121419 J. Zhang, Z. Yao, K. Wang, F. Wang, H. Jiang, M. Liang, J. Wei, G. Airey, Sustainable utilization of bauxite residue (red mud) as a road material in pavements: a critical review, Constr. Build. Mater., 270 (2021) 121419. [12] B. Swain A. Akcil J.C. Lee Red mud valorization an industrial waste circular economy challenge; review over processes and their chemistry Crit. Rev. Environ. Sci. Technol. 52 2022 520 570 B. Swain, A. Akcil, J.C. Lee, Red mud valorization an industrial waste circular economy challenge; review over processes and their chemistry, Crit. Rev. Environ. Sci. Technol., 52 (2022) 520–570. [13] B. Das K. Mohanty A review on advances in sustainable energy production through various catalytic processes by using catalysts derived from waste red mud Renew. Energy 143 2019 1791 1811 B. Das, K. Mohanty, A review on advances in sustainable energy production through various catalytic processes by using catalysts derived from waste red mud, Renew. Energy 143 (2019) 1791–1811. [14] J.L. Cao Z.L. Yan Q.F. Deng Y. Wang Z.Y. Yuan G. Sun T.K. Jia X.D. Wang H. Bala Z.Y. Zhang Mesoporous modified-red-mud supported Ni catalysts for ammonia decomposition to hydrogen Int. J. Hydrog. Energy 39 2014 5747 5755 J.L. Cao, Z.L. Yan, Q.F. Deng, Y. Wang, Z.Y. Yuan, G. Sun, T.K. Jia, X.D. Wang, H. Bala, Z.Y. Zhang, Mesoporous modified-red-mud supported Ni catalysts for ammonia decomposition to hydrogen, Int. J. Hydrog. Energy 39 (2014) 5747–5755. [15] E.C. De Resende C. Gissane R. Nicol R.J. Heck M.C. Guerreiro J.V. Coelho L.C.A. de Oliveira P. Palmisano F. Berruti C. Briens M. Schlaf Synergistic co-processing of red mud waste from the Bayer process and a crude untreated waste stream from bio-diesel production Green Chem. 15 2013 496 510 E.C. De Resende, C. Gissane, R. Nicol, R.J. Heck, M.C. Guerreiro, J.V. Coelho, L.C.A. de Oliveira, P. Palmisano, F. Berruti, C. Briens, M. Schlaf, Synergistic co-processing of red mud waste from the Bayer process and a crude untreated waste stream from bio-diesel production, Green Chem. 15 (2013) 496–510. [16] A.A.S. Oliveira D.S. Costa I.F. Teixeira L.A. Parreira L. Menini E.V. Gusevskaya F.C.C. Moura Red mud based gold catalysts in the oxidation of benzyl alcohol with molecular oxygen Catal. Today 289 2017 89 95 A.A.S. Oliveira, D.S. Costa, I.F. Teixeira, L.A. Parreira, L. Menini, E.V. Gusevskaya, F.C.C. Moura, Red mud based gold catalysts in the oxidation of benzyl alcohol with molecular oxygen, Catal. Today, 289 (2017) 89–95. [17] S. Muhammad E. Saputra H.Q. Sun H.M. Ang M.O. Tade S.B. Wang Heterogeneous catalytic oxidation of aqueous phenol on red mud-supported cobalt catalysts Ind. Eng. Chem. Res. 51 2012 15351 15359 S. Muhammad, E. Saputra, H.Q. Sun, H.M. Ang, M.O. Tade, S.B. Wang, Heterogeneous catalytic oxidation of aqueous phenol on red mud-supported cobalt catalysts, Ind. Eng. Chem. Res., 51 (2012) 15351–15359. [18] E. Karimi C. Briens F. Berruti S. Moloodi T. Tzanetakis M.J. Thomson M. Schlaf Red mud as a catalyst for the upgrading of hemp-seed pyrolysis bio-oil Energy Fuel 24 2010 6586 6600 E. Karimi, C. Briens, F. Berruti, S. Moloodi, T. Tzanetakis, M.J. Thomson, M. Schlaf, Red mud as a catalyst for the upgrading of hemp-seed pyrolysis bio-oil, Energy Fuel, 24 (2010) 6586–6600. [19] Y. Sato Y. Yamamoto T. Kamo A. Inaba K. Miki I. Saito Effect of hydrotreatment of various heavy oils as solvent for coal-liquefaction Energy Fuel 5 1991 98 102 Y. Sato, Y. Yamamoto, T. Kamo, A. Inaba, K. Miki, I. Saito, Effect of hydrotreatment of various heavy oils as solvent for coal-liquefaction, Energy Fuel, 5 (1991) 98–102. [20] M. Ebrahiminejad R. Karimzadeh Diesel hydrocracking and hydrodesulfurization with activated red mud-supported and fluorine-containing NiW nanocatalysts Mol. Catal. 517 2022 112056 M. Ebrahiminejad, R. Karimzadeh, Diesel hydrocracking and hydrodesulfurization with activated red mud-supported and fluorine-containing NiW nanocatalysts, Mol. Catal., 517 (2022) 112056. [21] S. Mishra R. Bal R.K. Dey Heterogeneous recyclable copper oxide supported on activated red mud as an efficient and stable catalyst for the one pot hydroxylation of benzene to phenol Mol. Catal. 499 2021 111310 S. Mishra, R. Bal, R.K. Dey, Heterogeneous recyclable copper oxide supported on activated red mud as an efficient and stable catalyst for the one pot hydroxylation of benzene to phenol, Mol. Catal., 499 (2021) 111310. [22] T. Naito Development of new synthetic reactions for nitrogen-containing compounds and their application Chem. Pharm. Bull. 56 2008 1367 1383 T. Naito, Development of new synthetic reactions for nitrogen-containing compounds and their application, Chem. Pharm. Bull., 56 (2008) 1367–1383. [23] A. Mermer T. Keles Y. Sirin Recent studies of nitrogen containing heterocyclic compounds as novel antiviral agents: a review Bioorg. Chem. 114 2021 105076 A. Mermer, T. Keles, Y. Sirin, Recent studies of nitrogen containing heterocyclic compounds as novel antiviral agents: a review, Bioorg. Chem., 114 (2021) 105076. [24] S. Song V.F.K. Yuen L. Di Q. Sun K. Zhou N. Yan Integrating biomass into the organonitrogen chemical supply chain: production of pyrrole and d-proline from furfural Angew. Chem. Int. Ed. 59 2020 19846 19850 S. Song, V.F.K. Yuen, L. Di, Q. Sun, K. Zhou, N. Yan, Integrating biomass into the organonitrogen chemical supply chain: production of pyrrole and d-proline from furfural, Angew. Chem. Int. Ed. 59 (2020) 19846–19850. [25] X. Chen S. Song H. Li G. Gözaydın N. Yan Expanding the boundary of biorefinery: organonitrogen chemicals from biomass Acc. Chem. Res. 54 2021 1711 1722 X. Chen, S. Song, H. Li, G. Gözaydın, N. Yan, Expanding the boundary of biorefinery: organonitrogen chemicals from biomass, Acc. Chem. Res., 54 (2021) 1711–1722. [26] Y. Cao J.G. Yang Y. Deng S. Wang Q. Liu C. Shen W. Lu C.M. Che Y. Chen L. He Amine-responsive disassembly of AuI–CuI double salts for oxidative carbonylation Angew. Chem. Int. Ed. 59 2020 2080 2084 Y. Cao, J.G. Yang, Y. Deng, S. Wang, Q. Liu, C. Shen, W. Lu, C.M. Che, Y. Chen, L. He, Amine-responsive disassembly of AuI–CuI double salts for oxidative carbonylation, Angew. Chem. Int. Ed., 59 (2020) 2080–2084. [27] Y. Cao Y. Huang L. He Sustainable route toward n-Boc amines: AuCl3/CuI-catalyzed N-tert-butyloxycarbonylation of amines at room temperature ChemSusChem 15 2022 e202102400 Y. Cao, Y. Huang, L. He, Sustainable route toward n-Boc amines: AuCl3/CuI-catalyzed N-tert-butyloxycarbonylation of amines at room temperature, ChemSusChem, 15 (2022) e202102400. [28] H. Wu Y. Cao G. Zhu D. Zeng X. Zhu J. Du L. He π-Conjugated polymeric phthalocyanine for the oxidative coupling of amines Chem. Commun. 56 2020 3637 3640 H. Wu, Y. Cao, G. Zhu, D. Zeng, X. Zhu, J. Du, L. He, π-Conjugated polymeric phthalocyanine for the oxidative coupling of amines, Chem. Commun., 56 (2020) 3637–3640. [29] M. Wang H. Wu C. Shen S. Luo D. Wang L. He C. Xia G. Zhu Seaweed-like 2D-2D architecture of MoS2/rGO composites for enhanced selective aerobic oxidative coupling of amines ChemCatChem 11 2019 1935 1942 M. Wang, H. Wu, C. Shen, S. Luo, D. Wang, L. He, C. Xia, G. Zhu, Seaweed-like 2D-2D architecture of MoS2/rGO composites for enhanced selective aerobic oxidative coupling of amines, ChemCatChem, 11 (2019) 1935–1942. [30] D. Lv Y. Li W. Qiao D. Zhang Y. Mai N. Cai H. Xiang Y. Li H. Niemantsverdriet W. Hao R. Su Metal cocatalyst mediated photocatalytic dehydrogenative-condensation and direct condensation cross-coupling of aniline and alcohol Appl. Catal. B Environ. 309 2022 121264 D. Lv, Y. Li, W. Qiao, D. Zhang, Y. Mai, N. Cai, H. Xiang, Y. Li, H. Niemantsverdriet, W. Hao, R. Su, Metal cocatalyst mediated photocatalytic dehydrogenative-condensation and direct condensation cross-coupling of aniline and alcohol, Appl. Catal. B Environ. 309 (2022) 121264. [31] Z. Zhang F. Wang M. Wang S. Xu H. Chen C. Zhang J. Xu Tert-butyl hydroperoxide (TBHP)-mediated oxidative self-coupling of amines to imines over a α-MnO2 catalyst Green Chem. 16 2014 2523 2527 Z. Zhang, F. Wang, M. Wang, S. Xu, H. Chen, C. Zhang, J. Xu, Tert-butyl hydroperoxide (TBHP)-mediated oxidative self-coupling of amines to imines over a α-MnO2 catalyst, Green Chem., 16 (2014) 2523–2527. [32] S. Zhang Z. Xia Y. Zou M. Zhang Y. Qu Spatial intimacy of binary active-sites for selective sequential hydrogenation-condensation of nitriles into secondary imines Nat. Commun. 12 2021 3382 S. Zhang, Z. Xia, Y. Zou, M. Zhang, Y. Qu, Spatial intimacy of binary active-sites for selective sequential hydrogenation-condensation of nitriles into secondary imines, Nat. Commun., 12 (2021) 3382. [33] G. Gogoi M.J. Baruah S. Biswas N. Hoque S. Lee Y.B. Park L. Saikia K.K. Bania CuO-Fe(III)-Zeolite-Y as efficient catalyst for oxidative alcohol-amine coupling reactions Mol. Catal. 528 2022 112458 G. Gogoi, M.J. Baruah, S. Biswas, N. Hoque, S. Lee, Y.B. Park, L. Saikia, K.K. Bania, CuO-Fe(III)-Zeolite-Y as efficient catalyst for oxidative alcohol-amine coupling reactions, Mol. Catal., 528 (2022) 112458. [34] I. Gumus A. Ruzgar Y. Karatas M. Gülcan Highly efficient and selective one-pot tandem imine synthesis via amine-alcohol cross-coupling reaction catalysed by chromium-based MIL-101 supported Au nanoparticles Mol. Catal. 501 2021 111363 I. Gumus, A. Ruzgar, Y. Karatas, M. Gülcan, Highly efficient and selective one-pot tandem imine synthesis via amine-alcohol cross-coupling reaction catalysed by chromium-based MIL-101 supported Au nanoparticles, Mol. Catal., 501 (2021) 111363. [35] R.D. Patil S. Adimurthy Catalytic methods for imine synthesis Asian J. Org. Chem. 2 2013 726 744 R.D. Patil, S. Adimurthy, Catalytic methods for imine synthesis, Asian J. Org. Chem., 2 (2013) 726–744. [36] S. Hazra E. Malik A. Nair V. Tiwari P. Dolui A.J. Elias Catalytic oxidation of alcohols and amines to value-added chemicals using water as the solvent Chem. Asian J. 15 2020 1916 1936 S. Hazra, E. Malik, A. Nair, V. Tiwari, P. Dolui, A.J. Elias, Catalytic oxidation of alcohols and amines to value-added chemicals using water as the solvent, Chem. Asian J., 15 (2020) 1916–1936. [37] M. Largeron Protocols for the catalytic oxidation of primary amines to imines Eur. J. Org. Chem. 2013 2013 5225 5235 M. Largeron, Protocols for the catalytic oxidation of primary amines to imines, Eur. J. Org. Chem., 2013 (2013) 5225–5235. [38] H. Sun F.Z. Su J. Ni Y. Cao H.Y. He K.N. Fan Gold supported on hydroxyapatite as a versatile multifunctional catalyst for the direct tandem synthesis of imines and oximes Angew. Chem. Int. Ed. 48 2009 4390 4393 H. Sun, F.Z. Su, J. Ni, Y. Cao, H.Y. He, K.N. Fan, Gold supported on hydroxyapatite as a versatile multifunctional catalyst for the direct tandem synthesis of imines and oximes, Angew. Chem. Int. Ed., 48 (2009) 4390–4393. [39] L. Geng J. Song B. Zheng S. Wu W. Zhang M. Jia G. Liu Aerobic oxidative coupling of alcohols and amines to imines over iron catalysts supported on mesoporous carbon Chin. J. Catal. 37 2016 1451 1460 L. Geng, J. Song, B. Zheng, S. Wu, W. Zhang, M. Jia, G. Liu, Aerobic oxidative coupling of alcohols and amines to imines over iron catalysts supported on mesoporous carbon, Chin. J. Catal. 37 (2016) 1451–1460. [40] S. Wu W. Sun J. Chen J. Zhao Q. Cao W. Fang Q. Zhao Efficient imine synthesis from oxidative coupling of alcohols and amines under air atmosphere catalysed by Zn-doped Al2O3 supported Au nanoparticles J. Catal. 377 2019 110 121 S. Wu, W. Sun, J. Chen, J. Zhao, Q. Cao, W. Fang, Q. Zhao, Efficient imine synthesis from oxidative coupling of alcohols and amines under air atmosphere catalysed by Zn-doped Al2O3 supported Au nanoparticles, J. Catal., 377 (2019) 110–121. [41] L. Zhang W. Wang A. Wang Y. Cui X. Yang Y. Huang X. Liu W. Liu J.Y. Son H. Oji T. Zhang Aerobic oxidative coupling of alcohols and amines over Au-Pd/resin in water: Au/Pd molar ratios switch the reaction pathways to amides or imines Green Chem. 15 2013 2680 2684 L. Zhang, W. Wang, A. Wang, Y. Cui, X. Yang, Y. Huang, X. Liu, W. Liu, J.Y. Son, H. Oji, T. Zhang, Aerobic oxidative coupling of alcohols and amines over Au-Pd/resin in water: Au/Pd molar ratios switch the reaction pathways to amides or imines, Green Chem., 15 (2013) 2680–2684. [42] X. Cao J. Qin G. Gou J. Li W. Wu S. Luo Y. Luo Z. Dong J. Ma Y. Long Continuous solvent-free synthesis of imines over uip-γ-Al2O3-CeO2 catalyst in a fixed bed reactor App. Catal. B Environ. 272 2020 118958 X. Cao, J. Qin, G. Gou, J. Li, W. Wu, S. Luo, Y. Luo, Z. Dong, J. Ma, Y. Long, Continuous solvent-free synthesis of imines over uip-γ-Al2O3-CeO2 catalyst in a fixed bed reactor, App. Catal. B Environ., 272 (2020) 118958. [43] Z. Zhang Y. Wang M. Wang J. Lü L. Li Z. Zhang M. Li J. Jiang F. Wang An investigation of the effects of CeO2 crystal planes on the aerobic oxidative synthesis of imines from alcohols and amines Chin. J. Catal. 36 2015 1623 1630 Z. Zhang, Y. Wang, M. Wang, J. Lü, L. Li, Z. Zhang, M. Li, J. Jiang, F. Wang, An investigation of the effects of CeO2 crystal planes on the aerobic oxidative synthesis of imines from alcohols and amines, Chin. J. Catal., 36 (2015) 1623–1630. [44] X. Huang L. Liu H. Gao W. Dong M. Yang G. Wang Hierarchically nanostructured MnCo2O4 as active catalysts for the synthesis of N-benzylideneaniline from benzyl alcohol and aniline Green Chem. 19 2017 769 777 X. Huang, L. Liu, H. Gao, W. Dong, M. Yang, G. Wang, Hierarchically nanostructured MnCo2O4 as active catalysts for the synthesis of N-benzylideneaniline from benzyl alcohol and aniline, Green Chem., 19 (2017) 769–777. [45] B. Dutta S. March L. Achola S. Sahoo J. He A.S. Amin Y. Wu S. Poges S.P. Alpay S.L. Suib Mesoporous cobalt/manganese oxide: a highly selective bifunctional catalyst for amine–imine transformations Green Chem. 20 2018 3180 3185 B. Dutta, S. March, L. Achola, S. Sahoo, J. He, A.S. Amin, Y. Wu, S. Poges, S.P. Alpay, S.L. Suib, Mesoporous cobalt/manganese oxide: a highly selective bifunctional catalyst for amine–imine transformations, Green Chem., 20 (2018) 3180–3185. [46] S. Sithambaram R. Kumar Y. Son S. Suib Tandem catalysis: Direct catalytic synthesis of imines from alcohols using manganese octahedral molecular sieves J. Catal. 253 2008 269 277 S. Sithambaram, R. Kumar, Y. Son, S. Suib, Tandem catalysis: Direct catalytic synthesis of imines from alcohols using manganese octahedral molecular sieves, J. Catal., 253 (2008) 269–277. [47] R.J.K. Taylor M. Reid J. Foot S.A. Raw Tandem oxidation processes using manganese dioxide: discovery, applications, and current studies Acc. Chem. Res. 38 2005 851 869 R.J.K. Taylor, M. Reid, J. Foot, S.A. Raw, Tandem oxidation processes using manganese dioxide: discovery, applications, and current studies, Acc. Chem. Res., 38 (2005) 851–869. [48] X. Bi T. Tang X. Meng M. Gou X. Liu P. Zhao Aerobic oxidative dehydrogenation of N-heterocycles over OMS-2-based nanocomposite catalysts: preparation, characterization and kinetic study Catal. Sci. Technol. 10 2020 360 371 X. Bi, T. Tang, X. Meng, M. Gou, X. Liu, P. Zhao, Aerobic oxidative dehydrogenation of N-heterocycles over OMS-2-based nanocomposite catalysts: preparation, characterization and kinetic study, Catal. Sci. Technol., 10 (2020) 360–371. [49] X. Wang X. Bi N. Yao G. Elmaci A.S. Ertürk Q. Lv P. Zhao X. Meng Doping strategy-tuned non-radical pathway on manganese oxide for catalytic degradation of parabens Chem. Eng. J. 442 2022 136180 X. Wang, X. Bi, N. Yao, G. Elmaci, A.S. Ertürk, Q. Lv, P. Zhao, X. Meng, Doping strategy-tuned non-radical pathway on manganese oxide for catalytic degradation of parabens, Chem. Eng. J., 442 (2022) 136180. [50] J. Bu W. Wang H. Zhang C. Wu B. Zhang Y. Cao F. Zhou Q. Zhang X. Zhang Efficient synthesis of imine from alcohols and amines over different crystal structure MnOx catalysts Mol. Catal. 459 2018 46 54 J. Bu, W. Wang, H. Zhang, C. Wu, B. Zhang, Y. Cao, F. Zhou, Q. Zhang, X. Zhang, Efficient synthesis of imine from alcohols and amines over different crystal structure MnOx catalysts, Mol. Catal., 459 (2018) 46–54. [51] F. Chen T. Yang S. Zhao T. Jiang L. Yu H. Xiong C. Guo Y. Rao Y. Liu L. Liu J. Zhou P. Tu J. Ni Q. Zhang X. Li Highly selective oxidation of amines to imines by Mn2O3 catalyst under eco-friendly conditions Chin. Chem. Lett. 30 2019 2282 2286 F. Chen, T. Yang, S. Zhao, T. Jiang, L. Yu, H. Xiong, C. Guo, Y. Rao, Y. Liu, L. Liu, J. Zhou, P. Tu, J. Ni, Q. Zhang, X. Li, Highly selective oxidation of amines to imines by Mn2O3 catalyst under eco-friendly conditions, Chin. Chem. Lett., 30 (2019) 2282–2286. [52] S. Mandal S. Maity S. Saha B. Banerjee MnOx supported on a TiO2@SBA-15 nanoreactor used as an efficient catalyst for one-pot synthesis of imine by oxidative coupling of benzyl alcohol and aniline under atmospheric air RSC Adv. 6 2016 73906 73914 S. Mandal, S. Maity, S. Saha, B. Banerjee, MnOx supported on a TiO2@SBA-15 nanoreactor used as an efficient catalyst for one-pot synthesis of imine by oxidative coupling of benzyl alcohol and aniline under atmospheric air, RSC Adv., 6 (2016) 73906–73914. [53] B. Chen J. Li W. Dai L. Wang S. Gao Direct imine formation by oxidative coupling of alcohols and amines using supported manganese oxides under an air atmosphere Green Chem. 16 2014 3328 B. Chen, J. Li, W. Dai, L. Wang, S. Gao, Direct imine formation by oxidative coupling of alcohols and amines using supported manganese oxides under an air atmosphere, Green Chem., 16 (2014) 3328. [54] S. Cheng X. Ma Y. Hu B. Li MnO2/graphene oxide: a highly efficient catalyst for imine synthesis from alcohols and amines App. Organomet. Chem. 31 2017 e3659 S. Cheng, X. Ma, Y. Hu, B. Li, MnO2/graphene oxide: a highly efficient catalyst for imine synthesis from alcohols and amines, App. Organomet. Chem., 31 (2017) e3659. [55] P. Sudarsanam B. Hillary M.H. Amin S.B.A. Hamid S.K. Bhargava Structure-activity relationships of nanoscale MnOx/CeO2 heterostructured catalysts for selective oxidation of amines under eco-friendly conditions App. Catal. B Environ. 185 2016 213 224 P. Sudarsanam, B. Hillary, M.H. Amin, S.B.A. Hamid, S.K. Bhargava, Structure-activity relationships of nanoscale MnOx/CeO2 heterostructured catalysts for selective oxidation of amines under eco-friendly conditions, App. Catal. B Environ., 185 (2016) 213–224. [56] S. Biswas B. Dutta K. Mullick C.H. Kuo A.S. Poyraz S.L. Suib Aerobic oxidation of amines to imines by cesium-promoted mesoporous manganese oxide ACS Catal. 5 2015 4394 4403 S. Biswas, B. Dutta, K. Mullick, C.H. Kuo, A.S. Poyraz, S.L. Suib, Aerobic oxidation of amines to imines by cesium-promoted mesoporous manganese oxide, ACS Catal. 5 (2015) 4394–4403. [57] S. Biswas K. Mullick S.Y. Chen A. Gudz D.M. Carr C. Mendoza A.M. Angeles-Boza S.L. Suib Facile access to versatile functional groups from alcohol by single multifunctional reusable catalyst App. Catal. B Environ. 203 2017 607 614 S. Biswas, K. Mullick, S.Y. Chen, A. Gudz, D.M. Carr, C. Mendoza, A.M. Angeles-Boza, S.L. Suib, Facile access to versatile functional groups from alcohol by single multifunctional reusable catalyst, App. Catal. B Environ. 203 (2017) 607–614. [58] H. Shen J. Bu W. Wang C. Wu Y. Cao B. Zhang Q. Zhang H. Zhang Insight into Ce doping induced oxygen vacancies over Ce-doped MnO2 catalysts for imine synthesis Chin. J. Chem. 38 2020 1353 1359 H. Shen, J. Bu, W. Wang, C. Wu, Y. Cao, B. Zhang, Q. Zhang, H. Zhang, Insight into Ce doping induced oxygen vacancies over Ce-doped MnO2 catalysts for imine synthesis, Chin. J. Chem., 38 (2020) 1353–1359. [59] J. Qin Y. Long G. Gou W. Wu Y. Luo X. Cao S. Luo K. Wang J. Ma Tuning effect of amorphous Fe2O3 on Mn3O4 for efficient atom-economic synthesis of imines at low temperature: improving [O] transfer cycle of Mn3+/Mn2+ in Mn3O4 Catal. Sci. Technol. 10 2020 5628 5640 J. Qin, Y. Long, G. Gou, W. Wu, Y. Luo, X. Cao, S. Luo, K. Wang, J. Ma, Tuning effect of amorphous Fe2O3 on Mn3O4 for efficient atom-economic synthesis of imines at low temperature: improving [O] transfer cycle of Mn3+/Mn2+ in Mn3O4, Catal. Sci. Technol., 10 (2020) 5628–5640. [60] S. Wu K. Wei W. Fang Influence of calcination on mesoporous Mn1Zr0.5Oy solid solution in oxidative coupling catalysis for benzylideneaniline formation ChemistrySelect 6 2021 234 238 S. Wu, K. Wei, W. Fang, Influence of calcination on mesoporous Mn1Zr0.5Oy solid solution in oxidative coupling catalysis for benzylideneaniline formation, ChemistrySelect, 6 (2021) 234–238. [61] S. Wu H. Zhang Q. Cao Q. Zhao W. Fang Efficient imine synthesis via oxidative coupling of alcohols with amines in an air atmosphere using a mesoporous manganese–zirconium solid solution catalyst Catal. Sci. Technol. 11 2021 810 822 S. Wu, H. Zhang, Q. Cao, Q. Zhao, W. Fang, Efficient imine synthesis via oxidative coupling of alcohols with amines in an air atmosphere using a mesoporous manganese–zirconium solid solution catalyst, Catal. Sci. Technol., 11 (2021) 810–822. [62] A. Umar A.A. Ibrahim R. Kumar H. Albargi M.A. Alsaiari F. Ahmed Cubic shaped hematite (α-Fe2O3) micro-structures composed of stacked nanosheets for rapid ethanol sensor application Sens. Actuators B Chem. 326 2021 128851 A. Umar, A.A. Ibrahim, R. Kumar, H. Albargi, M.A. Alsaiari, F. Ahmed, Cubic shaped hematite (α-Fe2O3) micro-structures composed of stacked nanosheets for rapid ethanol sensor application, Sens. Actuators B Chem., 326 (2021) 128851. [63] J.L. Cao Z.L. Yan Q.F. Deng Z.Y. Yuan Y. Wang G. Sun X.D. Wang B. Hari Z.Y. Zhang Homogeneous precipitation method preparation of modified red mud supported Ni mesoporous catalysts for ammonia decomposition Catal. Sci. Technol. 4 2014 361 368 J.L. Cao, Z.L. Yan, Q.F. Deng, Z.Y. Yuan, Y. Wang, G. Sun, X.D. Wang, B. Hari, Z.Y. Zhang, Homogeneous precipitation method preparation of modified red mud supported Ni mesoporous catalysts for ammonia decomposition, Catal. Sci. Technol., 4 (2014) 361–368. [64] M.H.M. Ahmed N. Batalha T. Qiu M.D.M. Hasan L. Atanda N. Amiralian L. Wang H. Peng M. Konarova Red-mud based porous nanocatalysts for valorisation of municipal solid waste J. Hazard. Mater. 396 2020 122711 M.H.M. Ahmed, N. Batalha, T. Qiu, M.D.M. Hasan, L. Atanda, N. Amiralian, L. Wang, H. Peng, M. Konarova, Red-mud based porous nanocatalysts for valorisation of municipal solid waste, J. Hazard. Mater., 396 (2020) 122711. [65] J. Yang S. Ren B. Su Y. zhou G. Hu L. Jiang J. Cao W. Liu L. Yao M. Kong J. Yang Q. Liu Insight into N2O formation over different crystal phases of MnO2 during low-temperature NH3–SCR of NO Catal. Lett. 151 2021 2964 2971 J. Yang, S. Ren, B. Su, Y. zhou, G. Hu, L. Jiang, J. Cao, W. Liu, L. Yao, M. Kong, J. Yang, Q. Liu, Insight into N2O formation over different crystal phases of MnO2 during low-temperature NH3–SCR of NO, Catal. Lett. 151 (2021) 2964–2971. [66] Y. Li D. Li S. Fan T. Yang Q. Zhou Facile template synthesis of dumbbell-like Mn2O3 with oxygen vacancies for efficient degradation of organic pollutants by activating peroxymonosulfate Catal. Sci. Technol. 10 2020 864 875 Y. Li, D. Li, S. Fan, T. Yang, Q. Zhou, Facile template synthesis of dumbbell-like Mn2O3 with oxygen vacancies for efficient degradation of organic pollutants by activating peroxymonosulfate, Catal. Sci. Technol. 10 (2020) 864–875. [67] Y. Liu P. Zhang J. Zhan L. Liu Heat treatment of MnCO3: an easy way to obtain efficient and stable MnO2 for humid O3 decomposition Appl. Surf. Sci. 463 2019 374 385 Y. Liu, P. Zhang, J. Zhan, L. Liu, Heat treatment of MnCO3: an easy way to obtain efficient and stable MnO2 for humid O3 decomposition, Appl. Surf. Sci. 463 (2019) 374–385. [68] L. Zhang X. Bi Z. Wang A.S. Ertürk G. Elmaci H. Zhao P. Zhao X. Meng Brønsted-acid sites promoted degradation of phthalate esters over MnO2: mineralization enhancement and aquatic toxicity assessment Chemosphere 291 2022 132740 L. Zhang, X. Bi, Z. Wang, A.S. Ertürk, G. Elmaci, H. Zhao, P. Zhao, X. Meng, Brønsted-acid sites promoted degradation of phthalate esters over MnO2: mineralization enhancement and aquatic toxicity assessment, Chemosphere, 291 (2022) 132740. [69] X. Bi Y. Huang X. Liu N. Yao P. Zhao X. Meng D. Astruc Oxidative degradation of aqueous organic contaminants over shape-tunable MnO2 nanomaterials via peroxymonosulfate activation Sep. Purif. Technol. 275 2021 119141 X. Bi, Y. Huang, X. Liu, N. Yao, P. Zhao, X. Meng, D. Astruc, Oxidative degradation of aqueous organic contaminants over shape-tunable MnO2 nanomaterials via peroxymonosulfate activation, Sep. Purif. Technol., 275 (2021) 119141. [70] D. Gangwar C. Rath Structural, optical and magnetic properties of α- and β-MnO2 nanorods Appl. Surf. Sci. 557 2021 149693 D. Gangwar, C. Rath, Structural, optical and magnetic properties of α- and β-MnO2 nanorods, Appl. Surf. Sci. 557 (2021) 149693. [71] X. Zhang Z.a. Ma Z. Song H. Zhao W. Liu M. Zhao J. Zhao Role of cryptomelane in surface-adsorbed oxygen and Mn chemical valence in MnOx during the catalytic oxidation of toluene J. Phys. Chem. C 123 2019 17255 17264 X. Zhang, Z.a. Ma, Z. Song, H. Zhao, W. Liu, M. Zhao, J. Zhao, Role of cryptomelane in surface-adsorbed oxygen and Mn chemical valence in MnOx during the catalytic oxidation of toluene, J. Phys. Chem. C, 123 (2019) 17255–17264. [72] J. Yang J. Song S. Liang R. Guan Y. Shi W. Yu S. Zhu W. Fan H. Hou J. Hu H. Deng B. Xiao Synergistic effect of water content and composite conditioner of Fenton's reagent combined with red mud on the enhanced hydrogen production from sludge pyrolysis Water Res. 123 2017 378 387 J. Yang, J. Song, S. Liang, R. Guan, Y. Shi, W. Yu, S. Zhu, W. Fan, H. Hou, J. Hu, H. Deng, B. Xiao, Synergistic effect of water content and composite conditioner of Fenton's reagent combined with red mud on the enhanced hydrogen production from sludge pyrolysis, Water Res. 123 (2017) 378–387. [73] B. Das K. Mohanty Microwave induced one-pot conversion of d-glucose to 5-hydroxymethylfurfural by a novel sulfate-functionalized Sn-red mud catalyst Sustain. Energy Fuels 4 2020 6030 6044 B. Das, K. Mohanty, Microwave induced one-pot conversion of d-glucose to 5-hydroxymethylfurfural by a novel sulfate-functionalized Sn-red mud catalyst, Sustain. Energy Fuels, 4 (2020) 6030–6044. [74] B. Chen L. Wang S. Gao Recent advances in aerobic oxidation of alcohols and amines to imines ACS Catal. 5 2015 5851 5876 B. Chen, L. Wang, S. Gao, Recent advances in aerobic oxidation of alcohols and amines to imines, ACS Catal. 5 (2015) 5851–5876. [75] Y. Cao H. Zheng G. Zhu H. Wu L. He Ceria supported Ru0-Ruδ+ clusters as efficient catalyst for arenes hydrogenation Chin. Chem. Lett. 32 2021 770 774 Y. Cao, H. Zheng, G. Zhu, H. Wu, L. He, Ceria supported Ru0-Ruδ+ clusters as efficient catalyst for arenes hydrogenation, Chin. Chem. Lett., 32 (2021) 770–774. [76] S.R. de Miguel A.A. Castro O.A. Scelza J. Soria Effect of the addition of alkali metals on the metallic phase of Pt/Al2O3 catalysts Catal. Lett. 32 1995 281 291 S.R. de Miguel, A.A. Castro, O.A. Scelza, J. Soria, Effect of the addition of alkali metals on the metallic phase of Pt/Al2O3 catalysts, Catal. Lett., 32 (1995) 281–291. [77] S.R. de Miguel O.A. Scelza A.A. Castro J. Soria Characterization of γ-alumina doped with Li and K by infrared studies of CO adsorption and 27Al-NMR Top. Catal. 1 1994 87 94 S.R. de Miguel, O.A. Scelza, A.A. Castro, J. Soria, Characterization of γ-alumina doped with Li and K by infrared studies of CO adsorption and 27Al-NMR, Top. Catal., 1 (1994) 87–94. [78] H. Pines W.O. Haag Alumina: catalyst and support. I. alumina, its intrinsic acidity and catalytic activity1 J. Am. Chem. Soc. 82 1960 2471 2483 H. Pines, W.O. Haag, Alumina: catalyst and support. I. alumina, its intrinsic acidity and catalytic activity1, J. Am. Chem. Soc., 82 (1960) 2471–2483. [79] R. Bermejo-Deval R.M.H. Walter O.Y. Gutiérrez J.A. Lercher On the role of the alkali cations on methanol thiolation Catal. Sci. Technol. 7 2017 4437 4443 R. Bermejo-Deval, R.M.H. Walter, O.Y. Gutiérrez, J.A. Lercher, On the role of the alkali cations on methanol thiolation, Catal. Sci. Technol., 7 (2017) 4437–4443. [80] X. Weng Y. Long W. Wang M. Shao Z. Wu Structural effect and reaction mechanism of MnO2 catalysts in the catalytic oxidation of chlorinated aromatics Chin. J. Catal. 40 2019 638 646 X. Weng, Y. Long, W. Wang, M. Shao, Z. Wu, Structural effect and reaction mechanism of MnO2 catalysts in the catalytic oxidation of chlorinated aromatics, Chin. J. Catal., 40 (2019) 638–646. [81] D.A.I. Yun L.I. Jun-Hua P. Yue T. Xing-Fu Effects of MnO2 crystal structure and surface property on the NH3-SCR reaction at low temperature Acta Phys. Chim. Sin. 28 2012 1771 1776 D.A.I. Yun, L.I. Jun-Hua, P. Yue, T. Xing-Fu, Effects of MnO2 crystal structure and surface property on the NH3-SCR reaction at low temperature, Acta Phys. Chim. Sin., 28 (2012) 1771–1776.",
      "scopus-id": "85144383632",
      "coredata": {
        "eid": "1-s2.0-S2468823122007696",
        "dc:description": "The development of new application scenarios for the red mud, a huge by-product from the aluminum manufacture, has become urgent because of the increasingly stringent demands of environmental protection. Herein, a very simple and sustainable approach to the design of a synergistic catalytic system for the direct oxidative cross-coupling of alcohols and amines to (un)symmetric imines by physically mixing MnO x and red mud is presented. With the catalysis of active red mud, the synthesis of imines over MnO x can achieve an excellent (>98%) yield at 60 °C, air as oxidant for 8 h Without this catalysis, the imine yield reaches only 25%. The red mud clearly assists the reaction, resulting in a 4 ∼ 10-folds higher increase over reactions using only MnO x . From detailed experiments and characterizations, the synergistic effects of the extraordinary performance of this catalytic system were confirmed to be a combination of the reactivity of MnO x in the oxidation of alcohols and the enhancement by the active red mud in the condensation of aldehydes and amines. This work demonstrates a facile strategy for revival of the hazardous red mud. It could turn “waste” into wealth and greatly promote the catalytic applications of red mud.",
        "openArchiveArticle": "false",
        "prism:coverDate": "2023-01-15",
        "openaccessUserLicense": null,
        "prism:aggregationType": "Journal",
        "prism:url": "https://api.elsevier.com/content/article/pii/S2468823122007696",
        "dc:creator": [
          {
            "@_fa": "true",
            "$": "Cao, Yanwei"
          },
          {
            "@_fa": "true",
            "$": "Chen, Dilong"
          },
          {
            "@_fa": "true",
            "$": "Wang, Yaowei"
          },
          {
            "@_fa": "true",
            "$": "Shi, Huibing"
          },
          {
            "@_fa": "true",
            "$": "Feng, Baolin"
          },
          {
            "@_fa": "true",
            "$": "Xia, Chungu"
          },
          {
            "@_fa": "true",
            "$": "Ding, Yuxiao"
          },
          {
            "@_fa": "true",
            "$": "He, Lin"
          }
        ],
        "link": [
          {
            "@_fa": "true",
            "@rel": "self",
            "@href": "https://api.elsevier.com/content/article/pii/S2468823122007696"
          },
          {
            "@_fa": "true",
            "@rel": "scidir",
            "@href": "https://www.sciencedirect.com/science/article/pii/S2468823122007696"
          }
        ],
        "dc:format": "application/json",
        "openaccessType": null,
        "pii": "S2468-8231(22)00769-6",
        "prism:volume": "535",
        "articleNumber": "112883",
        "prism:publisher": "Elsevier B.V.",
        "dc:title": "Red mud-mediated cross-coupling of alcohols and amines to imines over MnO x catalysts",
        "prism:copyright": "© 2022 Elsevier B.V. All rights reserved.",
        "openaccess": "0",
        "prism:issn": "24688231",
        "dcterms:subject": [
          {
            "@_fa": "true",
            "$": "MnO x"
          },
          {
            "@_fa": "true",
            "$": "Red mud"
          },
          {
            "@_fa": "true",
            "$": "Synergistic catalysis"
          },
          {
            "@_fa": "true",
            "$": "Imine synthesis"
          },
          {
            "@_fa": "true",
            "$": "Cross-coupling"
          }
        ],
        "openaccessArticle": "false",
        "prism:publicationName": "Molecular Catalysis",
        "openaccessSponsorType": null,
        "prism:pageRange": "112883",
        "pubType": "fla",
        "prism:coverDisplayDate": "15 January 2023",
        "prism:doi": "10.1016/j.mcat.2022.112883",
        "prism:startingPage": "112883",
        "dc:identifier": "doi:10.1016/j.mcat.2022.112883",
        "openaccessSponsorName": null
      },
      "objects": {
        "object": [
          {
            "@category": "standard",
            "@height": "520",
            "@width": "621",
            "@_fa": "true",
            "$": "https://api.elsevier.com/content/object/eid/1-s2.0-S2468823122007696-gr2.jpg?httpAccept=%2A%2F%2A",
            "@multimediatype": "JPEG image file",
            "@type": "IMAGE-DOWNSAMPLED",
            "@size": "116964",
            "@ref": "gr2",
            "@mimetype": "image/jpeg"
          },
          {
            "@category": "standard",
            "@height": "733",
            "@width": "659",
            "@_fa": "true",
            "$": "https://api.elsevier.com/content/object/eid/1-s2.0-S2468823122007696-gr3.jpg?httpAccept=%2A%2F%2A",
            "@multimediatype": "JPEG image file",
            "@type": "IMAGE-DOWNSAMPLED",
            "@size": "82464",
            "@ref": "gr3",
            "@mimetype": "image/jpeg"
          },
          {
            "@category": "standard",
            "@height": "520",
            "@width": "621",
            "@_fa": "true",
            "$": "https://api.elsevier.com/content/object/eid/1-s2.0-S2468823122007696-gr4.jpg?httpAccept=%2A%2F%2A",
            "@multimediatype": "JPEG image file",
            "@type": "IMAGE-DOWNSAMPLED",
            "@size": "88637",
            "@ref": "gr4",
            "@mimetype": "image/jpeg"
          },
          {
            "@category": "standard",
            "@height": "174",
            "@width": "659",
            "@_fa": "true",
            "$": "https://api.elsevier.com/content/object/eid/1-s2.0-S2468823122007696-gr5.jpg?httpAccept=%2A%2F%2A",
            "@multimediatype": "JPEG image file",
            "@type": "IMAGE-DOWNSAMPLED",
            "@size": "38977",
            "@ref": "gr5",
            "@mimetype": "image/jpeg"
          },
          {
            "@category": "standard",
            "@height": "251",
            "@width": "602",
            "@_fa": "true",
            "$": "https://api.elsevier.com/content/object/eid/1-s2.0-S2468823122007696-gr6.jpg?httpAccept=%2A%2F%2A",
            "@multimediatype": "JPEG image file",
            "@type": "IMAGE-DOWNSAMPLED",
            "@size": "46717",
            "@ref": "gr6",
            "@mimetype": "image/jpeg"
          },
          {
            "@category": "standard",
            "@height": "272",
            "@width": "385",
            "@_fa": "true",
            "$": "https://api.elsevier.com/content/object/eid/1-s2.0-S2468823122007696-gr7.jpg?httpAccept=%2A%2F%2A",
            "@multimediatype": "JPEG image file",
            "@type": "IMAGE-DOWNSAMPLED",
            "@size": "23425",
            "@ref": "gr7",
            "@mimetype": "image/jpeg"
          },
          {
            "@category": "standard",
            "@height": "87",
            "@width": "659",
            "@_fa": "true",
            "$": "https://api.elsevier.com/content/object/eid/1-s2.0-S2468823122007696-sc1.jpg?httpAccept=%2A%2F%2A",
            "@multimediatype": "JPEG image file",
            "@type": "IMAGE-DOWNSAMPLED",
            "@size": "10669",
            "@ref": "sc1",
            "@mimetype": "image/jpeg"
          },
          {
            "@category": "standard",
            "@height": "151",
            "@width": "452",
            "@_fa": "true",
            "$": "https://api.elsevier.com/content/object/eid/1-s2.0-S2468823122007696-sc2.jpg?httpAccept=%2A%2F%2A",
            "@multimediatype": "JPEG image file",
            "@type": "IMAGE-DOWNSAMPLED",
            "@size": "21727",
            "@ref": "sc2",
            "@mimetype": "image/jpeg"
          },
          {
            "@category": "standard",
            "@height": "686",
            "@width": "659",
            "@_fa": "true",
            "$": "https://api.elsevier.com/content/object/eid/1-s2.0-S2468823122007696-sc3.jpg?httpAccept=%2A%2F%2A",
            "@multimediatype": "JPEG image file",
            "@type": "IMAGE-DOWNSAMPLED",
            "@size": "73182",
            "@ref": "sc3",
            "@mimetype": "image/jpeg"
          },
          {
            "@category": "standard",
            "@height": "225",
            "@width": "565",
            "@_fa": "true",
            "$": "https://api.elsevier.com/content/object/eid/1-s2.0-S2468823122007696-sc4.jpg?httpAccept=%2A%2F%2A",
            "@multimediatype": "JPEG image file",
            "@type": "IMAGE-DOWNSAMPLED",
            "@size": "24224",
            "@ref": "sc4",
            "@mimetype": "image/jpeg"
          },
          {
            "@category": "standard",
            "@height": "482",
            "@width": "621",
            "@_fa": "true",
            "$": "https://api.elsevier.com/content/object/eid/1-s2.0-S2468823122007696-gr1.jpg?httpAccept=%2A%2F%2A",
            "@multimediatype": "JPEG image file",
            "@type": "IMAGE-DOWNSAMPLED",
            "@size": "102287",
            "@ref": "gr1",
            "@mimetype": "image/jpeg"
          },
          {
            "@category": "standard",
            "@height": "200",
            "@width": "227",
            "@_fa": "true",
            "$": "https://api.elsevier.com/content/object/eid/1-s2.0-S2468823122007696-ga1.jpg?httpAccept=%2A%2F%2A",
            "@multimediatype": "JPEG image file",
            "@type": "IMAGE-DOWNSAMPLED",
            "@size": "12171",
            "@ref": "ga1",
            "@mimetype": "image/jpeg"
          },
          {
            "@category": "thumbnail",
            "@height": "164",
            "@width": "196",
            "@_fa": "true",
            "$": "https://api.elsevier.com/content/object/eid/1-s2.0-S2468823122007696-gr2.sml?httpAccept=%2A%2F%2A",
            "@multimediatype": "GIF image file",
            "@type": "IMAGE-THUMBNAIL",
            "@size": "17037",
            "@ref": "gr2",
            "@mimetype": "image/gif"
          },
          {
            "@category": "thumbnail",
            "@height": "163",
            "@width": "147",
            "@_fa": "true",
            "$": "https://api.elsevier.com/content/object/eid/1-s2.0-S2468823122007696-gr3.sml?httpAccept=%2A%2F%2A",
            "@multimediatype": "GIF image file",
            "@type": "IMAGE-THUMBNAIL",
            "@size": "10291",
            "@ref": "gr3",
            "@mimetype": "image/gif"
          },
          {
            "@category": "thumbnail",
            "@height": "164",
            "@width": "196",
            "@_fa": "true",
            "$": "https://api.elsevier.com/content/object/eid/1-s2.0-S2468823122007696-gr4.sml?httpAccept=%2A%2F%2A",
            "@multimediatype": "GIF image file",
            "@type": "IMAGE-THUMBNAIL",
            "@size": "13230",
            "@ref": "gr4",
            "@mimetype": "image/gif"
          },
          {
            "@category": "thumbnail",
            "@height": "58",
            "@width": "219",
            "@_fa": "true",
            "$": "https://api.elsevier.com/content/object/eid/1-s2.0-S2468823122007696-gr5.sml?httpAccept=%2A%2F%2A",
            "@multimediatype": "GIF image file",
            "@type": "IMAGE-THUMBNAIL",
            "@size": "6397",
            "@ref": "gr5",
            "@mimetype": "image/gif"
          },
          {
            "@category": "thumbnail",
            "@height": "91",
            "@width": "219",
            "@_fa": "true",
            "$": "https://api.elsevier.com/content/object/eid/1-s2.0-S2468823122007696-gr6.sml?httpAccept=%2A%2F%2A",
            "@multimediatype": "GIF image file",
            "@type": "IMAGE-THUMBNAIL",
            "@size": "8371",
            "@ref": "gr6",
            "@mimetype": "image/gif"
          },
          {
            "@category": "thumbnail",
            "@height": "155",
            "@width": "219",
            "@_fa": "true",
            "$": "https://api.elsevier.com/content/object/eid/1-s2.0-S2468823122007696-gr7.sml?httpAccept=%2A%2F%2A",
            "@multimediatype": "GIF image file",
            "@type": "IMAGE-THUMBNAIL",
            "@size": "13247",
            "@ref": "gr7",
            "@mimetype": "image/gif"
          },
          {
            "@category": "thumbnail",
            "@height": "29",
            "@width": "219",
            "@_fa": "true",
            "$": "https://api.elsevier.com/content/object/eid/1-s2.0-S2468823122007696-sc1.sml?httpAccept=%2A%2F%2A",
            "@multimediatype": "GIF image file",
            "@type": "IMAGE-THUMBNAIL",
            "@size": "2075",
            "@ref": "sc1",
            "@mimetype": "image/gif"
          },
          {
            "@category": "thumbnail",
            "@height": "73",
            "@width": "219",
            "@_fa": "true",
            "$": "https://api.elsevier.com/content/object/eid/1-s2.0-S2468823122007696-sc2.sml?httpAccept=%2A%2F%2A",
            "@multimediatype": "GIF image file",
            "@type": "IMAGE-THUMBNAIL",
            "@size": "6707",
            "@ref": "sc2",
            "@mimetype": "image/gif"
          },
          {
            "@category": "thumbnail",
            "@height": "163",
            "@width": "157",
            "@_fa": "true",
            "$": "https://api.elsevier.com/content/object/eid/1-s2.0-S2468823122007696-sc3.sml?httpAccept=%2A%2F%2A",
            "@multimediatype": "GIF image file",
            "@type": "IMAGE-THUMBNAIL",
            "@size": "5075",
            "@ref": "sc3",
            "@mimetype": "image/gif"
          },
          {
            "@category": "thumbnail",
            "@height": "87",
            "@width": "219",
            "@_fa": "true",
            "$": "https://api.elsevier.com/content/object/eid/1-s2.0-S2468823122007696-sc4.sml?httpAccept=%2A%2F%2A",
            "@multimediatype": "GIF image file",
            "@type": "IMAGE-THUMBNAIL",
            "@size": "3813",
            "@ref": "sc4",
            "@mimetype": "image/gif"
          },
          {
            "@category": "thumbnail",
            "@height": "164",
            "@width": "211",
            "@_fa": "true",
            "$": "https://api.elsevier.com/content/object/eid/1-s2.0-S2468823122007696-gr1.sml?httpAccept=%2A%2F%2A",
            "@multimediatype": "GIF image file",
            "@type": "IMAGE-THUMBNAIL",
            "@size": "17362",
            "@ref": "gr1",
            "@mimetype": "image/gif"
          },
          {
            "@category": "thumbnail",
            "@height": "164",
            "@width": "186",
            "@_fa": "true",
            "$": "https://api.elsevier.com/content/object/eid/1-s2.0-S2468823122007696-ga1.sml?httpAccept=%2A%2F%2A",
            "@multimediatype": "GIF image file",
            "@type": "IMAGE-THUMBNAIL",
            "@size": "8537",
            "@ref": "ga1",
            "@mimetype": "image/gif"
          },
          {
            "@category": "high",
            "@height": "2301",
            "@width": "2750",
            "@_fa": "true",
            "$": "https://api.elsevier.com/content/object/eid/1-s2.0-S2468823122007696-gr2_lrg.jpg?httpAccept=%2A%2F%2A",
            "@multimediatype": "JPEG image file",
            "@type": "IMAGE-HIGH-RES",
            "@size": "929842",
            "@ref": "gr2",
            "@mimetype": "image/jpeg"
          },
          {
            "@category": "high",
            "@height": "3243",
            "@width": "2917",
            "@_fa": "true",
            "$": "https://api.elsevier.com/content/object/eid/1-s2.0-S2468823122007696-gr3_lrg.jpg?httpAccept=%2A%2F%2A",
            "@multimediatype": "JPEG image file",
            "@type": "IMAGE-HIGH-RES",
            "@size": "580046",
            "@ref": "gr3",
            "@mimetype": "image/jpeg"
          },
          {
            "@category": "high",
            "@height": "2303",
            "@width": "2750",
            "@_fa": "true",
            "$": "https://api.elsevier.com/content/object/eid/1-s2.0-S2468823122007696-gr4_lrg.jpg?httpAccept=%2A%2F%2A",
            "@multimediatype": "JPEG image file",
            "@type": "IMAGE-HIGH-RES",
            "@size": "628712",
            "@ref": "gr4",
            "@mimetype": "image/jpeg"
          },
          {
            "@category": "high",
            "@height": "771",
            "@width": "2917",
            "@_fa": "true",
            "$": "https://api.elsevier.com/content/object/eid/1-s2.0-S2468823122007696-gr5_lrg.jpg?httpAccept=%2A%2F%2A",
            "@multimediatype": "JPEG image file",
            "@type": "IMAGE-HIGH-RES",
            "@size": "240757",
            "@ref": "gr5",
            "@mimetype": "image/jpeg"
          },
          {
            "@category": "high",
            "@height": "1111",
            "@width": "2667",
            "@_fa": "true",
            "$": "https://api.elsevier.com/content/object/eid/1-s2.0-S2468823122007696-gr6_lrg.jpg?httpAccept=%2A%2F%2A",
            "@multimediatype": "JPEG image file",
            "@type": "IMAGE-HIGH-RES",
            "@size": "303179",
            "@ref": "gr6",
            "@mimetype": "image/jpeg"
          },
          {
            "@category": "high",
            "@height": "1207",
            "@width": "1707",
            "@_fa": "true",
            "$": "https://api.elsevier.com/content/object/eid/1-s2.0-S2468823122007696-gr7_lrg.jpg?httpAccept=%2A%2F%2A",
            "@multimediatype": "JPEG image file",
            "@type": "IMAGE-HIGH-RES",
            "@size": "154064",
            "@ref": "gr7",
            "@mimetype": "image/jpeg"
          },
          {
            "@category": "high",
            "@height": "386",
            "@width": "2916",
            "@_fa": "true",
            "$": "https://api.elsevier.com/content/object/eid/1-s2.0-S2468823122007696-sc1_lrg.jpg?httpAccept=%2A%2F%2A",
            "@multimediatype": "JPEG image file",
            "@type": "IMAGE-HIGH-RES",
            "@size": "84546",
            "@ref": "sc1",
            "@mimetype": "image/jpeg"
          },
          {
            "@category": "high",
            "@height": "670",
            "@width": "2001",
            "@_fa": "true",
            "$": "https://api.elsevier.com/content/object/eid/1-s2.0-S2468823122007696-sc2_lrg.jpg?httpAccept=%2A%2F%2A",
            "@multimediatype": "JPEG image file",
            "@type": "IMAGE-HIGH-RES",
            "@size": "145285",
            "@ref": "sc2",
            "@mimetype": "image/jpeg"
          },
          {
            "@category": "high",
            "@height": "3036",
            "@width": "2917",
            "@_fa": "true",
            "$": "https://api.elsevier.com/content/object/eid/1-s2.0-S2468823122007696-sc3_lrg.jpg?httpAccept=%2A%2F%2A",
            "@multimediatype": "JPEG image file",
            "@type": "IMAGE-HIGH-RES",
            "@size": "595777",
            "@ref": "sc3",
            "@mimetype": "image/jpeg"
          },
          {
            "@category": "high",
            "@height": "996",
            "@width": "2500",
            "@_fa": "true",
            "$": "https://api.elsevier.com/content/object/eid/1-s2.0-S2468823122007696-sc4_lrg.jpg?httpAccept=%2A%2F%2A",
            "@multimediatype": "JPEG image file",
            "@type": "IMAGE-HIGH-RES",
            "@size": "190254",
            "@ref": "sc4",
            "@mimetype": "image/jpeg"
          },
          {
            "@category": "high",
            "@height": "2133",
            "@width": "2750",
            "@_fa": "true",
            "$": "https://api.elsevier.com/content/object/eid/1-s2.0-S2468823122007696-gr1_lrg.jpg?httpAccept=%2A%2F%2A",
            "@multimediatype": "JPEG image file",
            "@type": "IMAGE-HIGH-RES",
            "@size": "879188",
            "@ref": "gr1",
            "@mimetype": "image/jpeg"
          },
          {
            "@category": "high",
            "@height": "886",
            "@width": "1007",
            "@_fa": "true",
            "$": "https://api.elsevier.com/content/object/eid/1-s2.0-S2468823122007696-ga1_lrg.jpg?httpAccept=%2A%2F%2A",
            "@multimediatype": "JPEG image file",
            "@type": "IMAGE-HIGH-RES",
            "@size": "75062",
            "@ref": "ga1",
            "@mimetype": "image/jpeg"
          },
          {
            "@category": "standard",
            "@_fa": "true",
            "$": "https://api.elsevier.com/content/object/eid/1-s2.0-S2468823122007696-mmc1.docx?httpAccept=%2A%2F%2A",
            "@multimediatype": "Microsoft Word file",
            "@type": "APPLICATION",
            "@size": "4138135",
            "@ref": "mmc1",
            "@mimetype": "application/word"
          },
          {
            "@category": "standard",
            "@_fa": "true",
            "$": "https://api.elsevier.com/content/object/eid/1-s2.0-S2468823122007696-am.pdf?httpAccept=%2A%2F%2A",
            "@multimediatype": "Acrobat PDF file",
            "@type": "AAM-PDF",
            "@size": "1812954",
            "@ref": "am",
            "@mimetype": "application/pdf"
          }
        ]
      },
      "link": {
        "@rel": "abstract",
        "@href": "https://api.elsevier.com/content/abstract/scopus_id/85144383632"
      }
    }
  }
}