{
  "metadata": {
    "title": "Experimental and computational studies of Zn (II) complexes structured with Schiff base ligands as the efficient catalysts for chemical fixation of CO<ce:inf loc=post>2</ce:inf> into cyclic carbonates",
    "authors": "; ; ",
    "journal": "Molecular Catalysis",
    "date": "2021-10-31",
    "doi": "10.1016/j.mcat.2021.111894",
    "abstract": "",
    "uri": "https://api.elsevier.com/content/article/pii/S2468823121005113",
    "pii": "S2468823121005113"
  },
  "fulltext": {
    "full-text-retrieval-response": {
      "scopus-eid": "2-s2.0-85115418836",
      "originalText": "serial JL 315758 291210 291744 291790 291809 31 Molecular Catalysis MOLECULARCATALYSIS 2021-09-23 2021-09-23 2021-09-23 2021-09-23 2021-12-01T07:56:01 1-s2.0-S2468823121005113 S2468-8231(21)00511-3 S2468823121005113 10.1016/j.mcat.2021.111894 S300 S300.1 FULL-TEXT 1-s2.0-S2468823121X00156 2022-12-12T23:36:21.627889Z 0 0 20211001 20211031 2021 2021-09-23T05:13:29.960458Z absattachment articleinfo articlenumber articletitlenorm authfirstinitialnorm authfirstsurnamenorm cid cids contenttype copyright crossmark dateloaded dateloadedtxt datesearch datesort dateupdated dco docsubtype doctype doi eid ewtransactionid hubeid indexeddate issn issnnorm itemstage itemtransactionid itemweight openaccess openarchive pg pgfirst pii piinorm pubdateend pubdatestart pubdatetxt pubyr sectiontitle sortorder srctitle srctitlenorm srctype ssids alllist content subj subheadings suppl tomb volfirst volissue volumelist webpdf webpdfpagecount yearnav figure table e-component body mmlmath acknowledge affil appendices articletitle auth authfirstini authfull authkeywords authlast grantnumber grantsponsor highlightsabst primabst ref specialabst 2468-8231 24688231 true 515 515 C Volume 515 20 111894 111894 111894 202110 October 2021 2021-10-01 2021-10-31 2021 Regular Papers article fla © 2021 Elsevier B.V. All rights reserved. EXPERIMENTALCOMPUTATIONALSTUDIESZNIICOMPLEXESSTRUCTUREDSCHIFFBASELIGANDSEFFICIENTCATALYSTSFORCHEMICALFIXATIONCO2CYCLICCARBONATES WU Y 1 Introduction 2 Experimental section 2.1 Synthesis of Zn (II) complexes 2.2 Catalyst reaction 2.3 Characterization and computational details 3 Results and discussion 3.1 Characterization of the Zn (II) complexes 3.2 CO2 coupling with ECH and optimized parameters 3.3 Recyclability of the Zn-based complex 3.4 CO2 cycloaddition with other epoxides 3.5 Mechanism and DFT studies Conclusions Credit author statement Acknowledgments Appendix Supplementary materials References SNOECKX 2017 5805 5863 R ZHONG 2020 1385 1413 J WANG 2017 3595 3600 J WU 2018 3105 3113 Q TAMURA 2013 191 203 M BUKHARI 2021 116141 S WU 2018 296 303 Y SONG 2017 36 42 L SULEMAN 2020 111071 S RAJABZADEH 2020 458 469 M DECHENT 2020 969 978 S DEACY 2020 372 380 A HAO 2020 15811 15815 Y YANG 2020 110637 C HE 2014 1513 1528 Q VERONESE 2020 2653 2664 L STASTNA 2020 11692 11703 L CHAKRABORTY 2020 13916 13920 J LUO 2020 18408 18424 R WANG 2020 13052 13059 X ZHA 2020 7991 7998 J ISFAHANI 2020 11970 11978 N LIU 2020 111008 Y TAMBE 2017 345 356 P PRASAD 2019 4393 4412 D JIN 2017 189 203 X SUN 2016 15790 15796 Q YANG 2020 4510 4514 F WU 2019 288 297 Y CUI 2019 79 120 W CASTROOSMA 2014 15005 15008 J LUO 2014 1496 1506 R SUPASITMONGKOL 2014 1622 1630 S RINTJEMA 2017 1274 1282 J TROTT 2019 4618 4627 G CLEGG 2010 6828 6843 W MELENDEZ 2007 3323 3326 J GAO 2016 1707 1712 P NOH 2007 8082 8083 E REN 2015 1535 1538 Y ALQAISI 2016 81 85 F BAUL 2015 2359 2369 T BAUL 2014 1191 1202 T LIU 2020 5400 5406 J ZHANG 2020 eaaz4824 X LIU 2013 285 294 F DOSSANTOS 2020 116206 R WANDAS 2008 832 841 M HAMDOUNI 2019 126827 N LANG 2016 208 215 X STASCH 2012 15105 15112 A YADAV 2017 11418 11424 S DAVID 2003 11911 11924 M SHAO 2020 8870 8879 H WU 2008 106 111 S YUE 2019 233 241 S WU 2019 110485 Y PATEL 2020 117375 P ROSHAN 2014 2023 2031 K MIAO 2008 236 241 C WANG 2017 2574 2582 T WANG 2017 44 52 T MOUSAVI 2016 5170 5176 B ZANON 2017 282 291 A LIU 2020 2395 2398 J JAYAKUMAR 2018 2546 2555 S DAURIA 2018 9871 9877 I WUX2021X111894 WUX2021X111894XY 2023-09-23T00:00:00.000Z 2023-09-23T00:00:00.000Z http://creativecommons.org/licenses/by-nc-nd/4.0/ © 2021 Elsevier B.V. All rights reserved. 2021-09-25T21:54:51.577Z http://vtw.elsevier.com/data/voc/AddOnTypes/50.7/aggregated-refined Outstanding Foreign Scientists Studio of Coal Green Conversion of Henan Province 20210701 GZS2020012 National Natural Science Foundation of China 21676054 NSFC National Natural Science Foundation of China http://data.elsevier.com/vocabulary/SciValFunders/501100001809 http://sws.geonames.org/1814991/ Southeast University SEU Southeast University http://data.elsevier.com/vocabulary/SciValFunders/501100008081 http://sws.geonames.org/1814991/ National Key R&D Program of China 2019YFB1504003 NKRDPC National Key Research and Development Program of China http://data.elsevier.com/vocabulary/SciValFunders/501100012166 http://sws.geonames.org/1814991/ Scientific Research Foundation of Graduate School of Southeast University 3207049714 Scientific Research Foundation of the Graduate School of Southeast University http://data.elsevier.com/vocabulary/SciValFunders/501100012595 http://sws.geonames.org/1814991/ This work was financially supported by National Key R&D Program of China (No. 2019YFB1504003 ), National Natural Science Foundation of China (No. 21676054 ), Outstanding Foreign Scientists Studio of Coal Green Conversion of Henan Province (No. GZS2020012 ), GHfund A (No. 20210701 ), and Scientific Research Foundation of Graduate School of Southeast University (No. 3207049714 ). We also appreciate the Big Data Center of Southeast University for providing the facility support on the numerical calculations in this work. This work was financially supported by National Key R&D Program of China (No. 2019YFB1504003), National Natural Science Foundation of China (No. 21676054), Outstanding Foreign Scientists Studio of Coal Green Conversion of Henan Province (No. GZS2020012), GHfund A (No. 20210701), and Scientific Research Foundation of Graduate School of Southeast University (No. 3207049714). We also appreciate the Big Data Center of Southeast University for providing the facility support on the numerical calculations in this work. 0 https://doi.org/10.15223/policy-017 https://doi.org/10.15223/policy-037 https://doi.org/10.15223/policy-012 https://doi.org/10.15223/policy-029 https://doi.org/10.15223/policy-004 item S2468-8231(21)00511-3 S2468823121005113 1-s2.0-S2468823121005113 10.1016/j.mcat.2021.111894 315758 2021-12-01T08:33:46.201544Z 2021-10-01 2021-10-31 1-s2.0-S2468823121005113-main.pdf https://s3-eu-west-1.amazonaws.com/prod-ucs-content-store-eu-west/content/pii:S2468823121005113/MAIN/application/pdf/826a922f64a139e345de43f1ecaa8650/main.pdf main.pdf pdf true 5773211 MAIN 9 1-s2.0-S2468823121005113-main_1.png https://s3-eu-west-1.amazonaws.com/prod-ucs-content-store-eu-west/content/pii:S2468823121005113/PREVIEW/image/png/2e9ce0ef0d4a716044bd544820f21533/main_1.png main_1.png png 56903 849 656 IMAGE-WEB-PDF 1 1-s2.0-S2468823121005113-sc1.jpg https://s3-eu-west-1.amazonaws.com/prod-ucs-content-store-eu-west/content/pii:S2468823121005113/sc1/DOWNSAMPLED/image/jpeg/9871ae6682df84056ae058d773d32bb8/sc1.jpg sc1 sc1.jpg jpg 58848 460 565 IMAGE-DOWNSAMPLED 1-s2.0-S2468823121005113-sc2.jpg https://s3-eu-west-1.amazonaws.com/prod-ucs-content-store-eu-west/content/pii:S2468823121005113/sc2/DOWNSAMPLED/image/jpeg/1de47cc75efa20bf1f3b922741da5b55/sc2.jpg sc2 sc2.jpg jpg 9683 97 339 IMAGE-DOWNSAMPLED 1-s2.0-S2468823121005113-sc3.jpg https://s3-eu-west-1.amazonaws.com/prod-ucs-content-store-eu-west/content/pii:S2468823121005113/sc3/DOWNSAMPLED/image/jpeg/eeaec2499e0362b8d8afe4ab2e5748d2/sc3.jpg sc3 sc3.jpg jpg 62340 537 659 IMAGE-DOWNSAMPLED 1-s2.0-S2468823121005113-gr1.jpg https://s3-eu-west-1.amazonaws.com/prod-ucs-content-store-eu-west/content/pii:S2468823121005113/gr1/DOWNSAMPLED/image/jpeg/ef1973ff15533a9de4fdb89a6d31d7f3/gr1.jpg gr1 gr1.jpg jpg 76022 425 339 IMAGE-DOWNSAMPLED 1-s2.0-S2468823121005113-gr2.jpg https://s3-eu-west-1.amazonaws.com/prod-ucs-content-store-eu-west/content/pii:S2468823121005113/gr2/DOWNSAMPLED/image/jpeg/e5ff2038e5067f81060dfa55bfe09aa1/gr2.jpg gr2 gr2.jpg jpg 53995 302 565 IMAGE-DOWNSAMPLED 1-s2.0-S2468823121005113-gr3.jpg https://s3-eu-west-1.amazonaws.com/prod-ucs-content-store-eu-west/content/pii:S2468823121005113/gr3/DOWNSAMPLED/image/jpeg/85fcecafd93813b451b0eb00fa8c586b/gr3.jpg gr3 gr3.jpg jpg 57106 301 339 IMAGE-DOWNSAMPLED 1-s2.0-S2468823121005113-gr4.jpg https://s3-eu-west-1.amazonaws.com/prod-ucs-content-store-eu-west/content/pii:S2468823121005113/gr4/DOWNSAMPLED/image/jpeg/26e14068e3c97c3a38820b629ff5029a/gr4.jpg gr4 gr4.jpg jpg 32586 296 339 IMAGE-DOWNSAMPLED 1-s2.0-S2468823121005113-gr5.jpg https://s3-eu-west-1.amazonaws.com/prod-ucs-content-store-eu-west/content/pii:S2468823121005113/gr5/DOWNSAMPLED/image/jpeg/52731a7178c54aff4ef48b964bb85440/gr5.jpg gr5 gr5.jpg jpg 74921 546 339 IMAGE-DOWNSAMPLED 1-s2.0-S2468823121005113-gr6.jpg https://s3-eu-west-1.amazonaws.com/prod-ucs-content-store-eu-west/content/pii:S2468823121005113/gr6/DOWNSAMPLED/image/jpeg/57dab2b86a83b0ced76600e7db986b42/gr6.jpg gr6 gr6.jpg jpg 107477 502 565 IMAGE-DOWNSAMPLED 1-s2.0-S2468823121005113-gr7.jpg https://s3-eu-west-1.amazonaws.com/prod-ucs-content-store-eu-west/content/pii:S2468823121005113/gr7/DOWNSAMPLED/image/jpeg/b999834aa46f2c6a434ac9fa540b6b4a/gr7.jpg gr7 gr7.jpg jpg 29189 297 339 IMAGE-DOWNSAMPLED 1-s2.0-S2468823121005113-gr8.jpg https://s3-eu-west-1.amazonaws.com/prod-ucs-content-store-eu-west/content/pii:S2468823121005113/gr8/DOWNSAMPLED/image/jpeg/ad0512b7dc656cc87f463f4fc8c1b798/gr8.jpg gr8 gr8.jpg jpg 48312 270 565 IMAGE-DOWNSAMPLED 1-s2.0-S2468823121005113-gr9.jpg https://s3-eu-west-1.amazonaws.com/prod-ucs-content-store-eu-west/content/pii:S2468823121005113/gr9/DOWNSAMPLED/image/jpeg/4a3d2210dbf1a9dc895fb7312b90404b/gr9.jpg gr9 gr9.jpg jpg 60204 282 565 IMAGE-DOWNSAMPLED 1-s2.0-S2468823121005113-ga1.jpg https://s3-eu-west-1.amazonaws.com/prod-ucs-content-store-eu-west/content/pii:S2468823121005113/ga1/DOWNSAMPLED/image/jpeg/96114db3c0fd27f66d4a798c6a2feaa6/ga1.jpg ga1 true ga1.jpg jpg 25238 185 301 IMAGE-DOWNSAMPLED 1-s2.0-S2468823121005113-sc1.sml https://s3-eu-west-1.amazonaws.com/prod-ucs-content-store-eu-west/content/pii:S2468823121005113/sc1/THUMBNAIL/image/gif/b5e8a7cea0e61a090fb0f67b55fe12fd/sc1.sml sc1 sc1.sml sml 9597 164 201 IMAGE-THUMBNAIL 1-s2.0-S2468823121005113-sc2.sml https://s3-eu-west-1.amazonaws.com/prod-ucs-content-store-eu-west/content/pii:S2468823121005113/sc2/THUMBNAIL/image/gif/3fb8548f3268182671ec4d77213cfb1c/sc2.sml sc2 sc2.sml sml 5338 63 219 IMAGE-THUMBNAIL 1-s2.0-S2468823121005113-sc3.sml https://s3-eu-west-1.amazonaws.com/prod-ucs-content-store-eu-west/content/pii:S2468823121005113/sc3/THUMBNAIL/image/gif/fb346d2272bb5c690204158632152495/sc3.sml sc3 sc3.sml sml 8210 164 201 IMAGE-THUMBNAIL 1-s2.0-S2468823121005113-gr1.sml https://s3-eu-west-1.amazonaws.com/prod-ucs-content-store-eu-west/content/pii:S2468823121005113/gr1/THUMBNAIL/image/gif/e13c83656911ab8bc3a1b307132c366b/gr1.sml gr1 gr1.sml sml 12341 164 131 IMAGE-THUMBNAIL 1-s2.0-S2468823121005113-gr2.sml https://s3-eu-west-1.amazonaws.com/prod-ucs-content-store-eu-west/content/pii:S2468823121005113/gr2/THUMBNAIL/image/gif/0bc304d87802cb03b1864443690f82b9/gr2.sml gr2 gr2.sml sml 10948 117 219 IMAGE-THUMBNAIL 1-s2.0-S2468823121005113-gr3.sml https://s3-eu-west-1.amazonaws.com/prod-ucs-content-store-eu-west/content/pii:S2468823121005113/gr3/THUMBNAIL/image/gif/c107aa0b2407c991520f5172aa1b1280/gr3.sml gr3 gr3.sml sml 12992 163 184 IMAGE-THUMBNAIL 1-s2.0-S2468823121005113-gr4.sml https://s3-eu-west-1.amazonaws.com/prod-ucs-content-store-eu-west/content/pii:S2468823121005113/gr4/THUMBNAIL/image/gif/872bc64c97d336dcf57df62a23099507/gr4.sml gr4 gr4.sml sml 10060 163 187 IMAGE-THUMBNAIL 1-s2.0-S2468823121005113-gr5.sml https://s3-eu-west-1.amazonaws.com/prod-ucs-content-store-eu-west/content/pii:S2468823121005113/gr5/THUMBNAIL/image/gif/5deaf00bea0f9bfd4db287a422218710/gr5.sml gr5 gr5.sml sml 9901 163 101 IMAGE-THUMBNAIL 1-s2.0-S2468823121005113-gr6.sml https://s3-eu-west-1.amazonaws.com/prod-ucs-content-store-eu-west/content/pii:S2468823121005113/gr6/THUMBNAIL/image/gif/c698414efb7d5ce883430f858911324e/gr6.sml gr6 gr6.sml sml 15830 163 184 IMAGE-THUMBNAIL 1-s2.0-S2468823121005113-gr7.sml https://s3-eu-west-1.amazonaws.com/prod-ucs-content-store-eu-west/content/pii:S2468823121005113/gr7/THUMBNAIL/image/gif/e517d203be34ff654aaf81f3352af7e4/gr7.sml gr7 gr7.sml sml 9500 164 187 IMAGE-THUMBNAIL 1-s2.0-S2468823121005113-gr8.sml https://s3-eu-west-1.amazonaws.com/prod-ucs-content-store-eu-west/content/pii:S2468823121005113/gr8/THUMBNAIL/image/gif/b484dbbceb55555a893f4f14c587fd77/gr8.sml gr8 gr8.sml sml 11016 105 219 IMAGE-THUMBNAIL 1-s2.0-S2468823121005113-gr9.sml https://s3-eu-west-1.amazonaws.com/prod-ucs-content-store-eu-west/content/pii:S2468823121005113/gr9/THUMBNAIL/image/gif/3af0a2bdf326fa1284d7e865ce85f1a4/gr9.sml gr9 gr9.sml sml 9869 109 219 IMAGE-THUMBNAIL 1-s2.0-S2468823121005113-ga1.sml https://s3-eu-west-1.amazonaws.com/prod-ucs-content-store-eu-west/content/pii:S2468823121005113/ga1/THUMBNAIL/image/gif/be477b77068282a34e767986da9048e1/ga1.sml ga1 true ga1.sml sml 12483 134 219 IMAGE-THUMBNAIL 1-s2.0-S2468823121005113-sc1_lrg.jpg https://s3-eu-west-1.amazonaws.com/prod-ucs-content-store-eu-west/content/pii:S2468823121005113/sc1/HIGHRES/image/jpeg/662ea5db1764dd460b8087693dfdd2b1/sc1_lrg.jpg sc1 sc1_lrg.jpg jpg 458249 2036 2500 IMAGE-HIGH-RES 1-s2.0-S2468823121005113-sc2_lrg.jpg https://s3-eu-west-1.amazonaws.com/prod-ucs-content-store-eu-west/content/pii:S2468823121005113/sc2/HIGHRES/image/jpeg/eb93b59f83e198197a2cdec9ad49ed0c/sc2_lrg.jpg sc2 sc2_lrg.jpg jpg 52926 431 1500 IMAGE-HIGH-RES 1-s2.0-S2468823121005113-sc3_lrg.jpg https://s3-eu-west-1.amazonaws.com/prod-ucs-content-store-eu-west/content/pii:S2468823121005113/sc3/HIGHRES/image/jpeg/70d4e7c40c418b29dbbd1a163ecfaf93/sc3_lrg.jpg sc3 sc3_lrg.jpg jpg 420576 2375 2917 IMAGE-HIGH-RES 1-s2.0-S2468823121005113-gr1_lrg.jpg https://s3-eu-west-1.amazonaws.com/prod-ucs-content-store-eu-west/content/pii:S2468823121005113/gr1/HIGHRES/image/jpeg/aa3b3b2f7558171587da1bc7a661fe22/gr1_lrg.jpg gr1 gr1_lrg.jpg jpg 1098740 1879 1500 IMAGE-HIGH-RES 1-s2.0-S2468823121005113-gr2_lrg.jpg https://s3-eu-west-1.amazonaws.com/prod-ucs-content-store-eu-west/content/pii:S2468823121005113/gr2/HIGHRES/image/jpeg/4a39e63c7c2ab407e7ec1dd52886a84a/gr2_lrg.jpg gr2 gr2_lrg.jpg jpg 380717 1335 2500 IMAGE-HIGH-RES 1-s2.0-S2468823121005113-gr3_lrg.jpg https://s3-eu-west-1.amazonaws.com/prod-ucs-content-store-eu-west/content/pii:S2468823121005113/gr3/HIGHRES/image/jpeg/f66eb23ee63c37f41367e24c0bae7d91/gr3_lrg.jpg gr3 gr3_lrg.jpg jpg 749468 1332 1500 IMAGE-HIGH-RES 1-s2.0-S2468823121005113-gr4_lrg.jpg https://s3-eu-west-1.amazonaws.com/prod-ucs-content-store-eu-west/content/pii:S2468823121005113/gr4/HIGHRES/image/jpeg/021bd8d3cb45984b70038b91d4d876b9/gr4_lrg.jpg gr4 gr4_lrg.jpg jpg 237947 1311 1500 IMAGE-HIGH-RES 1-s2.0-S2468823121005113-gr5_lrg.jpg https://s3-eu-west-1.amazonaws.com/prod-ucs-content-store-eu-west/content/pii:S2468823121005113/gr5/HIGHRES/image/jpeg/fce6b5cf643a992fb1fb97bde7555b62/gr5_lrg.jpg gr5 gr5_lrg.jpg jpg 560059 2417 1500 IMAGE-HIGH-RES 1-s2.0-S2468823121005113-gr6_lrg.jpg https://s3-eu-west-1.amazonaws.com/prod-ucs-content-store-eu-west/content/pii:S2468823121005113/gr6/HIGHRES/image/jpeg/88db8e634cd5d84507be3a43fd494f58/gr6_lrg.jpg gr6 gr6_lrg.jpg jpg 794453 2221 2500 IMAGE-HIGH-RES 1-s2.0-S2468823121005113-gr7_lrg.jpg https://s3-eu-west-1.amazonaws.com/prod-ucs-content-store-eu-west/content/pii:S2468823121005113/gr7/HIGHRES/image/jpeg/85c04f01b2460a7d1938aa1a8f2a33f0/gr7_lrg.jpg gr7 gr7_lrg.jpg jpg 189626 1313 1500 IMAGE-HIGH-RES 1-s2.0-S2468823121005113-gr8_lrg.jpg https://s3-eu-west-1.amazonaws.com/prod-ucs-content-store-eu-west/content/pii:S2468823121005113/gr8/HIGHRES/image/jpeg/440b3e4c9d7b4fb62d2967ba6cc3148b/gr8_lrg.jpg gr8 gr8_lrg.jpg jpg 351114 1195 2500 IMAGE-HIGH-RES 1-s2.0-S2468823121005113-gr9_lrg.jpg https://s3-eu-west-1.amazonaws.com/prod-ucs-content-store-eu-west/content/pii:S2468823121005113/gr9/HIGHRES/image/jpeg/0f0369b5c98d1f546374ab92ad19a8e3/gr9_lrg.jpg gr9 gr9_lrg.jpg jpg 425471 1249 2500 IMAGE-HIGH-RES 1-s2.0-S2468823121005113-ga1_lrg.jpg https://s3-eu-west-1.amazonaws.com/prod-ucs-content-store-eu-west/content/pii:S2468823121005113/ga1/HIGHRES/image/jpeg/c89f46b929c8840e44cb2786b9493cdf/ga1_lrg.jpg ga1 true ga1_lrg.jpg jpg 183367 818 1333 IMAGE-HIGH-RES 1-s2.0-S2468823121005113-mmc1.docx https://s3-eu-west-1.amazonaws.com/prod-ucs-content-store-eu-west/content/pii:S2468823121005113/mmc1/MAIN/application/vnd.openxmlformats-officedocument.wordprocessingml.document/12618804bcb99c93df9060dcf6e9657d/mmc1.docx mmc1 mmc1.docx docx 5446324 APPLICATION 1-s2.0-S2468823121005113-si1.svg https://s3-eu-west-1.amazonaws.com/prod-ucs-content-store-eu-west/content/pii:S2468823121005113/STRIPIN/image/svg+xml/ee8ef3b6e5aa8d8b6db21d8efef00331/si1.svg si1 si1.svg svg 27721 ALTIMG 1-s2.0-S2468823121005113-si2.svg https://s3-eu-west-1.amazonaws.com/prod-ucs-content-store-eu-west/content/pii:S2468823121005113/STRIPIN/image/svg+xml/5d7a3fdc6ac3767719157cf8c4eb03e1/si2.svg si2 si2.svg svg 25385 ALTIMG 1-s2.0-S2468823121005113-am.pdf https://s3-eu-west-1.amazonaws.com/prod-ucs-content-store-eu-west/content/egi:10CXZCFZZC6/MAIN/application/pdf/d011883f9466e275ff8efb4c6006a39e/am.pdf am am.pdf pdf false 1373152 AAM-PDF MCAT 111894 111894 S2468-8231(21)00511-3 10.1016/j.mcat.2021.111894 Scheme 1 The synthesis processes and chemical structures of the Zn (II) complexes. Scheme 1 Scheme 2 Carbon dioxide coupling with epoxides catalyzed by Zn (II) complexes. Scheme 2 Scheme 3 Chemical fixation of CO2 into cyclic carbonates catalyzed by oMyPbh-ZnI2 complex. Scheme 3 Fig. 1 Measured and simulated X-ray diffraction (XRD) patterns of Zn (II) complexes. Fig 1 Fig. 2 Basic structural units of the synthesized Zn (II) complexes. (a) oMyPbh-ZnCl2, (b) oMyPbh-ZnBr2, (c) oMyPbh-ZnI2, (d) pTdPbh-ZnCl2, (e) oTdPbh-ZnBr2. Fig 2 Fig. 3 FT-IR spectrum of Zn (II) complexes. (a) pTdPbh-ZnCl2, (b) oTdPbh-ZnBr2, (c) oMyPbh-ZnCl2, (d) oMyPbh-ZnBr2, (e) oMyPbh-ZnI2. Fig 3 Fig. 4 TGA profiles of Zn (II) complexes. Fig 4 Fig. 5 (I) NH3-TPD and (II) CO2-adsorption profiles of Zn-based samples. (a) pTdPbh-ZnCl2, (b) oTdPbh-ZnBr2, (c) oMyPbh-ZnCl2, (d) oMyPbh-ZnBr2, (e) oMyPbh-ZnI2. Fig 5 Fig. 6 (a) Effects of reaction temperature, (b) Effects of catalyst amount, (c) Effects of initial pressure, (d) Effects of reaction time. Optimal conditions: ECH 16.66 g, 110 °C, 1.25 wt.% catalyst of ECH, 2.5 MPa, 8 h. Fig 6 Fig. 7 The recyclability of the recovered oMyPbh-ZnI2 complex. ECH 16.66 g, 110 °C, 1.25 wt.% catalyst of ECH, 2.5 MPa, 8 h. Fig 7 Fig. 8 Hypothetical state of carbon dioxide coupling with ECH in the presence of oMyPbh-ZnI2. Structure optimization including ECH, CO2, CPC, transition states and intermediates were carried out on M06 equipped with ECP-based LANL2DZ/6–311G(d, p) mixed basis sets. Fig 8 Fig. 9 Theoretical calculation of CO2 coupling with ECH catalyzed by oMyPbh-ZnX2 (X = I−, Br− and Cl−). Fig 9 Table 1 CO2 insertion into ECH catalyzed by various Zn (II) complexes. Table 1 Conversion (%) Selectivity (%) Yield (%) oMyPbh-ZnI2 56.11 98.31 55.16 oMyPbh-ZnBr2 53.45 98.51 52.65 oMyPbh-ZnCl2 39.65 96.33 38.20 oTdPbh-ZnBr2 53.41 94.26 50.34 pTdPbh-ZnCl2 40.57 96.18 39.02 Reaction conditions: 90 °C, 2.5 MPa, 5 h, 1.25 wt.% catalyst of ECH. Table 2 CO2 coupling with various epoxides. Table 2 Conversion (%) Selectivity (%) Yield (%) 1 93.01 96.93 90.15 2 76.84 95.86 73.66 3 98.62 96.97 95.63 4 33.97 98.72 33.54 5 95.14 98.90 94.10 6 a 99.11 98.61 97.73 7 b 98.95 98.83 97.79 8c 17.94 86.97 15.60 Reaction conditions: ECH 16.66 g,110 °C, 2.5 MPa, 8 h, 1.25 wt.% catalyst of ECH; a: ECH 16.66 g, 0.16 g ethanol, 90 °C, 2.5 MPa, 8 h, 1.25 wt.% catalyst of ECH; b: ECH 16.66 g, 0.16 g methanol, 90 °C, 2.5 MPa, 8 h, 1.25 wt.% catalyst of ECH; c: ECH 16.66 g, 0.16 g H2O, 90 °C, 2.5 MPa, 8 h, 1.25 wt.% catalyst of ECH. Experimental and computational studies of Zn (II) complexes structured with Schiff base ligands as the efficient catalysts for chemical fixation of CO2 into cyclic carbonates Yuanfeng Wu a b ⁎ Shenbin Shi b Xiaoxiao Su a Zongqi Zhang b Panli Liu b Olayinka ODERINDE b c Guiyun Yi a Guomin Xiao b ⁎ Yulong Zhang a a School of Chemistry and Chemical Engineering, Henan Polytechnic University, Jiaozuo 454003, China School of Chemistry and Chemical Engineering, Henan Polytechnic University Jiaozuo 454003 China aSchool of Chemistry and Chemical Engineering, Henan Polytechnic University, Jiaozuo 454003, China b School of Chemistry and Chemical Engineering, Southeast University, Nanjing 211189, China School of Chemistry and Chemical Engineering, Southeast University Nanjing 211189 China bSchool of Chemistry and Chemical Engineering, Southeast University, Nanjing 211189, China c Department of Chemical Sciences Faculty of Basic Medical and Applied Sciences, Lead City University, Ibadan, Nigeria Department of Chemical Sciences Faculty of Basic Medical and Applied Sciences Lead City University Ibadan Nigeria cDepartment of Chemical Sciences Faculty of Basic Medical and Applied Sciences, Lead City University, Ibadan, Nigeria ⁎ Corresponding authors. The present work aimed at comparably studying the catalytic performance of Zn (II) complexes applied as the efficient catalysts in accelerating the transformation of CO2 into cyclic carbonates. The physicochemical properties of the synthesized complexes were determined by XRD, NMR, FT-IR, TGA, NH3-TPD, CO2-adsorption. The synthesized samples were found to possess the Lewis acid/basic sites derived from the zinc ions and nitrogen-containing ligands, which can synergistically catalyze the coupling reaction. In addition, the sample containing iodide ion ligands showed the highest catalytic performance compared with other Zn (II) complexes, suggesting that the amount and distribution of the Lewis acid sites were not the primary factors for determining the catalytic activity, and the difference in activity of halogen ion ligands (I−, Br−, Cl−) has a larger influence on the coupling process, which made the CO2 insertion and ring closure of the formed intermediate more easily occur when iodide ion ligands participated. It can be drawn that the catalytic activity of the Zn (II) complexes was simultaneously associated with halide ion ligands and substitution group of the ligand. Moreover, 98.62% conversion of epichlorohydrin (ECH) and 96.97% selectivity to chloropropene carbonate (TOF=56.65 h − 1) was achieved at the optimal operation parameters (110 °C, 2.5 MPa, 8 h, 1.25 wt.% catalyst of ECH). Furthermore, the proposed pathway of CO2 coupling with epoxide was confirmed by DFT calculation, with the result confirming that the process of epoxide ring opening was the key step for the coupling reaction. Graphical abstract Chemical fixation of CO2 into cyclic carbonates over Zn (II) Schiff base complex Image, graphical abstract Keywords CO2 Epoxides Cyclic carbonates Zn (II) complexes DFT 1 Introduction The rapid increasing amount of CO2 emissions from fossil fuel combustion has caused a series of negative influence on the climate as well as sustainable development [1, 2]. Hence, finding the transformation routes for CO2 utilization is profound both for academic research and environmental protection. Interestingly, carbon dioxide with excellent physicochemical properties (inexpensiveness, nontoxic, harmlessness, renewability) has been applied as C1 resource to participate in the synthesis of fine chemicals [3-7]. Among the synthesized chemicals, cyclic carbonates derived from CO2 cycloaddition have been found with wide industrial applications [8-12]. For example, the use of the synthesized cyclic carbonates as intermediates for the synthesis of polyester (polycarbonates and polyurethanes), pharmaceutically important compounds have also been performed widely. Besides, the cyclic carbonates can also serve as polar solvents, and electrolytes in lithium secondary batteries. At present, the coupling reactions between CO2 and epoxides have been promoted by various catalysts containing the homogeneous alkali metal halides [13-15], quaternary ammonium or phosponium salts [16, 17], functional polymer [18-20], ionic liquids [21-23], heterogeneous metal oxides [24-26], covalent organic framework materials [27, 28], and metal-organic frameworks [29, 30], of which the separation for reobtaining the homogeneous catalysts was difficult to carried out, while some reaction systems always required harsh conditions. Hence, this has stimulated some researchers in the past years to pursue the studies of finding highly-efficient catalysts for catalytic transformation of carbon dioxide into cyclic carbonates. The metal-based complexes constructed with metal ions and nitrogen-containing ligand can exhibit the dual functions of Lewis acid-basic sites, which have been widely explored for accelerating the catalytic process of CO2 insertion into epoxide [31-35]. For example, bimetallic aluminum-salen complexes together with tetrabutylammonium bromide (TBAB) was found with the relatively high catalytic activity for promoting cyclic carbonates synthesis [36, 37]. Besides, carbon dioxide coupling with epoxides can be efficiently enhanced by Al complexes constructed with amine-bridged poly(phenolato) ligands, and when TBAB was employed, 60–97% yield of the cyclic carbonates was obtained [38]. In addition, the catalytic activity for CO2/epoxide copolymerization was remarkably enhanced after the Co ions-containing salen complexes were functionalized by quaternary ammonium salt [39]. Moreover, when M(salphen) complexes (M=Zn, Cu, and Ni) modified by N-methylhomopiperazine were employed, increasing catalytic activity for propylene carbonate synthesis was observed, and the yield was in the order: 92% (Zn) > 68% (Cu) > 27% (Zn) [40]. Furthermore, when bis(phenoxyiminato)Fe(III)‑chloro complexes and cocatalyst (DMAP, Bu4NBr, Bu4PBr) were simultaneously added in the coupling reaction performed at 120 °C for 24 h, the conversion of propylene oxide was respectively observed with 79%(DMAP), 75%(Bu4NBr), and 83%(DMAP) [41]. The reason for all the reported complexes having the ability to promote CO2 cycloaddition was due to the presence of Lewis acid-basic sites within its structure, and the bifunctional species can synergistically catalyze the three steps of CO2 cycloaddition (ring opening of epoxide, CO2 insertion, and ring closure for cyclic carbonate). In this work, five kinds of Zn (II) complexes were synthesized, and applied as the catalysts for promoting CO2 cycloaddition. Some reaction conditions including reaction temperature, initial pressure, reaction time, catalyst amount and recyclability were systemically investigated with epichlorohydrin as the probe, while the coupling scope of epoxide with CO2 was also extensively studied under the optimal conditions. Finally, a proposed reaction pathway was confirmed by DFT calculations. 2 Experimental section 2.1 Synthesis of Zn (II) complexes Five kinds of Zn (II) complexes were synthesized reference to previous reports (Scheme 1 ) [42, 43], which was described as follows: Synthesis of oMyPbh-ZnCl2(1). 10 mL ethanol solution including 2-Pyridinecarboxaldehyde (1.2 mmol) was added dropwise into o-Methoxyaniline (1.2 mmol) methanol solution (10 mL). After being stirred for 2 h, 40 mL ethanol solution including ZnCl2 (1.1 mmol) was added into the mixed solution, which brought about the rapid formation of a yellow precipitate. The system was continuously stirred for another 48 h. Subsequently, the newly-formed complex was filtered and washed with ethanol three times (3 × 5 mL), followed by being dried under vacuum. The precipitate was dissolved into 50 mL boiling acetonitrile, and obtained via hot filtration. Thereafter, the precipitate was recrystallized from acetonitrile to give the yellow crystal sample. 1HNMR (600 MHz, DMSO‑d6): 8.73 (s, 1H), 8.69 (s, 1H), 8.15–8.14 (d, 1H), 8.05–8.03 (m, 1H), 7.62–7.60 (m, 1H), 7.28–7.24 (m, 2H), 7.14–7.3 (d, 1H), 7.03–7.01 (m, 1H), 3.83 (s, 3H) ppm. 13CNMR (600 MHz, DMSO‑d6): δ 159.88, 152.34, 149.82, 140.10, 136.17, 129.85, 128.15, 126.03, 121.58, 121.08, 11,295, 56.13 ppm. (Fig.S1 and Fig.S6) Synthesis of oMyPbh-ZnBr2(2). The synthesis process was similar with that of oMyPbh-ZnCl2, only the ZnCl2 was replaced by ZnBr2, forming the yellow crystal sample via recrystallization from acetonitrile. oMyPbh-ZnBr2 , 1HNMR (600 MHz, DMSO‑d6): 8.76 (s, 2H), 8.17–8.16 (d, 2H), 7.77 (s, 1H), 7.28 (s, 1H), 7.12 (s, 2H), 7.01 (m, 1H), 3.78 (s, 3H) ppm. 13CNMR (600 MHz, DMSO‑d6): δ 161.77, 151.39, 149.69, 141.67, 135.54, 129.67, 129.33, 128.68, 122.96, 121.17, 112.77, 56.12 ppm. (Fig.S2 and Fig.S7) Synthesis of oMyPbh-ZnI2(3). The synthesis process was similar with that of oMyPbh-ZnCl2, only the ZnCl2 was replaced by ZnI2, giving the yellow crystal sample via recrystallization from acetonitrile. oMyPbh-ZnI2 , 1HNMR (600 MHz, DMSO‑d6): 8.84 (s, 1H), 8.75–8.74 (d, 1H),8.16–8.12 (m, 2H), 7.70–7.69 (m, 1H), 7.33–7.31 (m, 2H), 7.16–7.15 (d, 1H), 7.04–7.03 (d, 1H), 3.85 (s, 3H) ppm. 13CNMR (600 MHz, DMSO‑d6): δ 160.13, 152.23, 149.75, 140.15, 136.31, 129.78, 128.13, 126.01, 121.54, 121.19, 112.93, 56.03 ppm. (Fig.S3 and Fig.S8) Synthesis of oTdPbh-ZnBr2 (4). The synthesis process was similar with that of oMyPbh-ZnBr2, only the o-Methoxyaniline was replaced by o-Toluidine, giving the yellow crystal sample via recrystallization from acetonitrile. oTdPbh-ZnBr2 , 1HNMR (600 MHz, DMSO‑d6): δ 8.74–8.73 (d, 1H), 8.49 (s, 1H), 8.20–8.18 (d, 1H), 8.01–7.98 (t, 1H), 7.58–7.56 (d, 1H), 7.29–7.24 (m, 2H), 7.20–7.17 (m, 1H), 7.12–7.11 (d, 1H), 2.32 (s, 3H) ppm. 13CNMR (600 MHz, DMSO‑d6): δ 160.65, 150.09, 149.87, 137.85, 131.95, 130.73, 127.37, 126.88, 126.33,122.16, 118.40 ppm. (Fig.S4 and Fig.S9) Synthesis of pTdPbh-ZnCl2 (5). The synthesis process was similar with that of oMyPbh-ZnCl2, only the o-Methoxyaniline was replaced by p-Toluidine, giving the yellow crystal sample via recrystallization from acetonitrile. pTdPbh-ZnCl2 , 1HNMR (600 MHz, DMSO‑d6): 8.76–8.75 (d, 1H), 8.64 (s, 1H), 8.15–8.14 (d, 1H), 8.02–8.00 (d, 1H), 7.58 (s, 1H), 7.30–7.25 (m, 4H), 2.34 (s, 3H) ppm. 13CNMR (600 MHz, DMSO‑d6): δ 159.78, 150.16, 138.16, 137.26, 130.21, 129.67, 126.86, 121.90, 114.56,122.16, 21.11 ppm. (Fig.S5 and Fig.S10) 2.2 Catalyst reaction The catalytic performance of the synthesized samples was evaluated via enhancing CO2 coupling with epoxide to form cyclic carbonate (CLC) performed in a stainless autoclave (100 mL), and the control parameters were monitored by the electromagnetic stirrer and thermocouple (>Scheme 2 ). During the catalytic activity test, the epoxide and catalyst were firstly charged into reactor which was sealed, and pressurized with CO2 after the system have been purified thrice. Subsequently, the reaction system was stirred and heated to the setting parameters. After the reaction had continued for 8 h, the reaction system was cooled down to 5 °C in an ice bath. The catalyst-free liquid and recovered solid were thereafter obtained via centrifugation, after which the organic liquid was analyzed by gas chromatography. Reactant conversion and product selectivity were measured reference to Eq. (1) and (2). (When propylene oxide reacted with CO2, the purification process was omitted) (1) Epoxide conversion = amount of epoxid e i n i t i a l − amount of epoxid e r e s i d u a l amount of epoxid e i n i t i a l × 100 % (2) CLCselectivity = amount of CL C f o r m e d amount of CL C f o r m e d + amount of by − products × 100 % 2.3 Characterization and computational details Crystal structure of the synthesized Zn (II) complexes was determined by X-ray diffraction (XRD) instrument equipped with Cu Kα radiation, and the data were collected in 2θ range of 5–60° with a scan speed of 10 o/min. The chemical groups of the synthesized Zn (II) complexes were identified by Fourier transform infrared (FT-IR) spectra performed on a Nicolet 5700 spectrometer, and the spectra was recorded in the range of 400–4000 cm−1 with KBr as fixative. CO2-adsorption profiles and adsorption capacity of the synthesized samples were measured at room temperature on a Beishide 3H-2000 analyzer after the samples have been outgassed at 120 °C for 12 h. The thermostability of the Zn (II) complexes was determined by Thermo gravimetric analysis (TGA) conducted on a SDT Q600 thermal analyzer. During the record, the sample was linearly heated from 30 to 600 °C (10 °/min) with the nitrogen as protective gas. CO2/NH3-TPD profiles of the synthesized samples were determined via temperature-programmed desorption of carbon dioxide/ammonia on the TP-5056 equipment. During the test, the sample was firstly heated at 150 °C for 1 h under helium atmosphere. After being cooled down to 30 °C, the sample was then exposed in 30 mL/min NH3/CO2 airflow for 30 min. Thereafter, the system was purged with helium for another 30 min to exclude physical residual gas, and then the sample was heated to 400 °C with a liner rate of 10 °C/min, and the released gas from the sample was recorded via TCD detector. The composition and content of the catalyst-free liquid were detected by GC-6890 instrument equipped with SE-54 capillary column, of which ethylene glycol monobutyl ether was selected as the internal standard. The geometric structure including CO2, ECH, CPC, intermediates and transition states were optimized by G09 packages, of which ECP-based LANL2DZ for Zn atom and 6–311G(d, p) for main-group atoms basis set together with M06 exchange functional were applied for the optimal structure search. 3 Results and discussion 3.1 Characterization of the Zn (II) complexes The measured and simulated crystal data of Zn (II) complexes were exhibited in Fig. 1. It was observed that the experimentally-measured patterns were in well consistent with the simulated data, which were also validated by previous reports [42, 43]. As a result, all the studied Zn (II) complexes were successfully prepared. The basic structural units of the Zn (II) complexes were displayed in Fig. 2. For oMyPbh-ZnCl2, oMyPbh-ZnBr2, and oMyPbh-ZnI2 compounds, zinc ion was simultaneously coordinated with two nitrogen atoms, oxygen atom and two halogen atoms, while, zinc ion was linked to two nitrogen atoms and two halogen atoms in pTdPbh-ZnCl2, oTdPbh-ZnBr2, and pNlPbh-ZnBr2. More importantly, zinc ions within the crystal structure have the ability to promote the acid-catalyzed reaction, and nitrogen-containing groups can be provided with Lewis basic sites function. As a result, the synthesized Zn (II) complexes can enhance CO2 insertion into epoxide [44, 45]. FT-IR spectra of the Zn (II) complexes were displayed in Fig. 3. Similar spectra were observed for oMyPbh-ZnCl2, oMyPbh-ZnBr2, and oMyPbh-ZnI2, which was due to the three samples being constructed with the same ligand, additionally, the bands centered at 1255 cm−1 and 1018 cm−1 were related to anti-symmetric stretching vibration and symmetric stretching vibration of C-O-C groups [46, 47]. While the band located at 1024 cm−1 for pTdPbh-ZnCl2 and oTdPbh-ZnBr2 was attributed to the rocking vibration of methyl groups [48, 49]. For all the samples, the band peak at 1590 cm−1 corresponds to the symmetric stretching vibration of C = N groups [42, 43], demonstrated that the characteristic bond of C = N within the ligands were formed during the sample preparation. The thermal behaviors of the synthesized Zn (II) complexes were detected in the range of 30–600 °C, and the weight loss recorded at the heating rate of 10 °C/min in nitrogen flow, with the results being presented in Fig. 4. Interestingly, the as-synthesized four kinds of Zn (II) complexes maintained a constant weight until the temperature was beyond 274 °C, while the decomposition of pTdPbh-ZnCl2 sample occurred at a higher temperature (320 °C), suggesting that all the synthesized samples can withstand a high temperature without structural collapse. Due to absence of carboxylic groups and hydroxyl groups within all the sample, the active sites detected by NH3-TPD corresponded to Lewis instead of Brönsted acid sites. As a result, the desorption area appearing in Fig. 5I was associated with Lewis acid sites, of which the area appearing in the range of 30–200 °C and 200–400 °C were assigned to weak and moderate Lewis acid sites, respectively. Moreover, oMyPbh-ZnCl2 was found with the desorption area peak at 266 °C which was higher than that of oMyPbh-ZnI2 and oMyPbh-ZnBr2, implying that oMyPbh-ZnCl2 has the highest catalytic activity among the same-ligand compounds. Also, the second NH3 desorption peak appeared at 266 °C for oMyPbh-ZnCl2 and 220 °C for oMyPbh-ZnI2, respectively, indicating that the two samples were provided with moderate acid sites. For pTdPbh-ZnCl2 and oTdPbh-ZnBr2, the NH3 desorption peak only appeared in the range of 80–170 °C, suggesting that only the weak Lewis acid sites were formed inside the three samples. Additionally, CO2-TPD profile of oMyPbh-ZnI2 as shown in Fig. 5I(e), was observed without any desorption area below the decomposition temperature (Fig. 4), possibly caused by the strong interaction between CO2 molecule and basic sites, which make CO2 desorption from the active sites difficult. To confirm the existence of Lewis basic sites within the samples, CO2 adsorption was performed with the results being shown in Fig. 5II. Interestingly, Zn (II) complexes observed with various adsorption capacities of CO2, suggesting that Lewis basic sites existed in the synthesized samples. Furthermore, oMyPbh-ZnCl2 was observed with the highest adsorption capacity, and the lowest adsorption capacity was observed over oMyPbh-ZnBr2, implying that halogen ion ligands also have a large effect on the formation of basic sites. According to the characterization results, the synthesized Zn (II) complexes have the ability to enhance transformation of CO2 into cyclic carbonates. 3.2 CO2 coupling with ECH and optimized parameters The conversion of ECH and selectivity to CPC was applied as the determining parameters for evaluating the catalytic performance of the Zn (II) complexes, with the catalytic results being listed in Table 1 . Among all the studied samples, oMyPbh-ZnI2 was found to possess the highest catalytic activity. Besides, for the same-ligand samples (oMyPbh-ZnCl2, oMyPbh-ZnBr2, oMyPbh-ZnI2), the catalytic activity was in the order: oMyPbh-ZnI2 (56.11%) > oMyPbh-ZnBr2 (53.45%) > oMyPbh-ZnCl2 (39.65%), while the oMyPbh-ZnCl2 was observed with more Lewis acid sites (Fig. 5I), demonstrated that the amount and distribution of the Lewis acid sites were not the primary factors for determining the catalytic activity, and the difference in activity of halogen ion ligands (I−, Br−, Cl−) can account for the various ECH conversion, of which CO2 insertion and ring closure of the formed intermediate easily occurring when iodide ion ligands participated in the coupling reaction (Fig. 9). Besides, this may be associated with the hydrogen bond interactions for the total Hirsheld surfaces (Fig. S13–14):37.2% (I…H)> 36.0% (Br…H)> 32.6% (Cl…H). Moreover, the multiple hydrogen bonding donor together with protic ammonium bromide has been confirmed with the catalytic performance for CO2 coupling with epoxide [50]. While, the conversion of ECH decrease from 53.41% to 40.57% when oTdPbh-ZnBr2 was replaced by pTdPbh-ZnCl2, indicating that the activity of bromide ion was higher than chloride ion although the larger Steric hindrance would be formed between active sites and reactant when the coupling process was enhanced by oTdPbh-ZnBr2. Besides, higher acidity of Lewis acid sites (Fig. 5I) within solid can also endow oTdPbh-ZnBr2 with higher catalytic activity. Moreover, some complexes structured similar with the all above have been reported with the feature of spontaneously producing dimeric structures both in solid state and in the reaction media, which could improve the catalytic performances during the reaction [51-54]. The catalytic activity of the Zn (II) complexes for CO2 cycloaddition was simultaneously related to halide ion ligands and substitution group of the ligand. As a result, oMyPbh-ZnI2 was selected to optimize the operating parameters. Reaction temperature as one of the important operating parameters is usually optimized to indicate the reactants with high conversion and minima side reaction. As Fig. 6a presented that the conversion of ECH showed a rapid increase from 46.11% (80 °C) to 85.14% (110 °C), and then slightly increased to 90.12% (120 °C), while the CPC selectivity exhibited an obvious decrease with the temperature above 110 °C. The decreasing CPC selectivity was attributed to the dissociation of limited water from catalyst solid: the dissociated water reacted with ECH to form 3‑chloro-1,2-propanediol (Fig. S11). Hence, to obtain a high conversion of ECH with less by-products, 110 °C can be considered as the most suitable reaction temperature for exploring subsequent parameters. The content of oMyPbh-ZnI2 complex within the organic liquid was optimized via detection of ECH conversion and CPC selectivity, with the results being displayed in Fig. 6b. The conversion of ECH showed a continuous uptrend from 56.95% (0.5 wt.% of ECH) to 95.06% (1.5 wt.% of ECH) with the catalyst amount increase, and when the catalyst amount was above 1.25 wt.% of ECH, the conversion of ECH only show a slow rise. Thus, 1.25 wt.% of ECH was regarded as the optimal catalyst concentration for the fixed catalytic system. The amount of CO2 effecting the ECH conversion was studied at the initial pressure range of 2.0 - 3.5 MPa. The conversion of ECH observed in Fig. 6c exhibited an obvious increase, maximizing to 92.62% (2.5 MPa), followed by decrease to 74.16% (3.5 MPa), while the selectivity to ECH only show a slight fluctuation with the pressure rise. The increasing conversion along with pressure change is attributed to the appropriate CO2 concentration which could make as many molecules as possible participate in the coupling reaction [55]. Moreover, excessive pressure can also make the ECH molecules get diluted around the active sites [56, 57], resulting in a decreasing reactant conversion. As a result, charging the reactor with 2.5 MPa of CO2 gas is most suitable for promoting the coupling reaction. The ECH conversion together with CPC selectivity gradually changed with the prolonging of reaction time. Therefore, intermittent detection of the continuously-changing component distribution is necessary to achieve the satisfactory product yield in a short time. The results of component change versus reaction time is displayed in Fig. 6d. The ECH conversion was found with a rapid increase when the reaction time was prolonged from second hour (28.19%) to sixth hour (95.65%), then showed a slow increase to 98.62% (eighth hour). This was thereafter followed by a slight fluctuation with increased timing, which is related to the rapid formation of CPC alongside with ECH conversion [58]. Furthermore, a slight decrease in the CPC selectivity was observed during the coupling reaction, suggesting that only a small quantity of ECH was hydrolyzed into 3‑chloro-1,2-propanediol. Thus, reaction time of 8 h was beneficial for gaining a satisfactory CPC yield. As mentioned earlier, the highest catalytic activity was observed with 98.62% conversion of epichlorohydrin and 96.97% selectivity to chloropropene carbonate (TOF=56.65 h − 1) once the coupling reaction was performed at the optimized conditions. 3.3 Recyclability of the Zn-based complex The recyclability is the important parameter for the evaluation of the Zn-based complex, which is usually reused at the optimal reaction conditions. During the catalytic cycle, most sample was regained via centrifugation, while another part was recovered from organic liquid via water extraction, after which it was further treated via rotary evaporation to remove the water. Subsequently, both parts were simultaneously added into the catalytic system for enhancing CO2 conversion (Fig. 7). When the recovered experiment was performed three times, only a slight decrease in ECH conversion was observed, suggesting that the synthesized Zn (II) complexes was table in catalytic performance during the liquid reaction. However, the conversion of ECH displayed an obvious decrease for the fourth cycle, which may be ascribed to the adsorbed organic component covering the surface of oMyPbh-ZnI2 complex, hence making the reactant contact with the active sites difficultly. Besides, the structure collapse of the recovered sample may be also a reason for this case (Fig. S15). 3.4 CO2 cycloaddition with other epoxides The coupling scope of oMyPbh-ZnI2 being used as the catalyst for enhancing CO2 cycloaddition was investigated with ECH, styrene oxide (SO), propylene oxide (PO), allyl-glycidyl ether (AGE), cyclohexene oxide (CHO) as the substrate, respectively. As shown in Table 2 , most cyclic carbonates can be efficiently synthesized from the corresponding epoxides, which were respectively confirmed by 1H NMR (Fig. S12). However, when CHO was employed, only 33.97% conversion was observed. The low conversion of CHO is ascribed to the steric hindrance, which made the ring opening of CHO difficult to occur [59]. Additionally, the obtained 3-Butoxy-1, 2-propylene carbonate from CHO conversion was only the cis isomer, which has been confirmed by previous literature [60]. As a result, a low conversion of CHO was gained. In addition, when the catalytic system was charged with additional 1.0 wt.% ethanol (methanol) of PO, almost all of PO molecule were converted into PC. While the additive was replaced by equivalent water, the conversion of PO is only 17.94%, and the selectivity decreased to from 98.61% (98.83%) to 86.97%, indicating that the hydrogen atom of ethanol hydroxyl showed a higher activity for ring opening of epoxide. Besides, addition of water molecule into reaction system can promote PO hydrolysis into 1,2-propanediol, resulting in a decreasing selectivity to PC. 3.5 Mechanism and DFT studies Carbon dioxide coupling with epoxide includes the ring opening of epoxide, CO2 insertion into ring-opening intermediate, and intermediate ring closure, of which the ring opening of epoxide was the rate-determining step [61, 62], as the coupling process can be efficiently promoted in the presence of Lewis acid-basic sites simultaneously. Interestingly, the existence of Lewis acid sites within Zn (II) complexes have been validated by NH3-TPD profiles (Fig. 5I), while the nitrogen-containing ligand constructing the crystal structure has the function to serve as Lewis basic sites [63, 64], and as also confirmed by CO2-adsorption (Fig. 5II). Therefore, a possible reaction pathway was proposed with reference to the previous reports [65-67]. As shown in Scheme 3 , the epoxide was firstly activated by Zinc node, and then formed a ring-opening intermediate which was thereafter attacked by CO2 to produce another intermediate. Subsequently, the intermediate underwent ring closure to release cyclic carbonate, as well as generate Zn-based complex. In order to confirm the reliability of the proposed mechanism to illustrate the coupling process, the G09 package was adopted for studying the transition state and intermediate. The corresponding theoretical calculations for the coupling reactions catalyzed by oMyPbh-ZnI2 is exhibited in Figs. 8 and 9 . The energy barrier of the transition state increases in the order: 2.07 kcal/mol (Ring closure, TS3) < 3.99 kcal/mol (CO2 insertion, TS2) < 31.00 kcal/mol (Ring opening, TS1), indicated that the ring-opening transition state was the key step for CO2 cycloaddition. Moreover, the ring-opening transition state in the coupling process has also been reported by previous literatures [61, 62], which is also considered as the rate-determining step for similar reactions. Additionally, the reaction process catalyzed by oMyPbh-ZnX2 (X=Br− and Cl−) has also been calculated with the results showing a similar trend with that enhanced by oMyPbh-ZnI2. It can also be found that the difference in catalytic activity of oMyPbh-ZnX2 (X=Br− and Cl−) was also related to the CO2 inserting into ring opening intermediate and the ring closure of subsequently-formed intermediates. Conclusions In the present work, the catalytic performance of simply-synthesized Zn (II) complexes were evaluated in facilitation of CO2 coupling with epoxide. The oMyPbh-ZnI2 was found with the highest catalytic performance among the studied Zn-based samples, suggesting that the CO2 insertion and ring closure of the formed intermediate easily occur in the presence of iodide ion ligands. Besides, the highest yield consisting of 98.62% conversion of ECH and 96.97% selectivity to CPC can be obtained when the reaction system was charged with 2.5 MPa of CO2 molecule and 1.25 wt.% catalyst of ECH heated at 110 °C for 8 h. Moreover, it was also found that methanol/ethanol as the additive has an obviously positive effect on the coupling process. Importantly, the ring opening process of epoxide, as the rate-determining step for CO2 fixation, was confirmed by DFT calculations. Credit author statement Yuanfeng Wu: Experimental, Writing - original draft, DFT calculations. Shengbin Shi: Methodology, Data analysis. Xiaoxiao Su: Writing- review & editing. Zongqi Zhang: Investigation. Panli Liu: NMR test. Olayinka ODERINDE: Language revision. Guiyun Yi: Investigation. Guomin Xiao: Conceptualization, Supervision, Funding acquisition. Yulong Zhang: Investigation. Appendix A. Supplementary data The following is the Supplementary data to this article: Declaration of competing interest The authors declare that they have no known competing financial interests or personal relationships that could have appeared to influence the work reported in this paper. Acknowledgments This work was financially supported by National Key R&D Program of China (No. 2019YFB1504003), National Natural Science Foundation of China (No. 21676054), Outstanding Foreign Scientists Studio of Coal Green Conversion of Henan Province (No. GZS2020012), GHfund A (No. 20210701), and Scientific Research Foundation of Graduate School of Southeast University (No. 3207049714). We also appreciate the Big Data Center of Southeast University for providing the facility support on the numerical calculations in this work. Supplementary materials Supplementary material associated with this article can be found, in the online version, at doi:10.1016/j.mcat.2021.111894. Appendix Supplementary materials Image, application 1 References [1] R. Snoeckx A. Bogaerts Chem.Soc.Rev 46 2017 5805 5863 R. Snoeckx, A. Bogaerts, Chem.Soc.Rev. 46 (2017) 5805–5863. [2] J.W. Zhong X.F. Yang Z.L. Wu B.L. Liang Y.Q. Huang T. Zhang Chem. Soc. Rev. 49 5 2020 1385 1413 J.W. Zhong, X.F. Yang, Z.L. Wu, B.L. Liang, Y.Q. Huang and T. Zhang, Chem. Soc. Rev.49(5) (2020) 1385–1413. [3] J.H. Wang Z.P. Hao S. Wohlrab Green Chem 19 15 2017 3595 3600 J.H. Wang, Z.P. Hao and S. Wohlrab, Green Chem. 19(15) (2017) 3595–3600. [4] Q.M. Wu J.Z. Chen X.H. Guo Y.S. Xu Eur. J. Org. Chem. 2018 3105 3113 201824 Q.M. Wu, J.Z. Chen, X.H. Guo and Y.S. Xu, Eur. J. Org. Chem.2018(24) (2018) 3105–3113. [5] M. Tamura M. Honda K. Noro Y. Nakagawa K. Tomishige J. Catal. 305 2013 191 203 M. Tamura, M. Honda, K. Noro, Y. Nakagawa and K. Tomishige, J. Catal.305 (2013) 191–203. [6] S.N. Bukhari C.C. Chong H.D. Setiabudi Y.W. Cheng L.P. Teh A.A. Jalil Chem. Eng. Sci. 229 2021 116141 S.N. Bukhari, C.C. Chong, H.D. Setiabudi, Y.W. Cheng, L.P. Teh and A.A. Jalil, Chem. Eng. Sci.229 (2021), 116141. [7] Y.F. Wu X.H. Song S. Li J.H. Zhang X.H. Yang P.S. Shen L.G. Gao R.P. Wei J. Zhang G.M. Xiao J. Ind. Eng. Chem. 58 2018 296 303 Y.F. Wu, X.H. Song, S. Li, J.H. Zhang, X.H. Yang, P.S. Shen, L.G. Gao, R.P. Wei, J. Zhang, G.M. Xiao, J. Ind. Eng. Chem.58 (2018) 296–303. [8] L. Song X. Zhang C. Chen X. Liu N. Zhang Microporous Mesoporous Mater 241 2017 36 42 L. Song, X. Zhang, C. Chen, X. Liu and N. Zhang, Microporous Mesoporous Mater. 241 (2017) 36–42. [9] S. Suleman H.A. Younus Z.A.K. Khattak H. Ullah M. Elkadi F. Verpoort Mol. Catal. 493 2020 111071 S. Suleman, H.A. Younus, Z.A.K. Khattak, H. Ullah, M. Elkadi and F. Verpoort, Mol. Catal.493 (2020), 111071. [10] M. Rajabzadeh R. Khalifeh H. Eshghi A. Hafizi J. Ind. Eng. Chem. 89 2020 458 469 M. Rajabzadeh, R. Khalifeh, H. Eshghi and A. Hafizi, J. Ind. Eng. Chem.89 (2020) 458–469. [11] S.E. Dechent A.W. Kleij G.A. Luinstra Green Chem 22 2020 969 978 S.E. Dechent, A.W. Kleij, G.A. Luinstra, Green Chem. 22 (2020) 969–978. [12] A.C. Deacy A.F.R. Kilpatrick A. Regoutz C.K. Williams Nat. Chem. 12 2020 372 380 A.C. Deacy, A.F.R. Kilpatrick, A. Regoutz, C.K. Williams, Nat. Chem.12 (2020) 372–380. [13] Y.J. Hao T. Tian Y.H. Kang T. Chang X.X. Fu Z. Zhu X.C. Meng B. Panchal S.J. Qin New J. Chem. 44 37 2020 15811 15815 Y.J. Hao, T. Tian, Y.H. Kang, T. Chang, X.X. Fu, Z. Zhu, X.C. Meng, B. Panchal and S.J. Qin, New J. Chem.44(37) (2020) 15811–15815. [14] C.K. Yang Y.L. Chen P. Xu L. Yang J.X. Zhang J.M. Sun Mol. Catal. 480 2020 110637 C.K. Yang, Y.L. Chen, P. Xu, L. Yang, J.X. Zhang and J.M. Sun, Mol. Catal.480 (2020),110637. [15] Q. He J.W. O'Brien K.A. Kitselman L.E. Tompkins G.C.T. Curtis F.M. Kerton Catal. Sci. Technol. 4 6 2014 1513 1528 Q. He, J.W. O'Brien, K.A. Kitselman, L.E. Tompkins, G.C.T. Curtis and F.M. Kerton, Catal. Sci. Technol.4(6) (2014) 1513–1528. [16] L. Veronese M. Brivio P. Biagini R. Po I. Tritto S. Losio L. Boggioni Organometallics 39 14 2020 2653 2664 L. Veronese, M. Brivio, P. Biagini, R. Po, I. Tritto, S. Losio and L. Boggioni, Organometallics 39(14) (2020) 2653–2664. [17] L.C. Št'astná A. Krupková R. Petrickovic M. Müllerová J. Matoušek M. Koštejn P. Cuřínová V. Jandová S. Šabata T. Strašák ACS Sustain. Chem. Eng. 8 31 2020 11692 11703 L.C. Št'astná, A. Krupková, R. Petrickovic, M. Müllerová, J. Matoušek, M. Koštejn, P. Cuřínová, V. Jandová, S. Šabata and T. Strašák, ACS Sustain. Chem. Eng.8(31) (2020) 11692–11703. [18] J. Chakraborty I. Nath S. Song C.M. Kao F. Verpoort J. Mater. Chem. A 8 28 2020 13916 13920 J. Chakraborty, I. Nath, S. Song, C.M. Kao and F. Verpoort, J. Mater. Chem. A8(28) (2020) 13916–13920. [19] R.C. Luo M. Chen X.Y. Liu W. Xu J.Y. Li B.Y. Liu Y.X. Fang J. Mater. Chem. A 8 36 2020 18408 18424 R.C. Luo, M. Chen, X.Y. Liu, W. Xu, J.Y. Li, B.Y. Liu and Y.X. Fang, J. Mater. Chem. A8(36) (2020) 18408–18424. [20] X.J. Wang W. Li J.X. Wang J. Zhu Y.T. Li X.Z. Liu L.P. Wang L. Li Dalton Trans 49 37 2020 13052 13059 X.J. Wang, W. Li, J.X. Wang, J. Zhu, Y.T. Li, X.Z. Liu, L.P. Wang and L. Li, Dalton Trans. 49(37) (2020) 13052–13059. [21] J.Y. Zha T. Ding J. Chen R. Wang G.H. Gao F. Xia J. Phys. Chem. A 124 39 2020 7991 7998 J.Y. Zha, T. Ding, J. Chen, R. Wang, G.H. Gao and F. Xia, J. Phys. Chem. A124(39) (2020) 7991–7998. [22] N.N. Isfahani M. Bahadori A. Marandi S. Tangestaninejad M. Moghadam V. Mirkhani M. Beheshti N. Afzali Ind. Eng. Chem. Res. 59 26 2020 11970 11978 N.N. Isfahani, M. Bahadori, A. Marandi, S. Tangestaninejad, M. Moghadam, V. Mirkhani, M. Beheshti and N. Afzali, Ind. Eng. Chem. Res.59(26) (2020) 11970–11978. [23] Y. Liu Y. Song J.H. Zhou X.P. Zhang Mol. Catal. 492 2020 111008 Y. Liu, Y. Song, J.H. Zhou and X.P. Zhang, Mol. Catal.492 (2020),111008. [24] P.R. Tambe G.D. Yadav Clean Technol. Environ. Policy 20 2 2017 345 356 P.R. Tambe and G.D. Yadav, Clean Technol. Environ. Policy20(2) (2017) 345–356. [25] D. Prasad K.N. Patil J.T. Bhanushali B.M. Nagaraja A.H. Jadhav Catal. Sci. Technol. 9 16 2019 4393 4412 D. Prasad, K.N. Patil, J.T. Bhanushali, B.M. Nagaraja and A.H. Jadhav, Catal. Sci. Technol.9(16) (2019) 4393–4412. [26] X. Jin P. Bobba N. Reding Z. Song P.S. Thapa G. Prasad B. Subramaniam R.V. Chaudhari Chem. Eng. Sci. 168 2017 189 203 X. Jin, P. Bobba, N. Reding, Z. Song, P.S. Thapa, G. Prasad, B. Subramaniam and R.V. Chaudhari, Chem. Eng. Sci.168 (2017) 189–203. [27] Q. Sun B. Aguila J. Perman N. Nguyen S.Q. Ma J. Am. Chem. Soc. 138 48 2016 15790 15796 Q. Sun, B. Aguila, J. Perman, N. Nguyen and S.Q. Ma, J. Am. Chem. Soc.138(48) (2016) 15790–15796. [28] F. Yang Y.L. Li T. Zhang Z.Q. Zhao G.L. Xing L. Chen Chem. - Eur. J. 26 20 2020 4510 4514 F. Yang, Y.L. Li, T. Zhang, Z.Q. Zhao, G.L. Xing and L. Chen, Chem. - Eur. J.26(20) (2020) 4510–4514. [29] Y.F. Wu X.H. Song J.H. Zhang S.Q. Xu L.J. Gao J. Zhang G.M. Xiao Chem. Eng. Sci. 201 2019 288 297 Y.F. Wu, X.H. Song, J.H. Zhang, S.Q. Xu, L.J. Gao, J. Zhang and G.M. Xiao, Chem. Eng. Sci.201 (2019) 288–297. [30] W.G. Cui G.Y. Zhang T.L. Hu X.H. Bu Coord. Chem. Rev. 387 2019 79 120 W.G. Cui, G.Y. Zhang, T.L. Hu and X.H. Bu, Coord. Chem. Rev.387 (2019) 79–120. [31] J.A. Castro-Osma M. North X. Wu Chem. - Eur. J. 20 46 2014 15005 15008 J.A. Castro-Osma, M. North and X. Wu, Chem. - Eur. J.20(46) (2014) 15005–8. [32] R.C. Luo X.T. Zhou S.Y. Chen Y. Li L. Zhou H.B. Ji Green Chem 16 3 2014 1496 1506 R.C. Luo, X.T. Zhou, S.Y. Chen, Y. Li, L. Zhou and H.B. Ji, Green Chem. 16(3) (2014) 1496–1506. [33] S. Supasitmongkol P. Styring Catal. Sci. Technol. 4 6 2014 1622 1630 S. Supasitmongkol and P. Styring, Catal. Sci. Technol.4(6) (2014) 1622–1630. [34] J. Rintjema A.W. Kleij ChemSusChem 10 2017 1274 1282 J. Rintjema, A.W. Kleij, ChemSusChem, 10 (2017) 1274–1282. [35] G. Trott J.A. Garden C.K. Williams Chem. Sci. 10 2019 4618 4627 G. Trott, J.A. Garden, C.K. Williams, Chem. Sci.10 (2019) 4618–4627. [36] W. Clegg R.W. Harrington M. North R. Pasquale Chem. - Eur. J. 16 23 2010 6828 6843 W. Clegg, R.W. Harrington, M. North and R. Pasquale, Chem. - Eur. J.16(23) (2010) 6828–43 [37] J. Meléndez M. North R. Pasquale Eur. J. Inorg. Chem. 2007 3323 3326 200721 J. Meléndez, M. North and R. Pasquale, Eur. J. Inorg. Chem.2007(21) (2007) 3323–3326. [38] P.F. Gao Z.W. Zhao L.J. Chen D. Yuan Y.M. Yao Organometallics 35 11 2016 1707 1712 P.F. Gao, Z.W. Zhao, L.J. Chen, D. Yuan and Y.M. Yao, Organometallics 35(11) (2016) 1707–1712. [39] E.K. Noh S.J. Na S. Sujith S.W. Kim B.Y. Lee J. Am. Chem. Soc. 129 2007 8082 8083 E.K. Noh, S.J. Na, S. Sujith, S.W. Kim, and B.Y. Lee, J. Am. Chem. Soc.129 (2007) 8082–8083. [40] Y.W. Ren J.G. Chen C.R. Qi H.F. Jiang ChemCatChem 7 10 2015 1535 1538 Y.W. Ren, J.G. Chen, C.R. Qi and H.F. Jiang, ChemCatChem 7(10) (2015) 1535–1538. [41] F. Al-Qaisi N. Genjang M. Nieger T. Repo Inorg. Chim. Acta 442 2016 81 85 F. Al-Qaisi, N. Genjang, M. Nieger and T. Repo, Inorg. Chim. Acta442 (2016) 81–85. [42] T.S.B. Baul S. Kundu P. Singh Shaveta F.C.G. da Silva Dalton Trans 44 5 2015 2359 2369 T.S.B. Baul, S. Kundu, P. Singh, Shaveta, F.C.G. da Silva, Dalton Trans. 44(5) (2015) 2359–69. [43] T.S.B. Baul S. Kundu A. Linden N. Raviprakash S.K. Manna M.F.C.G. da Silva Dalton Trans 43 3 2014 1191 1202 T.S.B. Baul, S. Kundu, A. Linden, N. Raviprakash, S.K. Manna and M.F.C.G. da Silva, Dalton Trans. 43(3) (2014) 1191–202. [44] J. Liu D. Wu G.P. Yang Y.L. Wu S.Y. Zhang J. Jin Y.Y. Wang Chem. - Eur. J. 26 24 2020 5400 5406 J. Liu, D. Wu, G.P. Yang, Y.L. Wu, S.Y. Zhang, J. Jin and Y.Y. Wang, Chem. - Eur. J.26(24) (2020) 5400–5406. [45] X.F. Zhang H.L. Liu P.F. An Y.N. Shi J.Y. Han Z.J. Yang C. Long J. Guo S.L. Zhao H.J. Yin L.R. Zheng B.H. Zhang X.P. Liu L.J. Zhang G.D. Li Z. Y. Tang, Sci. Adv. 6 2020 eaaz4824 X.F. Zhang, H.L. Liu, P.F. An, Y.N. Shi, J.Y. Han, Z.J. Yang, C. Long, J. Guo, S.L. Zhao, H.J. Yin, L.R. Zheng, B.H. Zhang, X.P. Liu, L.J. Zhang, G.D. Li, Z. Y. Tang, Sci. Adv.6 (2020) eaaz4824. [46] F. Liu Z.B. Wei L.S. Wang Z.Y. Wang J. Mol. Struct. 1035 2013 285 294 F. Liu, Z.B. Wei, L.S. Wang and Z.Y. Wang, J. Mol. Struct.1035 (2013) 285–294. [47] R.C.M. dos Santos P.C. Gurgel N.S. Pereira R.A. Breves P.R.R. de Matos L.P. Silva M.J.A. Sales R.D.V. Lopes Fuel 259 2020 116206 R.C.M. dos Santos, P.C. Gurgel, N.S. Pereira, R.A. Breves, P.R.R. de Matos, L.P. Silva, M.J.A. Sales and R.D.V. Lopes, Fuel259 (2020), 116206. [48] M. Wandas J. Lorenc E. Kucharska M. Ma̧czka J. Hanuza J. Raman Spectrosc. 39 7 2008 832 841 M. Wandas, J. Lorenc, E. Kucharska, M. Ma̧czka and J. Hanuza, J. Raman Spectrosc.39(7) (2008) 832–841. [49] N. Hamdouni A. Boudjada M.L. Medjroubi J. Mol. Struct. 1198 2019 126827 N. Hamdouni, A. Boudjada and M.L. Medjroubi, J. Mol. Struct.1198 (2019), 126827. [50] X.D. Lang Y.C. Yu L.N. He J. Mol. Catal. A: Chem. 420 2016 208 215 X.D. Lang, Y.C. Yu, L.N. He, J. Mol. Catal. A: Chem.420 (2016) 208–215. [51] A. Stasch Chem. Eur. J. 18 2012 15105 15112 A. Stasch, Chem. Eur. J., 18 (2012) 15105–15112. [52] S. Yadav E. Sangtani D. Dhawan R.G. Gonnade D. Ghosh S.S. Sen Dalton Trans 46 2017 11418 11424 S. Yadav, E. Sangtani, D. Dhawan, R.G. Gonnade, D. Ghosh, S.S. Sen, Dalton Trans. 46 (2017) 11418–11424. [53] M.C. David R. Moore Emil B. Lobkovsky Geoffrey W. Coates J. AM. CHEM. SOC. 125 2003 11911 11924 M.C. David R. Moore, Emil B. Lobkovsky, and Geoffrey W. Coates, J. AM. CHEM. SOC.125 (2003) 11911–11924. [54] H.L. Shao Y. Reddi C.J. Cramer ACS Catal 10 2020 8870 8879 H.L. Shao, Y. Reddi, C.J. Cramer, ACS Catal. 10 (2020) 8870–8879. [55] S.S. Wu X.W. Zhang W.L. Dai S.F. Yin W.S. Li Y.Q. Ren C.T. Au Appl. Catal., A 341 1–2 2008 106 111 S.S. Wu, X.W. Zhang, W.L. Dai, S.F. Yin, W.S. Li, Y.Q. Ren and C.T. Au, Appl. Catal., A341(1–2) (2008) 106–111. [56] S. Yue P.P. Wang X.Y. Hao Fuel 251 2019 233 241 S. Yue, P.P. Wang and X.Y. Hao, Fuel251 (2019) 233–241. [57] Y.F. Wu X.H. Song S.Q. Xu T. Yu J.H. Zhang Q. Qi L.J. Gao J. Zhang G.M. Xiao Mol. Catal. 475 2019 110485 Y.F. Wu, X.H. Song, S.Q. Xu, T. Yu, J.H. Zhang, Q. Qi, L.J. Gao, J. Zhang, G.M. Xiao, Mol. Catal.475 (2019) 110485. [58] P. Patel B. Parmar R.S. Pillai A. Ansari N.U.H. Khan E. Suresh Appl. Catal., A 590 2020 117375 P. Patel, B. Parmar, R.S. Pillai, A. Ansari, N.U.H. Khan and E. Suresh, Appl. Catal., A590 (2020), 117375. [59] K.R. Roshan A.C. Kathalikkattil J. Tharun D.W. Kim Y.S. Won D.W. Park Dalton Trans 43 5 2014 2023 2031 K.R. Roshan, A.C. Kathalikkattil, J. Tharun, D.W. Kim, Y.S. Won and D.W. Park, Dalton Trans. 43(5) (2014) 2023–31. [60] C.X. Miao J.Q. Wang Y. Wu Y. Du L.N. He ChemSusChem 1 2008 236 241 C.X. Miao, J.Q. Wang, Y. Wu, Y. Du, L.N. He, ChemSusChem 1 (2008) 236–241. [61] T.F. Wang D.N. Zheng J.S. Zhang B.W. Fan Y. Ma T.G. Ren L. Wang J.L. Zhang ACS Sustain. Chem. Eng. 6 2 2017 2574 2582 T.F. Wang, D.N. Zheng, J.S. Zhang, B.W. Fan, Y. Ma, T.G. Ren, L. Wang and J.L. Zhang, ACS Sustain. Chem. Eng.6(2) (2017) 2574–2582. [62] T.F. Wang D.N. Zheng Y. Ma J.Y. Guo Z.P. He B. Ma L.H. Liu T.G. Ren L. Wang J.L. Zhang J. CO2 Util 22 2017 44 52 T.F. Wang, D.N. Zheng, Y. Ma, J.Y. Guo, Z.P. He, B. Ma, L.H. Liu, T.G. Ren, L. Wang and J.L. Zhang, J. CO2 Util. 22 (2017) 44–52. [63] B. Mousavi S. Chaemchuen B. Moosavi Z.X. Luo N. Gholampour F. Verpoort New J. Chem. 40 6 2016 5170 5176 B. Mousavi, S. Chaemchuen, B. Moosavi, Z.X. Luo, N. Gholampour and F. Verpoort, New J. Chem.40(6) (2016) 5170–5176. [64] A. Zanon S. Chaemchuen B. Mousavi F. Verpoort CO2 Util 20 2017 282 291 A. Zanon, S. Chaemchuen, B. Mousavi and F. Verpoort, CO2 Util. 20 (2017) 282–291. [65] J. Liu G.P. Yang J. Jin D. Wu L.F. Ma Y.Y. Wang Chem. Commun. 56 16 2020 2395 2398 J. Liu, G.P. Yang, J. Jin, D. Wu, L.F. Ma and Y.Y. Wang, Chem. Commun.56(16) (2020) 2395–2398. [66] S. Jayakumar H. Li J. Chen Q.H. Yang ACS Appl. Mater. Interfaces 10 3 2018 2546 2555 S. Jayakumar, H. Li, J. Chen and Q.H. Yang, ACS Appl. Mater. Interfaces10(3) (2018) 2546–2555. [67] I. D’Auria M.C. D’Alterio G. Talarico C. Pellecchia Macromolecules 51 2018 9871 9877 I. D'Auria, M.C. D'Alterio, G. Talarico, C. Pellecchia, Macromolecules 51 (2018) 9871–9877.",
      "scopus-id": "85115418836",
      "coredata": {
        "eid": "1-s2.0-S2468823121005113",
        "dc:description": "The present work aimed at comparably studying the catalytic performance of Zn (II) complexes applied as the efficient catalysts in accelerating the transformation of CO2 into cyclic carbonates. The physicochemical properties of the synthesized complexes were determined by XRD, NMR, FT-IR, TGA, NH3-TPD, CO2-adsorption. The synthesized samples were found to possess the Lewis acid/basic sites derived from the zinc ions and nitrogen-containing ligands, which can synergistically catalyze the coupling reaction. In addition, the sample containing iodide ion ligands showed the highest catalytic performance compared with other Zn (II) complexes, suggesting that the amount and distribution of the Lewis acid sites were not the primary factors for determining the catalytic activity, and the difference in activity of halogen ion ligands (I−, Br−, Cl−) has a larger influence on the coupling process, which made the CO2 insertion and ring closure of the formed intermediate more easily occur when iodide ion ligands participated. It can be drawn that the catalytic activity of the Zn (II) complexes was simultaneously associated with halide ion ligands and substitution group of the ligand. Moreover, 98.62% conversion of epichlorohydrin (ECH) and 96.97% selectivity to chloropropene carbonate (TOF=56.65 h − 1) was achieved at the optimal operation parameters (110 °C, 2.5 MPa, 8 h, 1.25 wt.% catalyst of ECH). Furthermore, the proposed pathway of CO2 coupling with epoxide was confirmed by DFT calculation, with the result confirming that the process of epoxide ring opening was the key step for the coupling reaction.",
        "openArchiveArticle": "false",
        "prism:coverDate": "2021-10-31",
        "openaccessUserLicense": null,
        "prism:aggregationType": "Journal",
        "prism:url": "https://api.elsevier.com/content/article/pii/S2468823121005113",
        "dc:creator": [
          {
            "@_fa": "true",
            "$": "Wu, Yuanfeng"
          },
          {
            "@_fa": "true",
            "$": "Shi, Shenbin"
          },
          {
            "@_fa": "true",
            "$": "Su, Xiaoxiao"
          },
          {
            "@_fa": "true",
            "$": "Zhang, Zongqi"
          },
          {
            "@_fa": "true",
            "$": "Liu, Panli"
          },
          {
            "@_fa": "true",
            "$": "ODERINDE, Olayinka"
          },
          {
            "@_fa": "true",
            "$": "Yi, Guiyun"
          },
          {
            "@_fa": "true",
            "$": "Xiao, Guomin"
          },
          {
            "@_fa": "true",
            "$": "Zhang, Yulong"
          }
        ],
        "link": [
          {
            "@_fa": "true",
            "@rel": "self",
            "@href": "https://api.elsevier.com/content/article/pii/S2468823121005113"
          },
          {
            "@_fa": "true",
            "@rel": "scidir",
            "@href": "https://www.sciencedirect.com/science/article/pii/S2468823121005113"
          }
        ],
        "dc:format": "application/json",
        "openaccessType": null,
        "pii": "S2468-8231(21)00511-3",
        "prism:volume": "515",
        "articleNumber": "111894",
        "prism:publisher": "Elsevier B.V.",
        "dc:title": "Experimental and computational studies of Zn (II) complexes structured with Schiff base ligands as the efficient catalysts for chemical fixation of CO2 into cyclic carbonates",
        "prism:copyright": "© 2021 Elsevier B.V. All rights reserved.",
        "openaccess": "0",
        "prism:issn": "24688231",
        "dcterms:subject": [
          {
            "@_fa": "true",
            "$": "CO2"
          },
          {
            "@_fa": "true",
            "$": "Epoxides"
          },
          {
            "@_fa": "true",
            "$": "Cyclic carbonates"
          },
          {
            "@_fa": "true",
            "$": "Zn (II) complexes"
          },
          {
            "@_fa": "true",
            "$": "DFT"
          }
        ],
        "openaccessArticle": "false",
        "prism:publicationName": "Molecular Catalysis",
        "openaccessSponsorType": null,
        "prism:pageRange": "111894",
        "pubType": "fla",
        "prism:coverDisplayDate": "October 2021",
        "prism:doi": "10.1016/j.mcat.2021.111894",
        "prism:startingPage": "111894",
        "dc:identifier": "doi:10.1016/j.mcat.2021.111894",
        "openaccessSponsorName": null
      },
      "objects": {
        "object": [
          {
            "@category": "standard",
            "@height": "460",
            "@width": "565",
            "@_fa": "true",
            "$": "https://api.elsevier.com/content/object/eid/1-s2.0-S2468823121005113-sc1.jpg?httpAccept=%2A%2F%2A",
            "@multimediatype": "JPEG image file",
            "@type": "IMAGE-DOWNSAMPLED",
            "@size": "58848",
            "@ref": "sc1",
            "@mimetype": "image/jpeg"
          },
          {
            "@category": "standard",
            "@height": "97",
            "@width": "339",
            "@_fa": "true",
            "$": "https://api.elsevier.com/content/object/eid/1-s2.0-S2468823121005113-sc2.jpg?httpAccept=%2A%2F%2A",
            "@multimediatype": "JPEG image file",
            "@type": "IMAGE-DOWNSAMPLED",
            "@size": "9683",
            "@ref": "sc2",
            "@mimetype": "image/jpeg"
          },
          {
            "@category": "standard",
            "@height": "537",
            "@width": "659",
            "@_fa": "true",
            "$": "https://api.elsevier.com/content/object/eid/1-s2.0-S2468823121005113-sc3.jpg?httpAccept=%2A%2F%2A",
            "@multimediatype": "JPEG image file",
            "@type": "IMAGE-DOWNSAMPLED",
            "@size": "62340",
            "@ref": "sc3",
            "@mimetype": "image/jpeg"
          },
          {
            "@category": "standard",
            "@height": "425",
            "@width": "339",
            "@_fa": "true",
            "$": "https://api.elsevier.com/content/object/eid/1-s2.0-S2468823121005113-gr1.jpg?httpAccept=%2A%2F%2A",
            "@multimediatype": "JPEG image file",
            "@type": "IMAGE-DOWNSAMPLED",
            "@size": "76022",
            "@ref": "gr1",
            "@mimetype": "image/jpeg"
          },
          {
            "@category": "standard",
            "@height": "302",
            "@width": "565",
            "@_fa": "true",
            "$": "https://api.elsevier.com/content/object/eid/1-s2.0-S2468823121005113-gr2.jpg?httpAccept=%2A%2F%2A",
            "@multimediatype": "JPEG image file",
            "@type": "IMAGE-DOWNSAMPLED",
            "@size": "53995",
            "@ref": "gr2",
            "@mimetype": "image/jpeg"
          },
          {
            "@category": "standard",
            "@height": "301",
            "@width": "339",
            "@_fa": "true",
            "$": "https://api.elsevier.com/content/object/eid/1-s2.0-S2468823121005113-gr3.jpg?httpAccept=%2A%2F%2A",
            "@multimediatype": "JPEG image file",
            "@type": "IMAGE-DOWNSAMPLED",
            "@size": "57106",
            "@ref": "gr3",
            "@mimetype": "image/jpeg"
          },
          {
            "@category": "standard",
            "@height": "296",
            "@width": "339",
            "@_fa": "true",
            "$": "https://api.elsevier.com/content/object/eid/1-s2.0-S2468823121005113-gr4.jpg?httpAccept=%2A%2F%2A",
            "@multimediatype": "JPEG image file",
            "@type": "IMAGE-DOWNSAMPLED",
            "@size": "32586",
            "@ref": "gr4",
            "@mimetype": "image/jpeg"
          },
          {
            "@category": "standard",
            "@height": "546",
            "@width": "339",
            "@_fa": "true",
            "$": "https://api.elsevier.com/content/object/eid/1-s2.0-S2468823121005113-gr5.jpg?httpAccept=%2A%2F%2A",
            "@multimediatype": "JPEG image file",
            "@type": "IMAGE-DOWNSAMPLED",
            "@size": "74921",
            "@ref": "gr5",
            "@mimetype": "image/jpeg"
          },
          {
            "@category": "standard",
            "@height": "502",
            "@width": "565",
            "@_fa": "true",
            "$": "https://api.elsevier.com/content/object/eid/1-s2.0-S2468823121005113-gr6.jpg?httpAccept=%2A%2F%2A",
            "@multimediatype": "JPEG image file",
            "@type": "IMAGE-DOWNSAMPLED",
            "@size": "107477",
            "@ref": "gr6",
            "@mimetype": "image/jpeg"
          },
          {
            "@category": "standard",
            "@height": "297",
            "@width": "339",
            "@_fa": "true",
            "$": "https://api.elsevier.com/content/object/eid/1-s2.0-S2468823121005113-gr7.jpg?httpAccept=%2A%2F%2A",
            "@multimediatype": "JPEG image file",
            "@type": "IMAGE-DOWNSAMPLED",
            "@size": "29189",
            "@ref": "gr7",
            "@mimetype": "image/jpeg"
          },
          {
            "@category": "standard",
            "@height": "270",
            "@width": "565",
            "@_fa": "true",
            "$": "https://api.elsevier.com/content/object/eid/1-s2.0-S2468823121005113-gr8.jpg?httpAccept=%2A%2F%2A",
            "@multimediatype": "JPEG image file",
            "@type": "IMAGE-DOWNSAMPLED",
            "@size": "48312",
            "@ref": "gr8",
            "@mimetype": "image/jpeg"
          },
          {
            "@category": "standard",
            "@height": "282",
            "@width": "565",
            "@_fa": "true",
            "$": "https://api.elsevier.com/content/object/eid/1-s2.0-S2468823121005113-gr9.jpg?httpAccept=%2A%2F%2A",
            "@multimediatype": "JPEG image file",
            "@type": "IMAGE-DOWNSAMPLED",
            "@size": "60204",
            "@ref": "gr9",
            "@mimetype": "image/jpeg"
          },
          {
            "@category": "standard",
            "@height": "185",
            "@width": "301",
            "@_fa": "true",
            "$": "https://api.elsevier.com/content/object/eid/1-s2.0-S2468823121005113-ga1.jpg?httpAccept=%2A%2F%2A",
            "@multimediatype": "JPEG image file",
            "@type": "IMAGE-DOWNSAMPLED",
            "@size": "25238",
            "@ref": "ga1",
            "@mimetype": "image/jpeg"
          },
          {
            "@category": "thumbnail",
            "@height": "164",
            "@width": "201",
            "@_fa": "true",
            "$": "https://api.elsevier.com/content/object/eid/1-s2.0-S2468823121005113-sc1.sml?httpAccept=%2A%2F%2A",
            "@multimediatype": "GIF image file",
            "@type": "IMAGE-THUMBNAIL",
            "@size": "9597",
            "@ref": "sc1",
            "@mimetype": "image/gif"
          },
          {
            "@category": "thumbnail",
            "@height": "63",
            "@width": "219",
            "@_fa": "true",
            "$": "https://api.elsevier.com/content/object/eid/1-s2.0-S2468823121005113-sc2.sml?httpAccept=%2A%2F%2A",
            "@multimediatype": "GIF image file",
            "@type": "IMAGE-THUMBNAIL",
            "@size": "5338",
            "@ref": "sc2",
            "@mimetype": "image/gif"
          },
          {
            "@category": "thumbnail",
            "@height": "164",
            "@width": "201",
            "@_fa": "true",
            "$": "https://api.elsevier.com/content/object/eid/1-s2.0-S2468823121005113-sc3.sml?httpAccept=%2A%2F%2A",
            "@multimediatype": "GIF image file",
            "@type": "IMAGE-THUMBNAIL",
            "@size": "8210",
            "@ref": "sc3",
            "@mimetype": "image/gif"
          },
          {
            "@category": "thumbnail",
            "@height": "164",
            "@width": "131",
            "@_fa": "true",
            "$": "https://api.elsevier.com/content/object/eid/1-s2.0-S2468823121005113-gr1.sml?httpAccept=%2A%2F%2A",
            "@multimediatype": "GIF image file",
            "@type": "IMAGE-THUMBNAIL",
            "@size": "12341",
            "@ref": "gr1",
            "@mimetype": "image/gif"
          },
          {
            "@category": "thumbnail",
            "@height": "117",
            "@width": "219",
            "@_fa": "true",
            "$": "https://api.elsevier.com/content/object/eid/1-s2.0-S2468823121005113-gr2.sml?httpAccept=%2A%2F%2A",
            "@multimediatype": "GIF image file",
            "@type": "IMAGE-THUMBNAIL",
            "@size": "10948",
            "@ref": "gr2",
            "@mimetype": "image/gif"
          },
          {
            "@category": "thumbnail",
            "@height": "163",
            "@width": "184",
            "@_fa": "true",
            "$": "https://api.elsevier.com/content/object/eid/1-s2.0-S2468823121005113-gr3.sml?httpAccept=%2A%2F%2A",
            "@multimediatype": "GIF image file",
            "@type": "IMAGE-THUMBNAIL",
            "@size": "12992",
            "@ref": "gr3",
            "@mimetype": "image/gif"
          },
          {
            "@category": "thumbnail",
            "@height": "163",
            "@width": "187",
            "@_fa": "true",
            "$": "https://api.elsevier.com/content/object/eid/1-s2.0-S2468823121005113-gr4.sml?httpAccept=%2A%2F%2A",
            "@multimediatype": "GIF image file",
            "@type": "IMAGE-THUMBNAIL",
            "@size": "10060",
            "@ref": "gr4",
            "@mimetype": "image/gif"
          },
          {
            "@category": "thumbnail",
            "@height": "163",
            "@width": "101",
            "@_fa": "true",
            "$": "https://api.elsevier.com/content/object/eid/1-s2.0-S2468823121005113-gr5.sml?httpAccept=%2A%2F%2A",
            "@multimediatype": "GIF image file",
            "@type": "IMAGE-THUMBNAIL",
            "@size": "9901",
            "@ref": "gr5",
            "@mimetype": "image/gif"
          },
          {
            "@category": "thumbnail",
            "@height": "163",
            "@width": "184",
            "@_fa": "true",
            "$": "https://api.elsevier.com/content/object/eid/1-s2.0-S2468823121005113-gr6.sml?httpAccept=%2A%2F%2A",
            "@multimediatype": "GIF image file",
            "@type": "IMAGE-THUMBNAIL",
            "@size": "15830",
            "@ref": "gr6",
            "@mimetype": "image/gif"
          },
          {
            "@category": "thumbnail",
            "@height": "164",
            "@width": "187",
            "@_fa": "true",
            "$": "https://api.elsevier.com/content/object/eid/1-s2.0-S2468823121005113-gr7.sml?httpAccept=%2A%2F%2A",
            "@multimediatype": "GIF image file",
            "@type": "IMAGE-THUMBNAIL",
            "@size": "9500",
            "@ref": "gr7",
            "@mimetype": "image/gif"
          },
          {
            "@category": "thumbnail",
            "@height": "105",
            "@width": "219",
            "@_fa": "true",
            "$": "https://api.elsevier.com/content/object/eid/1-s2.0-S2468823121005113-gr8.sml?httpAccept=%2A%2F%2A",
            "@multimediatype": "GIF image file",
            "@type": "IMAGE-THUMBNAIL",
            "@size": "11016",
            "@ref": "gr8",
            "@mimetype": "image/gif"
          },
          {
            "@category": "thumbnail",
            "@height": "109",
            "@width": "219",
            "@_fa": "true",
            "$": "https://api.elsevier.com/content/object/eid/1-s2.0-S2468823121005113-gr9.sml?httpAccept=%2A%2F%2A",
            "@multimediatype": "GIF image file",
            "@type": "IMAGE-THUMBNAIL",
            "@size": "9869",
            "@ref": "gr9",
            "@mimetype": "image/gif"
          },
          {
            "@category": "thumbnail",
            "@height": "134",
            "@width": "219",
            "@_fa": "true",
            "$": "https://api.elsevier.com/content/object/eid/1-s2.0-S2468823121005113-ga1.sml?httpAccept=%2A%2F%2A",
            "@multimediatype": "GIF image file",
            "@type": "IMAGE-THUMBNAIL",
            "@size": "12483",
            "@ref": "ga1",
            "@mimetype": "image/gif"
          },
          {
            "@category": "high",
            "@height": "2036",
            "@width": "2500",
            "@_fa": "true",
            "$": "https://api.elsevier.com/content/object/eid/1-s2.0-S2468823121005113-sc1_lrg.jpg?httpAccept=%2A%2F%2A",
            "@multimediatype": "JPEG image file",
            "@type": "IMAGE-HIGH-RES",
            "@size": "458249",
            "@ref": "sc1",
            "@mimetype": "image/jpeg"
          },
          {
            "@category": "high",
            "@height": "431",
            "@width": "1500",
            "@_fa": "true",
            "$": "https://api.elsevier.com/content/object/eid/1-s2.0-S2468823121005113-sc2_lrg.jpg?httpAccept=%2A%2F%2A",
            "@multimediatype": "JPEG image file",
            "@type": "IMAGE-HIGH-RES",
            "@size": "52926",
            "@ref": "sc2",
            "@mimetype": "image/jpeg"
          },
          {
            "@category": "high",
            "@height": "2375",
            "@width": "2917",
            "@_fa": "true",
            "$": "https://api.elsevier.com/content/object/eid/1-s2.0-S2468823121005113-sc3_lrg.jpg?httpAccept=%2A%2F%2A",
            "@multimediatype": "JPEG image file",
            "@type": "IMAGE-HIGH-RES",
            "@size": "420576",
            "@ref": "sc3",
            "@mimetype": "image/jpeg"
          },
          {
            "@category": "high",
            "@height": "1879",
            "@width": "1500",
            "@_fa": "true",
            "$": "https://api.elsevier.com/content/object/eid/1-s2.0-S2468823121005113-gr1_lrg.jpg?httpAccept=%2A%2F%2A",
            "@multimediatype": "JPEG image file",
            "@type": "IMAGE-HIGH-RES",
            "@size": "1098740",
            "@ref": "gr1",
            "@mimetype": "image/jpeg"
          },
          {
            "@category": "high",
            "@height": "1335",
            "@width": "2500",
            "@_fa": "true",
            "$": "https://api.elsevier.com/content/object/eid/1-s2.0-S2468823121005113-gr2_lrg.jpg?httpAccept=%2A%2F%2A",
            "@multimediatype": "JPEG image file",
            "@type": "IMAGE-HIGH-RES",
            "@size": "380717",
            "@ref": "gr2",
            "@mimetype": "image/jpeg"
          },
          {
            "@category": "high",
            "@height": "1332",
            "@width": "1500",
            "@_fa": "true",
            "$": "https://api.elsevier.com/content/object/eid/1-s2.0-S2468823121005113-gr3_lrg.jpg?httpAccept=%2A%2F%2A",
            "@multimediatype": "JPEG image file",
            "@type": "IMAGE-HIGH-RES",
            "@size": "749468",
            "@ref": "gr3",
            "@mimetype": "image/jpeg"
          },
          {
            "@category": "high",
            "@height": "1311",
            "@width": "1500",
            "@_fa": "true",
            "$": "https://api.elsevier.com/content/object/eid/1-s2.0-S2468823121005113-gr4_lrg.jpg?httpAccept=%2A%2F%2A",
            "@multimediatype": "JPEG image file",
            "@type": "IMAGE-HIGH-RES",
            "@size": "237947",
            "@ref": "gr4",
            "@mimetype": "image/jpeg"
          },
          {
            "@category": "high",
            "@height": "2417",
            "@width": "1500",
            "@_fa": "true",
            "$": "https://api.elsevier.com/content/object/eid/1-s2.0-S2468823121005113-gr5_lrg.jpg?httpAccept=%2A%2F%2A",
            "@multimediatype": "JPEG image file",
            "@type": "IMAGE-HIGH-RES",
            "@size": "560059",
            "@ref": "gr5",
            "@mimetype": "image/jpeg"
          },
          {
            "@category": "high",
            "@height": "2221",
            "@width": "2500",
            "@_fa": "true",
            "$": "https://api.elsevier.com/content/object/eid/1-s2.0-S2468823121005113-gr6_lrg.jpg?httpAccept=%2A%2F%2A",
            "@multimediatype": "JPEG image file",
            "@type": "IMAGE-HIGH-RES",
            "@size": "794453",
            "@ref": "gr6",
            "@mimetype": "image/jpeg"
          },
          {
            "@category": "high",
            "@height": "1313",
            "@width": "1500",
            "@_fa": "true",
            "$": "https://api.elsevier.com/content/object/eid/1-s2.0-S2468823121005113-gr7_lrg.jpg?httpAccept=%2A%2F%2A",
            "@multimediatype": "JPEG image file",
            "@type": "IMAGE-HIGH-RES",
            "@size": "189626",
            "@ref": "gr7",
            "@mimetype": "image/jpeg"
          },
          {
            "@category": "high",
            "@height": "1195",
            "@width": "2500",
            "@_fa": "true",
            "$": "https://api.elsevier.com/content/object/eid/1-s2.0-S2468823121005113-gr8_lrg.jpg?httpAccept=%2A%2F%2A",
            "@multimediatype": "JPEG image file",
            "@type": "IMAGE-HIGH-RES",
            "@size": "351114",
            "@ref": "gr8",
            "@mimetype": "image/jpeg"
          },
          {
            "@category": "high",
            "@height": "1249",
            "@width": "2500",
            "@_fa": "true",
            "$": "https://api.elsevier.com/content/object/eid/1-s2.0-S2468823121005113-gr9_lrg.jpg?httpAccept=%2A%2F%2A",
            "@multimediatype": "JPEG image file",
            "@type": "IMAGE-HIGH-RES",
            "@size": "425471",
            "@ref": "gr9",
            "@mimetype": "image/jpeg"
          },
          {
            "@category": "high",
            "@height": "818",
            "@width": "1333",
            "@_fa": "true",
            "$": "https://api.elsevier.com/content/object/eid/1-s2.0-S2468823121005113-ga1_lrg.jpg?httpAccept=%2A%2F%2A",
            "@multimediatype": "JPEG image file",
            "@type": "IMAGE-HIGH-RES",
            "@size": "183367",
            "@ref": "ga1",
            "@mimetype": "image/jpeg"
          },
          {
            "@category": "standard",
            "@_fa": "true",
            "$": "https://api.elsevier.com/content/object/eid/1-s2.0-S2468823121005113-mmc1.docx?httpAccept=%2A%2F%2A",
            "@multimediatype": "Microsoft Word file",
            "@type": "APPLICATION",
            "@size": "5446324",
            "@ref": "mmc1",
            "@mimetype": "application/word"
          },
          {
            "@category": "thumbnail",
            "@_fa": "true",
            "$": "https://api.elsevier.com/content/object/eid/1-s2.0-S2468823121005113-si1.svg?httpAccept=%2A%2F%2A",
            "@multimediatype": "Scalable Vector Graphics file",
            "@type": "ALTIMG",
            "@size": "27721",
            "@ref": "si1",
            "@mimetype": "image/svg+xml"
          },
          {
            "@category": "thumbnail",
            "@_fa": "true",
            "$": "https://api.elsevier.com/content/object/eid/1-s2.0-S2468823121005113-si2.svg?httpAccept=%2A%2F%2A",
            "@multimediatype": "Scalable Vector Graphics file",
            "@type": "ALTIMG",
            "@size": "25385",
            "@ref": "si2",
            "@mimetype": "image/svg+xml"
          },
          {
            "@category": "standard",
            "@_fa": "true",
            "$": "https://api.elsevier.com/content/object/eid/1-s2.0-S2468823121005113-am.pdf?httpAccept=%2A%2F%2A",
            "@multimediatype": "Acrobat PDF file",
            "@type": "AAM-PDF",
            "@size": "1373152",
            "@ref": "am",
            "@mimetype": "application/pdf"
          }
        ]
      },
      "link": {
        "@rel": "abstract",
        "@href": "https://api.elsevier.com/content/abstract/scopus_id/85115418836"
      }
    }
  }
}