{
  "metadata": {
    "title": "Facile fabrication of atomically dispersed Pt catalysts on MgFe<ce:inf loc=post>2</ce:inf>O<ce:inf loc=post>4</ce:inf> toward efficient CO oxidation",
    "authors": "; ; ",
    "journal": "Molecular Catalysis",
    "date": "2024-05-01",
    "doi": "10.1016/j.mcat.2024.114107",
    "abstract": "",
    "uri": "https://api.elsevier.com/content/article/pii/S2468823124002906",
    "pii": "S2468823124002906"
  },
  "fulltext": {
    "full-text-retrieval-response": {
      "scopus-eid": "2-s2.0-85189661544",
      "originalText": "serial JL 315758 291210 291744 291790 291809 31 Molecular Catalysis MOLECULARCATALYSIS 2024-04-08 2024-04-08 2024-04-08 2024-04-08 2024-04-25T19:58:46 1-s2.0-S2468823124002906 S2468-8231(24)00290-6 S2468823124002906 10.1016/j.mcat.2024.114107 S300 S300.1 FULL-TEXT 1-s2.0-S2468823124X00061 2024-05-25T07:02:10.354629Z 0 0 20240501 2024 2024-04-08T17:10:12.937298Z absattachment articleinfo articlenumber articletitlenorm authfirstinitialnorm authfirstsurnamenorm cid cids contenttype copyright crossmark dateloaded dateloadedtxt datesearch datesort dateupdated dco docsubtype doctype doi eid ewtransactionid hubeid indexeddate issn issnnorm itemstage itemtransactionid itemweight openaccess openarchive pg pgfirst pii piinorm pubdatestart pubdatetxt pubyr sectiontitle sortorder srctitle srctitlenorm srctype ssids alllist content subj subheadings suppl tomb volfirst volissue volumelist webpdf webpdfpagecount yearnav figure table e-component body acknowledge affil appendices articletitle auth authfirstini authfull authkeywords authlast grantnumber grantsponsor highlightsabst orcid primabst ref specialabst 2468-8231 24688231 true 560 560 C Volume 560 5 114107 114107 114107 20240501 1 May 2024 2024-05-01 2024 Regular Papers article fla © 2024 Elsevier B.V. All rights reserved. FACILEFABRICATIONATOMICALLYDISPERSEDPTCATALYSTSMGFE2O4TOWARDEFFICIENTCOOXIDATION WANG F 1 Introduction 2 Experimental 2.1 Synthesis of Pt/MgFe2O4, Pt/Fe2O3 and Pt/Al2O3 2.2 Catalyst structural characterization 2.3 Catalytic performance tests 3 Results and discussion 3.1 Catalytic performance 3.2 Catalyst characterizations 3.3 Discussion 4 Conclusions CRediT authorship contribution statement Acknowledgments Appendix Supplementary materials References RYTER 2004 270 280 S LIU 2013 255 288 Z WAUGH 1994 197 210 K ZHANG 2022 333 345 Z PRABHAKARREDDY 2021 6134 6142 K CAI 2019 2558 2567 Y LIU 2021 16514 16520 Y GAO 2016 82 90 J XI 2016 24302 24306 Y VANSPRONSEN 2017 4347 4374 M LI 2015 544 552 F BORONIN 2021 119931 A QIAO 2011 634 641 B KUAI 2018 5534 5538 L KUAI 2022 e202212338 L TAO 2022 11932 11938 Q LIN 2013 15314 15317 J QIAO 2015 2913 2924 B WANG 2023 101341 F XU 2023 122678 L QIAO 2014 2113 2117 B LI 2021 1435 1442 Q ZHANG 2019 5812 X LIU 2020 949 958 K ALEKSANDROV 2016 22108 22121 H CARLSSON 2004 422 434 P WANG 2021 19301 19310 W YANG 2022 4244 J YE 2019 1401 1409 X ZHANG 2020 12932 12942 W WANG 2015 1 13 Y MUKRI 2013 3822 3833 B GRASSET 1999 2101 2108 F WANG 2023 24730 24741 S XUE 2017 6112 6123 Y CHEN 2018 859 868 Y MARS 1954 41 59 P TIAN 2012 261 267 L OU 2019 43 54 C WANGX2024X114107 WANGX2024X114107XF 2026-04-08T00:00:00.000Z 2026-04-08T00:00:00.000Z http://creativecommons.org/licenses/by-nc-nd/4.0/ © 2024 Elsevier B.V. All rights reserved. 2024-04-26T08:02:20.259Z http://vtw.elsevier.com/data/voc/AddOnTypes/50.7/aggregated-refined Anhui Provincial Natural Science Foundation 2108085QB49 Anhui Provincial Natural Science Foundation http://data.elsevier.com/vocabulary/SciValFunders/501100003995 http://sws.geonames.org/1814991 Anhui University of Science and Technology ALW2022YF05 AUST Anhui University of Science and Technology http://data.elsevier.com/vocabulary/SciValFunders/501100006247 http://sws.geonames.org/1814991/ Natural Science Research Project of Colleges and Universities in Anhui Province 2023AH051207 National Natural Science Foundation of China 22308007 NSFC National Natural Science Foundation of China http://data.elsevier.com/vocabulary/SciValFunders/501100001809 http://sws.geonames.org/1814991 This research was supported by the Natural Science Research Project of Colleges and Universities in Anhui Province (2023AH051207), the National Natural Science Foundation of China (22308007), the Anhui Provincial Natural Science Foundation (2108085QB49) and the Research Foundation of the Institute of Environment-friendly Materials and Occupational Health of Anhui University of Science and Technology (Wuhu) (ALW2022YF05). https://doi.org/10.15223/policy-017 https://doi.org/10.15223/policy-037 https://doi.org/10.15223/policy-012 https://doi.org/10.15223/policy-029 https://doi.org/10.15223/policy-004 item S2468-8231(24)00290-6 S2468823124002906 1-s2.0-S2468823124002906 10.1016/j.mcat.2024.114107 315758 2024-05-25T07:02:10.354629Z 2024-05-01 1-s2.0-S2468823124002906-main.pdf https://s3-eu-west-1.amazonaws.com/prod-ucs-content-store-eu-west/content/pii:S2468823124002906/MAIN/application/pdf/66675e5a01ac99320a2d8c4f494344d1/main.pdf main.pdf pdf true 11705723 MAIN 9 1-s2.0-S2468823124002906-main_1.png https://s3-eu-west-1.amazonaws.com/prod-ucs-content-store-eu-west/content/pii:S2468823124002906/PREVIEW/image/png/6b2803d982bd55ff9f721857ede50481/main_1.png main_1.png png 57204 849 656 IMAGE-WEB-PDF 1 1-s2.0-S2468823124002906-gr9.jpg https://s3-eu-west-1.amazonaws.com/prod-ucs-content-store-eu-west/content/pii:S2468823124002906/gr9/DOWNSAMPLED/image/jpeg/08860fd4821d224484ac1ea2c6fd684a/gr9.jpg gr9 gr9.jpg jpg 85614 349 621 IMAGE-DOWNSAMPLED 1-s2.0-S2468823124002906-gr7.jpg https://s3-eu-west-1.amazonaws.com/prod-ucs-content-store-eu-west/content/pii:S2468823124002906/gr7/DOWNSAMPLED/image/jpeg/41c0f03e753be6ef7d87465c46f2c3b6/gr7.jpg gr7 gr7.jpg jpg 132780 468 621 IMAGE-DOWNSAMPLED 1-s2.0-S2468823124002906-gr8.jpg https://s3-eu-west-1.amazonaws.com/prod-ucs-content-store-eu-west/content/pii:S2468823124002906/gr8/DOWNSAMPLED/image/jpeg/e93c35dc47943ec2ef4b0b54423c7b21/gr8.jpg gr8 gr8.jpg jpg 92893 343 621 IMAGE-DOWNSAMPLED 1-s2.0-S2468823124002906-gr1.jpg https://s3-eu-west-1.amazonaws.com/prod-ucs-content-store-eu-west/content/pii:S2468823124002906/gr1/DOWNSAMPLED/image/jpeg/296f7226b8eae637e8da5a7b6d66fbe7/gr1.jpg gr1 gr1.jpg jpg 66053 232 621 IMAGE-DOWNSAMPLED 1-s2.0-S2468823124002906-gr2.jpg https://s3-eu-west-1.amazonaws.com/prod-ucs-content-store-eu-west/content/pii:S2468823124002906/gr2/DOWNSAMPLED/image/jpeg/5be5f6e11dec880df2679173c0a04e74/gr2.jpg gr2 gr2.jpg jpg 117069 466 621 IMAGE-DOWNSAMPLED 1-s2.0-S2468823124002906-ga1.jpg https://s3-eu-west-1.amazonaws.com/prod-ucs-content-store-eu-west/content/pii:S2468823124002906/ga1/DOWNSAMPLED/image/jpeg/4b872eff5aba4bba92a6d9d61931b7dd/ga1.jpg ga1 true ga1.jpg jpg 46778 200 429 IMAGE-DOWNSAMPLED 1-s2.0-S2468823124002906-gr5.jpg https://s3-eu-west-1.amazonaws.com/prod-ucs-content-store-eu-west/content/pii:S2468823124002906/gr5/DOWNSAMPLED/image/jpeg/3c4b14f885629b1ce3df3dc6b1430168/gr5.jpg gr5 gr5.jpg jpg 61513 292 339 IMAGE-DOWNSAMPLED 1-s2.0-S2468823124002906-gr3.jpg https://s3-eu-west-1.amazonaws.com/prod-ucs-content-store-eu-west/content/pii:S2468823124002906/gr3/DOWNSAMPLED/image/jpeg/07a8ffc410e1bdb7b787d8d597a45f0e/gr3.jpg gr3 gr3.jpg jpg 44197 231 621 IMAGE-DOWNSAMPLED 1-s2.0-S2468823124002906-gr10.jpg https://s3-eu-west-1.amazonaws.com/prod-ucs-content-store-eu-west/content/pii:S2468823124002906/gr10/DOWNSAMPLED/image/jpeg/cda3e095662b4b7130df0d50112c8078/gr10.jpg gr10 gr10.jpg jpg 28821 252 339 IMAGE-DOWNSAMPLED 1-s2.0-S2468823124002906-gr4.jpg https://s3-eu-west-1.amazonaws.com/prod-ucs-content-store-eu-west/content/pii:S2468823124002906/gr4/DOWNSAMPLED/image/jpeg/be35e349ca01acc995228484508e70fa/gr4.jpg gr4 gr4.jpg jpg 64863 233 621 IMAGE-DOWNSAMPLED 1-s2.0-S2468823124002906-gr6.jpg https://s3-eu-west-1.amazonaws.com/prod-ucs-content-store-eu-west/content/pii:S2468823124002906/gr6/DOWNSAMPLED/image/jpeg/509e8b20c92980084d42cfe006842e77/gr6.jpg gr6 gr6.jpg jpg 77344 450 452 IMAGE-DOWNSAMPLED 1-s2.0-S2468823124002906-gr9.sml https://s3-eu-west-1.amazonaws.com/prod-ucs-content-store-eu-west/content/pii:S2468823124002906/gr9/THUMBNAIL/image/gif/7f10c3c82832c20f4d37c25b79010c97/gr9.sml gr9 gr9.sml sml 11576 123 219 IMAGE-THUMBNAIL 1-s2.0-S2468823124002906-gr7.sml https://s3-eu-west-1.amazonaws.com/prod-ucs-content-store-eu-west/content/pii:S2468823124002906/gr7/THUMBNAIL/image/gif/8f228916ece4ac6260431e0a851de0bb/gr7.sml gr7 gr7.sml sml 16802 163 217 IMAGE-THUMBNAIL 1-s2.0-S2468823124002906-gr8.sml https://s3-eu-west-1.amazonaws.com/prod-ucs-content-store-eu-west/content/pii:S2468823124002906/gr8/THUMBNAIL/image/gif/f86bddf1a02f2630ed98a2389142beb1/gr8.sml gr8 gr8.sml sml 15123 121 219 IMAGE-THUMBNAIL 1-s2.0-S2468823124002906-gr1.sml https://s3-eu-west-1.amazonaws.com/prod-ucs-content-store-eu-west/content/pii:S2468823124002906/gr1/THUMBNAIL/image/gif/f3a7e24ec43855599220ed8b24bb1ddf/gr1.sml gr1 gr1.sml sml 10328 82 219 IMAGE-THUMBNAIL 1-s2.0-S2468823124002906-gr2.sml https://s3-eu-west-1.amazonaws.com/prod-ucs-content-store-eu-west/content/pii:S2468823124002906/gr2/THUMBNAIL/image/gif/74ef42a5299e692ae954bec0e7e68e28/gr2.sml gr2 gr2.sml sml 18395 164 218 IMAGE-THUMBNAIL 1-s2.0-S2468823124002906-ga1.sml https://s3-eu-west-1.amazonaws.com/prod-ucs-content-store-eu-west/content/pii:S2468823124002906/ga1/THUMBNAIL/image/gif/fab24c0d7d08f55e15222df98d6fff7a/ga1.sml ga1 true ga1.sml sml 18161 102 219 IMAGE-THUMBNAIL 1-s2.0-S2468823124002906-gr5.sml https://s3-eu-west-1.amazonaws.com/prod-ucs-content-store-eu-west/content/pii:S2468823124002906/gr5/THUMBNAIL/image/gif/4a1f809e05b836e616b765bb0d000ec9/gr5.sml gr5 gr5.sml sml 17222 163 190 IMAGE-THUMBNAIL 1-s2.0-S2468823124002906-gr3.sml https://s3-eu-west-1.amazonaws.com/prod-ucs-content-store-eu-west/content/pii:S2468823124002906/gr3/THUMBNAIL/image/gif/b3caaf9bd6c31aec4d3fdfdbd66efa0b/gr3.sml gr3 gr3.sml sml 8277 82 219 IMAGE-THUMBNAIL 1-s2.0-S2468823124002906-gr10.sml https://s3-eu-west-1.amazonaws.com/prod-ucs-content-store-eu-west/content/pii:S2468823124002906/gr10/THUMBNAIL/image/gif/d3c1aa9eb876760757867136ad436072/gr10.sml gr10 gr10.sml sml 11080 163 219 IMAGE-THUMBNAIL 1-s2.0-S2468823124002906-gr4.sml https://s3-eu-west-1.amazonaws.com/prod-ucs-content-store-eu-west/content/pii:S2468823124002906/gr4/THUMBNAIL/image/gif/2315d6fad5fcf45695d84c6e26d8d487/gr4.sml gr4 gr4.sml sml 9883 82 219 IMAGE-THUMBNAIL 1-s2.0-S2468823124002906-gr6.sml https://s3-eu-west-1.amazonaws.com/prod-ucs-content-store-eu-west/content/pii:S2468823124002906/gr6/THUMBNAIL/image/gif/75162e177c30aca4bcf85a9257a96b0e/gr6.sml gr6 gr6.sml sml 21583 163 164 IMAGE-THUMBNAIL 1-s2.0-S2468823124002906-gr9_lrg.jpg https://s3-eu-west-1.amazonaws.com/prod-ucs-content-store-eu-west/content/pii:S2468823124002906/HIGHRES/image/jpeg/83b104e25cb57e390a6d37441a7c8ff4/gr9_lrg.jpg gr9 gr9_lrg.jpg jpg 1406693 1547 2750 IMAGE-HIGH-RES 1-s2.0-S2468823124002906-gr7_lrg.jpg https://s3-eu-west-1.amazonaws.com/prod-ucs-content-store-eu-west/content/pii:S2468823124002906/HIGHRES/image/jpeg/9f3d1af8187a152158d2753192914c90/gr7_lrg.jpg gr7 gr7_lrg.jpg jpg 2032814 2072 2750 IMAGE-HIGH-RES 1-s2.0-S2468823124002906-gr8_lrg.jpg https://s3-eu-west-1.amazonaws.com/prod-ucs-content-store-eu-west/content/pii:S2468823124002906/HIGHRES/image/jpeg/a2fa0eeefd33f48f46e79eba31d5639a/gr8_lrg.jpg gr8 gr8_lrg.jpg jpg 1456453 1518 2750 IMAGE-HIGH-RES 1-s2.0-S2468823124002906-gr1_lrg.jpg https://s3-eu-west-1.amazonaws.com/prod-ucs-content-store-eu-west/content/pii:S2468823124002906/HIGHRES/image/jpeg/614a99c539c66ac272ece3c0b6ebc841/gr1_lrg.jpg gr1 gr1_lrg.jpg jpg 963252 1029 2750 IMAGE-HIGH-RES 1-s2.0-S2468823124002906-gr2_lrg.jpg https://s3-eu-west-1.amazonaws.com/prod-ucs-content-store-eu-west/content/pii:S2468823124002906/HIGHRES/image/jpeg/0d4d87c1a35c78f118d89bd3f215d58f/gr2_lrg.jpg gr2 gr2_lrg.jpg jpg 1878320 2064 2750 IMAGE-HIGH-RES 1-s2.0-S2468823124002906-ga1_lrg.jpg https://s3-eu-west-1.amazonaws.com/prod-ucs-content-store-eu-west/content/pii:S2468823124002906/HIGHRES/image/jpeg/b7cc7de392c809acfdb14f79987fc706/ga1_lrg.jpg ga1 true ga1_lrg.jpg jpg 1011544 886 1902 IMAGE-HIGH-RES 1-s2.0-S2468823124002906-gr5_lrg.jpg https://s3-eu-west-1.amazonaws.com/prod-ucs-content-store-eu-west/content/pii:S2468823124002906/HIGHRES/image/jpeg/870829c550992e05b1447c0fb7757746/gr5_lrg.jpg gr5 gr5_lrg.jpg jpg 840471 1290 1500 IMAGE-HIGH-RES 1-s2.0-S2468823124002906-gr3_lrg.jpg https://s3-eu-west-1.amazonaws.com/prod-ucs-content-store-eu-west/content/pii:S2468823124002906/HIGHRES/image/jpeg/ee42df49a5aa6933a85ec925787b8f55/gr3_lrg.jpg gr3 gr3_lrg.jpg jpg 774031 1024 2750 IMAGE-HIGH-RES 1-s2.0-S2468823124002906-gr10_lrg.jpg https://s3-eu-west-1.amazonaws.com/prod-ucs-content-store-eu-west/content/pii:S2468823124002906/HIGHRES/image/jpeg/22e8e277de1d83d1e85a780480ef4fc4/gr10_lrg.jpg gr10 gr10_lrg.jpg jpg 524047 1117 1500 IMAGE-HIGH-RES 1-s2.0-S2468823124002906-gr4_lrg.jpg https://s3-eu-west-1.amazonaws.com/prod-ucs-content-store-eu-west/content/pii:S2468823124002906/HIGHRES/image/jpeg/81293f9f72acfd12bff40d638b7d4520/gr4_lrg.jpg gr4 gr4_lrg.jpg jpg 995318 1032 2750 IMAGE-HIGH-RES 1-s2.0-S2468823124002906-gr6_lrg.jpg https://s3-eu-west-1.amazonaws.com/prod-ucs-content-store-eu-west/content/pii:S2468823124002906/HIGHRES/image/jpeg/607a524a8fe429b10e70ec9178b9112c/gr6_lrg.jpg gr6 gr6_lrg.jpg jpg 747872 1993 2000 IMAGE-HIGH-RES 1-s2.0-S2468823124002906-mmc1.docx https://s3-eu-west-1.amazonaws.com/prod-ucs-content-store-eu-west/content/pii:S2468823124002906/mmc1/MAIN/application/vnd.openxmlformats-officedocument.wordprocessingml.document/a51b979b2a7ea085cf2e75607a6b54c3/mmc1.docx mmc1 mmc1.docx docx 1930082 APPLICATION 1-s2.0-S2468823124002906-am.pdf am am.pdf pdf 2027915 AAM-PDF https://s3-eu-west-1.amazonaws.com/prod-ucs-content-store-eu-west/content/egi:10G6JLTFZMW/MAIN/application/pdf/b5dbbcf590584736be43708be56993c7/am.pdf MCAT 114107 114107 S2468-8231(24)00290-6 10.1016/j.mcat.2024.114107 Elsevier B.V. Fig. 1 Catalytic activity of Pt/MgFe2O4, Pt/Fe2O3 and Pt/Al2O3 in CO oxidation at WHSV of 30,000 mL h−1 gcat. −1 (a) and Arrhenius plots for CO oxidation over Pt/MgFe2O4, Pt/Fe2O3 and Pt/Al2O3 (b). Fig 1 Fig. 2 The durability tests results of the Pt/MgFe2O4 catalysts at 150 °C (a) and cyclic stability tests of 1Pt/MgFe2O4 (b), 3Pt/MgFe2O4 (c) and 5Pt/MgFe2O4 (d) for CO oxidation under WHSV of 30,000 mL h−1 gcat. −1. Fig 2 Fig. 3 Catalytic performance over the 1Pt/MgFe2O4 (a) and 3Pt/MgFe2O4 (b) catalysts at 150 °C under WHSV of 50,500 mL h−1 gcat. −1 during successive reaction-regeneration cycles. Fig 3 Fig. 4 Adsorption-desorption isotherms of N2 (a) and pore-size distributions curves (b) for Pt/MgFe2O4, Pt/Fe2O3 and Pt/Al2O3 catalysts. Fig 4 Fig. 5 XRD patterns of Pt/MgFe2O4, Pt/Fe2O3 and Pt/Al2O3 catalysts. Fig 5 Fig. 6 STEM images of 1Pt/MgFe2O4 (a), 3Pt/MgFe2O4 (b), 5Pt/MgFe2O4 (c) and 5Pt/Al2O3 (d) catalysts. Fig 6 Fig. 7 CO-DRIFT spectra for the 1Pt/MgFe2O4 (a), 3Pt/MgFe2O4 (b), 5Pt/MgFe2O4 (c) and 5Pt/Al2O3 (d) catalysts. Fig 7 Fig. 8 XPS spectroscopy of Pt 4f for Pt/MgFe2O4 and Pt/Fe2O3 (a) and Pt 4d for Pt/Al2O3 (b) catalysts. Fig 8 Fig. 9 H2-TPR profiles for the Pt/MgFe2O4, Pt/Fe2O3 and Pt/Al2O3 catalysts (a) and CO-TPD profiles for the Pt/MgFe2O4 catalysts (b). Fig 9 Fig. 10 FT-IR profiles of the 3Pt/MgFe2O4 catalyst after long-term stability test of 100 h at 150 °C under WHSV of 50,500 mL h −1 gcat. −1. Fig 10 Table 1 Physicochemical parameters of the catalysts. Table 1 Samples SBET (m2/g) Pore size a (nm) Pore volume (cm3/g) Pt loading (wt.%) Ea (kJ/mol) dSTEM (nm) Total amount of desorbed CO2 and CO (mmol/g) b 1Pt/MgFe2O4 93.2 10.0 0.28 1.0 49.8 – 0.08 3Pt/MgFe2O4 92.1 10.9 0.28 2.9 43.9 – 0.13 5Pt/MgFe2O4 91.7 9.0 0.23 4.9 39.8 – 0.15 5Pt/Fe2O3 13.8 17.7 0.06 5.2 53.5 – – 5Pt/Al2O3 203.6 6.0 0.37 5.1 102.0 1.6 – a Obtained from the desorption isotherm with BJH method. b Calculated from CO-TPD curves of Fig. 9b. Facile fabrication of atomically dispersed Pt catalysts on MgFe2O4 toward efficient CO oxidation Fen Wang Writing – review & editing Writing – original draft Validation Funding acquisition Supervision a b ⁎ Yulong Li Validation Methodology Investigation Data curation a Yao Ouyang Validation Methodology Data curation a Xiumiao Yang Writing – review & editing Validation Investigation Data curation c ⁎ a School of Chemical and Blasting Engineering, Anhui University of Science and Technology, Huainan 232001, China School of Chemical and Blasting Engineering Anhui University of Science and Technology Huainan 232001 China aSchool of Chemical and Blasting Engineering, Anhui University of Science and Technology, Huainan 232001, China b Institute of Environment-friendly Materials and Occupational Health of Anhui University of Science and Technology (Wuhu), Wuhu 241003, China Institute of Environment-friendly Materials and Occupational Health of Anhui University of Science and Technology (Wuhu) Wuhu 241003 China bInstitute of Environment-friendly Materials and Occupational Health of Anhui University of Science and Technology (Wuhu), Wuhu 241003, China c School of Mechanical Engineering, Southeast University, Nanjing 211189, China School of Mechanical Engineering Southeast University Nanjing 211189 China cSchool of Mechanical Engineering, Southeast University, Nanjing 211189, China ⁎ Corresponding authors. Catalytic oxidation is an efficient way for removing low-concentration of toxic CO. The noble metal catalysts demonstrate outstanding catalytic properties in CO oxidation, but their high-cost present great challenges for further applications. Thus, developing atomically dispersed noble metal on support is a promising candidate because of the highest atom utilization efficiency. In this paper, a range of MgFe2O4 supported atomically dispersed Pt catalysts with different Pt loading (1–5 wt.%) have been successfully developed by simple incipient wetness impregnation technique. The activity of Pt/MgFe2O4 increases with Pt loading for CO oxidation. The catalytic activity of the 5Pt/MgFe2O4 (T50 = 102 °C, T90 = 133 °C) is much better than that of the 5Pt/Fe2O3 (T50 = 132 °C, T90 = 146 °C) and commonly used 5Pt/Al2O3 with PtOx size of ∼1.6 nm (T50 = 156 °C, T90 = 163 °C) at WHSV of 30,000 mL h−1 gcat. −1. All Pt/MgFe2O4 catalysts displayed superior cyclic stability throughout five consecutive heating–cooling cycles via a possible reaction mechanism of Mars–van Krevelen. The 1Pt/MgFe2O4 and 3Pt/MgFe2O4 were gradually deactivated in the long-term catalytic stability testing of 150 °C, and the activity could be fully restored after regeneration, suggesting that the catalysts deactivation was due to the formation of carbonates. These above results provide a useful reference for the development of advanced CO oxidation catalysts in the future. Graphical abstract Image, graphical abstract Keywords Platinum MgFe2O4 Atomically dispersed catalysts Carbonates CO oxidation Data availability No data was used for the research described in the article. 1 Introduction Carbon monoxide (CO) gas is widely generated from incomplete combustion of carbon-containing compounds. CO is highly toxic. It binds with hemoglobin in blood, which leads to a decrease in the supply of oxygen, thus causing damages for the central nervous system [1]. Even small amounts of CO can cause serious poison on human body in enclosed environments. In addition, even very low concentrations of CO can poison the metal catalysts of important industrial reactions. For example, even trace of CO (ppm-level) in the H2 feed can result in a drastic drop in electrocatalytic activity of anode Pt catalysts in fuel cell [2]. For ammonia synthesis, CO is a poison of the Fe-based catalysts [3]. Catalytic oxidation has been currently considered as one of the most effective techniques of removing CO. The main challenge of this techniques lies in designing low-cost and highly efficient CO oxidation catalysts. Although transition metal oxides catalysts, such as CuO [4,5], Co3O4 [6,7], and MnO2 [8,9] have the advantages of low cost, their CO oxidation activity is far below than that of the noble metal (like Pt, Au, Pd, Ru and Rh) catalysts [10–12]. Among them, Pt catalysts are the most used for oxidation reactions. In order to maximize the utilization of each platinum atom and reduce the cost of catalysts, the atomically dispersed Pt catalysts have attracted much attention since 2011 [13]. The atomically dispersed Pt catalysts are widely used in water–gas shift reaction [14,15], CO oxidation reaction [16], and so on. Recently, iron oxide (FeOx) has been reported as an excellent support in dispersing noble metals Pt [13], Ir [17], and Au [18] through the strong metal–support interaction. However, FeOx as a monometallic oxide has relatively low surface area, especially after the heat treatment at high temperature. Spinel materials, especially mixed oxides, have been intensively investigated and presented promising surface area and thermal stability as catalyst support materials for supported catalysts. On the basis of the above considerations, the use of MgFe2O4 as catalyst support to prepare atomically dispersed Pt catalysts with various Pt loadings is very promising. Here, we have successfully synthesized a range of atomically dispersed Pt/MgFe2O4 with various Pt loading by simple incipient wetness impregnation. The performance of Pt/MgFe2O4 in CO oxidation was assessed and the structure of catalysts was explored. The activity of Pt/MgFe2O4 increases with Pt loading and the excellent cyclic stability was achieved on all the Pt/MgFe2O4 catalysts for CO oxidation under WHSV of 30,000 mL h−1 gcat. −1 via a possible mechanism of Mars–van Krevelen. For comparison, the 5Pt/Fe2O3 and commonly used 5Pt/Al2O3 with particle size of ∼1.6 nm was also prepared and the 5Pt/MgFe2O4 is more active than the 5Pt/Fe2O3 and 5Pt/Al2O3. The deactivation behaviour of the 1Pt/MgFe2O4 and 3Pt/MgFe2O4 during the long-term reaction at 150 °C has been studied and we confirm that the carbonates are the main reason for Pt/MgFe2O4 catalyst deactivation. 2 Experimental 2.1 Synthesis of Pt/MgFe2O4, Pt/Fe2O3 and Pt/Al2O3 MgFe2O4 was synthesized through a solid-state method which we reported before [19]. Briefly, magnesium sulfate, iron nitrate nonahydrate, sodium chloride and sodium hydroxide with molar ratio of 1: 2: 10: 8 were mixed evenly by grinding vigorously for 30 min. After calcination at 700 °C in ambient air for 1 h, the obtained solid was washed thoroughly with pure water and finally dried at 120 °C. Fe2O3 was prepared using same procedure as MgFe2O4. Iron nitrate nonahydrate, sodium chloride and sodium hydroxide with molar ratio of 1: 5: 3 were used in the preparation of Fe2O3. Al2O3 support was purchased from Shandong Aluminum Industry. Pt/MgFe2O4 (with nominal Pt loading of 1, 3 and 5 wt.%) were synthesized through facile incipient wetness impregnation of MgFe2O4 with H2PtCl6·6H2O (Damas-beta, Shanghai, China) aqueous solution. The resulting sample was dried at 60 °C, followed by calcination at 500 °C in ambient air for 5 h. After natural cooling, the acquired solid was washed thoroughly with pure water and then dried at 120 °C. For comparison, Pt/Fe2O3 and Pt/Al2O3 (with nominal Pt loading of 5 wt.%) were also synthesized using same procedure as Pt/MgFe2O4 catalysts. The produced catalysts were denoted as xPt/MgFe2O4, xPt/Fe2O3, and xPt/Al2O3, where x represents the nominal Pt loading of the catalysts. 2.2 Catalyst structural characterization BET surface areas of samples were determined on a Micromeritics ASAP 2460 analyzers by using nitrogen physisorption at −196 °C. The samples were treated at 200 °C in a vacuum for 3 h prior to measurements. The Pt weight content of as-prepared samples was obtained by inductively coupled plasma spectrometer using an Agilent 5110 apparatus. The crystal structure of samples was characterized by X-ray diffraction (XRD) on a SmartLab SE apparatus. The morphology and elemental distribution of as-prepared samples were investigated by aberration-corrected scanning-transmission electron-microscopy (AC-STEM) on a FEI Themis Z instrument with a Super X-EDX detector. Diffuse reflectance infrared Fourier transform spectroscopy (DRIFTs) data was collected from a Bruker Tensor 27 instruments. Before the infrared tests, the sample was treated at 120 °C in Ar for 30 min for removing impurities and water. After cooling down to 30 °C under a stream of Ar gas, 20 vol.% CO/Ar was introduced to reach saturated CO adsorption. Subsequently, the gas was switched to Ar gas for purging and the DRIFT spectra were acquired. X-ray photoelectron spectroscopy (XPS) signals were recorded on an ESCALAB 250Xi instrument. The values of binding energies were calibrated by C 1s located at 284.6 eV. Hydrogen temperature-programmed reduction (H2-TPR) experiments were conducted using an AutoChem II 2920 instrument. Before reduction, the samples were exposed to Ar of 300 °C for 30 min and then cooled down to 50 °C. Subsequently, the temperature of samples was increased to 900 °C in 10 vol.% H2/Ar at 10 °C/min. CO temperature-programmed desorption (CO-TPD) experiments were conducted on a Bel Cata II Chemisorption analyzer which coupled with a mass spectrometer. Before CO absorption, the samples were exposed to He of 300 °C for 1 h and then cooled down to 50 °C. Subsequently, 10 vol.% CO/He of 50 mL/min was pass through the sample for 1 h. Then, the gas was switched to He for removal of the weakly adsorbed CO. Finally, the temperature of samples was ramped to 900 °C and the mass spectrometric (MS) signals of CO with an m/z of 28 and CO2 with an m/z of 44 were recorded in the heating process. Fourier transform infrared (FT-IR) characterization was conducted using a Nicolet iS50 instrument. Before measurements, the sample was finely dispersed in KBr and then compressed into a slice. 2.3 Catalytic performance tests The activity and stability of Pt/MgFe2O4, Pt/Fe2O3 and Pt/Al2O3 were tested for CO oxidation in fixed-bed apparatus of atmospheric pressure. A mixture of 50 mg of powdered catalyst and 1 g of silica sand was introduced into a quartz tube with internal diameters of 10 mm. The reactant including 1 vol.% CO, 1 vol.% O2 and 98 vol.% N2 was fed into catalyst bed. The activity test was conducted in the range of room temperature to 300 °C at 25 mL/min and the weight hourly space velocity (WHSV) was 30,000 mL h−1 gcat. −1. Catalysts durability tests were performed at 150 °C under WHSV of 30,000 or 50,500 mL h−1 gcat. −1. Repeated reaction-regeneration cycles were performed as follows. The steady state test was proceeded at 150 °C for 3 h with WHSV of 50,500 mL h−1 gcat. −1. The regeneration process was conducted at 200 °C in 25 mL/min of 20 vol.% O2/N2 for 30 min. Component of the outlet gas was determined using an on-line infrared analyzer (FGA 10). The calculated formula of CO conversion was (CCO, inlet − CCO, outlet)/CCO, inlet × 100 %, in which CCO, inlet and CCO, outlet represented the CO concentrations of gas mixtures at inlet and outlet, respectively. 3 Results and discussion 3.1 Catalytic performance The catalytic activities of Pt/MgFe2O4, Pt/Fe2O3 and Pt/Al2O3 in CO oxidation were assessed. The results are displayed in Fig. 1 a. The catalyst activities were assessed by the values of T10, T50 and T90, which correspond to the temperature at which CO conversion reaches 10 %, 50 % and 90 %, respectively. It was observed that the MgFe2O4 exhibited inferior activity for CO oxidation, giving 183, 231 and 248 °C of T10, T50 and T90 values, respectively. The catalysts exhibit apparently better activities than pure MgFe2O4 with addition of Pt. CO conversion temperature of the Pt/MgFe2O4 catalysts are ranked as follows: 1Pt/MgFe2O4 (T10 = 108 °C, T50 = 148 °C, T90 = 173 °C) < 3Pt/MgFe2O4 (T10 = 80 °C, T50 = 117 °C, T90 = 149 °C) < 5Pt/MgFe2O4 (T10 = 67 °C, T50 = 102 °C, T90 = 133 °C). The findings suggest that Pt species play key roles in catalyst performance for CO oxidation. Additionally, the influence of support type was also investigated. 5Pt/Fe2O3 and 5Pt/Al2O3 show much lower activity than 5Pt/MgFe2O4 with similar loading of Pt. The T10, T50 and T90 over 5Pt/Fe2O3 are 84, 132 and 146 °C, respectively. The T10, T50 and T90 over 5Pt/Al2O3 are 127, 156 and 163 °C, respectively, while are 67, 102 and 133 °C for 5Pt/MgFe2O4. Compared with Fe2O3 and Al2O3 supports, the MgFe2O4 significantly enhances the Pt catalyst activity in CO oxidation. The corresponding T10, T50 and T90 values over Pt/MgFe2O4, Pt/Fe2O3 and Pt/Al2O3 are presented in Table S1. Fig. 1b shows the Arrhenius plots for CO oxidation on Pt/MgFe2O4, Pt/Fe2O3 and Pt/Al2O3 at low CO conversions (below 20 %). Table 1 presents the values of apparent activation energy (Ea) over Pt/MgFe2O4, Pt/Fe2O3 and Pt/Al2O3, which were calculated from the slopes of Arrhenius plots. The 1Pt/MgFe2O4, 3Pt/MgFe2O4, 5Pt/MgFe2O4, 5Pt/Fe2O3 and 5Pt/Al2O3 presented the Ea values of 49.8, 43.9, 39.8, 53.5 and 102.0 kJ/mol, respectively. For Pt/MgFe2O4 catalysts, the Ea values decrease with increasing the Pt loading, and all these Ea values are lower than that of 5Pt/Fe2O3 and 5Pt/Al2O3. Such low Ea values on the Pt/MgFe2O4 are favorable for catalysts to exhibit high performance in CO oxidation reaction. The CO turnover rates at 80 °C on 1Pt/MgFe2O4, 3Pt/MgFe2O4 and 5Pt/MgFe2O4 are calculated to be 0.0020, 0.0025 and 0.0028 mol/(molPt-s), respectively, showing a slight increase with the increase of Pt loading in Pt/MgFe2O4. The durability and cyclic stability of the Pt/MgFe2O4 catalyst were investigated under WHSV of 30,000 mL h−1 gcat. −1. As illustrated in Fig. 2 a, the 5Pt/MgFe2O4 shows stable CO conversion of 100 % during the TOS of 23 h. The 3Pt/MgFe2O4 catalyst exhibits initial CO conversion of 90.9 %, and then deactivates gradually during 12 h TOS with CO conversion decreasing to 69.1 %. The 1Pt/MgFe2O4 catalyst exhibits initial CO conversion of 54.1 %, and then gradually deactivates at about 12 h TOS with CO conversion declining to 18.9 %. As displayed in Fig. 2b–d, the five conversion curves over 1Pt/MgFe2O4 are almost same for the five consecutive catalytic reaction cycles. Similar phenomena can be observed on 3Pt/MgFe2O4 and 5Pt/MgFe2O4 catalysts. These results indicated that the Pt/MgFe2O4 catalysts exhibited excellent cyclic stability in CO oxidation rection. The regeneration stability of the 1Pt/MgFe2O4 and 3Pt/MgFe2O4 catalysts was investigated with interval regeneration for every 3 h. High WHSV of 50,500 mL h−1 gcat. −1 was adopted in order to deactivate the catalyst quickly. As illustrated in Fig. 3 a, 1Pt/MgFe2O4 displayed a continuous decrease in the CO conversion in the first reaction period from 32.7 % to 13.9 %. In the subsequent second and third runs, the initial CO conversion can be recovered to 36.6 %, and then decreased to 9.9 % and 7.9 % within 3 h, respectively. As shown in Fig. 3b, in the first reaction period, the 3Pt/MgFe2O4 catalysts exhibited initial CO conversion of 83.2 % and then deactivates gradually during 3 h TOS with CO conversion decreasing to 76.2 %. In the subsequent second and third runs, the initial CO conversion can be recovered to 100 %, and then decreased to 65.3 % and 91.1 % within 3 h, respectively. These results demonstrate that the accumulation of carbonates is the major reason of deactivation for Pt/MgFe2O4 catalysts, which is consistent with literature reports that Pt-CoO/Al2O3 deactivation in CO oxidation is cause by the formation of carbonate covering the active sites [20]. 3.2 Catalyst characterizations The actual Pt loadings of Pt/MgFe2O4, Pt/Fe2O3 and Pt/Al2O3 catalysts analysed by ICP-OES are illustrated in Table 1. The Pt loadings are 1.0, 2.9, 4.9, 5.2 and 5.1 wt.% for 1Pt/MgFe2O4, 3Pt/MgFe2O4, 5Pt/MgFe2O4, 5Pt/Fe2O3 and 5Pt/Al2O3, respectively, which is close to the nominal values. It indicates that the Pt loadings are almost precisely controlled during the preparation process. Fig. 4 presents the adsorption isotherms of N2 and the pore-size distributions curves for Pt/MgFe2O4, 5Pt/Fe2O3 and Pt/Al2O3 catalysts. The 1Pt/MgFe2O4, 3Pt/MgFe2O4 and 5Pt/MgFe2O4 catalysts exhibit similar BET surface areas of 93.2, 92.1 and 91.7 m2/g, respectively. The 5Pt/Fe2O3 has surface areas of 13.8 m2/g, while the 5Pt/Al2O3 catalyst has surface areas as high as 203.6 m2/g, as illustrated in Table 1. It is obvious that the Pt/MgFe2O4, 5Pt/Fe2O3 and Pt/Al2O3 catalysts have mesoporous structure and the pore sizes are 10.0, 10.9, 9.0, 17.7 and 6.0 nm for 1Pt/MgFe2O4, 3Pt/MgFe2O4, 5Pt/MgFe2O4, 5Pt/Fe2O3 and 5Pt/Al2O3, respectively. The corresponding pore volumes are 0.28, 0.28, 0.23, 0.06 and 0.37 cm3/g. Fig. 5 displays the XRD patterns of Pt/MgFe2O4, Pt/Fe2O3 and Pt/Al2O3 catalysts. The 5Pt/Fe2O3 exhibits obvious diffractions indexed to Fe2O3 (JCPDS 33–0664) and Pt (JCPDS 04–0802), respectively. The average crystalline sizes of Pt were calculated to be above 100 nm by using Scherrer equation based on the XRD diffraction at 2θ of 39.8°. The Pt/MgFe2O4 and Pt/Al2O3 exhibit broad diffractions indexed to spinel MgFe2O4 (JCPDS 73–1720) and Al2O3 (JCPDS 10–0425), respectively. No detectable diffraction corresponding to PtOx was observed due to its small particle size below XRD detection limit, indicating that highly dispersed Pt oxidic species exist in both Pt/MgFe2O4 and Pt/Al2O3 catalysts. This result was further verified by ACHAADF-STEM characterization. Representative ACHAADF-STEM images of 1Pt/MgFe2O4, 3Pt/MgFe2O4 and 5Pt/MgFe2O4 are displayed in Figs. 6 a, b and c, respectively. For 1Pt/MgFe2O4, 3Pt/MgFe2O4 and 5Pt/MgFe2O4 catalysts, the isolated single Pt atoms were observed on MgFe2O4 surfaces from high-magnification images. In addition, very few Pt dimers and clusters are observed in the 3Pt/MgFe2O4 and 5Pt/MgFe2O4 catalysts, as indicated by green and yellow circles in the images, respectively. As shown in Figs. S1a–c, no PtOx nanoparticles can be observed on the 1Pt/MgFe2O4, 3Pt/MgFe2O4 and 5Pt/MgFe2O4 catalysts from the low-magnification images. By analyzing many images of different magnification of the 1Pt/MgFe2O4, 3Pt/MgFe2O4 and 5Pt/MgFe2O4 catalysts, we have found that only atomically dispersed Pt atoms exist in the catalysts without the presence of PtOx nanoparticles. Fig. S2 displays the EDS images of the 5Pt/MgFe2O4 catalyst. It demonstrates that the Pt atoms distribute evenly on MgFe2O4. Fig. 6d presents the STEM images and the corresponding particle size distribution results of 5Pt/Al2O3 catalyst. It is obvious that a large number of nanosized PtOx particles are densely and evenly supported on Al2O3. As displayed in the insert images in Fig. 6d, the statistical size distribution illustrates that the sizes of the PtOx particles are mainly in a narrow range of 1.0–2.2 nm with average size of ∼ 1.6 nm. Furthermore, as displayed in Fig. S3, the EDS images of the 5Pt/Al2O3 catalyst exhibits the even elemental distributions of Pt, Al, and O, suggesting the uniform deposition of the PtOx nanoparticles on the surface of Al2O3. To further confirm the structure of Pt species in Pt/MgFe2O4 and Pt/Al2O3, in situ CO-DRIFTs tests were performed. As seen from Fig. 7 , all samples show two typical absorption peaks at 2169 and 2119 cm–1, which are related to gaseous CO [21]. For 3Pt/MgFe2O4 and 5Pt/MgFe2O4, a main peak at 2062 and 2087 cm–1, attributed to CO linear adsorption on oxidized monoatomic Pt [22], was observed. In addition, a very weak peak at 1834 cm–1, ascribed to the bridged CO adsorption on two adjacent Pt atoms, was also observed in the 3Pt/MgFe2O4 and 5Pt/MgFe2O4. The formation of bridged CO adsorption indicates the presence of dimers or clusters of Pt [23], which is consistent with the results of STEM. Differently, on 1Pt/MgFe2O4 catalyst, no adsorption of CO was observed, which is consistent with literature reported results that no adsorption of CO was detected on Pt1/MgAl1.2Fe0.8O4 [24]. For 5Pt/Al2O3 catalyst, the CO linear adsorption at 2114 and 2056 cm–1 and bridged adsorption at 1810 cm–1 on small oxidized Pt nanoparticles were observed, respectively [25,26]. To investigate the electronic structures of platinum species in catalysts, X-ray photoelectron spectroscopy (XPS) was performed. Fig. S4 shows the XPS survey spectra for Pt/MgFe2O4, Pt/Fe2O3 and Pt/Al2O3. The results indicate the presence of Pt, Mg, Fe, and O elements in all Pt/MgFe2O4. The elements of Pt, Fe, and O exist in 5Pt/Fe2O3. The elements of Pt, Al, and O were detected in 5Pt/Al2O3. As displayed in Fig. 8 a, the Pt 4f spectra of all Pt/MgFe2O4 catalysts could be deconvoluted into four peaks. The pair of peaks at binding energies of 72.8 and 76.0 eV are assigned to Pt2+ species [27–29], whereas the peaks at binding energies of 74.8 and 78.2 eV are ascribed to Pt4+ species, suggesting the likely co-existence of both Pt4+ and Pt2+ on the Pt/MgFe2O4 surface. For 5Pt/Fe2O3, similar Pt species exist, showing decreases of 0.4 and 0.7 eV in the binding energies of Pt4+ and Pt2+, respectively. Although the Pt 4f signals are the most intense for Pt species, Pt 4d spectra were recorded for 5Pt/Al2O3 catalyst because of the overlap of the Pt 4f signal with Al 2p. Fig. 8b presents Pt 4d spectra of 5Pt/Al2O3 catalyst. For Pt 4d spectra, it can be fitted into four peaks with BEs of 314.9, 317.6, 331.9 and 334.6 eV. The pairs of binding energies centred at 314.9 and 331.9 eV, and 317.6 and 334.6 eV are assigned to Pt2+ and Pt4+ species, respectively [30,31], indicating that the existence of Pt2+ and Pt4+ species for 5Pt/Al2O3. According to the ratio of peak area of Pt2+ to the sum of peak areas of Pt2+ and Pt4+, the proportion of Pt2+ in 5Pt/MgFe2O4 and 5Pt/Al2O3 is calculated to be 36.8 % and 29.3 %, respectively. It is generally believed that the Pt2+ species in CO oxidation is more active than Pt4+ species at low temperature [32,33], indicating that the activity of 5Pt/MgFe2O4 in CO oxidation may be higher than that of 5Pt/Al2O3. Fig. S5 shows the O 1s XPS spectra for Pt/MgFe2O4, Pt/Fe2O3 and Pt/Al2O3. The fitted peak at 531.0 eV in Pt/MgFe2O4 is attributed to the adsorbed oxygen species on the catalyst surface [19]. Compared with Pt/MgFe2O4, the binding energies of the adsorbed oxygen species on 5Pt/Fe2O3 and 5Pt/Al2O3 have increased by 0.6 and 0.8 eV, respectively, suggesting the more active adsorbed oxygen species formed on Pt/MgFe2O4 catalyst [13,34]. It was reported that the adsorbed oxygen species could promote the adsorption and activation of O2 molecules [19]. The more active adsorbed oxygen species in Pt/MgFe2O4 are beneficial for its high catalytic activity. Fig. 9 a shows the H2-TPR results of Pt/MgFe2O4, Pt/Fe2O3, Pt/Al2O3 and MgFe2O4 support. A distinct H2 consumption peak centred at 120 °C was observed for 1Pt/MgFe2O4, which is ascribed to the reduction of oxidized Pt species [29]. However, the reduction temperature of oxidized Pt decreased with increasing Pt loading (106 °C for 3Pt/MgFe2O4 and 97 °C for 5Pt/MgFe2O4), suggesting that the metal–support interaction became weaker. Considering the fact that Mg2+ is rather difficult to be reduced, the reduction peak above 240 °C in MgFe2O4 and Pt/MgFe2O4 is associated with Fe species reduction [25]. For 5Pt/Fe2O3, there is a distinct reduction peak at 364 °C, which is attributed to the reduction of oxidized Pt species. Reduction peaks above 400 °C are ascribed to the reduction of Fe species [35]. As for the 5Pt/Al2O3, only a broad and relatively weak reduction peak at 196 °C was observed in the range of 50−900 °C, which is ascribed to the facts that small size of oxidized Pt nanoparticles (∼2 nm) can be reduced below 50 °C [36]. This difference of reduction temperature for oxidized Pt suggests that the bonding of oxygen species in Pt/MgFe2O4 and Pt/Fe2O3 is stronger compared to that of Pt/Al2O3. Fig. 9b shows the CO-TPD results of the Pt/MgFe2O4 catalysts. Significant quantities of CO2 and minor amounts of CO were detected for all Pt/MgFe2O4 catalysts. The production of CO2 is result of the reaction of adsorbed CO species with the lattice oxygen. This is generally seen as the first step of oxidation reaction for Mars–van Krevelen mechanism [37], suggesting that CO oxidation may follow Mars–van Krevelen mechanism on Pt/MgFe2O4 catalysts. The amount of CO2 and CO was calculated from the calibrated desorption peak areas. The total amount of the detected CO2 and CO is 0.08, 0.13 and 0.15 mmol/g for the 1Pt/MgFe2O4, 3Pt/MgFe2O4 and 5Pt/MgFe2O4, respectively, as displayed in Table 1. The amount of adsorbed CO increases in the order of 1Pt/MgFe2O4<3Pt/MgFe2O4<5Pt/MgFe2O4 because CO2 is produced from CO, which is consistent well with the DRIFT data. The FT-IR analyses of the spent 3Pt/MgFe2O4 catalyst after 100 h reaction at 150 °C were performed because no IR signals related to carbonates could be detected over the spent 3Pt/MgFe2O4 after 12 h reaction at 150 °C probably due to the low concentration of carbonates. The obtained FT-IR curves are shown in Fig. 10 . The double band at 1384 and 1352 cm−1 is attributed to the ν3 band splitting of CO3 2− [38]. The band at 2900−3700 cm−1 and 1593 cm−1 are ascribed to the stretching vibrations of O–H and bending vibrations of H–O–H of adsorbed water, respectively [39], whereas the water mainly originated from residual water in KBr. The results indicate that carbonate species produced on 3Pt/MgFe2O4 during the long-term reaction process at 150 °C. 3.3 Discussion An atomically dispersed Pt with Pt loading of 1, 3 and 5 wt.% can be successfully obtained on a MgFe2O4 support. The activity and long-term stability of Pt/MgFe2O4 increased as increasing Pt loading (Figs. 1 and 2a). The obtained 5Pt/MgFe2O4 catalyst showed a high CO oxidation activity (T90 = 133 °C), which surpass the activity of 5Pt/Fe2O3 (T90 = 146 °C) and 5Pt/Al2O3 (T90 = 163 °C) (Table S1). A stable CO conversion of 100 % was obtained during 23 h TOS at 150 °C under WHSV of 30,000 mL h−1 gcat. −1 in 5Pt/MgFe2O4 (Fig. 2a). It was also observed that the Pt/MgFe2O4 with Pt loading of 1, 3 and 5 wt.% has good catalytic cyclic stability for CO oxidation (Figs. 2b–d). The fact that the deactivated 1Pt/MgFe2O4 and 3Pt/MgFe2O4 catalysts can be regenerated after 20 vol.% O2/N2 treatment implies that its deactivation is most probably due to the deposited carbonates (Fig. 3). As seen from XRD data (Fig. 5), the Pt/MgFe2O4 displayed MgFe2O4 phase and the crystalline sizes of Pt in 5Pt/Fe2O3 exceed 100 nm calculated from the peak at 2θ of 39.8°. The AC-STEM and DRIFT results demonstrated that the atomically dispersed Pt species exist in Pt/MgFe2O4 and the PtOx nanoparticles of ∼1.6 nm formed in 5Pt/Al2O3 (Figs. 6 and 7). According to the XPS characterization results, the Pt4+ and Pt2+ species coexist in Pt/MgFe2O4, Pt/Fe2O3 and Pt/Al2O3, and Pt4+ is the main species. Compared with 5Pt/Fe2O3 and 5Pt/Al2O3, the adsorbed oxygen species is more active on Pt/MgFe2O4. H2-TPR results disclosed that the interaction between Pt species and MgFe2O4 decreased with increasing Pt loading (Fig. 9a). CO-TPD results demonstrated that the oxidation of CO on Pt/MgFe2O4 may follow Mars–van Krevelen (MvK) mechanism (Fig. 9b). The deposition of carbonates in the spent 3Pt/MgFe2O4 was further confirmed by FT-IR analysis (Fig. 10). All the above results suggest that the atomically dispersed Pt/MgFe2O4 with Pt loading of 1, 3 and 5 wt.% can be successfully prepared by simple incipient wetness impregnation method and exhibits excellent cyclic stability in CO oxidation reaction. The atomically dispersed 5Pt/MgFe2O4 catalyst indeed is more active than that of the 5Pt/Fe2O3 and commonly used 5Pt/Al2O3 with PtOx size of ∼1.6 nm for CO oxidation. The CO oxidation reaction most probably proceeds via a Mars–van Krevelen (MvK) mechanism over Pt/MgFe2O4 and the deposited carbonates are main reason for deactivating 1Pt/MgFe2O4 and 3Pt/MgFe2O4 in long-term reaction at 150 °C. 4 Conclusions In conclusion, we have reported a facile method for preparing atomically dispersed Pt/MgFe2O4 catalyst with Pt loading of 1, 3 and 5 wt.%. The catalytic test results showed that the activity of Pt/MgFe2O4 increases with increasing Pt loading from 1 to 5 wt.%. All the Pt/MgFe2O4 catalysts display an excellent cyclic stability at WHSV of 30,000 mL h−1 gcat. −1 for CO oxidation, which possibly proceeds via the Mars–van Krevelen reaction mechanism. The atomically dispersed 5Pt/MgFe2O4 displays better catalytic activity than that of the 5Pt/Fe2O3 and commonly used 5Pt/Al2O3 (dPtOx ≈ 1.6 nm). Although an obvious deactivation was observed over 1Pt/MgFe2O4 and 3Pt/MgFe2O4 during the long-term stability test at 150 °C, the activity could be recovered after regeneration at 200 °C due to deactivation caused by carbonates. These findings provide valuable information on design of atomically dispersed Pt-based catalysts with higher efficiency and stability for CO oxidation. CRediT authorship contribution statement Fen Wang: Writing – review & editing, Writing – original draft, Validation, Funding acquisition, Supervision. Yulong Li: Validation, Methodology, Investigation, Data curation. Yao Ouyang: Validation, Methodology, Data curation. Xiumiao Yang: Writing – review & editing, Validation, Investigation, Data curation. Declaration of competing interest The authors declare that they have no known competing financial interests or personal relationships that could have appeared to influence the work reported in this paper. Acknowledgments This research was supported by the Natural Science Research Project of Colleges and Universities in Anhui Province (2023AH051207), the National Natural Science Foundation of China (22308007), the Anhui Provincial Natural Science Foundation (2108085QB49) and the Research Foundation of the Institute of Environment-friendly Materials and Occupational Health of Anhui University of Science and Technology (Wuhu) (ALW2022YF05). Supplementary materials Supplementary material associated with this article can be found, in the online version, at doi:10.1016/j.mcat.2024.114107. Appendix Supplementary materials Image, application 1 References [1] S.W. Ryter L.E. Otterbein Carbon monoxide in biology and medicine Bioessays 26 2004 270 280 S.W. Ryter, L.E. Otterbein, Carbon monoxide in biology and medicine, Bioessays, 26 (2004) 270–280. [2] Z. Liu L. Ma J. Zhang K. Hongsirikarn J.G. Goodwin Pt alloy electrocatalysts for proton exchange membrane fuel cells: a review Catal. Rev.: Sci, Eng. 55 2013 255 288 Z. Liu, L. Ma, J. Zhang, K. Hongsirikarn, J.G. Goodwin, Pt alloy electrocatalysts for proton exchange membrane fuel cells: a review, Catal. Rev.: Sci, Eng., 55 (2013) 255–288. [3] K.C. Waugh D. Butler B.E. Hayden The mechanism of the poisoning of ammonia synthesis catalysts by oxygenates O2, CO and H2O: an in situ method for active surface determination Catal. Lett. 24 1994 197 210 K.C. Waugh, D. Butler, B.E. Hayden, The mechanism of the poisoning of ammonia synthesis catalysts by oxygenates O2, CO and H2O: an in situ method for active surface determination, Catal. Lett., 24 (1994) 197–210. [4] Z. Zhang L. Fan W. Liao F. Zhao C. Tang J. Zhang M. Feng J. Lu Structure sensitivity of CuO in CO oxidation over CeO2-CuO/Cu2O catalysts J. Catal. 405 2022 333 345 Z. Zhang, L. Fan, W. Liao, F. Zhao, C. Tang, J. Zhang, M. Feng, J. Lu, Structure sensitivity of CuO in CO oxidation over CeO2-CuO/Cu2O catalysts, J. Catal., 405 (2022) 333–345. [5] K. Prabhakar Reddy H. Choi D. Kim R. Ryoo J.Y. Park Cu oxide deposited on shape-controlled ceria nanocrystals for CO oxidation: influence of interface-driven oxidation states on catalytic activity Catal. Sci. Technol. 11 2021 6134 6142 K. Prabhakar Reddy, H. Choi, D. Kim, R. Ryoo, J.Y. Park, Cu oxide deposited on shape-controlled ceria nanocrystals for CO oxidation: influence of interface-driven oxidation states on catalytic activity, Catal. Sci. Technol., 11 (2021) 6134–6142. [6] Y. Cai J. Xu Y. Guo J. Liu Ultrathin, polycrystalline, two-dimensional Co3O4 for low-temperature CO oxidation ACS Catal. 9 2019 2558 2567 Y. Cai, J. Xu, Y. Guo, J. Liu, Ultrathin, polycrystalline, two-dimensional Co3O4 for low-temperature CO oxidation, ACS Catal., 9 (2019) 2558–2567. [7] Y. Liu Y. Peng M. Naschitzki S. Gewinner W. Schöllkopf H. Kuhlenbeck R. Pentcheva B.Roldan Cuenya Surface oxygen vacancies on reduced Co3O4 (100): superoxide formation and ultra-low-temperature CO oxidation Angew. Chem. Int. Ed. 60 2021 16514 16520 Y. Liu, Y. Peng, M. Naschitzki, S. Gewinner, W. Schöllkopf, H. Kuhlenbeck, R. Pentcheva, B.Roldan Cuenya, Surface oxygen vacancies on reduced Co3O4 (100): superoxide formation and ultra-low-temperature CO oxidation, Angew. Chem. Int. Ed., 60 (2021) 16514–16520. [8] J. Gao C. Jia L. Zhang H. Wang Y. Yang S.F. Hung Y.Y. Hsu B. Liu Tuning chemical bonding of MnO2 through transition-metal doping for enhanced CO oxidation J. Catal. 341 2016 82 90 J. Gao, C. Jia, L. Zhang, H. Wang, Y. Yang, S.F. Hung, Y.Y. Hsu, B. Liu, Tuning chemical bonding of MnO2 through transition-metal doping for enhanced CO oxidation, J. Catal., 341 (2016) 82–90. [9] Y. Xi J.C. Ren Design of a CO oxidation catalyst based on two-dimensional MnO2 J. Phys. Chem. C 120 2016 24302 24306 Y. Xi, J.C. Ren, Design of a CO oxidation catalyst based on two-dimensional MnO2, J. Phys. Chem. C, 120 (2016) 24302–24306. [10] M.A. van Spronsen J.W.M. Frenken I.M.N. Groot Surface science under reaction conditions: CO oxidation on Pt and Pd model catalysts Chem. Soc. Rev. 46 2017 4347 4374 M.A. van Spronsen, J.W.M. Frenken, I.M.N. Groot, Surface science under reaction conditions: CO oxidation on Pt and Pd model catalysts, Chem. Soc. Rev., 46 (2017) 4347–4374. [11] F. Li Y. Li X.C. Zeng Z. Chen Exploration of high-performance single-atom catalysts on support M1/FeOx for CO oxidation via computational study ACS Catal. 5 2015 544 552 F. Li, Y. Li, X.C. Zeng, Z. Chen, Exploration of high-performance single-atom catalysts on support M1/FeOx for CO oxidation via computational study, ACS Catal., 5 (2015) 544–552. [12] A.I. Boronin E.M. Slavinskaya A. Figueroba A.I. Stadnichenko T.Y. Kardash O.A. Stonkus E.A. Fedorova V.V. Muravev V.A. Svetlichnyi A. Bruix K.M. Neyman CO oxidation activity of Pt/CeO2 catalysts below 0°C: platinum loading effects Appl. Catal. B: Environ. 286 2021 119931 A.I. Boronin, E.M. Slavinskaya, A. Figueroba, A.I. Stadnichenko, T.Y. Kardash, O.A. Stonkus, E.A. Fedorova, V.V. Muravev, V.A. Svetlichnyi, A. Bruix, K.M. Neyman, CO oxidation activity of Pt/CeO2 catalysts below 0°C: platinum loading effects, Appl. Catal. B: Environ., 286 (2021) 119931. [13] B. Qiao A. Wang X. Yang L.F. Allard Z. Jiang Y. Cui J. Liu J. Li T. Zhang Single-atom catalysis of CO oxidation using Pt1/FeOx Nat. Chem. 3 2011 634 641 B. Qiao, A. Wang, X. Yang, L.F. Allard, Z. Jiang, Y. Cui, J. Liu, J. Li, T. Zhang, Single-atom catalysis of CO oxidation using Pt1/FeOx, Nat. Chem., 3 (2011) 634–641. [14] L. Kuai S. Liu S. Cao Y. Ren E. Kan Y. Zhao N. Yu F. Li X. Li Z. Wu X. Wang B. Geng Atomically dispersed Pt/metal oxide mesoporous catalysts from synchronous pyrolysis–deposition route for water–gas shift reaction Chem. Mater. 30 2018 5534 5538 L. Kuai, S. Liu, S. Cao, Y. Ren, E. Kan, Y. Zhao, N. Yu, F. Li, X. Li, Z. Wu, X. Wang, B. Geng, Atomically dispersed Pt/metal oxide mesoporous catalysts from synchronous pyrolysis–deposition route for water–gas shift reaction, Chem. Mater., 30 (2018) 5534–5538. [15] L. Kuai L. Liu Q. Tao N. Yu E. Kan N. Sun S. Liu B. Geng High-areal density single-atoms/metal oxide nanosheets: a micro-gas blasting synthesis and superior catalytic properties Angew. Chem. Int. Ed. 61 2022 e202212338 L. Kuai, L. Liu, Q. Tao, N. Yu, E. Kan, N. Sun, S. Liu, B. Geng, High-areal density single-atoms/metal oxide nanosheets: a micro-gas blasting synthesis and superior catalytic properties, Angew. Chem. Int. Ed., 61 (2022) e202212338. [16] Q. Tao J. Song N. Sun Y. Ren L. Xiang S. Liu L. Kuai Boosting the activity of single-atom Pt1/CeO2 via Co doping for low-temperature catalytic oxidation of CO Inorg. Chem. 61 2022 11932 11938 Q. Tao, J. Song, N. Sun, Y. Ren, L. Xiang, S. Liu, L. Kuai, Boosting the activity of single-atom Pt1/CeO2 via Co doping for low-temperature catalytic oxidation of CO, Inorg. Chem., 61 (2022) 11932–11938. [17] J. Lin A. Wang B. Qiao X. Liu X. Yang X. Wang J. Liang J. Li J. Liu T. Zhang Remarkable performance of Ir1/FeOx single-atom catalyst in water gas shift reaction J. Am. Chem. Soc. 135 2013 15314 15317 J. Lin, A. Wang, B. Qiao, X. Liu, X. Yang, X. Wang, J. Liang, J. Li, J. Liu, T. Zhang, Remarkable performance of Ir1/FeOx single-atom catalyst in water gas shift reaction, J. Am. Chem. Soc., 135 (2013) 15314–15317. [18] B. Qiao J.X. Liang A. Wang C.Q. Xu J. Li T. Zhang J.J. Liu Ultrastable single-atom gold catalysts with strong covalent metal-support interaction (CMSI) Nano Res. 8 2015 2913 2924 B. Qiao, J.X. Liang, A. Wang, C.Q. Xu, J. Li, T. Zhang, J.J. Liu, Ultrastable single-atom gold catalysts with strong covalent metal-support interaction (CMSI), Nano Res.., 8 (2015) 2913–2924. [19] F. Wang Y. Ouyang X. Yang Promoting effect of Pt on the activity and stability of Pd/MgFe2O4 for catalytic combustion of methane J. Energy Inst. 110 2023 101341 F. Wang, Y. Ouyang, X. Yang. Promoting effect of Pt on the activity and stability of Pd/MgFe2O4 for catalytic combustion of methane, J. Energy Inst., 2023, 110, 101341. [20] L. Xu Y. Pan H. Li R. Xu Z. Sun Highly active and water-resistant lanthanum-doped platinum-cobalt oxide catalysts for CO oxidation Appl. Catal. B: Environ. 331 2023 122678 L. Xu, Y. Pan, H. Li, R. Xu, Z. Sun, Highly active and water-resistant lanthanum-doped platinum-cobalt oxide catalysts for CO oxidation, Appl. Catal. B: Environ., 331 (2023) 122678. [21] B. Qiao A. Wang L. Li Q. Lin H. Wei J. Liu T. Zhang Ferric oxide-supported Pt subnano clusters for preferential oxidation of CO in H2-rich gas at room temperature ACS Catal. 4 2014 2113 2117 B. Qiao, A. Wang, L. Li, Q. Lin, H. Wei, J. Liu, T. Zhang, Ferric oxide-supported Pt subnano clusters for preferential oxidation of CO in H2-rich gas at room temperature, ACS Catal., 4 (2014) 2113–2117. [22] Q. Li Z. Li Q. Zhang L. Zheng W. Yan X. Liang L. Gu C. Chen D. Wang Q. Peng Y. Li Porous γ-Fe2O3 nanoparticle decorated with atomically dispersed platinum: study on atomic site structural change and gas sensor activity evolution Nano Res. 14 2021 1435 1442 Q. Li, Z. Li, Q. Zhang, L. Zheng, W. Yan, X. Liang, L. Gu, C. Chen, D. Wang, Q. Peng, Y. Li, Porous γ-Fe2O3 nanoparticle decorated with atomically dispersed platinum: study on atomic site structural change and gas sensor activity evolution, Nano Res.., 14 (2021) 1435–1442. [23] X. Zhang G. Cui H. Feng L. Chen H. Wang B. Wang X. Zhang L. Zheng S. Hong M. Wei Platinum–copper single atom alloy catalysts with high performance towards glycerol hydrogenolysis Nat. Commun. 10 2019 5812 X. Zhang, G. Cui, H. Feng, L. Chen, H. Wang, B. Wang, X. Zhang, L. Zheng, S. Hong, M. Wei, Platinum–copper single atom alloy catalysts with high performance towards glycerol hydrogenolysis, Nat. Commun., 10 (2019) 5812. [24] K. Liu Y. Tang Z. Yu B. Ge G. Ren Y. Ren Y. Su J. Zhang X. Sun Z. Chen X. Liu B. Qiao W.Z. Li A. Wang J. Li High-loading and thermally stable Pt1/MgAl1.2Fe0.8O4 single-atom catalysts for high-temperature applications Sci. China Mater. 63 2020 949 958 K. Liu, Y. Tang, Z. Yu, B. Ge, G. Ren, Y. Ren, Y. Su, J. Zhang, X. Sun, Z. Chen, X. Liu, B. Qiao, W.Z. Li, A. Wang, J. Li, High-loading and thermally stable Pt1/MgAl1.2Fe0.8O4 single-atom catalysts for high-temperature applications, Sci. China Mater., 63 (2020) 949–958. [25] H.A. Aleksandrov K.M. Neyman K.I. Hadjiivanov G.N. Vayssilov Can the state of platinum species be unambiguously determined by the stretching frequency of an adsorbed CO probe molecule? Phys. Chem. Chem. Phys. 18 2016 22108 22121 H.A. Aleksandrov, K.M. Neyman, K.I. Hadjiivanov, G.N. Vayssilov, Can the state of platinum species be unambiguously determined by the stretching frequency of an adsorbed CO probe molecule?, Phys. Chem. Chem. Phys., 18 (2016) 22108–22121. [26] P.A. Carlsson L. Österlund P. Thormählen A. Palmqvist E. Fridell J. Jansson M. Skoglundh A transient in situ FTIR and XANES study of CO oxidation over Pt/Al2O3 catalysts J. Catal. 226 2004 422 434 P.A. Carlsson, L. Österlund, P. Thormählen, A. Palmqvist, E. Fridell, J. Jansson, M. Skoglundh, A transient in situ FTIR and XANES study of CO oxidation over Pt/Al2O3 catalysts, J. Catal., 226 (2004) 422–434. [27] W. Wang D. Li H. Yu C. Liu C. Tang J. Chen J. Lu M. Luo Insights into different reaction behaviors of propane and CO oxidation over Pt/CeO2 and Pt/Nb2O5: the crucial roles of support properties J. Phys. Chem. C 125 2021 19301 19310 W. Wang, D. Li, H. Yu, C. Liu, C. Tang, J. Chen, J. Lu, M. Luo, Insights into different reaction behaviors of propane and CO oxidation over Pt/CeO2 and Pt/Nb2O5: the crucial roles of support properties, J. Phys. Chem. C, 125 (2021) 19301–19310. [28] J. Yang Y. Huang H. Qi C. Zeng Q. Jiang Y. Cui Y. Su X. Du X. Pan X. Liu W. Li B. Qiao A. Wang T. Zhang Modulating the strong metal-support interaction of single-atom catalysts via vicinal structure decoration Nat. Commun. 13 2022 4244 J. Yang, Y. Huang, H. Qi, C. Zeng, Q. Jiang, Y. Cui, Y. Su, X. Du, X. Pan, X. Liu, W. Li, B. Qiao, A. Wang, T. Zhang, Modulating the strong metal-support interaction of single-atom catalysts via vicinal structure decoration, Nat. Commun., 13 (2022) 4244. [29] X. Ye H. Wang Y. Lin X. Liu L. Cao J. Gu J. Lu Insight of the stability and activity of platinum single atoms on ceria Nano Res. 12 2019 1401 1409 X. Ye, H. Wang, Y. Lin, X. Liu, L. Cao, J. Gu, J. Lu, Insight of the stability and activity of platinum single atoms on ceria, Nano Res.., 12 (2019) 1401–1409. [30] W. Zhang H. Wang J. Jiang Z. Sui Y. Zhu D. Chen X. Zhou Size dependence of Pt catalysts for propane dehydrogenation: from atomically dispersed to nanoparticles ACS Catal. 10 2020 12932 12942 W. Zhang, H. Wang, J. Jiang, Z. Sui, Y. Zhu, D. Chen, X. Zhou, Size dependence of Pt catalysts for propane dehydrogenation: from atomically dispersed to nanoparticles, ACS Catal., 10 (2020) 12932–12942. [31] Y. Wang Z. Tao B. Wu J. Xu C. Huo K. Li H. Chen Y. Yang Y. Li Effect of metal precursors on the performance of Pt/ZSM-22 catalysts for n-hexadecane hydroisomerization J. Catal. 322 2015 1 13 Y. Wang, Z. Tao, B. Wu, J. Xu, C. Huo, K. Li, H. Chen, Y. Yang, Y. Li, Effect of metal precursors on the performance of Pt/ZSM-22 catalysts for n-hexadecane hydroisomerization, J. Catal., 322 (2015) 1–13. [32] B.D. Mukri U.V. Waghmare M.S. Hegde Platinum ion-doped TiO2: high catalytic activity of Pt2+ with oxide ion vacancy in Ti4+ 1–xPt2+ xO2–x compared to Pt4+ without oxide ion vacancy in Ti4+ 1–xPt4+ xO2 Chem. Mater. 25 2013 3822 3833 B.D. Mukri, U.V. Waghmare, M.S. Hegde, Platinum ion-doped TiO2: high catalytic activity of Pt2+ with oxide ion vacancy in Ti4+1–xPt2+xO2–x compared to Pt4+ without oxide ion vacancy in Ti4+1–xPt4+xO2, Chem. Mater., 25 (2013) 3822–3833. [33] F. Grasset P. Alphonse C. Labrugère J. Darriet A. Rousset Correlation between the Pt2+/Pt4+ ratio and the catalytic activity for the CO oxidation of Ba12[BaxPt3−x]Pt6O27 (0 ≤ x ≤ 3) Mater. Res. Bull. 34 1999 2101 2108 F. Grasset, P. Alphonse, C. Labrugère, J. Darriet, A. Rousset, Correlation between the Pt2+/Pt4+ ratio and the catalytic activity for the CO oxidation of Ba12[BaxPt3−x]Pt6O27 (0 ≤ x ≤ 3), Mater. Res. Bull., 34 (1999) 2101–2108. [34] S. Wang C. Zhou G. Shu Y. Cao L. Fan L. Song K. Ma H. Yue Insights into the effects of Pt and PtOx site for electrocatalytic water gas shift reaction via altering supports and calcinated temperatures Int. J. Hydrogen Energy 48 2023 24730 24741 S. Wang, C. Zhou, G. Shu, Y. Cao, L. Fan, L. Song, K. Ma, H. Yue, Insights into the effects of Pt and PtOx site for electrocatalytic water gas shift reaction via altering supports and calcinated temperatures, Int. J. Hydrogen Energy, 48 (2023) 24730–24741. [35] Y. Xue R. Yao J. Li G. Wang P. Wu X. Li Efficient Pt–FeOx/TiO2@SBA-15 catalysts for selective hydrogenation of cinnamaldehyde to cinnamyl alcohol Catal. Sci. Technol. 7 2017 6112 6123 Y. Xue, R. Yao, J. Li, G. Wang, P. Wu, X. Li, Efficient Pt–FeOx/TiO2@SBA-15 catalysts for selective hydrogenation of cinnamaldehyde to cinnamyl alcohol, Catal. Sci. Technol., 7 (2017) 6112–6123. [36] Y. Chen J. Lin L. Li B. Qiao J. Liu Y. Su X. Wang Identifying size effects of Pt as single atoms and nanoparticles supported on FeOx for the water-gas shift reaction ACS Catal. 8 2018 859 868 Y. Chen, J. Lin, L. Li, B. Qiao, J. Liu, Y. Su, X. Wang, Identifying size effects of Pt as single atoms and nanoparticles supported on FeOx for the water-gas shift reaction, ACS Catal., 8 (2018) 859–868. [37] P. Mars D.W. van Krevelen Oxidations carried out by means of vanadium oxide catalysts Chem. Eng. Sci. 3 1954 41 59 P. Mars, D.W. van Krevelen, Oxidations carried out by means of vanadium oxide catalysts, Chem. Eng. Sci., 3 (1954) 41–59. [38] L. Tian Y. Zhao S. He M. Wei X. Duan Immobilized Cu–Cr layered double hydroxide films with visible-light responsive photocatalysis for organic pollutants Chem. Eng. J. 184 2012 261 267 L. Tian, Y. Zhao, S. He, M. Wei, X. Duan, Immobilized Cu–Cr layered double hydroxide films with visible-light responsive photocatalysis for organic pollutants, Chem. Eng. J., 184 (2012) 261–267. [39] C.C. Ou C.H. Chen T.S. Chan C.S. Chen S. Cheng Influence of pretreatment on the catalytic performance of Ag/CeO2 for formaldehyde removal at low temperature J. Catal. 380 2019 43 54 C.C. Ou, C.H. Chen, T.S. Chan, C.S. Chen, S. Cheng, Influence of pretreatment on the catalytic performance of Ag/CeO2 for formaldehyde removal at low temperature, J. Catal., 380 (2019) 43–54.",
      "scopus-id": "85189661544",
      "coredata": {
        "eid": "1-s2.0-S2468823124002906",
        "dc:description": "Catalytic oxidation is an efficient way for removing low-concentration of toxic CO. The noble metal catalysts demonstrate outstanding catalytic properties in CO oxidation, but their high-cost present great challenges for further applications. Thus, developing atomically dispersed noble metal on support is a promising candidate because of the highest atom utilization efficiency. In this paper, a range of MgFe2O4 supported atomically dispersed Pt catalysts with different Pt loading (1–5 wt.%) have been successfully developed by simple incipient wetness impregnation technique. The activity of Pt/MgFe2O4 increases with Pt loading for CO oxidation. The catalytic activity of the 5Pt/MgFe2O4 (T50 = 102 °C, T90 = 133 °C) is much better than that of the 5Pt/Fe2O3 (T50 = 132 °C, T90 = 146 °C) and commonly used 5Pt/Al2O3 with PtOx size of ∼1.6 nm (T50 = 156 °C, T90 = 163 °C) at WHSV of 30,000 mL h−1 gcat. −1. All Pt/MgFe2O4 catalysts displayed superior cyclic stability throughout five consecutive heating–cooling cycles via a possible reaction mechanism of Mars–van Krevelen. The 1Pt/MgFe2O4 and 3Pt/MgFe2O4 were gradually deactivated in the long-term catalytic stability testing of 150 °C, and the activity could be fully restored after regeneration, suggesting that the catalysts deactivation was due to the formation of carbonates. These above results provide a useful reference for the development of advanced CO oxidation catalysts in the future.",
        "openArchiveArticle": "false",
        "prism:coverDate": "2024-05-01",
        "openaccessUserLicense": null,
        "prism:aggregationType": "Journal",
        "prism:url": "https://api.elsevier.com/content/article/pii/S2468823124002906",
        "dc:creator": [
          {
            "@_fa": "true",
            "$": "Wang, Fen"
          },
          {
            "@_fa": "true",
            "$": "Li, Yulong"
          },
          {
            "@_fa": "true",
            "$": "Ouyang, Yao"
          },
          {
            "@_fa": "true",
            "$": "Yang, Xiumiao"
          }
        ],
        "link": [
          {
            "@_fa": "true",
            "@rel": "self",
            "@href": "https://api.elsevier.com/content/article/pii/S2468823124002906"
          },
          {
            "@_fa": "true",
            "@rel": "scidir",
            "@href": "https://www.sciencedirect.com/science/article/pii/S2468823124002906"
          }
        ],
        "dc:format": "application/json",
        "openaccessType": null,
        "pii": "S2468-8231(24)00290-6",
        "prism:volume": "560",
        "articleNumber": "114107",
        "prism:publisher": "Elsevier B.V.",
        "dc:title": "Facile fabrication of atomically dispersed Pt catalysts on MgFe2O4 toward efficient CO oxidation",
        "prism:copyright": "© 2024 Elsevier B.V. All rights reserved.",
        "openaccess": "0",
        "prism:issn": "24688231",
        "dcterms:subject": [
          {
            "@_fa": "true",
            "$": "Platinum"
          },
          {
            "@_fa": "true",
            "$": "MgFe2O4"
          },
          {
            "@_fa": "true",
            "$": "Atomically dispersed catalysts"
          },
          {
            "@_fa": "true",
            "$": "Carbonates"
          },
          {
            "@_fa": "true",
            "$": "CO oxidation"
          }
        ],
        "openaccessArticle": "false",
        "prism:publicationName": "Molecular Catalysis",
        "openaccessSponsorType": null,
        "prism:pageRange": "114107",
        "pubType": "fla",
        "prism:coverDisplayDate": "1 May 2024",
        "prism:doi": "10.1016/j.mcat.2024.114107",
        "prism:startingPage": "114107",
        "dc:identifier": "doi:10.1016/j.mcat.2024.114107",
        "openaccessSponsorName": null
      },
      "objects": {
        "object": [
          {
            "@category": "standard",
            "@height": "349",
            "@width": "621",
            "@_fa": "true",
            "$": "https://api.elsevier.com/content/object/eid/1-s2.0-S2468823124002906-gr9.jpg?httpAccept=%2A%2F%2A",
            "@multimediatype": "JPEG image file",
            "@type": "IMAGE-DOWNSAMPLED",
            "@size": "85614",
            "@ref": "gr9",
            "@mimetype": "image/jpeg"
          },
          {
            "@category": "standard",
            "@height": "468",
            "@width": "621",
            "@_fa": "true",
            "$": "https://api.elsevier.com/content/object/eid/1-s2.0-S2468823124002906-gr7.jpg?httpAccept=%2A%2F%2A",
            "@multimediatype": "JPEG image file",
            "@type": "IMAGE-DOWNSAMPLED",
            "@size": "132780",
            "@ref": "gr7",
            "@mimetype": "image/jpeg"
          },
          {
            "@category": "standard",
            "@height": "343",
            "@width": "621",
            "@_fa": "true",
            "$": "https://api.elsevier.com/content/object/eid/1-s2.0-S2468823124002906-gr8.jpg?httpAccept=%2A%2F%2A",
            "@multimediatype": "JPEG image file",
            "@type": "IMAGE-DOWNSAMPLED",
            "@size": "92893",
            "@ref": "gr8",
            "@mimetype": "image/jpeg"
          },
          {
            "@category": "standard",
            "@height": "232",
            "@width": "621",
            "@_fa": "true",
            "$": "https://api.elsevier.com/content/object/eid/1-s2.0-S2468823124002906-gr1.jpg?httpAccept=%2A%2F%2A",
            "@multimediatype": "JPEG image file",
            "@type": "IMAGE-DOWNSAMPLED",
            "@size": "66053",
            "@ref": "gr1",
            "@mimetype": "image/jpeg"
          },
          {
            "@category": "standard",
            "@height": "466",
            "@width": "621",
            "@_fa": "true",
            "$": "https://api.elsevier.com/content/object/eid/1-s2.0-S2468823124002906-gr2.jpg?httpAccept=%2A%2F%2A",
            "@multimediatype": "JPEG image file",
            "@type": "IMAGE-DOWNSAMPLED",
            "@size": "117069",
            "@ref": "gr2",
            "@mimetype": "image/jpeg"
          },
          {
            "@category": "standard",
            "@height": "200",
            "@width": "429",
            "@_fa": "true",
            "$": "https://api.elsevier.com/content/object/eid/1-s2.0-S2468823124002906-ga1.jpg?httpAccept=%2A%2F%2A",
            "@multimediatype": "JPEG image file",
            "@type": "IMAGE-DOWNSAMPLED",
            "@size": "46778",
            "@ref": "ga1",
            "@mimetype": "image/jpeg"
          },
          {
            "@category": "standard",
            "@height": "292",
            "@width": "339",
            "@_fa": "true",
            "$": "https://api.elsevier.com/content/object/eid/1-s2.0-S2468823124002906-gr5.jpg?httpAccept=%2A%2F%2A",
            "@multimediatype": "JPEG image file",
            "@type": "IMAGE-DOWNSAMPLED",
            "@size": "61513",
            "@ref": "gr5",
            "@mimetype": "image/jpeg"
          },
          {
            "@category": "standard",
            "@height": "231",
            "@width": "621",
            "@_fa": "true",
            "$": "https://api.elsevier.com/content/object/eid/1-s2.0-S2468823124002906-gr3.jpg?httpAccept=%2A%2F%2A",
            "@multimediatype": "JPEG image file",
            "@type": "IMAGE-DOWNSAMPLED",
            "@size": "44197",
            "@ref": "gr3",
            "@mimetype": "image/jpeg"
          },
          {
            "@category": "standard",
            "@height": "252",
            "@width": "339",
            "@_fa": "true",
            "$": "https://api.elsevier.com/content/object/eid/1-s2.0-S2468823124002906-gr10.jpg?httpAccept=%2A%2F%2A",
            "@multimediatype": "JPEG image file",
            "@type": "IMAGE-DOWNSAMPLED",
            "@size": "28821",
            "@ref": "gr10",
            "@mimetype": "image/jpeg"
          },
          {
            "@category": "standard",
            "@height": "233",
            "@width": "621",
            "@_fa": "true",
            "$": "https://api.elsevier.com/content/object/eid/1-s2.0-S2468823124002906-gr4.jpg?httpAccept=%2A%2F%2A",
            "@multimediatype": "JPEG image file",
            "@type": "IMAGE-DOWNSAMPLED",
            "@size": "64863",
            "@ref": "gr4",
            "@mimetype": "image/jpeg"
          },
          {
            "@category": "standard",
            "@height": "450",
            "@width": "452",
            "@_fa": "true",
            "$": "https://api.elsevier.com/content/object/eid/1-s2.0-S2468823124002906-gr6.jpg?httpAccept=%2A%2F%2A",
            "@multimediatype": "JPEG image file",
            "@type": "IMAGE-DOWNSAMPLED",
            "@size": "77344",
            "@ref": "gr6",
            "@mimetype": "image/jpeg"
          },
          {
            "@category": "thumbnail",
            "@height": "123",
            "@width": "219",
            "@_fa": "true",
            "$": "https://api.elsevier.com/content/object/eid/1-s2.0-S2468823124002906-gr9.sml?httpAccept=%2A%2F%2A",
            "@multimediatype": "GIF image file",
            "@type": "IMAGE-THUMBNAIL",
            "@size": "11576",
            "@ref": "gr9",
            "@mimetype": "image/gif"
          },
          {
            "@category": "thumbnail",
            "@height": "163",
            "@width": "217",
            "@_fa": "true",
            "$": "https://api.elsevier.com/content/object/eid/1-s2.0-S2468823124002906-gr7.sml?httpAccept=%2A%2F%2A",
            "@multimediatype": "GIF image file",
            "@type": "IMAGE-THUMBNAIL",
            "@size": "16802",
            "@ref": "gr7",
            "@mimetype": "image/gif"
          },
          {
            "@category": "thumbnail",
            "@height": "121",
            "@width": "219",
            "@_fa": "true",
            "$": "https://api.elsevier.com/content/object/eid/1-s2.0-S2468823124002906-gr8.sml?httpAccept=%2A%2F%2A",
            "@multimediatype": "GIF image file",
            "@type": "IMAGE-THUMBNAIL",
            "@size": "15123",
            "@ref": "gr8",
            "@mimetype": "image/gif"
          },
          {
            "@category": "thumbnail",
            "@height": "82",
            "@width": "219",
            "@_fa": "true",
            "$": "https://api.elsevier.com/content/object/eid/1-s2.0-S2468823124002906-gr1.sml?httpAccept=%2A%2F%2A",
            "@multimediatype": "GIF image file",
            "@type": "IMAGE-THUMBNAIL",
            "@size": "10328",
            "@ref": "gr1",
            "@mimetype": "image/gif"
          },
          {
            "@category": "thumbnail",
            "@height": "164",
            "@width": "218",
            "@_fa": "true",
            "$": "https://api.elsevier.com/content/object/eid/1-s2.0-S2468823124002906-gr2.sml?httpAccept=%2A%2F%2A",
            "@multimediatype": "GIF image file",
            "@type": "IMAGE-THUMBNAIL",
            "@size": "18395",
            "@ref": "gr2",
            "@mimetype": "image/gif"
          },
          {
            "@category": "thumbnail",
            "@height": "102",
            "@width": "219",
            "@_fa": "true",
            "$": "https://api.elsevier.com/content/object/eid/1-s2.0-S2468823124002906-ga1.sml?httpAccept=%2A%2F%2A",
            "@multimediatype": "GIF image file",
            "@type": "IMAGE-THUMBNAIL",
            "@size": "18161",
            "@ref": "ga1",
            "@mimetype": "image/gif"
          },
          {
            "@category": "thumbnail",
            "@height": "163",
            "@width": "190",
            "@_fa": "true",
            "$": "https://api.elsevier.com/content/object/eid/1-s2.0-S2468823124002906-gr5.sml?httpAccept=%2A%2F%2A",
            "@multimediatype": "GIF image file",
            "@type": "IMAGE-THUMBNAIL",
            "@size": "17222",
            "@ref": "gr5",
            "@mimetype": "image/gif"
          },
          {
            "@category": "thumbnail",
            "@height": "82",
            "@width": "219",
            "@_fa": "true",
            "$": "https://api.elsevier.com/content/object/eid/1-s2.0-S2468823124002906-gr3.sml?httpAccept=%2A%2F%2A",
            "@multimediatype": "GIF image file",
            "@type": "IMAGE-THUMBNAIL",
            "@size": "8277",
            "@ref": "gr3",
            "@mimetype": "image/gif"
          },
          {
            "@category": "thumbnail",
            "@height": "163",
            "@width": "219",
            "@_fa": "true",
            "$": "https://api.elsevier.com/content/object/eid/1-s2.0-S2468823124002906-gr10.sml?httpAccept=%2A%2F%2A",
            "@multimediatype": "GIF image file",
            "@type": "IMAGE-THUMBNAIL",
            "@size": "11080",
            "@ref": "gr10",
            "@mimetype": "image/gif"
          },
          {
            "@category": "thumbnail",
            "@height": "82",
            "@width": "219",
            "@_fa": "true",
            "$": "https://api.elsevier.com/content/object/eid/1-s2.0-S2468823124002906-gr4.sml?httpAccept=%2A%2F%2A",
            "@multimediatype": "GIF image file",
            "@type": "IMAGE-THUMBNAIL",
            "@size": "9883",
            "@ref": "gr4",
            "@mimetype": "image/gif"
          },
          {
            "@category": "thumbnail",
            "@height": "163",
            "@width": "164",
            "@_fa": "true",
            "$": "https://api.elsevier.com/content/object/eid/1-s2.0-S2468823124002906-gr6.sml?httpAccept=%2A%2F%2A",
            "@multimediatype": "GIF image file",
            "@type": "IMAGE-THUMBNAIL",
            "@size": "21583",
            "@ref": "gr6",
            "@mimetype": "image/gif"
          },
          {
            "@category": "high",
            "@height": "1547",
            "@width": "2750",
            "@_fa": "true",
            "$": "https://api.elsevier.com/content/object/eid/1-s2.0-S2468823124002906-gr9_lrg.jpg?httpAccept=%2A%2F%2A",
            "@multimediatype": "JPEG image file",
            "@type": "IMAGE-HIGH-RES",
            "@size": "1406693",
            "@ref": "gr9",
            "@mimetype": "image/jpeg"
          },
          {
            "@category": "high",
            "@height": "2072",
            "@width": "2750",
            "@_fa": "true",
            "$": "https://api.elsevier.com/content/object/eid/1-s2.0-S2468823124002906-gr7_lrg.jpg?httpAccept=%2A%2F%2A",
            "@multimediatype": "JPEG image file",
            "@type": "IMAGE-HIGH-RES",
            "@size": "2032814",
            "@ref": "gr7",
            "@mimetype": "image/jpeg"
          },
          {
            "@category": "high",
            "@height": "1518",
            "@width": "2750",
            "@_fa": "true",
            "$": "https://api.elsevier.com/content/object/eid/1-s2.0-S2468823124002906-gr8_lrg.jpg?httpAccept=%2A%2F%2A",
            "@multimediatype": "JPEG image file",
            "@type": "IMAGE-HIGH-RES",
            "@size": "1456453",
            "@ref": "gr8",
            "@mimetype": "image/jpeg"
          },
          {
            "@category": "high",
            "@height": "1029",
            "@width": "2750",
            "@_fa": "true",
            "$": "https://api.elsevier.com/content/object/eid/1-s2.0-S2468823124002906-gr1_lrg.jpg?httpAccept=%2A%2F%2A",
            "@multimediatype": "JPEG image file",
            "@type": "IMAGE-HIGH-RES",
            "@size": "963252",
            "@ref": "gr1",
            "@mimetype": "image/jpeg"
          },
          {
            "@category": "high",
            "@height": "2064",
            "@width": "2750",
            "@_fa": "true",
            "$": "https://api.elsevier.com/content/object/eid/1-s2.0-S2468823124002906-gr2_lrg.jpg?httpAccept=%2A%2F%2A",
            "@multimediatype": "JPEG image file",
            "@type": "IMAGE-HIGH-RES",
            "@size": "1878320",
            "@ref": "gr2",
            "@mimetype": "image/jpeg"
          },
          {
            "@category": "high",
            "@height": "886",
            "@width": "1902",
            "@_fa": "true",
            "$": "https://api.elsevier.com/content/object/eid/1-s2.0-S2468823124002906-ga1_lrg.jpg?httpAccept=%2A%2F%2A",
            "@multimediatype": "JPEG image file",
            "@type": "IMAGE-HIGH-RES",
            "@size": "1011544",
            "@ref": "ga1",
            "@mimetype": "image/jpeg"
          },
          {
            "@category": "high",
            "@height": "1290",
            "@width": "1500",
            "@_fa": "true",
            "$": "https://api.elsevier.com/content/object/eid/1-s2.0-S2468823124002906-gr5_lrg.jpg?httpAccept=%2A%2F%2A",
            "@multimediatype": "JPEG image file",
            "@type": "IMAGE-HIGH-RES",
            "@size": "840471",
            "@ref": "gr5",
            "@mimetype": "image/jpeg"
          },
          {
            "@category": "high",
            "@height": "1024",
            "@width": "2750",
            "@_fa": "true",
            "$": "https://api.elsevier.com/content/object/eid/1-s2.0-S2468823124002906-gr3_lrg.jpg?httpAccept=%2A%2F%2A",
            "@multimediatype": "JPEG image file",
            "@type": "IMAGE-HIGH-RES",
            "@size": "774031",
            "@ref": "gr3",
            "@mimetype": "image/jpeg"
          },
          {
            "@category": "high",
            "@height": "1117",
            "@width": "1500",
            "@_fa": "true",
            "$": "https://api.elsevier.com/content/object/eid/1-s2.0-S2468823124002906-gr10_lrg.jpg?httpAccept=%2A%2F%2A",
            "@multimediatype": "JPEG image file",
            "@type": "IMAGE-HIGH-RES",
            "@size": "524047",
            "@ref": "gr10",
            "@mimetype": "image/jpeg"
          },
          {
            "@category": "high",
            "@height": "1032",
            "@width": "2750",
            "@_fa": "true",
            "$": "https://api.elsevier.com/content/object/eid/1-s2.0-S2468823124002906-gr4_lrg.jpg?httpAccept=%2A%2F%2A",
            "@multimediatype": "JPEG image file",
            "@type": "IMAGE-HIGH-RES",
            "@size": "995318",
            "@ref": "gr4",
            "@mimetype": "image/jpeg"
          },
          {
            "@category": "high",
            "@height": "1993",
            "@width": "2000",
            "@_fa": "true",
            "$": "https://api.elsevier.com/content/object/eid/1-s2.0-S2468823124002906-gr6_lrg.jpg?httpAccept=%2A%2F%2A",
            "@multimediatype": "JPEG image file",
            "@type": "IMAGE-HIGH-RES",
            "@size": "747872",
            "@ref": "gr6",
            "@mimetype": "image/jpeg"
          },
          {
            "@category": "standard",
            "@_fa": "true",
            "$": "https://api.elsevier.com/content/object/eid/1-s2.0-S2468823124002906-mmc1.docx?httpAccept=%2A%2F%2A",
            "@multimediatype": "Microsoft Word file",
            "@type": "APPLICATION",
            "@size": "1930082",
            "@ref": "mmc1",
            "@mimetype": "application/word"
          },
          {
            "@category": "standard",
            "@_fa": "true",
            "$": "https://api.elsevier.com/content/object/eid/1-s2.0-S2468823124002906-am.pdf?httpAccept=%2A%2F%2A",
            "@multimediatype": "Acrobat PDF file",
            "@type": "AAM-PDF",
            "@size": "2027915",
            "@ref": "am",
            "@mimetype": "application/pdf"
          }
        ]
      },
      "link": {
        "@rel": "abstract",
        "@href": "https://api.elsevier.com/content/abstract/scopus_id/85189661544"
      }
    }
  }
}