{
  "metadata": {
    "title": "Recent progresses in the application of lignin derived (nano)catalysts in oxidation reactions",
    "authors": "; ; ",
    "journal": "Molecular Catalysis",
    "date": "2020-06-30",
    "doi": "10.1016/j.mcat.2020.110942",
    "abstract": "",
    "uri": "https://api.elsevier.com/content/article/pii/S2468823120301978",
    "pii": "S2468823120301978"
  },
  "fulltext": {
    "full-text-retrieval-response": {
      "scopus-eid": "2-s2.0-85083345303",
      "originalText": "serial JL 315758 291210 291744 291790 291809 31 Molecular Catalysis MOLECULARCATALYSIS 2020-04-20 2020-04-20 2020-04-20 2020-04-20 2020-06-13T00:04:20 1-s2.0-S2468823120301978 S2468-8231(20)30197-8 S2468823120301978 10.1016/j.mcat.2020.110942 S300 S300.1 FULL-TEXT 1-s2.0-S2468823120X00083 2021-01-23T10:18:37.211978Z 0 0 20200601 20200630 2020 2020-04-20T22:56:35.523258Z absattachment articleinfo articlenumber articletitlenorm authfirstinitialnorm authfirstsurnamenorm cid cids contenttype copyright crossmark dateloaded dateloadedtxt datesearch datesort dateupdated dco docsubtype doctype doi eid ewtransactionid hubeid indexeddate issn issnnorm itemstage itemtransactionid itemweight openaccess openarchive pg pgfirst pii piinorm pubdateend pubdatestart pubdatetxt pubyr sectiontitle sortorder srctitle srctitlenorm srctype ssids alllist content subj subheadings suppl tomb volfirst volissue volumelist webpdf webpdfpagecount yearnav figure table body acknowledge affil articletitle auth authfirstini authfull authkeywords authlast grantsponsor highlightsabst primabst pubtype ref specialabst 2468-8231 24688231 true 489 489 C Volume 489 5 110942 110942 110942 202006 June 2020 2020-06-01 2020-06-30 2020 Regular Papers article rev © 2020 Elsevier B.V. All rights reserved. RECENTPROGRESSESINAPPLICATIONLIGNINDERIVEDNANOCATALYSTSINOXIDATIONREACTIONS NASROLLAHZADEH M 1 Introduction 2 Oxidizing agents 3 Lignin chemistry 4 Lignin derived (nano)catalysts in the oxidation reactions 5 Conclusion and future prospects Declaration of Competing Interest Acknowledgements References KANI 2012 827 840 I POCKLANOVA 2016 121 127 R SHELDON 1981 R MECHANISTICPRINCIPLESSYNTHETICMETHODOLOGYINCLUDINGBIOCHEMICALPROCESSES METALCATALYSEDOXIDATIONSORGANICCOMPOUNDS GALLEZOT 1997 405 418 P GEORGE 2008 2149 2153 K GUPTA 2009 1926 1946 K STAHL 2004 3400 3420 S MUZART 2003 5789 5816 J VERMA 2017 5577 5580 S GUPTA 2008 1420 1450 K OMURA 1978 1651 1660 K ZHDANKIN 2009 1 62 V CARON 2006 2943 2989 S PIERA 2008 3506 3523 J MA 2011 1005 1017 S SIGMAN 2006 221 229 M GOLDSMITH 2018 209 224 C FUKUZUMI 2017 44 56 S POLSHETTIWAR 2008 4637 4643 V RATHI 2016 2363 2373 A BAIG 2014 4333 4338 R POLSHETTIWAR 2009 37 40 V VERMA 2018 248 252 S SHOKOUHIMEHR 2018 3809 3817 M VARMA 2019 6458 6470 R SHOKOUHIMEHR 2019 4183 M NASROLLAHZADEH 2016 271 278 M NODZEWSKA 2019 181 216 A XU 2019 195 252 C OMIDVAR 2017 44 50 A MOMENI 2016 173 179 S KHODADADI 2017 1 10 B NASROLLAHZADEH 2014 43477 43484 M NASROLLAHZADEH 2019 54 75 M MOTAHHARIFAR 2020 115819 N SKOUTA 2005 571 575 R LIANG 2019 32 65 J ZHANG 2017 839 885 X BENAGLIA 2003 3401 3430 M ALTAVA 2018 2722 2771 B BARAN 2019 115029 T FRENZEL 2018 8 16 R NASROLLAHZADEH 2020 110645 M CHEN 2020 49 56 X KIM 2018 43 50 J ZHANG 2018 170 178 W BISWAS 2018 129 137 S VASSILIADI 2018 206 212 E DURACZYNSKA 2019 145 151 D CHEN 2019 110422 T SANO 2019 110451 T LIN 2020 110695 Y NASROLLAHZADEH 2019 14234 14241 M FAKAYODE 2016 19 44 B BIOPOLYMERMEDIATEDGREENSYNTHESISNOBLEMETALNANOSTRUCTURESRECENTADVBIOPOLYM MOHAN 2016 47 S KUMAR 2018 59 88 D SYNTHINORGNANOMATER QUANTUMNANOSTRUCTURESQDSOVERVIEW ZARNEGAR 2019 14 23 Z QIN 2019 110561 J KUMAR 2015 4921 4930 C LI 2015 11559 11624 C PATIL 2011 4713 4722 P ACHARJEE 2018 1449 1478 A GUAN 2018 519 530 R SHARMA 2018 223 233 A SUN 2020 110746 W PADAYACHEE 2019 1 9 D KASKOW 2020 110674 I ZHANG 2020 110701 X SANCHEZGARCIA 2020 110737 J SHARMA 2019 27 39 H SHIN 2019 148 153 H SINGH 2019 167 180 S NASROLLAHZADEH 2020 110775 M FRECHET 1978 2618 2621 J RUPPERT 2012 2564 2601 A RINALDI 2008 8047 8050 R IRAVANI 2020 612 636 S UPTON 2016 2275 2306 B AGBOR 2011 675 685 V GONZALES 2016 21678 21684 R XU 2016 431 459 J BIOMASSFRACTIONATIONTECHNOLOGIESFORALIGNOCELLULOSICFEEDSTOCKBASEDBIOREFINERY RECENTADVANCESINALKALINEPRETREATMENTLIGNOCELLULOSICBIOMASS GARCIACUBERO 2009 1608 1613 M NITSOS 2016 5181 5193 C DASILVA 2010 7402 7409 A BARAKAT 2014 48109 48127 A NITSOS 2013 110 122 C HU 2011 7224 7228 Z DALE 1996 111 116 B DUQUE 2016 349 368 A BIOMASSFRACTIONATIONTECHNOLOGIESFORALIGNOCELLULOSICFEEDSTOCKBASEDBIOREFINERY STEAMEXPLOSIONLIGNOCELLULOSICBIOMASSPRETREATMENT TANG 2018 87 94 Y SCHMIDT 1998 139 151 A KAMESHWAR 2016 156 171 A WANG 2016 770 783 C TUCK 2012 695 699 C WANG 2016 104 113 Y MAHMOOD 2016 317 329 N EUDES 2014 189 198 A TARASOV 2009 227 231 A WANG 2012 1455 1466 X XIE 2009 1797 1802 X DELRIO 2012 5922 5935 J ZAKZESKI 2010 3552 3599 J RALPH 2004 29 60 J BOERIU 2004 205 218 C CHAKAR 2004 131 141 F XU 2014 7485 7500 C SUN 2018 614 678 Z FUJIMOTO 2005 89 91 A AXELSSON 2012 246 256 L GUERRA 2006 9696 9705 A CAI 2013 3140 3145 C CHENG 2012 11850 11857 G RINALDI 2016 8164 8215 R PADALKAR 2010 8497 8502 S HE 2003 4401 4406 J REDDY 2006 12 16 K QUIGNARD 2001 21 22 F OWENS 2017 C ZHOU 2018 724 Z FERNANDEZRUIZ 2018 3926 3935 C GAO 2020 947 953 C COCCIA 2013 12 18 F NASROLLAHZADEH 2020 265 275 M FEIZIMOHAZZAB 2020 B ZHOU 2019 965 973 H ZHOU 2019 117767 H LI 2019 110 118 X CAPECCHI 2018 438 E MA 2018 20833 20840 Q GARCIAMATEOS 2017 18 30 F MARTINMARTINEZ 2017 372 378 M YANG 2016 1773 1781 Z BEDIA 2010 8 18 J PICCININO 2019 4125 4134 D PYLYPCHUK 2020 282 I BACIOCCHI 2000 393 394 E BACIOCCHI 2003 9061 9069 E LEE 2003 261 268 K FERREIRALEITAO 2007 230 236 V ZHANG 2008 50 53 Y MILCZAREK 2009 10345 10353 G ZHANG 2010 1089 1092 Y HUANG 2003 491 494 X CHIVUKULA 1995 7765 7772 M NASROLLAHZADEHX2020X110942 NASROLLAHZADEHX2020X110942XM 2022-04-20T00:00:00.000Z 2022-04-20T00:00:00.000Z http://creativecommons.org/licenses/by-nc-nd/4.0/ © 2020 Elsevier B.V. All rights reserved. item S2468-8231(20)30197-8 S2468823120301978 1-s2.0-S2468823120301978 10.1016/j.mcat.2020.110942 315758 2021-01-23T10:18:37.211978Z 2020-06-01 2020-06-30 1-s2.0-S2468823120301978-main.pdf https://s3-eu-west-1.amazonaws.com/prod-ucs-content-store-eu-west/content/pii:S2468823120301978/MAIN/application/pdf/f2628616bc3c42263822f5273caf154a/main.pdf main.pdf pdf true 7342915 MAIN 12 1-s2.0-S2468823120301978-main_1.png https://s3-eu-west-1.amazonaws.com/prod-ucs-content-store-eu-west/content/pii:S2468823120301978/PREVIEW/image/png/7bdca11b1e5c44bbb31c5a7abf45047d/main_1.png main_1.png png 53789 849 656 IMAGE-WEB-PDF 1 1-s2.0-S2468823120301978-ga1.jpg https://s3-eu-west-1.amazonaws.com/prod-ucs-content-store-eu-west/content/pii:S2468823120301978/ga1/DOWNSAMPLED/image/jpeg/b5e63bcad6dad2692c3cae3875315409/ga1.jpg ga1 true ga1.jpg jpg 12685 200 202 IMAGE-DOWNSAMPLED 1-s2.0-S2468823120301978-gr1.jpg https://s3-eu-west-1.amazonaws.com/prod-ucs-content-store-eu-west/content/pii:S2468823120301978/gr1/DOWNSAMPLED/image/jpeg/58261c173f0193462608665b1a52be12/gr1.jpg gr1 gr1.jpg jpg 91517 782 756 IMAGE-DOWNSAMPLED 1-s2.0-S2468823120301978-gr2.jpg https://s3-eu-west-1.amazonaws.com/prod-ucs-content-store-eu-west/content/pii:S2468823120301978/gr2/DOWNSAMPLED/image/jpeg/4b4b3f1376439048fc26c236503d19a8/gr2.jpg gr2 gr2.jpg jpg 70152 383 711 IMAGE-DOWNSAMPLED 1-s2.0-S2468823120301978-gr3.jpg https://s3-eu-west-1.amazonaws.com/prod-ucs-content-store-eu-west/content/pii:S2468823120301978/gr3/DOWNSAMPLED/image/jpeg/1696a994b7be8beb412259bd763529fe/gr3.jpg gr3 gr3.jpg jpg 60279 375 715 IMAGE-DOWNSAMPLED 1-s2.0-S2468823120301978-gr4.jpg https://s3-eu-west-1.amazonaws.com/prod-ucs-content-store-eu-west/content/pii:S2468823120301978/gr4/DOWNSAMPLED/image/jpeg/81c501fe33feacf435322ac1bbdcb196/gr4.jpg gr4 gr4.jpg jpg 81600 426 715 IMAGE-DOWNSAMPLED 1-s2.0-S2468823120301978-gr5.jpg https://s3-eu-west-1.amazonaws.com/prod-ucs-content-store-eu-west/content/pii:S2468823120301978/gr5/DOWNSAMPLED/image/jpeg/7c614b03c8317fa4963d2ec59ecb3bfb/gr5.jpg gr5 gr5.jpg jpg 65323 487 753 IMAGE-DOWNSAMPLED 1-s2.0-S2468823120301978-gr6.jpg https://s3-eu-west-1.amazonaws.com/prod-ucs-content-store-eu-west/content/pii:S2468823120301978/gr6/DOWNSAMPLED/image/jpeg/c67ac86fccd59d3bb27bd89b8996a497/gr6.jpg gr6 gr6.jpg jpg 16264 105 489 IMAGE-DOWNSAMPLED 1-s2.0-S2468823120301978-sc1.jpg https://s3-eu-west-1.amazonaws.com/prod-ucs-content-store-eu-west/content/pii:S2468823120301978/sc1/DOWNSAMPLED/image/jpeg/f63246f05b19cb6cff2ce03104f9aed7/sc1.jpg sc1 sc1.jpg jpg 47864 593 678 IMAGE-DOWNSAMPLED 1-s2.0-S2468823120301978-sc2.jpg https://s3-eu-west-1.amazonaws.com/prod-ucs-content-store-eu-west/content/pii:S2468823120301978/sc2/DOWNSAMPLED/image/jpeg/631ee918aaf25968a7213835dd0d085f/sc2.jpg sc2 sc2.jpg jpg 11335 167 378 IMAGE-DOWNSAMPLED 1-s2.0-S2468823120301978-sc3.jpg https://s3-eu-west-1.amazonaws.com/prod-ucs-content-store-eu-west/content/pii:S2468823120301978/sc3/DOWNSAMPLED/image/jpeg/c1248c9fd42e8386d657ae995db8aece/sc3.jpg sc3 sc3.jpg jpg 45345 534 755 IMAGE-DOWNSAMPLED 1-s2.0-S2468823120301978-sc4.jpg https://s3-eu-west-1.amazonaws.com/prod-ucs-content-store-eu-west/content/pii:S2468823120301978/sc4/DOWNSAMPLED/image/jpeg/9a96281e2b9ebab640682fd99684bca9/sc4.jpg sc4 sc4.jpg jpg 17282 198 376 IMAGE-DOWNSAMPLED 1-s2.0-S2468823120301978-sc5.jpg https://s3-eu-west-1.amazonaws.com/prod-ucs-content-store-eu-west/content/pii:S2468823120301978/sc5/DOWNSAMPLED/image/jpeg/f22bffe8eb25d7cbb41d5234efa7ff03/sc5.jpg sc5 sc5.jpg jpg 44263 621 678 IMAGE-DOWNSAMPLED 1-s2.0-S2468823120301978-sc6.jpg https://s3-eu-west-1.amazonaws.com/prod-ucs-content-store-eu-west/content/pii:S2468823120301978/sc6/DOWNSAMPLED/image/jpeg/2c0233837d0b9a646974c479127ac11f/sc6.jpg sc6 sc6.jpg jpg 66443 616 753 IMAGE-DOWNSAMPLED 1-s2.0-S2468823120301978-ga1.sml https://s3-eu-west-1.amazonaws.com/prod-ucs-content-store-eu-west/content/pii:S2468823120301978/ga1/THUMBNAIL/image/gif/99bd25ed4d73abea5ec9e4919b86ba54/ga1.sml ga1 true ga1.sml sml 8017 164 166 IMAGE-THUMBNAIL 1-s2.0-S2468823120301978-gr1.sml https://s3-eu-west-1.amazonaws.com/prod-ucs-content-store-eu-west/content/pii:S2468823120301978/gr1/THUMBNAIL/image/gif/447d288b4b87d77b898ef778aee852d1/gr1.sml gr1 gr1.sml sml 6932 163 158 IMAGE-THUMBNAIL 1-s2.0-S2468823120301978-gr2.sml https://s3-eu-west-1.amazonaws.com/prod-ucs-content-store-eu-west/content/pii:S2468823120301978/gr2/THUMBNAIL/image/gif/34e1f3d5610d54a65e9a3572ea44ceda/gr2.sml gr2 gr2.sml sml 14490 118 219 IMAGE-THUMBNAIL 1-s2.0-S2468823120301978-gr3.sml https://s3-eu-west-1.amazonaws.com/prod-ucs-content-store-eu-west/content/pii:S2468823120301978/gr3/THUMBNAIL/image/gif/df79eb5a1cb0232cb7de7709b23d4365/gr3.sml gr3 gr3.sml sml 7483 115 219 IMAGE-THUMBNAIL 1-s2.0-S2468823120301978-gr4.sml https://s3-eu-west-1.amazonaws.com/prod-ucs-content-store-eu-west/content/pii:S2468823120301978/gr4/THUMBNAIL/image/gif/08b4348171ae91a1434bd22f25e465bd/gr4.sml gr4 gr4.sml sml 13304 130 219 IMAGE-THUMBNAIL 1-s2.0-S2468823120301978-gr5.sml https://s3-eu-west-1.amazonaws.com/prod-ucs-content-store-eu-west/content/pii:S2468823120301978/gr5/THUMBNAIL/image/gif/6a7bfcba1dc5becc159d4ade5f84ab2f/gr5.sml gr5 gr5.sml sml 11218 142 219 IMAGE-THUMBNAIL 1-s2.0-S2468823120301978-gr6.sml https://s3-eu-west-1.amazonaws.com/prod-ucs-content-store-eu-west/content/pii:S2468823120301978/gr6/THUMBNAIL/image/gif/8558cd6d14d6b1987d0996276d688663/gr6.sml gr6 gr6.sml sml 5561 47 219 IMAGE-THUMBNAIL 1-s2.0-S2468823120301978-sc1.sml https://s3-eu-west-1.amazonaws.com/prod-ucs-content-store-eu-west/content/pii:S2468823120301978/sc1/THUMBNAIL/image/gif/c5fe23bcf11a94b9c935e9987bc9df0c/sc1.sml sc1 sc1.sml sml 4902 164 187 IMAGE-THUMBNAIL 1-s2.0-S2468823120301978-sc2.sml https://s3-eu-west-1.amazonaws.com/prod-ucs-content-store-eu-west/content/pii:S2468823120301978/sc2/THUMBNAIL/image/gif/26edd012577e8fe0118a6cce93b4844c/sc2.sml sc2 sc2.sml sml 3976 97 219 IMAGE-THUMBNAIL 1-s2.0-S2468823120301978-sc3.sml https://s3-eu-west-1.amazonaws.com/prod-ucs-content-store-eu-west/content/pii:S2468823120301978/sc3/THUMBNAIL/image/gif/c8ba8be0b88508d5bb687cc41370c18c/sc3.sml sc3 sc3.sml sml 4952 155 219 IMAGE-THUMBNAIL 1-s2.0-S2468823120301978-sc4.sml https://s3-eu-west-1.amazonaws.com/prod-ucs-content-store-eu-west/content/pii:S2468823120301978/sc4/THUMBNAIL/image/gif/00c7957384c6c3f06302bc09fac9887b/sc4.sml sc4 sc4.sml sml 5013 115 219 IMAGE-THUMBNAIL 1-s2.0-S2468823120301978-sc5.sml https://s3-eu-west-1.amazonaws.com/prod-ucs-content-store-eu-west/content/pii:S2468823120301978/sc5/THUMBNAIL/image/gif/9e7f4104a504ef4802a480a428b8577a/sc5.sml sc5 sc5.sml sml 4393 164 179 IMAGE-THUMBNAIL 1-s2.0-S2468823120301978-sc6.sml https://s3-eu-west-1.amazonaws.com/prod-ucs-content-store-eu-west/content/pii:S2468823120301978/sc6/THUMBNAIL/image/gif/eb8b9c30229af941b7aea55a3e9a7dae/sc6.sml sc6 sc6.sml sml 5446 164 200 IMAGE-THUMBNAIL 1-s2.0-S2468823120301978-am.pdf am am.pdf pdf 1098389 AAM-PDF https://s3-eu-west-1.amazonaws.com/prod-ucs-content-store-eu-west/content/egi:10T85PK2RJB/MAIN/application/pdf/b15ea8402ac7322e1a780808e5b1718a/am.pdf MCAT 110942 110942 S2468-8231(20)30197-8 10.1016/j.mcat.2020.110942 Elsevier B.V. Fig. 1 Graphic diagram of lignin structure and its monolignol units. Reprinted from [96] with permission. Fig. 1 Fig. 2 Biomass derived lignin and HMF and FDCA preparation via oxidation reaction. Reprinted from [125] with permission. Fig. 2 Fig. 3 Co-Mn/N@C catalyzed HMF selective oxidation. Fig. 3 Fig. 4 Strategy for the fabrication of M SAs-N@C. Reprinted from [126] with permission. Fig. 4 Fig. 5 Catalysts I-V synthetic process. Encapsulation (pathway A), physical adsorption (pathway B) and layer by layer (pathways C-E) immobilization procedures. OL: organosolv lignin; PDDA: poly(di-allyl dimethyl ammonium chloride); CATLIG: cationic lignin. Reprinted from [134] with permission. Fig. 5 Fig. 6 Encapsulation of enzymes adsorbed onto Fe3O4 NPs. Reprinted from [135] with permission. Fig. 6 Scheme 1 Catalytic oxidation of different phenols (AA = Ascorbic acid). Scheme 1 Scheme 2 Mechanism of catalytic oxidation of phenol over Fe@HC. Scheme 2 Scheme 3 Preparation diagram of L-β-CD. Scheme 3 Scheme 4 BzOH oxidation to BzH over L-β-CD as catalyst. Scheme 4 Scheme 5 Proposed mechanism for BzOH oxidation. Scheme 5 Scheme 6 oxidation of alcohols 1-5 using native laccase or catalysts I-V. Scheme 6 Table 1 Frequently used oxidizing agents and their subsequent products. Table 1 Entry Oxidizing agent Product(s) 1 Ozone (O3) Aldehydes, ketones, and H2O 2 Atomic oxygen (O2) H2O, CO2 and the oxides 3 Halogens F-, Cl-, Br- and I-, [I3]- 4 H2O2 and other inorganic peroxides, Fenton’s reagent H2O and oxides 5 Sulfuric acid (H2SO4) H2O, S, oxidized sulfur species 6 HNO3 and nitrate compounds NO2 and NO 7 Peroxymonosulfuric acid (H2SO5) H2O and SO4 2- 8 SO2 S 9 Hypochlorite and other hypohalite compounds, including household bleach (NaClO) Cl-, H2O 10 Perchlorate, chlorate, chlorite, and other analogous halogen compounds Cl-, H2O 11 KMnO4 MnO2 (basic) or Mn2+ (acidic) 12 Sodium bismuthate Ketones, carboxylic acid, and CO2 13 Tl(III) thallic compounds Tl(I) thallous compounds 14 Hexavalent chromium compounds including chromic and dichromic acids, pyridinium chlorochromate, chromium trioxide, and chromate/dichromate Cr3+, H2O 15 RuO4 and OsO4 In organic lab scale synthesis Table 2 Oxidation of alcohols 1-5 in the presence of TEMPO using native laccase or catalysts I-V. Table 2 Entry Catalyst Substrate Product(s) % Yield Entry Catalyst Substrate Product(s) % Yield 1 Laccase 1 6 96 16 III 3 8 99 2 I 1 6 0.5 17 IV 3 8 95 3 II 1 6 3.5 18 V 3 8 36.5 4 III 1 6 85 19 Laccase 4 9 97 5 IV 1 6 61.1 20 I 4 9 1.1 6 V 1 6 40.2 21 II 4 9 49.8 7 Laccase 2 7 >99 22 III 4 9 >99 8 I 2 7 1.5 23 IV 4 9 >99 9 II 2 7 22.1 24 V 4 9 84.1 10 III 2 7 >99 25 Laccase 4 9 93 11 IV 2 7 >99 26 I 5 10 1.2 12 V 2 7 98 27 II 5 10 35.4 13 Laccase 3 8 (11) 66 (23) a 28 III 5 10 >99 14 I 3 8 4.5 29 IV 5 10 >99 15 II 3 8 6.3 30 V 5 10 55.6 a Product 11 was obtained only in the case of the oxidation with native laccase. Table 3 Lignin-based catalysts in the oxidation processes. Table 3 Entry Catalyst Application Oxidizing agent Y a or C (%) Ref. 1 Lignin peroxidase (LP) N,N-Dimethylanilines oxidative N-demethylation H2O2 Y = 16-62 [136] 2 LP Oxidation of nonphenolic trimeric lignin model compounds H2O2 - [137] 3 LP Electroenzymatic oxidation of veratryl alcohol H2O2 - [138] 4 LP Oxidation of methylene blue H2O2 C = 90 [139] 5 LP Veratryl alcohol oxidation H2O2 - [140] 6 Lignosulfonate-modified electrodes Oxidation of nicotinamide adenine dinucleotide (NADH) - - [141] 7 LP Degradation of carbamazepine and diclofenac H2O2 - [142] 8 LP Oxidation of phenolic compounds H2O2 - [143] 9 LP Oxidation of the sulfonated azo dyes H2O2 - [144] a Yield or conversion. Review Recent progresses in the application of lignin derived (nano)catalysts in oxidation reactions Mahmoud Nasrollahzadeh * Nasrin Shafiei Zahra Nezafat Nayyereh Sadat Soheili Bidgoli Department of Chemistry, Faculty of Science, University of Qom, Qom, 37185-359, Iran Department of Chemistry Faculty of Science University of Qom Qom 37185-359 Iran Department of Chemistry, Faculty of Science, University of Qom, Qom 37185-359, Iran ⁎ Corresponding author. Graphical abstract Recently, the attention to bio-based catalysts has been on rise. The present review explains the developments regarding preparation, characterization and utilization of lignin based (nano)catalysts in oxidation reactions. Herein, the application of lignin in the preparation of (nano)catalysts and their catalytic prowess in oxidative transformations will be overviewed. Lignin offers exceptional physicochemical characteristics and important potential applications. Lignin can be used as a precursor or template to prepare novel eco-friendly catalysts. This review paper proposes the rational design of active, economical, recyclable and efficient catalysts for different oxidation reactions including oxidation of alcohols, phenols, etc. Keywords Oxidation reactions Lignin Sustainable Heterogeneous catalyst Selective 1 Introduction Oxidation transformations have always been attractive to researchers as noteworthy and powerful methods for fundamental research or industrial scale productions. Oxidation of alkenes, alcohols, olefins, CO, and other organic agents to valuable oxygenic compounds is a significant reaction [1–10]. Traditionally, oxidation reactions have been performed using toxic oxidants including chromates, DMSO/(COCl)2, hypervalent iodine reagents, permanganates, and various metal catalysts along with oxidants including oxones, peroxides, TEMPO, etc. [11–16]. Various reports have been published on the catalytic oxidation transformations using metal based catalysts from the environmental and economic perspectives [17,18]. These reactions are often carried out by homogeneous catalysts, which cannot be removed from the reaction media or recovered and produce toxic wastes. One of the effective ways to overcome the drawbacks of homogeneous systems is the use of heterogeneous catalysis with exceptional properties such as high stability, insolubility in solvents, ease of handling, easy removal from the reaction media, recyclability and reusability, and the wide accessibility of the support [19–33]. Many researches have reported the use of polymer based systems as heterogeneous catalysts for chemical transformations [34–51]. Among polymer based catalysts, many research efforts have introduced novel, and ecofriendly biopolymer based catalytic systems for application in oxidation reactions. Common approaches have been replaced by fresh catalytic transformations [52]. Biopolymers are polymeric organic molecules containing monomeric parts bonded covalently to form larger molecules. They are formed by a range of plants, trees or microorganisms. They can decrease the utilization of non-renewable materials and minimize the environmental pollutions commonly caused by synthetic resources. The biodegradability and biocompatibility of these resources increases their areas of application [53–57]. Biopolymers have been recently known as attractive candidates to afford catalytic systems for various reactions including oxidation reactions. The synthesis of (nano)catalysts from this biopolymer presents an enormous opportunity for addressing the future catalytic demands [58]. Lignin is an industrial solid waste produced in large amounts by wood processing and pulp and paper production industries [59–61]. It mediates catalytic systems, which are economical and environmentally friendly. Such catalysts can mostly be recycled and reused for more than one catalytic run and show high efficacy towards oxidative transformations. In this review, the use of lignin derived (nano)catalysts for catalytic oxidation transformations has been highlighted. 2 Oxidizing agents An oxidizing agent is a compound with the capability to oxidize other agents, receive their electrons or transfer electronegative atoms, usually oxygen, to the system. The amount and kind of the oxidizing agent affect the reaction yield and conversion. Oxygen, hydrogen peroxide and halogens are known as the most common oxidants [34]. Some of the most common oxidizing agents are listed in Table 1 . Some of these compounds are utilized in combustion and organic redox reactions, while others retain their relatively explosive character [34]. Permanganate, a useful oxidizing agent, has limited solubility in non-polar media, which restricts its application for the oxidation of organic substrate in non-aqueous media. However, the permanganate combination with phase transfer catalysts makes it mild, selective and lipopathic and is useful for several important chemical transformations. The lipopathic permanganate oxidants oxidize several functional groups, including ethers, alkynes, alkenes, alkanes, alcohols, aldehydes, and oximes and have been applied in organic syntheses with regio, chemo and stereoselectivity [62]. Hydrogen peroxide (H2O2), an efficient and clean oxidant, has received wide attention given its high efficiency and environmental friendliness. Upon activation by transition metals, ultrasonication, microwave irradiation, electrolysis and light irradiation, H2O2 can be converted into high oxidative hydroxyl radicals (HO•), which play an important role in the removal of pollutants by H2O2 based advanced oxidation processes [63]. Molecular ozone (O3) has been utilized usually for cleansing and oxidation of various pollutants for environmental remediation. The decomposition of O3 in water, which is dependent on pH and is initiated by hydroxyl ion, followed by a series of reactions, leads to the generation of HO• radicals. These radicals are short lived and really potent oxidizing agent [64]. Different oxidizing agents have been used in oxidation reactions [65–72]. Some oxidants used in reactions including those, which cause combustion, are hazardous. Many kinds of the catalase enzymes along with sodium thiosulfate, manganese dioxide, sodium sulfite, ascorbic acid and sodium nitrite have been used in probed bioassays for quenching of oxidizing agents including hydrogen peroxide, persulfate and peroxymonosulfate in order to remove toxic agents. Permanganates, chromates, organic peroxides, etc. are known as toxic oxidants. However, there are also non-toxic oxidants. K2Cr2O7, for example, is not known as a toxic compound. On the contrary, hexavalent chromium (Cr(VI)), which is one of the most common oxidants useful in various industrial procedures, is considered a harmful agent for human health. The development of catalytic supported oxidants is one advantageous approach to overcome the toxicity problem [73]. For example, poly[vinyl(pyridinium chlorochromate)] has been employed as a recyclable mild oxidant in the oxidation of various alcohols [74]. 3 Lignin chemistry Lignocellulosic biomass consists of hemicellulose, lignin and cellulose derived from grasses (miscanthus, switchgrass, etc.), softwoods (cedar, spruce, pine, etc.), hardwoods (poplar, birch, beech, etc.), and various agricultural wastes/byproducts (bagasse, husks, straws, etc.). Hemicellulose, a mixture of C6 and C5 polysaccharides, has significant applications in the fabrication of biofuel and important chemical intermediates such as furfural [75]. Cellulose, which is considered the most abundant biopolymers on earth, contains linear β(1-4) glucose chain links. This biopolymer can also be converted into valuable compounds such as biofuels, formic and levulinic acids, gamma-valerolactone and the corresponding derivatives [76]. Lignin is the third main part of lignocellulosic, which is the most utilized fraction for power and heat purposes via combustion in the paper and pulp industry because of its high calorific value. Among biopolymers, lignin has one of the complex structures and not shows various remarkable properties; specifically, insolubility in aqueous environment and its enzyme like activity can be remarkably decreased if not dissolved in organic solvents [77]. Biopolymers can be converted into various chemicals, which can be further transformed to cosmetics, fuels, engineering polymers, pharmaceuticals, etc. [78]. There are several pretreatment methods for the selective separation of each biomass component. Typically, these include chemical methods such as treatment with alkali compounds (NaOH), acids (HCl, H2SO4, H3PO4), ozone, oxidative treatment and organosolv [79–83] and physical methods such as milling [79,84,85], sometimes mixing with H2SO4, hydrothermal methods [86,87] and physicochemical such as SO2, ammonia fiber and steam explosion [79,88–90] and wet oxidation [91]. Lignin is the most abundant aromatic biopolymer after cellulose on the earth, occupying 15-40% of dry lignocellulosic biomass. It is one of the principal components of woody plants and is found in plant cell walls. Lignin acts as a binding agent by filling the space between hemicellulose and cellulose in the cell wall structure to tightly combine them [92]. Additionally, the presence of lignin in the plant promotes pathogenic defense and water transport [93]. Different reports have stated that the world's annual production of lignin differs from 40 to 50 million tons [59–61]. Thus, it is a very favorable method to depolymerize lignin to high value added and functional compounds [94]. Unfortunately, lignin is currently underutilized because of its biomass recalcitrance and enormous amounts of it is used as cheap solid fuel to make electricity and heat. Only 2% of pulping extracted lignin is utilized for other commercial purposes [95,96]. Generally, there are four main types of lignin; organosolv lignin, kraft lignin, lignosulfonate, and soda lignin, which can be directly extracted from grasses or woods in the pulp industry [93]. Considerable amounts of technical lignins such as lignosulfonates, kraft and hydrolysis lignin are prepared via the chemical processing of wood by the paper, pulping and hydrolysis industries. Moreover, lignin is the major source of natural aromatic structures in the world and is composed of aromatic monomers [94,96–97]. Various characterization methods such as scanning electron microscopy [98], gas chromatography-mass spectrometry [99], thermogravimetric analysis, infrared spectroscopy [100], transmission electron microscope (TEM), 13C/31P nuclear magnetic resonance (NMR) and heteronuclear single quantum coherence techniques [101] have been used to characterize lignin and its derivatives. Chemically, lignin is a linear and amorphous polymer composed of a random network of phenylpropane monomeric units; namely coniferyl alcohol (G), sinapyl (S), and p-coumaryl alcohols (H) and primary monolignols (Fig. 1 ) [96,102]. These units are linked to each other via C-C linkages such as β-1, 5-5', β-β, and aryl ether linkages counting β-O-4, 4-O-5 and dibenzodioxocin. Generally, β-O-4 is the main linkage (45-50%), while more than 12% of the linkages are β-5 phenylcoumaran bonds [103–105]. The usual bonding patterns in lignin are thus typically C-O-C bonds, which exist either as ethers or as part of a furan ring [106]. Additionally, typical functional groups in lignin include phenolic hydroxyl, aliphatic hydroxyl, methoxyl and other carbonyl groups. Lignin has many complexities compared with other constituents owing to its structure and the functional groups, which can be alkylated and acetylated as preferred in addition to undergoing several other reactions such as halogenation, nitration, reduction, oxidation, sulfonation, hydrolysis, catalytic hydrogenation under pressure, and fusion with metals or alkali compounds. Lignin is usually depolymerized to develop novel monomers [107], but some complexities exist as it is powerfully held together by some of the strongest bonds (C-C and C-O) and further structural characteristics are influenced by the approaches used in its extraction. These approaches include Björkman process [108], cellulolytic enzyme lignin, enzymatic mild acidolysis lignin [109,110], organosolv process [111] and ionic liquid treatment [112]. In addition, the starting materials affect the properties, structures and chemistry of lignin [113]. Cellulose, hemicelluloses and lignin are the significant biopolymers in woody biomass, which are extensively used as starting materials in the preparation of functional polymers and composites. Lignin biopolymers can be broadly used in different fields owing to several properties such as biodegradability, high thermal stability, antimicrobial actions, adhesive nature, antioxidant properties and so on. Lignocellulose fibers are natural, earth-abundant, inexpensive, promising compounds to produce supports for catalysts due to their rich surface functional groups such as methoxy, hydroxyl (OH), carbonyl (C = O), and carboxyl (COOH) groups, which can promote the dispersion and deposition of metal nanoparticles (NPs). Some workers have reported the fabrication of NPs such as Cu, Pt, Pd, Au, or Ag on cellulose polymers [114–117]. Generally, the use of lignocellulose fibers and lignin biomass as catalyst supports can lead to the enhanced stabilization of NPs. Important examples of different lignin based (nano)catalysts and their catalytic applications have been reported in recent years [118–124]. For example, recently, the activity of lignin based (nano)catalysts was evaluated in our research group in Cr(VI) reduction, hydrogen storage and Suzuki-Miyaura reaction in eco-friendly media [53,123,124]. 4 Lignin derived (nano)catalysts in the oxidation reactions In recent decade, lignin based (nano)catalysts have been used as heterogeneous and novel catalysts with excellent catalytic prowess for chemical transformations. Different applications of lignin based (nano)catalysts in the oxidation reactions are summarized in this section. In 2019, Liu et al. reported the pyrolysis of dicyandiamide and Co/Mn-lignin complex mixture to prepare novel Mn/N co-doped carbon supported Co (Co-Mn/N@C) nanocatalyst for selective oxidation of HMF (5-hydroxymethylfurfural) in the air to 2,5-furandicarboxylic acid (FDCA) (Fig. 2 ) [125]. The research group found that the Mn/N-doped carbon can increase the reactivity of Co NPs (Fig. 3 ). In this reaction, H2O is a source of oxygen of FDCA and O2 acts as an electron scavenger and removes protons for to regenerate the catalyst. Conversion of biomass derived lignin and HMF demonstrates the value of renewable wastes. In the same year, Jiang et al. prepared single-atom catalysts on nitrogen-doped carbon (M SAs-N@C, in which M = Fe, Co, Ni, Cu) via a robust and facile metal-lignin coordination process (Fig. 4 ) [126]. The Co SAs-N@C catalyst affords excellent reactivity in the oxidative esterification of primary alcohols. Co SAs-N@C catalyst also converts HMF directly to dimethyl furan-2,5-dicarboxylate (FDE). This method is facile, economical and scalable. Furthermore, Pt supported on lignin based carbon dots (Pt/Lg-CDs) was prepared by Li and co-workers via the chloroplatinic acid reduction in a solution of carbon dots in 2019 [127]. Optimal Pt/Lg-CDs-800 catalyst showed more stability and activity than PtRu/C (30% Pt + 15% Ru) and Pt/C (40% Pt) in the methanol electro-oxidation. In 2018, Saladino and co-workers functionalized lignin nanoparticles with tyrosinase for oxidizing phenol derivatives under eco-friendly conditions [128]. It was observed that lignin was stable to the tyrosinase activity. The as-synthesized catalyst helped in the synthesis of catechol derivatives (Scheme 1 ), where the efficiency of the catalyst refers to the immobilization processes. Tyrosinase immobilization was carried out via direct adsorption process, followed by encapsulation, and layer-by-layer deposition, with or without glutaraldehyde reticulation. In another study in the same year, Ma et al. encapsulated nanoscale zero-valent iron (ZVI) in lignin derived hydrochar (Fe@HC) via a facile one-pot, cheap and environmentally friendly, in situ method [129]. Fe@HC-800 can degrade phenol completely within 20 minutes at mild temperatures using peroxymonosulfate (PMS) (Scheme 2 ). The catalyst also exhibits high stability even after 3 runs. The research team of Rodríguez-Mirasol prepared platinum loaded lignin fibers with and without phosphorus via one-step electrospinning of lignin/phosphoric acid/ethanol/platinum acetylacetonate solutions in 2017 [130]. Thanks to thermochemical treatments, lignin based carbon fiber electrocatalysts were obtained with high and low Pt concentration, stabilized in the air and carbonized at the temperature of 900 °C in nitrogen atmosphere. Carbon fiber electrodes afford high surface areas with well dispersed Pt NPs. The electrodes, which contain Pt, exhibit higher surface area, smaller Pt particle size and good particle distribution and thus better oxidation and electro-oxidation activity than those with no P. The activity of the as-obtained catalyst was shown to be outstanding in the oxidation of methanol and ethanol. Furthermore, activated carbon derived from hemp and wheat lignin was prepared by Martin-Martinez et al. by carbonization at 800 °C in nitrogen atmosphere [131]. The consequential components were applied as catalysts in the 4-nitrophenol (4-NP) oxidative degradation using catalytic wet peroxide oxidation (CWPO) via decomposing H2O2. At low temperatures, fast but inefficient H2O2 decomposition was observed, which suggests the production of species other than HO•. Increasing the temperature was observed to complete 4-NP removal. In 2016, β-cyclodextrin (β-CD) attached to lignin (L-β-CD) was prepared by Ji and co-workers via the reaction of β-CD and lignin using epichlorohydrin (EPI) as a cross-linker (Scheme 3 ) [132]. The as prepared catalyst was then applied in benzyl alcohol (BzOH) oxidation to benzaldehyde (BzH) with good selectivity using H2O2 as the oxidant (Scheme 4 ). The best conditions for the reaction, which yields high selectivity (>99%) and the probable mechanism for the reaction (Scheme 5 ) were discussed. The weak interactions between the catalyst and support affected efficient oxidation reaction of BzOH. Recyclability with no loss of catalytic activity was the advantage of the catalyst, which extends its use for green synthesis of BzH. In another study, Rodríguez-Mirasol and colleagues synthesized carbon based Pd catalysts with low Pd content (0.5%) by using mesoporous activated carbons obtained from kraft lignin activated with H3PO4 [133]. The activation of the produced carbon supports limit their oxidation due to large amounts of surface phosphorus, in form of C-PO3, C-O-PO3 and C3PO groups. The prepared catalysts were used in the oxidation of benzene, toluene and xylene at 150-400 °C. The catalysts obtained displayed high mesopores volumes and surface areas. TEM study showed that Pd NPs had been suitably dispersed in size of 5-12 nm. In 2019, Piccinino et al. reported the laccase immobilization on lignin NPs by encapsulation, physical adsorption, and layer by layer (LbL) technologies, containing the glutaraldehyde and bovine derum albumin process (Fig. 5 ) [134]. The new catalysts converted alcohols to aldehydes with high selectivity by 2,2,6,6-tetramethylpiperidin-1-yloxyl (TEMPO) as a redox mediator (Scheme 6 and Table 2 ). Most recently, Pylypchuk and co-workers prepared the magnetic encapsulated lignin peroxidase (LiP) and horseradish peroxidase (HRP) composites via adsorption of the peroxidase enzymes on Fe3O4 surface, followed by the formation of SiO2 shell via sol-gel process (Fig. 6 ) [135]. Encapsulation improved the biocatalyst stability. The synthesized biocatalysts were used in the oxidation of diclofenac, carbamazepine, and paracetamol pollutants. The sol-gel encapsulated HRP and LiP based composites were active over 20 repeated cycles at 55 °C for 20 days (24 h/cycle). Diclofenac and carbamazepine were degraded to 64% and 68%, respectively, by F3O4/LP/SiO2 at pH 5. Complete degradation of diclofenac and carbamazepine was reached at 55 °C (pH 3) within 72 h for both immobilized LiP and HRP. There have also been other studies regarding the application of the lignin based catalysts in oxidation processes, which are summarized in Table 3 . 5 Conclusion and future prospects Despite the benefits of the prepared catalysts from non-renewable resources, they have often failed for commercialization due to their high production cost and environmental pollution. In order to decrease the environmental pollution by synthetic compounds and the use of non-renewable materials and resources, the search for using biomaterials is on growth. Among biomaterials, biopolymer based resources are safely and efficiently prepared via a green route. These compounds, which are valuable in nanoscience, sensors, catalysis, water treatment, biomedical application, cancer treatment, energy sector, antibacterial material, food industry and other fields can be prepared easily from the plant and animal wastes of otherwise no economic value. Biopolymers have revolutionized the improvement of biocatalysts. They are also used as stabilizers and reducers in metal ion reduction to metal NPs and their stabilization. Both biocompatibility and biodegradability of these materials are important characteristics, which have expanded their applications. A biopolymer can be combined with various compounds such as a biopolymer or a biodegradable synthetic polymer to generate an effective composite as a catalyst. In addition, the immobilization of metal nanoparticles or complexes such as Ag, Cu, Pd, TiO2, ZnO, Au, etc. on the surface of biopolymers forms stable compounds with enhanced catalytic prowess. The recent studies have demonstrated the true potential of lignin based catalysts in oxidation reactions. These catalytic systems afford environmentally friendly catalysts for oxidative transformation reactions, which can replace the conventional hazardous catalysts. Catalysts based on lignin have been outstanding to the researchers owing to their important characteristics such as facile and simple synthesis method, low price, recyclability, stability and environmental friendliness, which have extended their use in oxidation reactions. They can be also efficient in such reactions owing to their high surface area, high porosity, small size, low amount and uniform dispersion of nanoparticles and no release of particles into the mixture of the reaction. Lignin based catalysts can catalyze a variety of oxidation reactions. Catalyst assisted oxidative transformation reactions have been mostly carried out with the aim of synthesis or removal of pollutants. These catalysts present excellent catalytic activities in the oxidation reactions. Despite recent improvements in lignin based catalysts, there are several challenges, which need to be investigated in future studies: • Technological improvements and controlled environmental conditions for the easy preparation of biopolymers, including lignin, from available raw materials. • Utilization of different bio-wastes for the preparation of biopolymers. • Reported methods for the preparation of lignin based catalysts in this review were small in scale. Consequently, we believe there are great potentials for the fabrication of these catalysts in industrial scale. • The utilization of plant extracts for the immobilization of metal NPs on the biopolymers surface under green and mild conditions • Development of efficient approaches for the organization of magnetic lignin based catalyst due to their easy separation from the reaction media. Declaration of Competing Interest The authors declare no competing interest. Acknowledgements The support of this work by the University of Qom is greatly appreciated. References [1] I. Kani M. Kurtca Turkish J. Chem. 36 2012 827 840 I. Kani, M. Kurtca, Turkish J. Chem. 36 (2012) 827-840. [2] R. Pocklanova A.K. Rathi M.B. Gawande K.K.R. Datta V. Ranc K. Cepe M. Petr R.S. Varma L. Kvitek R. Zboril J. Mol. Catal. A Chem. 424 2016 121 127 R. Pocklanova, A.K. Rathi, M.B. Gawande, K.K.R. Datta, V. Ranc, K. Cepe, M. Petr, R.S. Varma, L. Kvitek, R. Zboril, J. Mol. Catal. A Chem. 424 (2016) 121-127. [3] R.A. Sheldon J.K. Kochi Metal-Catalysed Oxidations of Organic Compounds Mechanistic Principles and Synthetic Methodology Including Biochemical Processes 1st Edition 1981 Elsevier R.A. Sheldon, J.K. Kochi, Metal-Catalysed Oxidations of Organic Compounds, 1st Edition, Mechanistic Principles and Synthetic Methodology Including Biochemical Processes, Elsevier, 1981. [4] P. Gallezot Catal. Today. 37 1997 405 418 P. Gallezot, Catal. Today. 37 (1997) 405-418. [5] K. George S. Sugunan Catal. Commun. 9 2008 2149 2153 K. George, S. Sugunan, Catal. Commun. 9 (2008) 2149-2153. [6] K.C. Gupta A.K. Sutar C.-C. Lin Coord. Chem. Rev. 253 2009 1926 1946 K.C. Gupta, A.K. Sutar, C.-C. Lin, Coord. Chem. Rev. 253 (2009) 1926-1946. [7] S.S. Stahl Angew. Chemie Int. Ed. 43 2004 3400 3420 S.S. Stahl, Angew. Chemie Int. Ed. 43 (2004) 3400-3420. [8] J. Muzart Tetrahedron 59 2003 5789 5816 J. Muzart, Tetrahedron 59 (2003) 5789–5816. [9] S. Verma R.B.N. Baig M.N. Nadagouda R.S. Varma Tetrahedron 73 2017 5577 5580 S. Verma, R.B.N. Baig, M.N. Nadagouda, R.S. Varma, Tetrahedron 73 (2017) 5577-5580. [10] K.C. Gupta A.K. Sutar Coord. Chem. Rev. 252 2008 1420 1450 K C Gupta, A.K. Sutar, Coord. Chem. Rev. 252 (2008) 1420-1450. [11] K. Omura D. Swern Tetrahedron 34 1978 1651 1660 K. Omura, D. Swern, Tetrahedron 34 (1978) 1651-1660. [12] V.V. Zhdankin Hypervalent iodine (III) reagents in organic synthesis ARKIVOC (i) 2009 1 62 V. V. Zhdankin, Hypervalent iodine (III) reagents in organic synthesis, ARKIVOC (i) (2009) 1-62. [13] S. Caron R.W. Dugger S.G. Ruggeri J.A. Ragan D.H.B. Ripin Chem. Rev. 106 2006 2943 2989 S. Caron, R.W. Dugger, S.G. Ruggeri, J.A. Ragan, D.H.B. Ripin, Chem. Rev. 106 (2006) 2943-2989. [14] J. Piera J.-E. Bäckvall Angew. Chemie Int. Ed. 47 2008 3506 3523 J. Piera, J.-E. Bäckvall, Angew. Chemie Int. Ed. 47 (2008) 3506-3523. [15] S. Ma J. Liu S. Li B. Chen J. Cheng J. Kuang Y. Liu B. Wan Y. Wang J. Ye Adv. Synth. Catal. 353 2011 1005 1017 S. Ma, J. Liu, S. Li, B. Chen, J. Cheng, J. Kuang, Y. Liu, B. Wan, Y. Wang, J. Ye, Adv. Synth. Catal. 353 (2011) 1005-1017. [16] M.S. Sigman D.R. Jensen Acc. Chem. Res. 39 2006 221 229 M.S. Sigman, D.R. Jensen, Acc. Chem. Res. 39 (2006) 221-229. [17] C.R. Goldsmith Coord. Chem. Rev. 377 2018 209 224 C.R. Goldsmith, Coord. Chem. Rev. 377 (2018) 209-224. [18] S. Fukuzumi T. Kojima Y.-M. Lee W. Nam Coord. Chem. Rev. 333 2017 44 56 S. Fukuzumi, T. Kojima, Y.-M. Lee, W. Nam, Coord. Chem. Rev. 333 (2017) 44-56. [19] V. Polshettiwar R.S. Varma Tetrahedron 64 2008 4637 4643 V. Polshettiwar, R.S. Varma, Tetrahedron 64 (2008) 4637-4643. [20] A.K. Rathi M.B. Gawande J. Pechousek J. Tucek C. Aparicio M. Petr O. Tomanec R. Krikavova Z. Travnicek R.S. Varma Green Chem. 18 2016 2363 2373 A.K. Rathi, M.B. Gawande, J. Pechousek, J. Tucek, C. Aparicio, M. Petr, O. Tomanec, R. Krikavova, Z. Travnicek, R.S. Varma, Green Chem. 18 (2016) 2363-2373. [21] R.B.N. Baig M.N. Nadagouda R.S. Varma Green Chem. 16 2014 4333 4338 R.B.N. Baig, M.N. Nadagouda, R.S. Varma, Green Chem. 16 (2014) 4333-4338. [22] V. Polshettiwar R.S. Varma Org. Biomol. Chem. 7 2009 37 40 V. Polshettiwar, R.S. Varma, Org. Biomol. Chem. 7 (2009) 37-40. [23] S. Verma R.B.N. Baig M.N. Nadagouda R.S. Varma Catal. Today. 309 2018 248 252 S. Verma, R.B.N. Baig, M.N. Nadagouda, R.S. Varma, Catal. Today. 309 (2018) 248-252. [24] M. Shokouhimehr K. Hong T.H. Lee C.W. Moon S.P. Hong K. Zhang J.M. Suh K.S. Choi R.S. Varma H.W. Jang Green Chem. 20 2018 3809 3817 M. Shokouhimehr, K. Hong, T.H. Lee, C.W. Moon, S.P. Hong, K. Zhang, J.M. Suh, K.S. Choi, R.S. Varma, H.W. Jang, Green Chem. 20 (2018) 3809-3817. [25] R.S. Varma ACS Sustain. Chem. Eng. 7 2019 6458 6470 R.S. Varma, ACS Sustain. Chem. Eng. 7 (2019) 6458-6470. [26] M. Shokouhimehr S. Mahmoudi-Gom Yek M. Nasrollahzadeh R.S. Varma Appl. Sci. 9 2019 4183 M. Shokouhimehr, S. Mahmoudi-Gom Yek, M. Nasrollahzadeh, R.S. Varma, Appl. Sci. 9 (2019) 4183. [27] M. Nasrollahzadeh M. Bagherzadeh H. Karimi J. Colloid Interface Sci. 465 2016 271 278 M. Nasrollahzadeh, M. Bagherzadeh, H. Karimi, J. Colloid Interface Sci. 465 (2016) 271-278. [28] A. Nodzewska A. Wadolowska M. Watkinson Coord. Chem. Rev. 382 2019 181 216 A. Nodzewska, A. Wadolowska, M. Watkinson, Coord. Chem. Rev. 382 (2019) 181-216. [29] C. Xu M. Nasrollahzadeh M. Sajjadi M. Maham R. Luque A.R. Puente-Santiago Renew. Sustain. Energy Rev. 112 2019 195 252 C. Xu, M. Nasrollahzadeh, M. Sajjadi, M. Maham, R. Luque, A.R. Puente-Santiago, Renew. Sustain. Energy Rev. 112 (2019) 195-252. [30] A. Omidvar B. Jaleh M. Nasrollahzadeh J. Colloid Interface Sci. 496 2017 44 50 A. Omidvar, B. Jaleh, M. Nasrollahzadeh, J. Colloid Interface Sci. 496 (2017) 44-50. [31] S.S. Momeni M. Nasrollahzadeh A. Rustaiyan J. Colloid Interface Sci. 472 2016 173 179 S.S. Momeni, M. Nasrollahzadeh, A. Rustaiyan, J. Colloid Interface Sci. 472 (2016) 173-179. [32] B. Khodadadi M. Bordbar M. Nasrollahzadeh J. Colloid Interface Sci. 490 2017 1 10 B. Khodadadi, M. Bordbar, M. Nasrollahzadeh, J. Colloid Interface Sci. 490 (2017) 1-10. [33] M. Nasrollahzadeh S.M. Sajadi A. Rostami-Vartooni M. Khalaj RSC Adv. 4 2014 43477 43484 M. Nasrollahzadeh, S.M. Sajadi, A. Rostami-Vartooni, M. Khalaj, RSC Adv. 4 (2014) 43477–43484. [34] M. Nasrollahzadeh M. Sajjadi M. Shokouhimehr R.S. Varma Coord. Chem. Rev. 397 2019 54 75 M. Nasrollahzadeh, M. Sajjadi, M. Shokouhimehr, R.S. Varma, Coord. Chem. Rev. 397 (2019) 54–75. [35] N. Motahharifar M. Nasrollahzadeh A. Taheri-Kafrani R.S. Varma M. Shokouhimehr Carbohyd. Polym. 232 2020 115819 N. Motahharifar, M. Nasrollahzadeh, A. Taheri-Kafrani, R.S. Varma, M. Shokouhimehr, Carbohyd. Polym. 232 (2020) 115819. [36] R. Skouta R.S. Varma C.-J. Li Green Chem. 7 2005 571 575 R. Skouta, R.S. Varma, C.-J. Li, Green Chem. 7 (2005) 571–575. [37] J. Liang Y.-B. Huang R. Cao Coord. Chem. Rev. 378 2019 32 65 J. Liang, Y.-B. Huang, R. Cao, Coord. Chem. Rev. 378 (2019) 32–65. [38] X. Zhang M. Fevre G.O. Jones R.M. Waymouth Chem. Rev. 118 2017 839 885 X. Zhang, M. Fevre, G.O. Jones, R.M. Waymouth, Chem. Rev. 118 (2017) 839–885. [39] M. Benaglia A. Puglisi F. Cozzi Chem. Rev. 103 2003 3401 3430 M. Benaglia, A. Puglisi, F. Cozzi, Chem. Rev. 103 (2003) 3401–3430. [40] B. Altava M.I. Burguete E. García-Verdugo S.V. Luis Chem. Soc. Rev. 47 2018 2722 2771 B. Altava, M.I. Burguete, E. García-Verdugo, S. V. Luis, Chem. Soc. Rev. 47 (2018) 2722–2771. [41] T. Baran M. Nasrollahzadeh Carbohydr. Polym. 222 2019 115029 T. Baran, M. Nasrollahzadeh, Carbohydr. Polym. 222 (2019) 115029. [42] R.A. Frenzel G.P. Romanelli L.R. Pizzio Mol. Catal. 457 2018 8 16 R. A. Frenzel, G. P. Romanelli, L. R. Pizzio, Mol. Catal. 457 (2018) 8-16. [43] M. Nasrollahzadeh N. Motahharifar F. Ghorbannezhad N.S. Soheili Bidgoli T. Baran R.S. Varma Mol. Catal. 480 2020 110645 M. Nasrollahzadeh, N. Motahharifar, F. Ghorbannezhad, N. S. Soheili Bidgoli, T. Baran, R. S. Varma, Mol. Catal. 480 (2020) 110645. [44] X. Chen W. Wang H. Zhu W. Yang Y. Ding Mol. Catal. 456 2020 49 56 X. Chen, W. Wang, H. Zhu, W. Yang, Y. Ding, Mol. Catal. 456 (2020) 49-56. [45] J.-J. Kim C.-R. Lim B.M. Reddy S.-E. Park Mol. Catal. 451 2018 43 50 J.-J. Kim, C.-R. Lim, B. M. Reddy, S.-E. Park, Mol. Catal. 451 (2018) 43-50. [46] W. Zhang L. Peng C. Deng Y. Zhang H. Qian Mol. Catal. 445 2018 170 178 W. Zhang, L. Peng, C. Deng, Y. Zhang, H. Qian, Mol. Catal. 445 (2018) 170-178. [47] S. Biswas R. Khatun M. Sengupta S.M. Islam Mol. Catal. 452 2018 129 137 S. Biswas, R. Khatun, M. Sengupta, S. M. Islam, Mol. Catal. 452 (2018) 129-137. [48] E. Vassiliadi A. Xenakis M. Zoumpanioti Mol. Catal. 445 2018 206 212 E. Vassiliadi, A. Xenakis, M. Zoumpanioti, Mol. Catal. 445 (2018) 206-212. [49] D. Duraczyńska E.M. Serwicka A. Drelinkiewicz R.P. Socha M. Zimowska L. Lityńska-Dobrzyńska A. Bukowska Mol. Catal. 470 2019 145 151 D. Duraczyńska, E. M. Serwicka, A. Drelinkiewicz, R. P. Socha, M. Zimowska, L. Lityńska-Dobrzyńska, A. Bukowska, Mol. Catal. 470 (2019) 145-151. [50] T. Chen Z. Xu L. Zhou J. Qiu M. Wang J. Wang Mol. Catal. 474 2019 110422 T. Chen, Z. Xu, L. Zhou, J. Qiu, M. Wang, J. Wang, Mol. Catal. 474 (2019) 110422. [51] T. Sano H. Sato T. Hori T. Hirakawa Y. Teramoto K. Koike Mol. Catal. 474 2019 110451 T. Sano, H. Sato, T. Hori, T. Hirakawa, Y. Teramoto, K. Koike, Mol. Catal. 474 (2019) 110451. [52] Y. Lin G.-P. Lu X. Zhao X. Cao L. Yang B. Zhou Q. Zhong Z. Chen Mol. Catal. 482 2020 110695 Y. Lin, G.-P. Lu, X. Zhao, X. Cao, L. Yang, B. Zhou, Q. Zhong, Z. Chen, Mol. Catal. 482 (2020) 110695. [53] M. Nasrollahzadeh Z. Issaabadi R.S. Varma ACS Omega 4 2019 14234 14241 M. Nasrollahzadeh, Z. Issaabadi, R.S. Varma, ACS Omega. 4 (2019) 14234–14241. [54] B.O.J. Fakayode A.O. Oladipo O.S. Oluwafemi S.P. Songca Biopolymer-mediated Green Synthesis of Noble Metal Nanostructures, Recent Adv. Biopolym 1st Ed. 2016 Croat. InTech. 19 44 B.O.J. Fakayode, A.O. Oladipo, O.S. Oluwafemi, S.P. Songca, Biopolymer-mediated Green Synthesis of Noble Metal Nanostructures, Recent Adv. Biopolym. 1st Ed. Croat. InTech. (2016) 19–44. [55] S. Mohan O.S. Oluwafemi N. Kalarikkal S. Thomas S.P. Songca Recent Adv. Biopolym. 2016 47 S. Mohan, O.S. Oluwafemi, N. Kalarikkal, S. Thomas, S.P. Songca, Recent Adv. Biopolym. (2016) 47. [56] D.S. Kumar B.J. Kumar H.M. Mahesh Quantum Nanostructures (QDs): An Overview Synth. Inorg. Nanomater 2018 Elsevier 59 88 D.S. Kumar, B.J. Kumar, H.M. Mahesh, Quantum Nanostructures (QDs): An Overview, in: Synth. Inorg. Nanomater., Elsevier, 2018: pp. 59–88. [57] Z. Zarnegar H.R. Monjezi J. Safari J. Mol. Struct. 1193 2019 14 23 Z. Zarnegar, H.R. Monjezi, J. Safari, J. Mol. Struct. 1193 (2019) 14-23. [58] J. Qin H. Zhang H. Sun Y. Wang L. Niu X. Lan G. Bai Mol. Catal. 478 2019 110561 J. Qin, H. Zhang, H. Sun, Y. Wang, L. Niu, X. Lan, G. Bai, Mol. Catal. 478 (2019) 110561. [59] C.R. Kumar N. Anand A. Kloekhorst C. Cannilla G. Bonura F. Frusteri K. Barta H.J. Heeres Green Chem 17 2015 4921 4930 C.R. Kumar, N. Anand, A. Kloekhorst, C. Cannilla, G. Bonura, F. Frusteri, K. Barta, H.J. Heeres, Green Chem. 17 (2015) 4921-4930. [60] C. Li X. Zhao A. Wang G.W. Huber T. Zhang Chem. Rev. 115 2015 11559 11624 C. Li, X. Zhao, A. Wang, G.W. Huber, T. Zhang, Chem. Rev. 115 (2015) 11559-11624. [61] P.T. Patil U. Armbruster M. Richter A. Martin Energy & Fuels 25 2011 4713 4722 P.T. Patil, U. Armbruster, M. Richter, A. Martin, Energy & Fuels. 25 (2011) 4713-4722. [62] A. Acharjee M.A. Ali B. Saha J. Solution Chem. 47 2018 1449 1478 A. Acharjee, M. A. Ali, B. Saha, J. Solution Chem. 47 (2018) 1449-1478. [63] R. Guan X. Yuan Z. Wu L. Jiang Y. Li G. Zeng Chem. Eng. J. 339 2018 519 530 R. Guan, X. Yuan, Z. Wu, L. Jiang, Y. Li, G. Zeng, Chem. Eng. J. 339 (2018) 519-530. [64] A. Sharma J. Ahmad S.J.S. Flora Environ. Res. 167 2018 223 233 A. Sharma, J. Ahmad, S. J. S. Flora, Environ. Res. 167 (2018) 223-233. [65] W.-J. Sun E.-Q. Gao Mol. Catal. 482 2020 110746 W.-J. Sun, E.-Q. Gao, Mol. Catal. 482 (2020) 110746. [66] D. Padayachee A.S. Mahomed S. Singh H.B. Friedrich Mol. Catal. 464 2019 1 9 D. Padayachee, A. S. Mahomed, S. Singh, H. B. Friedrich, Mol. Catal. 464 (2019) 1-9. [67] I. Kaskow I. Sobczak M. Ziolek V. Cortés Corberán Mol. Catal. 482 2020 110674 I. Kaskow, I. Sobczak, M. Ziolek, V. Cortés Corberán, Mol. Catal. 482 (2020) 110674. [68] X. Zhang X. Lv F. Bi G. Lu Y. Wang Mol. Catal. 482 2020 110701 X. Zhang, X. Lv, F. Bi, G. Lu, Y. Wang, Mol. Catal. 482 (2020) 110701. [69] J. Sánchez-García A.M. Benito W.K. Maser E. García-Bordejé Mol. Catal. 484 2020 110737 J. Sánchez-García, A. M. Benito, W. K. Maser, E. García-Bordejé, Mol. Catal. 484 (2020) 110737. [70] H. Sharma S. Sharma C. Sharma S. Paul J.H. Clark Mol. Catal. 469 2019 27 39 H. Sharma, S. Sharma, C. Sharma, S. Paul, J. H. Clark, Mol. Catal. 469 (2019) 27-39. [71] H. Shin M. Baek D.H. Kim Mol. Catal. 468 2019 148 153 H. Shin, M. Baek, D. H. Kim, Mol. Catal. 468 (2019) 148-153. [72] S.A. Singh S. Mukherjee G. Madras Mol. Catal. 466 2019 167 180 S. A. Singh, S. Mukherjee, G. Madras, Mol. Catal. 466 (2019) 167-180. [73] M. Nasrollahzadeh Z. Nezafat N.S. Soheili Bidgoli N. Shafiei Mol. Catal. 484 2020 110775 M. Nasrollahzadeh, Z. Nezafat, N. S. Soheili Bidgoli, N. Shafiei, Mol. Catal. 484 (2020) 110775. [74] J.M.J. Frechet J. Warnock M.J. Farrall J. Org. Chem. 43 1978 2618 2621 J.M.J. Frechet, J. Warnock, M.J. Farrall, J. Org. Chem. 43 (1978) 2618-2621. [75] A.M. Ruppert K. Weinberg R. Palkovits Angew. Chem. Int. Ed. 51 2012 2564 2601 A. M. Ruppert, K. Weinberg, R. Palkovits, Angew. Chem. Int. Ed. 51 (2012) 2564-2601. [76] R. Rinaldi R. Palkovits F. Schueth Angew. Chem. Int. Ed. 47 2008 8047 8050 R. Rinaldi, R. Palkovits, F. Schueth, Angew. Chem. Int. Ed. 47 (2008) 8047-8050. [77] S. Iravani R.S. Varma Green Chem. 22 2020 612 636 S. Iravani, R. S. Varma, Green Chem. 22 (2020) 612-636. [78] B.M. Upton A.M. Kasko Chem. Rev. 116 2016 2275 2306 B.M. Upton, A.M. Kasko, Chem. Rev. 116 (2016) 2275-2306. [79] V.B. Agbor N. Cicek R. Sparling A. Berlin D.B. Levin Biotechnol. Adv. 29 2011 675 685 V.B. Agbor, N. Cicek, R. Sparling, A. Berlin, D.B. Levin, Biotechnol. Adv. 29 (2011) 675-685. [80] R.R. Gonzales P. Sivagurunathan S.H. Kim Int. J. Hydrogen Energy 41 2016 21678 21684 R.R. Gonzales, P. Sivagurunathan, S.H. Kim, Int. J. Hydrogen Energy 41 (2016) 21678-21684. [81] J.K. Xu R.C. Sun Recent Advances in Alkaline Pretreatment of Lignocellulosic Biomass Chapter 19 S.I. Mussatto Biomass Fractionation Technologies for a Lignocellulosic Feedstock Based Biorefinery 2016 Elsevier Amsterdam, The Netherlands 431 459 J.K. Xu, R.C. Sun, Chapter 19-Recent Advances in Alkaline Pretreatment of Lignocellulosic Biomass. In Biomass Fractionation Technologies for a Lignocellulosic Feedstock Based Biorefinery; Mussatto, S.I., Ed.; Elsevier: Amsterdam, The Netherlands, 2016; pp. 431-459. [82] M.A. Garcia-Cubero G. Gonzalez-Benito I. Indacoechea M. Coca S. Bolado Bioresour. Technol. 100 2009 1608 1613 M.A. Garcia-Cubero, G. Gonzalez-Benito, I. Indacoechea, M. Coca, S. Bolado, Bioresour. Technol. 100 (2009) 1608-1613. [83] C. Nitsos R. Stoklosa A. Karnaouri D. Vörös H. Lange D. Hodge C. Crestini U. Rova P. Christakopoulos ACS Sustain. Chem. Eng. 4 2016 5181 5193 C. Nitsos, R. Stoklosa, A. Karnaouri, D. Vörös, H. Lange, D. Hodge, C. Crestini, U. Rova, P. Christakopoulos, ACS Sustain. Chem. Eng. 4 (2016) 5181-5193. [84] A.S. Da Silva H. Inoue T. Endo S. Yano E.P. Bon Bioresour. Technol. 101 2010 7402 7409 A.S. Da Silva, H. Inoue, T. Endo, S. Yano, E.P. Bon, Bioresour. Technol. 101 (2010) 7402-7409. [85] A. Barakat C. Mayer-Laigle A. Solhy R.A.D. Arancon H. de Vries R. Luque RSC Adv. 4 2014 48109 48127 A. Barakat, C. Mayer-Laigle, A. Solhy, R.A.D. Arancon, H. de Vries, R. Luque, RSC Adv. 4 (2014) 48109-48127. [86] C.K. Nitsos K.A. Matis K.S. Triantafyllidis ChemSusChem 6 2013 110 122 C.K. Nitsos, K.A. Matis, K.S. Triantafyllidis, ChemSusChem 6 (2013) 110-122. [87] Z. Hu M. Foston A.J. Ragauskas Bioresour. Technol. 102 2011 7224 7228 Z. Hu, M. Foston, A.J. Ragauskas, Bioresour. Technol. 102 (2011) 7224-7228. [88] B.E. Dale C.K. Leong T.K. Pham V.M. Esquivel I. Rios V.M. Latimer Bioresour. Technol. 56 1996 111 116 B.E. Dale, C.K. Leong, T.K. Pham, V.M. Esquivel, I. Rios, V.M. Latimer, Bioresour. Technol. 56 (1996) 111-116. [89] A. Duque P. Manzanares I. Ballesteros M. Ballesteros Steam Explosion as Lignocellulosic Biomass Pretreatment Chapter 15 S.I. Mussatto Biomass Fractionation Technologies for a Lignocellulosic Feedstock Based Biorefinery 2016 Elsevier Amsterdam, The Netherlands 349 368 A. Duque, P. Manzanares, I. Ballesteros, M. Ballesteros, Chapter 15-Steam Explosion as Lignocellulosic Biomass Pretreatment. In Biomass Fractionation Technologies for a Lignocellulosic Feedstock Based Biorefinery; Mussatto, S.I., Ed.; Elsevier: Amsterdam, The Netherlands, 2016; pp. 349-368. [90] Y. Tang R.P. Chandra S. Sokhansanj J.N. Saddler Fuel 211 2018 87 94 Y. Tang, R.P. Chandra, S. Sokhansanj, J.N. Saddler, Fuel 211 (2018) 87-94. [91] A.S. Schmidt A.B. Thomsen Bioresour. Technol. 64 1998 139 151 A.S. Schmidt, A.B. Thomsen, Bioresour. Technol. 64 (1998) 139-151. [92] A.K.S. Kameshwar W.S. Qin Int. J. Biol. Sci. 12 2016 156 171 A.K.S. Kameshwar, W.S. Qin, Int. J. Biol. Sci. 12 (2016) 156-171. [93] C. Wang S.S. Kelley R.A. Venditti ChemSusChem 9 2016 770 783 C. Wang, S.S. Kelley, R.A. Venditti, ChemSusChem 9 (2016) 770-783. [94] C.O. Tuck E. Pérez I.T. Horváth R.A. Sheldon M. Poliakoff Science 337 2012 695 699 C.O. Tuck, E. Pérez, I.T. Horváth, R.A. Sheldon, M. Poliakoff, Science 337 (2012) 695-699. [95] Y.P. Wang L.L. Dai L.L. Fan S.Q. Shan Y.H. Liu R. Ruan J. Anal. Appl. Pyrolysis 119 2016 104 113 Y.P. Wang, L.L. Dai, L.L. Fan, S.Q. Shan, Y.H. Liu, R. Ruan, J. Anal. Appl. Pyrolysis 119 (2016) 104-113. [96] N. Mahmood Z.S. Yuan J. Schmidt C.B. Xu Renew. Sustain. Energy Rev. 60 2016 317 329 N. Mahmood, Z.S. Yuan, J. Schmidt, C.B. Xu, Renew. Sustain. Energy Rev. 60 (2016) 317-329. [97] A. Eudes Y. Liang P. Mitra D. Loqué Curr. Opin. Biotechnol. 26 2014 189 198 A. Eudes, Y. Liang, P. Mitra, D. Loqué, Curr. Opin. Biotechnol. 26 (2014) 189-198. [98] A.L. Tarasov L.M. Kustov A.A. Bogolyubov A.S. Kiselyov V.V. Semenov Appl. Catal. A Gen. 366 2009 227 231 A.L. Tarasov, L.M. Kustov, A.A. Bogolyubov, A.S. Kiselyov, V.V. Semenov, Appl. Catal. A Gen. 366 (2009) 227-231. [99] X.Y. Wang R. Rinaldi ChemSusChem 5 2012 1455 1466 X.Y. Wang, R. Rinaldi, ChemSusChem 5 (2012) 1455-1466. [100] X.F. Xie B. Goodell D.J. Zhang D.C. Nagle Y.H. Qian M.L. Peterson J. Jellison Bioresour. Technol. 100 2009 1797 1802 X.F. Xie, B. Goodell, D.J. Zhang, D.C. Nagle, Y.H. Qian, M.L. Peterson, J. Jellison, Bioresour. Technol. 100 (2009) 1797-1802. [101] J.C. del Río J. Rencoret P. Prinsen _A.T. Martínez J. Ralph A. Guti_errez J. Agric. Food Chem. 60 2012 5922 5935 J.C. del Río, J. Rencoret, P. Prinsen, _A.T. Martínez, J. Ralph, A. Guti_errez, J. Agric. Food Chem. 60 (2012) 5922-5935. [102] J. Zakzeski P.C.A. Bruijnincx A.L. Jongerius B.M. Weckhuysen Chem. Rev. 110 2010 3552 3599 J. Zakzeski, P. C. A. Bruijnincx, A. L. Jongerius and B. M. Weckhuysen, Chem. Rev. 110 (2010) 3552-3599. [103] J. Ralph K. Lundquist G. Brunow F. Lu H. Kim P.F. Schatz J.M. Marita R.D. Hatfield S.A. Ralph J.H. Christensen W. Boerjan Phytochemistry Rev. 3 2004 29 60 J. Ralph, K. Lundquist, G. Brunow, F. Lu, H. Kim, P.F. Schatz, J.M. Marita, R.D. Hatfield, S.A. Ralph, J.H. Christensen, W. Boerjan, Phytochemistry Rev. 3 (2004) 29-60. [104] C.G. Boeriu D. Bravo R.J.A. Gosselink J.E.G. van Dam Ind. Crops Prod. 20 2004 205 218 C.G. Boeriu, D. Bravo, R.J.A. Gosselink, J.E.G. van Dam, Ind. Crops Prod. 20 (2004) 205-218. [105] F.S. Chakar A.J. Ragauskas Ind. Crops Prod. 20 2004 131 141 F.S. Chakar, A.J. Ragauskas, Ind. Crops Prod. 20 (2004) 131-141. [106] C. Xu R.A.D. Arancon J. Labidi R. Luque Chem. Soc. Rev. 43 2014 7485 7500 C. Xu, R. A. D. Arancon, J. Labidi, R. Luque, Chem. Soc. Rev. 43 (2014) 7485-7500. [107] Z. Sun B. l. Fridrich A. de Santi S. Elangovan K. Barta Chem. Rev 118 2018 614 678 Z. Sun, B. l. Fridrich, A. de Santi, S. Elangovan, K. Barta, Chem. Rev. 118 (2018) 614-678. [108] A. Fujimoto Y. Matsumoto H.-M. Chang G. Meshitsuka J. Wood Sci. 51 2005 89 91 A. Fujimoto, Y. Matsumoto, H.-M. Chang, G. Meshitsuka, J. Wood Sci. 51 (2005) 89-91. [109] L. Axelsson M. Franzén M. Ostwald G. Berndes G. Lakshmi N. Ravindranath Biofuel. Bioprod. Biorefin. 6 2012 246 256 L. Axelsson, M. Franzén, M. Ostwald, G. Berndes, G. Lakshmi, N. Ravindranath, Biofuel. Bioprod. Biorefin. 6 (2012) 246-256. [110] A. Guerra I. Filpponen L.A. Lucia D.S. Argyropoulos J. Agric. Food Chem. 54 2006 9696 9705 A. Guerra, I. Filpponen, L. A. Lucia, D. S. Argyropoulos, J. Agric. Food Chem. 54 (2006) 9696-9705. [111] C.M. Cai T. Zhang R. Kumar C.E. Wyman Green Chem. 15 2013 3140 3145 C. M. Cai, T. Zhang, R. Kumar, C. E. Wyman, Green Chem. 15 (2013) 3140-3145. [112] G. Cheng M.S. Kent L. He P. Varanasi D. Dibble R. Arora K. Deng K. Hong Y.B. Melnichenko B.A. Simmons Langmuir 28 2012 11850 11857 G. Cheng, M. S. Kent, L. He, P. Varanasi, D. Dibble, R. Arora, K. Deng, K. Hong, Y. B. Melnichenko, B. A. Simmons, Langmuir 28 (2012) 11850-11857. [113] R. Rinaldi R. Jastrzebski M.T. Clough J. Ralph M. Kennema P.C. Bruijnincx B.M. Weckhuysen Angew. Chemie Int. Ed. 55 2016 8164 8215 R. Rinaldi, R. Jastrzebski, M. T. Clough, J. Ralph, M. Kennema, P. C. Bruijnincx, B.M. Weckhuysen, Angew. Chemie Int. Ed. 55 (2016) 8164-8215. [114] S. Padalkar J.R. Capadona S.J. Rowan C. Weder Y.-H. Won L.A. Stanciu R.J. Moon Langmuir 26 2010 8497 8502 S. Padalkar, J.R. Capadona, S.J. Rowan, C. Weder, Y.-H. Won, L.A. Stanciu, R.J. Moon, Langmuir 26 (2010) 8497-8502. [115] J. He T. Kunitake A. Nakao Chem. Mater. 15 2003 4401 4406 J. He, T. Kunitake, A. Nakao, Chem. Mater. 15 (2003) 4401-4406. [116] K.R. Reddy N.S. Kumar P.S. Reddy B. Sreedhar M.L. Kantam J. Mol. Catal. A Chem. 252 2006 12 16 K.R. Reddy, N.S. Kumar, P.S. Reddy, B. Sreedhar, M.L. Kantam, J. Mol. Catal. A Chem. 252 (2006) 12-16. [117] F. Quignard A. Choplin Chem. Commun. 2001 21 22 F. Quignard, A. Choplin, Chem. Commun. (2001) 21-22. [118] C.W. Owens G.S. Oporto B.C. Söderberg K.E. Lambson J Nanomater 2017 Article ID 9461615 C.W. Owens, G.S. Oporto, B.C. Söderberg, K.E. Lambson, J Nanomater 2017, Article ID 9461615. [119] Z. Zhou X. Peng L. Zhong X. Li R. Sun Polymers 10 7 2018 724 Z. Zhou, X. Peng, L. Zhong, X. Li, R. Sun, Polymers 10(7) (2018) 724. [120] C. Fernandez-Ruiz J. Bedia P. Bonal J.J. Rodriguez L.M. Gómez-Sainero Catal. Sci. Technol. 8 15 2018 3926 3935 C. Fernandez-Ruiz, J. Bedia, P. Bonal, J.J. Rodriguez, L.M. Gómez-Sainero, Catal. Sci. Technol. 8(15) (2018) 3926-3935. [121] C. Gao X. Wang H. Wang J. Zhou S. Zhai Q. An Int. J. Biol. Macromol. 144 2020 947 953 C. Gao, X. Wang, H. Wang, J. Zhou, S. Zhai, Q. An, Int. J. Biol. Macromol. 144 (2020) 947-953. [122] F. Coccia L. Tonucci N. ďAlessandro P. DAmbrosio M. Bressan Inorg. Chim. Acta 399 2013 12 18 F. Coccia, L. Tonucci, N. ďAlessandro, P. DAmbrosio, M. Bressan, Inorg. Chim. Acta 399 (2013) 12-18. [123] M. Nasrollahzadeh N.S. Soheili Bidgoli Z. Issaabadi Z. Ghavamifar T. Baran R. Luque Int. J. Biol. Macromol. 148 2020 265 275 M. Nasrollahzadeh, N. S. Soheili Bidgoli, Z. Issaabadi, Z. Ghavamifar, T. Baran, R. Luque, Int. J. Biol. Macromol. 148 (2020) 265-275. [124] B. Feizi Mohazzab B. Jaleh M. Nasrollahzadeh S. Khazalpour M. Sajjadi R.S. Varma ACS Omega 2020 10.1021/acsomega.9b04149 B. Feizi Mohazzab, B. Jaleh, M. Nasrollahzadeh, S. Khazalpour, M. Sajjadi, R. S. Varma, ACS Omega (2020) DOI: 10.1021/acsomega.9b04149 [125] H. Zhou H. Xu Y. Liu Appl. Catal. B Environ. 244 2019 965 973 H. Zhou, H. Xu, Y. Liu, Appl. Catal. B Environ. 244 (2019) 965-973. [126] H. Zhou S. Hong H. Zhang Y. Chen H. Xu X. Wang Z. Jiang S. Chen Y. Liu Appl. Catal. B Environ. 2019 117767 H. Zhou, S. Hong, H. Zhang, Y. Chen, H. Xu, X. Wang, Z. Jiang, S. Chen, Y. Liu, Appl. Catal. B Environ. (2019) 117767. [127] X. Li Y. Lv D. Pan Colloids Surfaces A Physicochem. Eng. Asp. 569 2019 110 118 X. Li, Y. Lv, D. Pan, Colloids Surfaces A Physicochem. Eng. Asp. 569 (2019) 110-118. [128] E. Capecchi D. Piccinino I. Delfino P. Bollella R. Antiochia R. Saladino Nanomaterials 8 2018 438 E. Capecchi, D. Piccinino, I. Delfino, P. Bollella, R. Antiochia, R. Saladino, Nanomaterials. 8 (2018) 438. [129] Q. Ma L. Cui S. Zhou Y. Li W. Shi S. Ai Environ. Sci. Pollut. Res. 25 2018 20833 20840 Q. Ma, L. Cui, S. Zhou, Y. Li, W. Shi, S. Ai, Environ. Sci. Pollut. Res. 25 (2018) 20833-20840. [130] F.J. García-Mateos T. Cordero-Lanzac R. Berenguer E. Morallon D. Cazorla-Amorós J. Rodríguez-Mirasol T. Cordero Appl. Catal. B Environ. 211 2017 18 30 F.J. García-Mateos, T. Cordero-Lanzac, R. Berenguer, E. Morallon, D. Cazorla-Amorós, J. Rodríguez-Mirasol, T. Cordero, Appl. Catal. B Environ. 211 (2017) 18-30. [131] M. Martin-Martinez M.F.F. Barreiro A.M.T. Silva J.L. Figueiredo J.L. Faria H.T. Gomes Appl. Catal. B Environ. 219 2017 372 378 M. Martin-Martinez, M.F.F. Barreiro, A.M.T. Silva, J.L. Figueiredo, J.L. Faria, H.T. Gomes, Appl. Catal. B Environ. 219 (2017) 372-378. [132] Z. Yang X. Zhang X. Yao Y. Fang H. Chen H. Ji Tetrahedron 72 2016 1773 1781 Z. Yang, X. Zhang, X. Yao, Y. Fang, H. Chen, H. Ji, Tetrahedron 72 (2016) 1773-1781. [133] J. Bedia J.M. Rosas J. Rodríguez-Mirasol T. Cordero Appl. Catal. B Environ. 94 2010 8 18 J. Bedia, J.M. Rosas, J. Rodríguez-Mirasol, T. Cordero, Appl. Catal. B Environ. 94 (2010) 8-18. [134] D. Piccinino E. Capecchi L. Botta P. Bollella R. Antiochia M. Crucianelli R. Saladino Catal. Sci. Technol. 9 2019 4125 4134 D. Piccinino, E. Capecchi, L. Botta, P. Bollella, R. Antiochia, M. Crucianelli, R. Saladino, Catal. Sci. Technol. 9 (2019) 4125-4134. [135] I.V. Pylypchuk G. Daniel V.G. Kessler G.A. Seisenbaeva Nanomaterials 10 2020 282 I. V. Pylypchuk, G. Daniel, V. G. Kessler, G. A. Seisenbaeva, Nanomaterials 10 (2020) 282. [136] E. Baciocchi M.F. Gerini O. Lanzalunga A. Lapi S. Mancinelli P. Mencarelli Chem. Commun. 2000 393 394 E. Baciocchi, M.F. Gerini, O. Lanzalunga, A. Lapi, S. Mancinelli, P. Mencarelli, Chem. Commun. (2000) 393-394. [137] E. Baciocchi C. Fabbri O. Lanzalunga J. Org. Chem. 68 2003 9061 9069 E. Baciocchi, C. Fabbri, O. Lanzalunga, J. Org. Chem. 68 (2003) 9061-9069. [138] K. Lee S.-H. Moon J. Biotechnol. 102 2003 261 268 K. Lee, S.-H. Moon, J. Biotechnol. 102 (2003) 261-268. [139] V.S. Ferreira-Leitão M.E.A. de Carvalho E.P.S. Bon Dye. Pigment. 74 2007 230 236 V.S. Ferreira-Leitão, M.E.A. de Carvalho, E.P.S. Bon, Dye. Pigment. 74 (2007) 230-236. [140] Y. Zhang X.-R. Huang F. Huang Y.-Z. Li Y.-B. Qu P.-J. Gao Colloids Surfaces B Biointerfaces 65 2008 50 53 Y. Zhang, X.-R. Huang, F. Huang, Y.-Z. Li, Y.-B. Qu, P.-J. Gao, Colloids Surfaces B Biointerfaces 65 (2008) 50-53. [141] G. Milczarek Langmuir 25 2009 10345 10353 G. Milczarek, Langmuir 25 (2009) 10345-10353. [142] Y. Zhang S.U. Geißen J. Hazard. Mater. 176 2010 1089 1092 Y. Zhang, S. U. Geißen, J. Hazard. Mater. 176 (2010) 1089-1092. [143] X. Huang D. Wang C. Liu M. Hu Y. Qu P. Gao Biochem. Biophys. Res. Commun. 311 2003 491 494 X. Huang, D. Wang, C. Liu, M. Hu, Y. Qu, P. Gao, Biochem. Biophys. Res. Commun. 311 (2003) 491-494. [144] M. Chivukula J.T. Spadaro V. Renganathan Biochemistry 34 1995 7765 7772 M. Chivukula, J. T. Spadaro, V. Renganathan, Biochemistry 34 (1995) 7765-7772.",
      "scopus-id": "85083345303",
      "coredata": {
        "eid": "1-s2.0-S2468823120301978",
        "dc:description": "Recently, the attention to bio-based catalysts has been on rise. The present review explains the developments regarding preparation, characterization and utilization of lignin based (nano)catalysts in oxidation reactions. Herein, the application of lignin in the preparation of (nano)catalysts and their catalytic prowess in oxidative transformations will be overviewed. Lignin offers exceptional physicochemical characteristics and important potential applications. Lignin can be used as a precursor or template to prepare novel eco-friendly catalysts. This review paper proposes the rational design of active, economical, recyclable and efficient catalysts for different oxidation reactions including oxidation of alcohols, phenols, etc.",
        "openArchiveArticle": "false",
        "prism:coverDate": "2020-06-30",
        "openaccessUserLicense": null,
        "prism:aggregationType": "Journal",
        "prism:url": "https://api.elsevier.com/content/article/pii/S2468823120301978",
        "dc:creator": [
          {
            "@_fa": "true",
            "$": "Nasrollahzadeh, Mahmoud"
          },
          {
            "@_fa": "true",
            "$": "Shafiei, Nasrin"
          },
          {
            "@_fa": "true",
            "$": "Nezafat, Zahra"
          },
          {
            "@_fa": "true",
            "$": "Bidgoli, Nayyereh Sadat Soheili"
          }
        ],
        "link": [
          {
            "@_fa": "true",
            "@rel": "self",
            "@href": "https://api.elsevier.com/content/article/pii/S2468823120301978"
          },
          {
            "@_fa": "true",
            "@rel": "scidir",
            "@href": "https://www.sciencedirect.com/science/article/pii/S2468823120301978"
          }
        ],
        "dc:format": "application/json",
        "openaccessType": null,
        "pii": "S2468-8231(20)30197-8",
        "prism:volume": "489",
        "articleNumber": "110942",
        "prism:publisher": "Elsevier B.V.",
        "dc:title": "Recent progresses in the application of lignin derived (nano)catalysts in oxidation reactions",
        "prism:copyright": "© 2020 Elsevier B.V. All rights reserved.",
        "openaccess": "0",
        "prism:issn": "24688231",
        "dcterms:subject": [
          {
            "@_fa": "true",
            "$": "Oxidation reactions"
          },
          {
            "@_fa": "true",
            "$": "Lignin"
          },
          {
            "@_fa": "true",
            "$": "Sustainable"
          },
          {
            "@_fa": "true",
            "$": "Heterogeneous catalyst"
          },
          {
            "@_fa": "true",
            "$": "Selective"
          }
        ],
        "openaccessArticle": "false",
        "prism:publicationName": "Molecular Catalysis",
        "openaccessSponsorType": null,
        "prism:pageRange": "110942",
        "pubType": "rev",
        "prism:coverDisplayDate": "June 2020",
        "prism:doi": "10.1016/j.mcat.2020.110942",
        "prism:startingPage": "110942",
        "dc:identifier": "doi:10.1016/j.mcat.2020.110942",
        "openaccessSponsorName": null
      },
      "objects": {
        "object": [
          {
            "@category": "standard",
            "@height": "200",
            "@width": "202",
            "@_fa": "true",
            "$": "https://api.elsevier.com/content/object/eid/1-s2.0-S2468823120301978-ga1.jpg?httpAccept=%2A%2F%2A",
            "@multimediatype": "JPEG image file",
            "@type": "IMAGE-DOWNSAMPLED",
            "@size": "12685",
            "@ref": "ga1",
            "@mimetype": "image/jpeg"
          },
          {
            "@category": "standard",
            "@height": "782",
            "@width": "756",
            "@_fa": "true",
            "$": "https://api.elsevier.com/content/object/eid/1-s2.0-S2468823120301978-gr1.jpg?httpAccept=%2A%2F%2A",
            "@multimediatype": "JPEG image file",
            "@type": "IMAGE-DOWNSAMPLED",
            "@size": "91517",
            "@ref": "gr1",
            "@mimetype": "image/jpeg"
          },
          {
            "@category": "standard",
            "@height": "383",
            "@width": "711",
            "@_fa": "true",
            "$": "https://api.elsevier.com/content/object/eid/1-s2.0-S2468823120301978-gr2.jpg?httpAccept=%2A%2F%2A",
            "@multimediatype": "JPEG image file",
            "@type": "IMAGE-DOWNSAMPLED",
            "@size": "70152",
            "@ref": "gr2",
            "@mimetype": "image/jpeg"
          },
          {
            "@category": "standard",
            "@height": "375",
            "@width": "715",
            "@_fa": "true",
            "$": "https://api.elsevier.com/content/object/eid/1-s2.0-S2468823120301978-gr3.jpg?httpAccept=%2A%2F%2A",
            "@multimediatype": "JPEG image file",
            "@type": "IMAGE-DOWNSAMPLED",
            "@size": "60279",
            "@ref": "gr3",
            "@mimetype": "image/jpeg"
          },
          {
            "@category": "standard",
            "@height": "426",
            "@width": "715",
            "@_fa": "true",
            "$": "https://api.elsevier.com/content/object/eid/1-s2.0-S2468823120301978-gr4.jpg?httpAccept=%2A%2F%2A",
            "@multimediatype": "JPEG image file",
            "@type": "IMAGE-DOWNSAMPLED",
            "@size": "81600",
            "@ref": "gr4",
            "@mimetype": "image/jpeg"
          },
          {
            "@category": "standard",
            "@height": "487",
            "@width": "753",
            "@_fa": "true",
            "$": "https://api.elsevier.com/content/object/eid/1-s2.0-S2468823120301978-gr5.jpg?httpAccept=%2A%2F%2A",
            "@multimediatype": "JPEG image file",
            "@type": "IMAGE-DOWNSAMPLED",
            "@size": "65323",
            "@ref": "gr5",
            "@mimetype": "image/jpeg"
          },
          {
            "@category": "standard",
            "@height": "105",
            "@width": "489",
            "@_fa": "true",
            "$": "https://api.elsevier.com/content/object/eid/1-s2.0-S2468823120301978-gr6.jpg?httpAccept=%2A%2F%2A",
            "@multimediatype": "JPEG image file",
            "@type": "IMAGE-DOWNSAMPLED",
            "@size": "16264",
            "@ref": "gr6",
            "@mimetype": "image/jpeg"
          },
          {
            "@category": "standard",
            "@height": "593",
            "@width": "678",
            "@_fa": "true",
            "$": "https://api.elsevier.com/content/object/eid/1-s2.0-S2468823120301978-sc1.jpg?httpAccept=%2A%2F%2A",
            "@multimediatype": "JPEG image file",
            "@type": "IMAGE-DOWNSAMPLED",
            "@size": "47864",
            "@ref": "sc1",
            "@mimetype": "image/jpeg"
          },
          {
            "@category": "standard",
            "@height": "167",
            "@width": "378",
            "@_fa": "true",
            "$": "https://api.elsevier.com/content/object/eid/1-s2.0-S2468823120301978-sc2.jpg?httpAccept=%2A%2F%2A",
            "@multimediatype": "JPEG image file",
            "@type": "IMAGE-DOWNSAMPLED",
            "@size": "11335",
            "@ref": "sc2",
            "@mimetype": "image/jpeg"
          },
          {
            "@category": "standard",
            "@height": "534",
            "@width": "755",
            "@_fa": "true",
            "$": "https://api.elsevier.com/content/object/eid/1-s2.0-S2468823120301978-sc3.jpg?httpAccept=%2A%2F%2A",
            "@multimediatype": "JPEG image file",
            "@type": "IMAGE-DOWNSAMPLED",
            "@size": "45345",
            "@ref": "sc3",
            "@mimetype": "image/jpeg"
          },
          {
            "@category": "standard",
            "@height": "198",
            "@width": "376",
            "@_fa": "true",
            "$": "https://api.elsevier.com/content/object/eid/1-s2.0-S2468823120301978-sc4.jpg?httpAccept=%2A%2F%2A",
            "@multimediatype": "JPEG image file",
            "@type": "IMAGE-DOWNSAMPLED",
            "@size": "17282",
            "@ref": "sc4",
            "@mimetype": "image/jpeg"
          },
          {
            "@category": "standard",
            "@height": "621",
            "@width": "678",
            "@_fa": "true",
            "$": "https://api.elsevier.com/content/object/eid/1-s2.0-S2468823120301978-sc5.jpg?httpAccept=%2A%2F%2A",
            "@multimediatype": "JPEG image file",
            "@type": "IMAGE-DOWNSAMPLED",
            "@size": "44263",
            "@ref": "sc5",
            "@mimetype": "image/jpeg"
          },
          {
            "@category": "standard",
            "@height": "616",
            "@width": "753",
            "@_fa": "true",
            "$": "https://api.elsevier.com/content/object/eid/1-s2.0-S2468823120301978-sc6.jpg?httpAccept=%2A%2F%2A",
            "@multimediatype": "JPEG image file",
            "@type": "IMAGE-DOWNSAMPLED",
            "@size": "66443",
            "@ref": "sc6",
            "@mimetype": "image/jpeg"
          },
          {
            "@category": "thumbnail",
            "@height": "164",
            "@width": "166",
            "@_fa": "true",
            "$": "https://api.elsevier.com/content/object/eid/1-s2.0-S2468823120301978-ga1.sml?httpAccept=%2A%2F%2A",
            "@multimediatype": "GIF image file",
            "@type": "IMAGE-THUMBNAIL",
            "@size": "8017",
            "@ref": "ga1",
            "@mimetype": "image/gif"
          },
          {
            "@category": "thumbnail",
            "@height": "163",
            "@width": "158",
            "@_fa": "true",
            "$": "https://api.elsevier.com/content/object/eid/1-s2.0-S2468823120301978-gr1.sml?httpAccept=%2A%2F%2A",
            "@multimediatype": "GIF image file",
            "@type": "IMAGE-THUMBNAIL",
            "@size": "6932",
            "@ref": "gr1",
            "@mimetype": "image/gif"
          },
          {
            "@category": "thumbnail",
            "@height": "118",
            "@width": "219",
            "@_fa": "true",
            "$": "https://api.elsevier.com/content/object/eid/1-s2.0-S2468823120301978-gr2.sml?httpAccept=%2A%2F%2A",
            "@multimediatype": "GIF image file",
            "@type": "IMAGE-THUMBNAIL",
            "@size": "14490",
            "@ref": "gr2",
            "@mimetype": "image/gif"
          },
          {
            "@category": "thumbnail",
            "@height": "115",
            "@width": "219",
            "@_fa": "true",
            "$": "https://api.elsevier.com/content/object/eid/1-s2.0-S2468823120301978-gr3.sml?httpAccept=%2A%2F%2A",
            "@multimediatype": "GIF image file",
            "@type": "IMAGE-THUMBNAIL",
            "@size": "7483",
            "@ref": "gr3",
            "@mimetype": "image/gif"
          },
          {
            "@category": "thumbnail",
            "@height": "130",
            "@width": "219",
            "@_fa": "true",
            "$": "https://api.elsevier.com/content/object/eid/1-s2.0-S2468823120301978-gr4.sml?httpAccept=%2A%2F%2A",
            "@multimediatype": "GIF image file",
            "@type": "IMAGE-THUMBNAIL",
            "@size": "13304",
            "@ref": "gr4",
            "@mimetype": "image/gif"
          },
          {
            "@category": "thumbnail",
            "@height": "142",
            "@width": "219",
            "@_fa": "true",
            "$": "https://api.elsevier.com/content/object/eid/1-s2.0-S2468823120301978-gr5.sml?httpAccept=%2A%2F%2A",
            "@multimediatype": "GIF image file",
            "@type": "IMAGE-THUMBNAIL",
            "@size": "11218",
            "@ref": "gr5",
            "@mimetype": "image/gif"
          },
          {
            "@category": "thumbnail",
            "@height": "47",
            "@width": "219",
            "@_fa": "true",
            "$": "https://api.elsevier.com/content/object/eid/1-s2.0-S2468823120301978-gr6.sml?httpAccept=%2A%2F%2A",
            "@multimediatype": "GIF image file",
            "@type": "IMAGE-THUMBNAIL",
            "@size": "5561",
            "@ref": "gr6",
            "@mimetype": "image/gif"
          },
          {
            "@category": "thumbnail",
            "@height": "164",
            "@width": "187",
            "@_fa": "true",
            "$": "https://api.elsevier.com/content/object/eid/1-s2.0-S2468823120301978-sc1.sml?httpAccept=%2A%2F%2A",
            "@multimediatype": "GIF image file",
            "@type": "IMAGE-THUMBNAIL",
            "@size": "4902",
            "@ref": "sc1",
            "@mimetype": "image/gif"
          },
          {
            "@category": "thumbnail",
            "@height": "97",
            "@width": "219",
            "@_fa": "true",
            "$": "https://api.elsevier.com/content/object/eid/1-s2.0-S2468823120301978-sc2.sml?httpAccept=%2A%2F%2A",
            "@multimediatype": "GIF image file",
            "@type": "IMAGE-THUMBNAIL",
            "@size": "3976",
            "@ref": "sc2",
            "@mimetype": "image/gif"
          },
          {
            "@category": "thumbnail",
            "@height": "155",
            "@width": "219",
            "@_fa": "true",
            "$": "https://api.elsevier.com/content/object/eid/1-s2.0-S2468823120301978-sc3.sml?httpAccept=%2A%2F%2A",
            "@multimediatype": "GIF image file",
            "@type": "IMAGE-THUMBNAIL",
            "@size": "4952",
            "@ref": "sc3",
            "@mimetype": "image/gif"
          },
          {
            "@category": "thumbnail",
            "@height": "115",
            "@width": "219",
            "@_fa": "true",
            "$": "https://api.elsevier.com/content/object/eid/1-s2.0-S2468823120301978-sc4.sml?httpAccept=%2A%2F%2A",
            "@multimediatype": "GIF image file",
            "@type": "IMAGE-THUMBNAIL",
            "@size": "5013",
            "@ref": "sc4",
            "@mimetype": "image/gif"
          },
          {
            "@category": "thumbnail",
            "@height": "164",
            "@width": "179",
            "@_fa": "true",
            "$": "https://api.elsevier.com/content/object/eid/1-s2.0-S2468823120301978-sc5.sml?httpAccept=%2A%2F%2A",
            "@multimediatype": "GIF image file",
            "@type": "IMAGE-THUMBNAIL",
            "@size": "4393",
            "@ref": "sc5",
            "@mimetype": "image/gif"
          },
          {
            "@category": "thumbnail",
            "@height": "164",
            "@width": "200",
            "@_fa": "true",
            "$": "https://api.elsevier.com/content/object/eid/1-s2.0-S2468823120301978-sc6.sml?httpAccept=%2A%2F%2A",
            "@multimediatype": "GIF image file",
            "@type": "IMAGE-THUMBNAIL",
            "@size": "5446",
            "@ref": "sc6",
            "@mimetype": "image/gif"
          },
          {
            "@category": "standard",
            "@_fa": "true",
            "$": "https://api.elsevier.com/content/object/eid/1-s2.0-S2468823120301978-am.pdf?httpAccept=%2A%2F%2A",
            "@multimediatype": "Acrobat PDF file",
            "@type": "AAM-PDF",
            "@size": "1098389",
            "@ref": "am",
            "@mimetype": "application/pdf"
          }
        ]
      },
      "link": {
        "@rel": "abstract",
        "@href": "https://api.elsevier.com/content/abstract/scopus_id/85083345303"
      }
    }
  }
}