{
  "metadata": {
    "title": "Amino acid-based ionic liquids for CO<ce:inf loc=post>2</ce:inf> conversion to form cyclic carbonate under solvent-free conditions",
    "authors": "; ; ",
    "journal": "Molecular Catalysis",
    "date": "2017-05-31",
    "doi": "10.1016/j.mcat.2017.01.027",
    "abstract": "",
    "uri": "https://api.elsevier.com/content/article/pii/S2468823117300226",
    "pii": "S2468823117300226"
  },
  "fulltext": {
    "full-text-retrieval-response": {
      "scopus-eid": "2-s2.0-85026531784",
      "originalText": "serial JL 315758 291210 291744 291790 291809 31 Molecular Catalysis MOLECULARCATALYSIS 2017-04-01 2017-04-01 2017-04-01 2017-04-01 2017-03-31T21:48:52 1-s2.0-S2468823117300226 S2468-8231(17)30022-6 S2468823117300226 10.1016/j.mcat.2017.01.027 S300 S300.1 FULL-TEXT 1-s2.0-S2468823117X00072 2021-10-25T08:48:04.452531Z 0 0 20170501 20170531 2017 2017-04-01T01:20:04.085984Z absattachment articleinfo articletitlenorm authfirstinitialnorm authfirstsurnamenorm cid cids contenttype copyright crossmark dateloaded dateloadedtxt datesearch datesort dateupdated dco docsubtype doctype doi eid ewtransactionid hubeid indexeddate issn issnnorm itemstage itemtransactionid itemweight openaccess openarchive pg pgfirst pglast pii piinorm pubdateend pubdatestart pubdatetxt pubyr sectiontitle sortorder srctitle srctitlenorm srctype ssids alllist content subj subheadings suppl tomb volfirst volissue volumelist webpdf webpdfpagecount yearnav figure table e-component body acknowledge affil appendices articletitle auth authfirstini authfull authkeywords authlast grantnumber grantsponsor highlightsabst primabst ref specialabst 2468-8231 24688231 true 433 433 C Volume 433 50 420 429 420 429 201705 May 2017 2017-05-01 2017-05-31 2017 Regular Papers article fla © 2017 Elsevier B.V. All rights reserved. AMINOACIDBASEDIONICLIQUIDSFORCO2CONVERSIONFORMCYCLICCARBONATEUNDERSOLVENTFREECONDITIONS YUE S 1 Introduction 2 Experimental 2.1 General remarks 2.2 Preparation of the ionic liquids 2.2.1 General preparation of ionic liquids 1-2 2.2.2 General preparation of ionic liquid 3 2.2.3 General preparation of ionic liquid 4 2.3 Characterization 2.4 Representative procedure for the cycloaddition reaction 2.5 Representative procedure for catalyst recycling 3 Results and discussion 3.1 Characterization 3.1.1 NMR spectroscopic characterization 3.1.2 Vibrational spectroscopy 3.2 Effect of reaction conditions 3.3 Scope of the reaction 3.4 The Reusability of the Catalyst 3.5 Catalytic kinetics study and mechanistic investigation 4 Conclusions Acknowledgements Appendix A Supplementary data References BEHR 1988 661 678 A MIKKELSEN 2010 43 81 M KUWAHARA 2013 50 59 Y OMAE 2012 1384 1405 I RAZALI 2012 4951 4964 N BOOTHANDFORD 2014 130 189 M MA 2016 226 231 R SAKAKURA 2009 1312 1330 T SHAIKH 1996 951 976 A SCHAFFNER 2010 4554 4581 B CLEMENTS 2003 663 674 J KIHARA 1993 6198 6202 N HUANG 2003 6705 6709 J YAMAGUCHI 1999 4526 4527 K XIE 2013 6732 6735 Z CASTROGOMEZ 2013 6289 6298 F YAN 2009 1325 1332 P LI 2003 2042 2043 F SAUNDERS 2012 165 167 L BAI 2012 1752 1758 D WU 2013 1328 1333 Z KUMAR 2012 615 618 S ROKICKI 1984 1662 1666 G XIE 2013 1960 1966 Y ZALOMAEVA 2013 179 185 O LESCOUET 2012 1725 1728 T MARTINEZ 2015 9850 9862 J CASTROOSMA 2016 791 794 J CALO 2002 2561 2563 V ZHANG 2012 1376 1381 Y THARUN 2013 62 65 J ZHOU 2012 12 16 X WANG 2012 1480 1484 J SHI 2005 4182 4183 F XIONG 2010 3399 3401 Y PENG 2001 639 641 J XIAO 2011 1838 1844 L GHAZALIESFAHANI 2013 1584 1589 S CHOI 2013 242 248 H CHENG 2013 117 124 W LI 2004 8307 8310 F XIAO 2006 265 269 L DAI 2014 183 188 W AGRIGENTO 2014 1598 1607 P XIAO 2014 1 6 L ZHAO 2015 49 53 H SUN 2005 3490 3497 J HE 2014 1513 1528 Q SAKAKURA 2009 1321 1330 T WU 2016 1 8 S KIM 2005 7882 7891 Y CHO 2008 67 72 C EGOROVA 2014 336 360 K ZHANG 2014 7838 7869 S WEI 2013 349 356 Y YU 2012 173 186 Z BARAN 2011 99 103 Y FUKUMOTO 2005 2398 2399 K DOMANSKA 2011 775 781 U ZHANG 2016 76 82 H CHOI 2005 281 284 S FU 2012 7782 7786 L YUE 2013 598 604 S LIU 2016 2851 2863 M ROSHAN 2014 963 970 K WU 2010 73 78 F YUE 2014 1313 1321 C XIAO 2014 285 290 L GONG 2012 381 386 Q LIU 2015 5959 5965 M CLEGG 2010 6828 6843 W CHATELET 2013 5348 5351 B ZOU 2015 119 129 B LV 2016 212 218 B HAJIPOUR 2015 61179 61183 A LIU 2016 20 26 M SUN 2008 3588 3591 J WANG 2014 2360 2367 J LIU 2015 960 966 M LIU 2016 6406 6416 M YUEX2017X420 YUEX2017X420X429 YUEX2017X420XS YUEX2017X420X429XS 2019-04-01T00:00:00Z http://creativecommons.org/licenses/by-nc-nd/4.0/ © 2017 Elsevier B.V. All rights reserved. 0 item S2468-8231(17)30022-6 S2468823117300226 1-s2.0-S2468823117300226 10.1016/j.mcat.2017.01.027 315758 2017-03-31T20:20:04.085984-04:00 2017-05-01 2017-05-31 1-s2.0-S2468823117300226-main.pdf https://s3-eu-west-1.amazonaws.com/prod-ucs-content-store-eu-west/content/pii:S2468823117300226/MAIN/application/pdf/f2fdddcc1a6a1fcf273d09d0f56cfbe6/main.pdf https://s3.amazonaws.com/prod-ucs-content-store-us-east/content/pii:S2468823117300226/MAIN/application/pdf/f2fdddcc1a6a1fcf273d09d0f56cfbe6/main.pdf main.pdf pdf true 2974208 MAIN 10 1-s2.0-S2468823117300226-main_1.png https://s3-eu-west-1.amazonaws.com/prod-ucs-content-store-eu-west/content/pii:S2468823117300226/PREVIEW/image/png/25fb86fa378f2770af4fa40c922edef9/main_1.png https://s3.amazonaws.com/prod-ucs-content-store-us-east/content/pii:S2468823117300226/PREVIEW/image/png/25fb86fa378f2770af4fa40c922edef9/main_1.png main_1.png png 55749 849 656 IMAGE-WEB-PDF 1 1-s2.0-S2468823117300226-fx1.sml https://s3-eu-west-1.amazonaws.com/prod-ucs-content-store-eu-west/content/pii:S2468823117300226/fx1/THUMBNAIL/image/gif/913e78147ab11cc05eb1f35f7b79679b/fx1.sml https://s3.amazonaws.com/prod-ucs-content-store-us-east/content/pii:S2468823117300226/fx1/THUMBNAIL/image/gif/913e78147ab11cc05eb1f35f7b79679b/fx1.sml fx1 true fx1.sml sml 4005 88 219 IMAGE-THUMBNAIL 1-s2.0-S2468823117300226-fx10.sml https://s3-eu-west-1.amazonaws.com/prod-ucs-content-store-eu-west/content/pii:S2468823117300226/fx10/THUMBNAIL/image/gif/b9c1fd65078bf2a97e275e1fd09a214f/fx10.sml https://s3.amazonaws.com/prod-ucs-content-store-us-east/content/pii:S2468823117300226/fx10/THUMBNAIL/image/gif/b9c1fd65078bf2a97e275e1fd09a214f/fx10.sml fx10 fx10.sml sml 2483 88 219 IMAGE-THUMBNAIL 1-s2.0-S2468823117300226-fx11.sml https://s3-eu-west-1.amazonaws.com/prod-ucs-content-store-eu-west/content/pii:S2468823117300226/fx11/THUMBNAIL/image/gif/60dbcc0ed73003016de3b640c95e00b8/fx11.sml https://s3.amazonaws.com/prod-ucs-content-store-us-east/content/pii:S2468823117300226/fx11/THUMBNAIL/image/gif/60dbcc0ed73003016de3b640c95e00b8/fx11.sml fx11 fx11.sml sml 3011 88 219 IMAGE-THUMBNAIL 1-s2.0-S2468823117300226-fx12.sml https://s3-eu-west-1.amazonaws.com/prod-ucs-content-store-eu-west/content/pii:S2468823117300226/fx12/THUMBNAIL/image/gif/fe1c836a8aab119b404b8dbd49c0f2b4/fx12.sml https://s3.amazonaws.com/prod-ucs-content-store-us-east/content/pii:S2468823117300226/fx12/THUMBNAIL/image/gif/fe1c836a8aab119b404b8dbd49c0f2b4/fx12.sml fx12 fx12.sml sml 2613 88 219 IMAGE-THUMBNAIL 1-s2.0-S2468823117300226-fx13.sml https://s3-eu-west-1.amazonaws.com/prod-ucs-content-store-eu-west/content/pii:S2468823117300226/fx13/THUMBNAIL/image/gif/140b49328ee6564501835eab11d816dc/fx13.sml https://s3.amazonaws.com/prod-ucs-content-store-us-east/content/pii:S2468823117300226/fx13/THUMBNAIL/image/gif/140b49328ee6564501835eab11d816dc/fx13.sml fx13 fx13.sml sml 2532 88 219 IMAGE-THUMBNAIL 1-s2.0-S2468823117300226-fx14.sml https://s3-eu-west-1.amazonaws.com/prod-ucs-content-store-eu-west/content/pii:S2468823117300226/fx14/THUMBNAIL/image/gif/c6d0bd55b0c50b132ee8ad515469f867/fx14.sml https://s3.amazonaws.com/prod-ucs-content-store-us-east/content/pii:S2468823117300226/fx14/THUMBNAIL/image/gif/c6d0bd55b0c50b132ee8ad515469f867/fx14.sml fx14 fx14.sml sml 3620 88 219 IMAGE-THUMBNAIL 1-s2.0-S2468823117300226-fx15.sml https://s3-eu-west-1.amazonaws.com/prod-ucs-content-store-eu-west/content/pii:S2468823117300226/fx15/THUMBNAIL/image/gif/eb8f33621ec611094c24c76f8908dc02/fx15.sml https://s3.amazonaws.com/prod-ucs-content-store-us-east/content/pii:S2468823117300226/fx15/THUMBNAIL/image/gif/eb8f33621ec611094c24c76f8908dc02/fx15.sml fx15 fx15.sml sml 2525 88 219 IMAGE-THUMBNAIL 1-s2.0-S2468823117300226-fx16.sml https://s3-eu-west-1.amazonaws.com/prod-ucs-content-store-eu-west/content/pii:S2468823117300226/fx16/THUMBNAIL/image/gif/0befb46cadb1b1175d2de09dd9de6a01/fx16.sml https://s3.amazonaws.com/prod-ucs-content-store-us-east/content/pii:S2468823117300226/fx16/THUMBNAIL/image/gif/0befb46cadb1b1175d2de09dd9de6a01/fx16.sml fx16 fx16.sml sml 2546 88 219 IMAGE-THUMBNAIL 1-s2.0-S2468823117300226-fx17.sml https://s3-eu-west-1.amazonaws.com/prod-ucs-content-store-eu-west/content/pii:S2468823117300226/fx17/THUMBNAIL/image/gif/7b86233bb745ad6479962b4198b12578/fx17.sml https://s3.amazonaws.com/prod-ucs-content-store-us-east/content/pii:S2468823117300226/fx17/THUMBNAIL/image/gif/7b86233bb745ad6479962b4198b12578/fx17.sml fx17 fx17.sml sml 3529 88 219 IMAGE-THUMBNAIL 1-s2.0-S2468823117300226-fx18.sml https://s3-eu-west-1.amazonaws.com/prod-ucs-content-store-eu-west/content/pii:S2468823117300226/fx18/THUMBNAIL/image/gif/202c5ba6b388748c86a3cf44e5919db4/fx18.sml https://s3.amazonaws.com/prod-ucs-content-store-us-east/content/pii:S2468823117300226/fx18/THUMBNAIL/image/gif/202c5ba6b388748c86a3cf44e5919db4/fx18.sml fx18 fx18.sml sml 2554 88 219 IMAGE-THUMBNAIL 1-s2.0-S2468823117300226-fx19.sml https://s3-eu-west-1.amazonaws.com/prod-ucs-content-store-eu-west/content/pii:S2468823117300226/fx19/THUMBNAIL/image/gif/42389e5aacc9dd24c4e0dc98165ff1b7/fx19.sml https://s3.amazonaws.com/prod-ucs-content-store-us-east/content/pii:S2468823117300226/fx19/THUMBNAIL/image/gif/42389e5aacc9dd24c4e0dc98165ff1b7/fx19.sml fx19 fx19.sml sml 3635 88 219 IMAGE-THUMBNAIL 1-s2.0-S2468823117300226-fx2.sml https://s3-eu-west-1.amazonaws.com/prod-ucs-content-store-eu-west/content/pii:S2468823117300226/fx2/THUMBNAIL/image/gif/1369b1d37d30c0d6921ad6f83ef1ed04/fx2.sml https://s3.amazonaws.com/prod-ucs-content-store-us-east/content/pii:S2468823117300226/fx2/THUMBNAIL/image/gif/1369b1d37d30c0d6921ad6f83ef1ed04/fx2.sml fx2 fx2.sml sml 1621 88 219 IMAGE-THUMBNAIL 1-s2.0-S2468823117300226-fx20.sml https://s3-eu-west-1.amazonaws.com/prod-ucs-content-store-eu-west/content/pii:S2468823117300226/fx20/THUMBNAIL/image/gif/00b4840101731e166b16f80a340f2261/fx20.sml https://s3.amazonaws.com/prod-ucs-content-store-us-east/content/pii:S2468823117300226/fx20/THUMBNAIL/image/gif/00b4840101731e166b16f80a340f2261/fx20.sml fx20 fx20.sml sml 2542 88 219 IMAGE-THUMBNAIL 1-s2.0-S2468823117300226-fx21.sml https://s3-eu-west-1.amazonaws.com/prod-ucs-content-store-eu-west/content/pii:S2468823117300226/fx21/THUMBNAIL/image/gif/641b1f7d1aec63f03f6e1cfe22250075/fx21.sml https://s3.amazonaws.com/prod-ucs-content-store-us-east/content/pii:S2468823117300226/fx21/THUMBNAIL/image/gif/641b1f7d1aec63f03f6e1cfe22250075/fx21.sml fx21 fx21.sml sml 3590 88 219 IMAGE-THUMBNAIL 1-s2.0-S2468823117300226-fx22.sml https://s3-eu-west-1.amazonaws.com/prod-ucs-content-store-eu-west/content/pii:S2468823117300226/fx22/THUMBNAIL/image/gif/8cc3862d5cf1bbc933b0e9d199ab3f80/fx22.sml https://s3.amazonaws.com/prod-ucs-content-store-us-east/content/pii:S2468823117300226/fx22/THUMBNAIL/image/gif/8cc3862d5cf1bbc933b0e9d199ab3f80/fx22.sml fx22 fx22.sml sml 2538 88 219 IMAGE-THUMBNAIL 1-s2.0-S2468823117300226-fx23.sml https://s3-eu-west-1.amazonaws.com/prod-ucs-content-store-eu-west/content/pii:S2468823117300226/fx23/THUMBNAIL/image/gif/069fb68ea2da2acbf934ecda6672e546/fx23.sml https://s3.amazonaws.com/prod-ucs-content-store-us-east/content/pii:S2468823117300226/fx23/THUMBNAIL/image/gif/069fb68ea2da2acbf934ecda6672e546/fx23.sml fx23 fx23.sml sml 3599 88 219 IMAGE-THUMBNAIL 1-s2.0-S2468823117300226-fx24.sml https://s3-eu-west-1.amazonaws.com/prod-ucs-content-store-eu-west/content/pii:S2468823117300226/fx24/THUMBNAIL/image/gif/a747d8f44fb259f450b4e4052c386173/fx24.sml https://s3.amazonaws.com/prod-ucs-content-store-us-east/content/pii:S2468823117300226/fx24/THUMBNAIL/image/gif/a747d8f44fb259f450b4e4052c386173/fx24.sml fx24 fx24.sml sml 2546 88 219 IMAGE-THUMBNAIL 1-s2.0-S2468823117300226-fx25.sml https://s3-eu-west-1.amazonaws.com/prod-ucs-content-store-eu-west/content/pii:S2468823117300226/fx25/THUMBNAIL/image/gif/e1872771bc48e76945a5dce2ad18084d/fx25.sml https://s3.amazonaws.com/prod-ucs-content-store-us-east/content/pii:S2468823117300226/fx25/THUMBNAIL/image/gif/e1872771bc48e76945a5dce2ad18084d/fx25.sml fx25 fx25.sml sml 2745 88 219 IMAGE-THUMBNAIL 1-s2.0-S2468823117300226-fx26.sml https://s3-eu-west-1.amazonaws.com/prod-ucs-content-store-eu-west/content/pii:S2468823117300226/fx26/THUMBNAIL/image/gif/f3fb0d954dec5dea0024489283893c89/fx26.sml https://s3.amazonaws.com/prod-ucs-content-store-us-east/content/pii:S2468823117300226/fx26/THUMBNAIL/image/gif/f3fb0d954dec5dea0024489283893c89/fx26.sml fx26 fx26.sml sml 2375 88 219 IMAGE-THUMBNAIL 1-s2.0-S2468823117300226-fx27.sml https://s3-eu-west-1.amazonaws.com/prod-ucs-content-store-eu-west/content/pii:S2468823117300226/fx27/THUMBNAIL/image/gif/6c929aba41e2e8378347a0fa423ec941/fx27.sml https://s3.amazonaws.com/prod-ucs-content-store-us-east/content/pii:S2468823117300226/fx27/THUMBNAIL/image/gif/6c929aba41e2e8378347a0fa423ec941/fx27.sml fx27 fx27.sml sml 3017 88 219 IMAGE-THUMBNAIL 1-s2.0-S2468823117300226-fx28.sml https://s3-eu-west-1.amazonaws.com/prod-ucs-content-store-eu-west/content/pii:S2468823117300226/fx28/THUMBNAIL/image/gif/be41b6f103e0c92e3b3615f89bbdc31e/fx28.sml https://s3.amazonaws.com/prod-ucs-content-store-us-east/content/pii:S2468823117300226/fx28/THUMBNAIL/image/gif/be41b6f103e0c92e3b3615f89bbdc31e/fx28.sml fx28 fx28.sml sml 2474 88 219 IMAGE-THUMBNAIL 1-s2.0-S2468823117300226-fx29.sml https://s3-eu-west-1.amazonaws.com/prod-ucs-content-store-eu-west/content/pii:S2468823117300226/fx29/THUMBNAIL/image/gif/6dc2f5b324478c6642f057d8c02592fd/fx29.sml https://s3.amazonaws.com/prod-ucs-content-store-us-east/content/pii:S2468823117300226/fx29/THUMBNAIL/image/gif/6dc2f5b324478c6642f057d8c02592fd/fx29.sml fx29 fx29.sml sml 2760 88 219 IMAGE-THUMBNAIL 1-s2.0-S2468823117300226-fx3.sml https://s3-eu-west-1.amazonaws.com/prod-ucs-content-store-eu-west/content/pii:S2468823117300226/fx3/THUMBNAIL/image/gif/e0c91904464460a27ad58aa9668d9139/fx3.sml https://s3.amazonaws.com/prod-ucs-content-store-us-east/content/pii:S2468823117300226/fx3/THUMBNAIL/image/gif/e0c91904464460a27ad58aa9668d9139/fx3.sml fx3 fx3.sml sml 3273 88 219 IMAGE-THUMBNAIL 1-s2.0-S2468823117300226-fx30.sml https://s3-eu-west-1.amazonaws.com/prod-ucs-content-store-eu-west/content/pii:S2468823117300226/fx30/THUMBNAIL/image/gif/f38d1f29be46a1e1d67a3e66a70e7bba/fx30.sml https://s3.amazonaws.com/prod-ucs-content-store-us-east/content/pii:S2468823117300226/fx30/THUMBNAIL/image/gif/f38d1f29be46a1e1d67a3e66a70e7bba/fx30.sml fx30 fx30.sml sml 2819 88 219 IMAGE-THUMBNAIL 1-s2.0-S2468823117300226-fx31.sml https://s3-eu-west-1.amazonaws.com/prod-ucs-content-store-eu-west/content/pii:S2468823117300226/fx31/THUMBNAIL/image/gif/3748ce0743c74b658d3781ce1bd3fdde/fx31.sml https://s3.amazonaws.com/prod-ucs-content-store-us-east/content/pii:S2468823117300226/fx31/THUMBNAIL/image/gif/3748ce0743c74b658d3781ce1bd3fdde/fx31.sml fx31 fx31.sml sml 2046 88 219 IMAGE-THUMBNAIL 1-s2.0-S2468823117300226-fx32.sml https://s3-eu-west-1.amazonaws.com/prod-ucs-content-store-eu-west/content/pii:S2468823117300226/fx32/THUMBNAIL/image/gif/a74fa8e0330498b7d6e3a6d73117df01/fx32.sml https://s3.amazonaws.com/prod-ucs-content-store-us-east/content/pii:S2468823117300226/fx32/THUMBNAIL/image/gif/a74fa8e0330498b7d6e3a6d73117df01/fx32.sml fx32 fx32.sml sml 2308 88 219 IMAGE-THUMBNAIL 1-s2.0-S2468823117300226-fx33.sml https://s3-eu-west-1.amazonaws.com/prod-ucs-content-store-eu-west/content/pii:S2468823117300226/fx33/THUMBNAIL/image/gif/dd18c0be79ac1d14f3e51b83a5591b09/fx33.sml https://s3.amazonaws.com/prod-ucs-content-store-us-east/content/pii:S2468823117300226/fx33/THUMBNAIL/image/gif/dd18c0be79ac1d14f3e51b83a5591b09/fx33.sml fx33 fx33.sml sml 2090 88 219 IMAGE-THUMBNAIL 1-s2.0-S2468823117300226-fx34.sml https://s3-eu-west-1.amazonaws.com/prod-ucs-content-store-eu-west/content/pii:S2468823117300226/fx34/THUMBNAIL/image/gif/69bf4db8609825c7f8b3cffb393d3262/fx34.sml https://s3.amazonaws.com/prod-ucs-content-store-us-east/content/pii:S2468823117300226/fx34/THUMBNAIL/image/gif/69bf4db8609825c7f8b3cffb393d3262/fx34.sml fx34 fx34.sml sml 2182 88 219 IMAGE-THUMBNAIL 1-s2.0-S2468823117300226-fx35.sml https://s3-eu-west-1.amazonaws.com/prod-ucs-content-store-eu-west/content/pii:S2468823117300226/fx35/THUMBNAIL/image/gif/feeb17436cce7eaeca9143fb9d1276cd/fx35.sml https://s3.amazonaws.com/prod-ucs-content-store-us-east/content/pii:S2468823117300226/fx35/THUMBNAIL/image/gif/feeb17436cce7eaeca9143fb9d1276cd/fx35.sml fx35 fx35.sml sml 2193 88 219 IMAGE-THUMBNAIL 1-s2.0-S2468823117300226-fx4.sml https://s3-eu-west-1.amazonaws.com/prod-ucs-content-store-eu-west/content/pii:S2468823117300226/fx4/THUMBNAIL/image/gif/7f4a9a254142ece6fab563128bff9f13/fx4.sml https://s3.amazonaws.com/prod-ucs-content-store-us-east/content/pii:S2468823117300226/fx4/THUMBNAIL/image/gif/7f4a9a254142ece6fab563128bff9f13/fx4.sml fx4 fx4.sml sml 2750 88 219 IMAGE-THUMBNAIL 1-s2.0-S2468823117300226-fx5.sml https://s3-eu-west-1.amazonaws.com/prod-ucs-content-store-eu-west/content/pii:S2468823117300226/fx5/THUMBNAIL/image/gif/50f49bc8304ae2c1fbb40feb3ad73d3a/fx5.sml https://s3.amazonaws.com/prod-ucs-content-store-us-east/content/pii:S2468823117300226/fx5/THUMBNAIL/image/gif/50f49bc8304ae2c1fbb40feb3ad73d3a/fx5.sml fx5 fx5.sml sml 2463 88 219 IMAGE-THUMBNAIL 1-s2.0-S2468823117300226-fx6.sml https://s3-eu-west-1.amazonaws.com/prod-ucs-content-store-eu-west/content/pii:S2468823117300226/fx6/THUMBNAIL/image/gif/0dcad637c8e5c53fe65c71f160878328/fx6.sml https://s3.amazonaws.com/prod-ucs-content-store-us-east/content/pii:S2468823117300226/fx6/THUMBNAIL/image/gif/0dcad637c8e5c53fe65c71f160878328/fx6.sml fx6 fx6.sml sml 2421 88 219 IMAGE-THUMBNAIL 1-s2.0-S2468823117300226-fx7.sml https://s3-eu-west-1.amazonaws.com/prod-ucs-content-store-eu-west/content/pii:S2468823117300226/fx7/THUMBNAIL/image/gif/acb8e50e5a191ce354333d892f49efcf/fx7.sml https://s3.amazonaws.com/prod-ucs-content-store-us-east/content/pii:S2468823117300226/fx7/THUMBNAIL/image/gif/acb8e50e5a191ce354333d892f49efcf/fx7.sml fx7 fx7.sml sml 2573 88 219 IMAGE-THUMBNAIL 1-s2.0-S2468823117300226-fx8.sml https://s3-eu-west-1.amazonaws.com/prod-ucs-content-store-eu-west/content/pii:S2468823117300226/fx8/THUMBNAIL/image/gif/6ec2ddb88e37480fdd1f2db06ca3fa1d/fx8.sml https://s3.amazonaws.com/prod-ucs-content-store-us-east/content/pii:S2468823117300226/fx8/THUMBNAIL/image/gif/6ec2ddb88e37480fdd1f2db06ca3fa1d/fx8.sml fx8 fx8.sml sml 2976 88 219 IMAGE-THUMBNAIL 1-s2.0-S2468823117300226-fx9.sml https://s3-eu-west-1.amazonaws.com/prod-ucs-content-store-eu-west/content/pii:S2468823117300226/fx9/THUMBNAIL/image/gif/8ae5596df9160b6546e806c132035e5e/fx9.sml https://s3.amazonaws.com/prod-ucs-content-store-us-east/content/pii:S2468823117300226/fx9/THUMBNAIL/image/gif/8ae5596df9160b6546e806c132035e5e/fx9.sml fx9 fx9.sml sml 2647 88 219 IMAGE-THUMBNAIL 1-s2.0-S2468823117300226-gr1.sml https://s3-eu-west-1.amazonaws.com/prod-ucs-content-store-eu-west/content/pii:S2468823117300226/gr1/THUMBNAIL/image/gif/7493823f37799cf1847fc11da4ba3229/gr1.sml https://s3.amazonaws.com/prod-ucs-content-store-us-east/content/pii:S2468823117300226/gr1/THUMBNAIL/image/gif/7493823f37799cf1847fc11da4ba3229/gr1.sml gr1 gr1.sml sml 1603 32 219 IMAGE-THUMBNAIL 1-s2.0-S2468823117300226-gr2.sml https://s3-eu-west-1.amazonaws.com/prod-ucs-content-store-eu-west/content/pii:S2468823117300226/gr2/THUMBNAIL/image/gif/821e14077e584f21fd65eb4f3accd759/gr2.sml https://s3.amazonaws.com/prod-ucs-content-store-us-east/content/pii:S2468823117300226/gr2/THUMBNAIL/image/gif/821e14077e584f21fd65eb4f3accd759/gr2.sml gr2 gr2.sml sml 1596 26 219 IMAGE-THUMBNAIL 1-s2.0-S2468823117300226-gr3.sml https://s3-eu-west-1.amazonaws.com/prod-ucs-content-store-eu-west/content/pii:S2468823117300226/gr3/THUMBNAIL/image/gif/33ad4858c331228fabd8cbf908054d27/gr3.sml https://s3.amazonaws.com/prod-ucs-content-store-us-east/content/pii:S2468823117300226/gr3/THUMBNAIL/image/gif/33ad4858c331228fabd8cbf908054d27/gr3.sml gr3 gr3.sml sml 7113 147 219 IMAGE-THUMBNAIL 1-s2.0-S2468823117300226-gr4.sml https://s3-eu-west-1.amazonaws.com/prod-ucs-content-store-eu-west/content/pii:S2468823117300226/gr4/THUMBNAIL/image/gif/0759da4e625044f7285c97619eaa520a/gr4.sml https://s3.amazonaws.com/prod-ucs-content-store-us-east/content/pii:S2468823117300226/gr4/THUMBNAIL/image/gif/0759da4e625044f7285c97619eaa520a/gr4.sml gr4 gr4.sml sml 3602 77 219 IMAGE-THUMBNAIL 1-s2.0-S2468823117300226-gr5.sml https://s3-eu-west-1.amazonaws.com/prod-ucs-content-store-eu-west/content/pii:S2468823117300226/gr5/THUMBNAIL/image/gif/ba61ff8afb9498b6441816ebb7841758/gr5.sml https://s3.amazonaws.com/prod-ucs-content-store-us-east/content/pii:S2468823117300226/gr5/THUMBNAIL/image/gif/ba61ff8afb9498b6441816ebb7841758/gr5.sml gr5 gr5.sml sml 3490 77 219 IMAGE-THUMBNAIL 1-s2.0-S2468823117300226-gr6.sml https://s3-eu-west-1.amazonaws.com/prod-ucs-content-store-eu-west/content/pii:S2468823117300226/gr6/THUMBNAIL/image/gif/9541a9e1ec5ba230dfd6b8aa41b61069/gr6.sml https://s3.amazonaws.com/prod-ucs-content-store-us-east/content/pii:S2468823117300226/gr6/THUMBNAIL/image/gif/9541a9e1ec5ba230dfd6b8aa41b61069/gr6.sml gr6 gr6.sml sml 4120 133 219 IMAGE-THUMBNAIL 1-s2.0-S2468823117300226-sc1.sml https://s3-eu-west-1.amazonaws.com/prod-ucs-content-store-eu-west/content/pii:S2468823117300226/sc1/THUMBNAIL/image/gif/02a849c1498270b0560a121c443e9d03/sc1.sml https://s3.amazonaws.com/prod-ucs-content-store-us-east/content/pii:S2468823117300226/sc1/THUMBNAIL/image/gif/02a849c1498270b0560a121c443e9d03/sc1.sml sc1 sc1.sml sml 2819 90 219 IMAGE-THUMBNAIL 1-s2.0-S2468823117300226-sc2.sml https://s3-eu-west-1.amazonaws.com/prod-ucs-content-store-eu-west/content/pii:S2468823117300226/sc2/THUMBNAIL/image/gif/fcc1bb1b4aa80fe1c6cb2f452e9e3a8a/sc2.sml https://s3.amazonaws.com/prod-ucs-content-store-us-east/content/pii:S2468823117300226/sc2/THUMBNAIL/image/gif/fcc1bb1b4aa80fe1c6cb2f452e9e3a8a/sc2.sml sc2 sc2.sml sml 4843 164 189 IMAGE-THUMBNAIL 1-s2.0-S2468823117300226-fx1.jpg https://s3-eu-west-1.amazonaws.com/prod-ucs-content-store-eu-west/content/pii:S2468823117300226/fx1/DOWNSAMPLED/image/jpeg/4a3219c8955608aec8d1a19d983a7abf/fx1.jpg https://s3.amazonaws.com/prod-ucs-content-store-us-east/content/pii:S2468823117300226/fx1/DOWNSAMPLED/image/jpeg/4a3219c8955608aec8d1a19d983a7abf/fx1.jpg fx1 true fx1.jpg jpg 18741 200 500 IMAGE-DOWNSAMPLED 1-s2.0-S2468823117300226-fx10.jpg https://s3-eu-west-1.amazonaws.com/prod-ucs-content-store-eu-west/content/pii:S2468823117300226/fx10/DOWNSAMPLED/image/jpeg/8b550adc5c542db2a72e7d9dcc5ca3ef/fx10.jpg https://s3.amazonaws.com/prod-ucs-content-store-us-east/content/pii:S2468823117300226/fx10/DOWNSAMPLED/image/jpeg/8b550adc5c542db2a72e7d9dcc5ca3ef/fx10.jpg fx10 fx10.jpg jpg 7864 200 500 IMAGE-DOWNSAMPLED 1-s2.0-S2468823117300226-fx11.jpg https://s3-eu-west-1.amazonaws.com/prod-ucs-content-store-eu-west/content/pii:S2468823117300226/fx11/DOWNSAMPLED/image/jpeg/0443cff10db6349a29251a80f7ee0395/fx11.jpg https://s3.amazonaws.com/prod-ucs-content-store-us-east/content/pii:S2468823117300226/fx11/DOWNSAMPLED/image/jpeg/0443cff10db6349a29251a80f7ee0395/fx11.jpg fx11 fx11.jpg jpg 9430 200 500 IMAGE-DOWNSAMPLED 1-s2.0-S2468823117300226-fx12.jpg https://s3-eu-west-1.amazonaws.com/prod-ucs-content-store-eu-west/content/pii:S2468823117300226/fx12/DOWNSAMPLED/image/jpeg/55891446f17ecd93b29fed3ea8fa2a5f/fx12.jpg https://s3.amazonaws.com/prod-ucs-content-store-us-east/content/pii:S2468823117300226/fx12/DOWNSAMPLED/image/jpeg/55891446f17ecd93b29fed3ea8fa2a5f/fx12.jpg fx12 fx12.jpg jpg 8342 200 500 IMAGE-DOWNSAMPLED 1-s2.0-S2468823117300226-fx13.jpg https://s3-eu-west-1.amazonaws.com/prod-ucs-content-store-eu-west/content/pii:S2468823117300226/fx13/DOWNSAMPLED/image/jpeg/10387d1f52ed1ecb94b36f1cda6e9925/fx13.jpg https://s3.amazonaws.com/prod-ucs-content-store-us-east/content/pii:S2468823117300226/fx13/DOWNSAMPLED/image/jpeg/10387d1f52ed1ecb94b36f1cda6e9925/fx13.jpg fx13 fx13.jpg jpg 8021 200 500 IMAGE-DOWNSAMPLED 1-s2.0-S2468823117300226-fx14.jpg https://s3-eu-west-1.amazonaws.com/prod-ucs-content-store-eu-west/content/pii:S2468823117300226/fx14/DOWNSAMPLED/image/jpeg/7b5f74f90c0f626d689750121f52a63e/fx14.jpg https://s3.amazonaws.com/prod-ucs-content-store-us-east/content/pii:S2468823117300226/fx14/DOWNSAMPLED/image/jpeg/7b5f74f90c0f626d689750121f52a63e/fx14.jpg fx14 fx14.jpg jpg 8279 200 500 IMAGE-DOWNSAMPLED 1-s2.0-S2468823117300226-fx15.jpg https://s3-eu-west-1.amazonaws.com/prod-ucs-content-store-eu-west/content/pii:S2468823117300226/fx15/DOWNSAMPLED/image/jpeg/955259abfd59e102f923158bc093cabf/fx15.jpg https://s3.amazonaws.com/prod-ucs-content-store-us-east/content/pii:S2468823117300226/fx15/DOWNSAMPLED/image/jpeg/955259abfd59e102f923158bc093cabf/fx15.jpg fx15 fx15.jpg jpg 6209 200 500 IMAGE-DOWNSAMPLED 1-s2.0-S2468823117300226-fx16.jpg https://s3-eu-west-1.amazonaws.com/prod-ucs-content-store-eu-west/content/pii:S2468823117300226/fx16/DOWNSAMPLED/image/jpeg/d98f3a9571c03d545a933beca6b490ee/fx16.jpg https://s3.amazonaws.com/prod-ucs-content-store-us-east/content/pii:S2468823117300226/fx16/DOWNSAMPLED/image/jpeg/d98f3a9571c03d545a933beca6b490ee/fx16.jpg fx16 fx16.jpg jpg 6232 200 500 IMAGE-DOWNSAMPLED 1-s2.0-S2468823117300226-fx17.jpg https://s3-eu-west-1.amazonaws.com/prod-ucs-content-store-eu-west/content/pii:S2468823117300226/fx17/DOWNSAMPLED/image/jpeg/9e99b9abae08e8b564d31dc02009e903/fx17.jpg https://s3.amazonaws.com/prod-ucs-content-store-us-east/content/pii:S2468823117300226/fx17/DOWNSAMPLED/image/jpeg/9e99b9abae08e8b564d31dc02009e903/fx17.jpg fx17 fx17.jpg jpg 8215 200 500 IMAGE-DOWNSAMPLED 1-s2.0-S2468823117300226-fx18.jpg https://s3-eu-west-1.amazonaws.com/prod-ucs-content-store-eu-west/content/pii:S2468823117300226/fx18/DOWNSAMPLED/image/jpeg/167ed9b3ae0c55e3c5e0fee7848c0319/fx18.jpg https://s3.amazonaws.com/prod-ucs-content-store-us-east/content/pii:S2468823117300226/fx18/DOWNSAMPLED/image/jpeg/167ed9b3ae0c55e3c5e0fee7848c0319/fx18.jpg fx18 fx18.jpg jpg 6235 200 500 IMAGE-DOWNSAMPLED 1-s2.0-S2468823117300226-fx19.jpg https://s3-eu-west-1.amazonaws.com/prod-ucs-content-store-eu-west/content/pii:S2468823117300226/fx19/DOWNSAMPLED/image/jpeg/b81d434786c19a8c78bc2f3e7665687b/fx19.jpg https://s3.amazonaws.com/prod-ucs-content-store-us-east/content/pii:S2468823117300226/fx19/DOWNSAMPLED/image/jpeg/b81d434786c19a8c78bc2f3e7665687b/fx19.jpg fx19 fx19.jpg jpg 8289 200 500 IMAGE-DOWNSAMPLED 1-s2.0-S2468823117300226-fx2.jpg https://s3-eu-west-1.amazonaws.com/prod-ucs-content-store-eu-west/content/pii:S2468823117300226/fx2/DOWNSAMPLED/image/jpeg/be3370692da2f9e0a9891b220e2164fd/fx2.jpg https://s3.amazonaws.com/prod-ucs-content-store-us-east/content/pii:S2468823117300226/fx2/DOWNSAMPLED/image/jpeg/be3370692da2f9e0a9891b220e2164fd/fx2.jpg fx2 fx2.jpg jpg 8138 200 500 IMAGE-DOWNSAMPLED 1-s2.0-S2468823117300226-fx20.jpg https://s3-eu-west-1.amazonaws.com/prod-ucs-content-store-eu-west/content/pii:S2468823117300226/fx20/DOWNSAMPLED/image/jpeg/22ab02cf7a61d6250cb5da82e0895fac/fx20.jpg https://s3.amazonaws.com/prod-ucs-content-store-us-east/content/pii:S2468823117300226/fx20/DOWNSAMPLED/image/jpeg/22ab02cf7a61d6250cb5da82e0895fac/fx20.jpg fx20 fx20.jpg jpg 6232 200 500 IMAGE-DOWNSAMPLED 1-s2.0-S2468823117300226-fx21.jpg https://s3-eu-west-1.amazonaws.com/prod-ucs-content-store-eu-west/content/pii:S2468823117300226/fx21/DOWNSAMPLED/image/jpeg/658af24f81c6c55b65fbfff43afb157d/fx21.jpg https://s3.amazonaws.com/prod-ucs-content-store-us-east/content/pii:S2468823117300226/fx21/DOWNSAMPLED/image/jpeg/658af24f81c6c55b65fbfff43afb157d/fx21.jpg fx21 fx21.jpg jpg 8287 200 500 IMAGE-DOWNSAMPLED 1-s2.0-S2468823117300226-fx22.jpg https://s3-eu-west-1.amazonaws.com/prod-ucs-content-store-eu-west/content/pii:S2468823117300226/fx22/DOWNSAMPLED/image/jpeg/4d8a5b3d60c75f8f638ea1fa7f2059de/fx22.jpg https://s3.amazonaws.com/prod-ucs-content-store-us-east/content/pii:S2468823117300226/fx22/DOWNSAMPLED/image/jpeg/4d8a5b3d60c75f8f638ea1fa7f2059de/fx22.jpg fx22 fx22.jpg jpg 6239 200 500 IMAGE-DOWNSAMPLED 1-s2.0-S2468823117300226-fx23.jpg https://s3-eu-west-1.amazonaws.com/prod-ucs-content-store-eu-west/content/pii:S2468823117300226/fx23/DOWNSAMPLED/image/jpeg/9dc0f96303d950e34e39e01eb6bc4697/fx23.jpg https://s3.amazonaws.com/prod-ucs-content-store-us-east/content/pii:S2468823117300226/fx23/DOWNSAMPLED/image/jpeg/9dc0f96303d950e34e39e01eb6bc4697/fx23.jpg fx23 fx23.jpg jpg 8314 200 500 IMAGE-DOWNSAMPLED 1-s2.0-S2468823117300226-fx24.jpg https://s3-eu-west-1.amazonaws.com/prod-ucs-content-store-eu-west/content/pii:S2468823117300226/fx24/DOWNSAMPLED/image/jpeg/b055530d47d81fded74b8eb0f863f638/fx24.jpg https://s3.amazonaws.com/prod-ucs-content-store-us-east/content/pii:S2468823117300226/fx24/DOWNSAMPLED/image/jpeg/b055530d47d81fded74b8eb0f863f638/fx24.jpg fx24 fx24.jpg jpg 6253 200 500 IMAGE-DOWNSAMPLED 1-s2.0-S2468823117300226-fx25.jpg https://s3-eu-west-1.amazonaws.com/prod-ucs-content-store-eu-west/content/pii:S2468823117300226/fx25/DOWNSAMPLED/image/jpeg/1455bb97d93f93d4d718836977574838/fx25.jpg https://s3.amazonaws.com/prod-ucs-content-store-us-east/content/pii:S2468823117300226/fx25/DOWNSAMPLED/image/jpeg/1455bb97d93f93d4d718836977574838/fx25.jpg fx25 fx25.jpg jpg 10473 200 500 IMAGE-DOWNSAMPLED 1-s2.0-S2468823117300226-fx26.jpg https://s3-eu-west-1.amazonaws.com/prod-ucs-content-store-eu-west/content/pii:S2468823117300226/fx26/DOWNSAMPLED/image/jpeg/c50266cb498b4c59e89e9ed54dd00450/fx26.jpg https://s3.amazonaws.com/prod-ucs-content-store-us-east/content/pii:S2468823117300226/fx26/DOWNSAMPLED/image/jpeg/c50266cb498b4c59e89e9ed54dd00450/fx26.jpg fx26 fx26.jpg jpg 5982 200 500 IMAGE-DOWNSAMPLED 1-s2.0-S2468823117300226-fx27.jpg https://s3-eu-west-1.amazonaws.com/prod-ucs-content-store-eu-west/content/pii:S2468823117300226/fx27/DOWNSAMPLED/image/jpeg/17106c15eddfd85ae1d5c319ee8e06c2/fx27.jpg https://s3.amazonaws.com/prod-ucs-content-store-us-east/content/pii:S2468823117300226/fx27/DOWNSAMPLED/image/jpeg/17106c15eddfd85ae1d5c319ee8e06c2/fx27.jpg fx27 fx27.jpg jpg 8698 200 500 IMAGE-DOWNSAMPLED 1-s2.0-S2468823117300226-fx28.jpg https://s3-eu-west-1.amazonaws.com/prod-ucs-content-store-eu-west/content/pii:S2468823117300226/fx28/DOWNSAMPLED/image/jpeg/9123019bb1e66d64e7be4a44b806b183/fx28.jpg https://s3.amazonaws.com/prod-ucs-content-store-us-east/content/pii:S2468823117300226/fx28/DOWNSAMPLED/image/jpeg/9123019bb1e66d64e7be4a44b806b183/fx28.jpg fx28 fx28.jpg jpg 7126 200 500 IMAGE-DOWNSAMPLED 1-s2.0-S2468823117300226-fx29.jpg https://s3-eu-west-1.amazonaws.com/prod-ucs-content-store-eu-west/content/pii:S2468823117300226/fx29/DOWNSAMPLED/image/jpeg/ff7b0a0bcd2073ece1111ea43fb0bab4/fx29.jpg https://s3.amazonaws.com/prod-ucs-content-store-us-east/content/pii:S2468823117300226/fx29/DOWNSAMPLED/image/jpeg/ff7b0a0bcd2073ece1111ea43fb0bab4/fx29.jpg fx29 fx29.jpg jpg 7539 200 500 IMAGE-DOWNSAMPLED 1-s2.0-S2468823117300226-fx3.jpg https://s3-eu-west-1.amazonaws.com/prod-ucs-content-store-eu-west/content/pii:S2468823117300226/fx3/DOWNSAMPLED/image/jpeg/07672255df04169225f5b398f7330491/fx3.jpg https://s3.amazonaws.com/prod-ucs-content-store-us-east/content/pii:S2468823117300226/fx3/DOWNSAMPLED/image/jpeg/07672255df04169225f5b398f7330491/fx3.jpg fx3 fx3.jpg jpg 10795 200 500 IMAGE-DOWNSAMPLED 1-s2.0-S2468823117300226-fx30.jpg https://s3-eu-west-1.amazonaws.com/prod-ucs-content-store-eu-west/content/pii:S2468823117300226/fx30/DOWNSAMPLED/image/jpeg/c6343c8fa5921ce6fb8eab5743e62d6a/fx30.jpg https://s3.amazonaws.com/prod-ucs-content-store-us-east/content/pii:S2468823117300226/fx30/DOWNSAMPLED/image/jpeg/c6343c8fa5921ce6fb8eab5743e62d6a/fx30.jpg fx30 fx30.jpg jpg 8268 200 500 IMAGE-DOWNSAMPLED 1-s2.0-S2468823117300226-fx31.jpg https://s3-eu-west-1.amazonaws.com/prod-ucs-content-store-eu-west/content/pii:S2468823117300226/fx31/DOWNSAMPLED/image/jpeg/a380683be3ef0e37810f298c328ed9af/fx31.jpg https://s3.amazonaws.com/prod-ucs-content-store-us-east/content/pii:S2468823117300226/fx31/DOWNSAMPLED/image/jpeg/a380683be3ef0e37810f298c328ed9af/fx31.jpg fx31 fx31.jpg jpg 5238 200 500 IMAGE-DOWNSAMPLED 1-s2.0-S2468823117300226-fx32.jpg https://s3-eu-west-1.amazonaws.com/prod-ucs-content-store-eu-west/content/pii:S2468823117300226/fx32/DOWNSAMPLED/image/jpeg/1ab9063fc5b22ceb2021392e202bd307/fx32.jpg https://s3.amazonaws.com/prod-ucs-content-store-us-east/content/pii:S2468823117300226/fx32/DOWNSAMPLED/image/jpeg/1ab9063fc5b22ceb2021392e202bd307/fx32.jpg fx32 fx32.jpg jpg 6587 200 500 IMAGE-DOWNSAMPLED 1-s2.0-S2468823117300226-fx33.jpg https://s3-eu-west-1.amazonaws.com/prod-ucs-content-store-eu-west/content/pii:S2468823117300226/fx33/DOWNSAMPLED/image/jpeg/444fdd4e36c98a4e4a65e9468d3e2dfc/fx33.jpg https://s3.amazonaws.com/prod-ucs-content-store-us-east/content/pii:S2468823117300226/fx33/DOWNSAMPLED/image/jpeg/444fdd4e36c98a4e4a65e9468d3e2dfc/fx33.jpg fx33 fx33.jpg jpg 5522 200 500 IMAGE-DOWNSAMPLED 1-s2.0-S2468823117300226-fx34.jpg https://s3-eu-west-1.amazonaws.com/prod-ucs-content-store-eu-west/content/pii:S2468823117300226/fx34/DOWNSAMPLED/image/jpeg/a0062fca1869cb8b07286a9656b5c509/fx34.jpg https://s3.amazonaws.com/prod-ucs-content-store-us-east/content/pii:S2468823117300226/fx34/DOWNSAMPLED/image/jpeg/a0062fca1869cb8b07286a9656b5c509/fx34.jpg fx34 fx34.jpg jpg 6076 200 500 IMAGE-DOWNSAMPLED 1-s2.0-S2468823117300226-fx35.jpg https://s3-eu-west-1.amazonaws.com/prod-ucs-content-store-eu-west/content/pii:S2468823117300226/fx35/DOWNSAMPLED/image/jpeg/7e6da504d8591f4b3fda44453287a6f9/fx35.jpg https://s3.amazonaws.com/prod-ucs-content-store-us-east/content/pii:S2468823117300226/fx35/DOWNSAMPLED/image/jpeg/7e6da504d8591f4b3fda44453287a6f9/fx35.jpg fx35 fx35.jpg jpg 6309 200 500 IMAGE-DOWNSAMPLED 1-s2.0-S2468823117300226-fx4.jpg https://s3-eu-west-1.amazonaws.com/prod-ucs-content-store-eu-west/content/pii:S2468823117300226/fx4/DOWNSAMPLED/image/jpeg/2523b9bfe8d564e3f91a79bc771b6f5c/fx4.jpg https://s3.amazonaws.com/prod-ucs-content-store-us-east/content/pii:S2468823117300226/fx4/DOWNSAMPLED/image/jpeg/2523b9bfe8d564e3f91a79bc771b6f5c/fx4.jpg fx4 fx4.jpg jpg 8672 200 500 IMAGE-DOWNSAMPLED 1-s2.0-S2468823117300226-fx5.jpg https://s3-eu-west-1.amazonaws.com/prod-ucs-content-store-eu-west/content/pii:S2468823117300226/fx5/DOWNSAMPLED/image/jpeg/6dc41ee07c0f2b5bc996cb7ed59fcca1/fx5.jpg https://s3.amazonaws.com/prod-ucs-content-store-us-east/content/pii:S2468823117300226/fx5/DOWNSAMPLED/image/jpeg/6dc41ee07c0f2b5bc996cb7ed59fcca1/fx5.jpg fx5 fx5.jpg jpg 7697 200 500 IMAGE-DOWNSAMPLED 1-s2.0-S2468823117300226-fx6.jpg https://s3-eu-west-1.amazonaws.com/prod-ucs-content-store-eu-west/content/pii:S2468823117300226/fx6/DOWNSAMPLED/image/jpeg/3c0d5ed431c84f5e7901238cae4cc095/fx6.jpg https://s3.amazonaws.com/prod-ucs-content-store-us-east/content/pii:S2468823117300226/fx6/DOWNSAMPLED/image/jpeg/3c0d5ed431c84f5e7901238cae4cc095/fx6.jpg fx6 fx6.jpg jpg 7867 200 500 IMAGE-DOWNSAMPLED 1-s2.0-S2468823117300226-fx7.jpg https://s3-eu-west-1.amazonaws.com/prod-ucs-content-store-eu-west/content/pii:S2468823117300226/fx7/DOWNSAMPLED/image/jpeg/aa9fabe5912305951cf7aabfd11d5b22/fx7.jpg https://s3.amazonaws.com/prod-ucs-content-store-us-east/content/pii:S2468823117300226/fx7/DOWNSAMPLED/image/jpeg/aa9fabe5912305951cf7aabfd11d5b22/fx7.jpg fx7 fx7.jpg jpg 8010 200 500 IMAGE-DOWNSAMPLED 1-s2.0-S2468823117300226-fx8.jpg https://s3-eu-west-1.amazonaws.com/prod-ucs-content-store-eu-west/content/pii:S2468823117300226/fx8/DOWNSAMPLED/image/jpeg/1a18e5334e356b928c8a167b3fc91273/fx8.jpg https://s3.amazonaws.com/prod-ucs-content-store-us-east/content/pii:S2468823117300226/fx8/DOWNSAMPLED/image/jpeg/1a18e5334e356b928c8a167b3fc91273/fx8.jpg fx8 fx8.jpg jpg 10010 200 500 IMAGE-DOWNSAMPLED 1-s2.0-S2468823117300226-fx9.jpg https://s3-eu-west-1.amazonaws.com/prod-ucs-content-store-eu-west/content/pii:S2468823117300226/fx9/DOWNSAMPLED/image/jpeg/54734d64a68f854f5b530555fb907b5d/fx9.jpg https://s3.amazonaws.com/prod-ucs-content-store-us-east/content/pii:S2468823117300226/fx9/DOWNSAMPLED/image/jpeg/54734d64a68f854f5b530555fb907b5d/fx9.jpg fx9 fx9.jpg jpg 8561 200 500 IMAGE-DOWNSAMPLED 1-s2.0-S2468823117300226-gr1.jpg https://s3-eu-west-1.amazonaws.com/prod-ucs-content-store-eu-west/content/pii:S2468823117300226/gr1/DOWNSAMPLED/image/jpeg/fafa50b42e296b540b1fb3dded866677/gr1.jpg https://s3.amazonaws.com/prod-ucs-content-store-us-east/content/pii:S2468823117300226/gr1/DOWNSAMPLED/image/jpeg/fafa50b42e296b540b1fb3dded866677/gr1.jpg gr1 gr1.jpg jpg 10533 92 640 IMAGE-DOWNSAMPLED 1-s2.0-S2468823117300226-gr2.jpg https://s3-eu-west-1.amazonaws.com/prod-ucs-content-store-eu-west/content/pii:S2468823117300226/gr2/DOWNSAMPLED/image/jpeg/627c1006334ad12d5451d49280fa00ac/gr2.jpg https://s3.amazonaws.com/prod-ucs-content-store-us-east/content/pii:S2468823117300226/gr2/DOWNSAMPLED/image/jpeg/627c1006334ad12d5451d49280fa00ac/gr2.jpg gr2 gr2.jpg jpg 8388 62 527 IMAGE-DOWNSAMPLED 1-s2.0-S2468823117300226-gr3.jpg https://s3-eu-west-1.amazonaws.com/prod-ucs-content-store-eu-west/content/pii:S2468823117300226/gr3/DOWNSAMPLED/image/jpeg/0a7b5d28029bc832d7a62cd55f46e51e/gr3.jpg https://s3.amazonaws.com/prod-ucs-content-store-us-east/content/pii:S2468823117300226/gr3/DOWNSAMPLED/image/jpeg/0a7b5d28029bc832d7a62cd55f46e51e/gr3.jpg gr3 gr3.jpg jpg 14040 215 320 IMAGE-DOWNSAMPLED 1-s2.0-S2468823117300226-gr4.jpg https://s3-eu-west-1.amazonaws.com/prod-ucs-content-store-eu-west/content/pii:S2468823117300226/gr4/DOWNSAMPLED/image/jpeg/19bcaa07a50f960cecbc529e45fc1704/gr4.jpg https://s3.amazonaws.com/prod-ucs-content-store-us-east/content/pii:S2468823117300226/gr4/DOWNSAMPLED/image/jpeg/19bcaa07a50f960cecbc529e45fc1704/gr4.jpg gr4 gr4.jpg jpg 32616 251 715 IMAGE-DOWNSAMPLED 1-s2.0-S2468823117300226-gr5.jpg https://s3-eu-west-1.amazonaws.com/prod-ucs-content-store-eu-west/content/pii:S2468823117300226/gr5/DOWNSAMPLED/image/jpeg/4da769be86546c417fc78c426a0f6d19/gr5.jpg https://s3.amazonaws.com/prod-ucs-content-store-us-east/content/pii:S2468823117300226/gr5/DOWNSAMPLED/image/jpeg/4da769be86546c417fc78c426a0f6d19/gr5.jpg gr5 gr5.jpg jpg 31736 253 716 IMAGE-DOWNSAMPLED 1-s2.0-S2468823117300226-gr6.jpg https://s3-eu-west-1.amazonaws.com/prod-ucs-content-store-eu-west/content/pii:S2468823117300226/gr6/DOWNSAMPLED/image/jpeg/f25d8a0c08bce30622e642b4460760ad/gr6.jpg https://s3.amazonaws.com/prod-ucs-content-store-us-east/content/pii:S2468823117300226/gr6/DOWNSAMPLED/image/jpeg/f25d8a0c08bce30622e642b4460760ad/gr6.jpg gr6 gr6.jpg jpg 32416 457 753 IMAGE-DOWNSAMPLED 1-s2.0-S2468823117300226-sc1.jpg https://s3-eu-west-1.amazonaws.com/prod-ucs-content-store-eu-west/content/pii:S2468823117300226/sc1/DOWNSAMPLED/image/jpeg/eb2128ed4c069f3038fd9ad9d61b3f5f/sc1.jpg https://s3.amazonaws.com/prod-ucs-content-store-us-east/content/pii:S2468823117300226/sc1/DOWNSAMPLED/image/jpeg/eb2128ed4c069f3038fd9ad9d61b3f5f/sc1.jpg sc1 sc1.jpg jpg 22675 231 565 IMAGE-DOWNSAMPLED 1-s2.0-S2468823117300226-sc2.jpg https://s3-eu-west-1.amazonaws.com/prod-ucs-content-store-eu-west/content/pii:S2468823117300226/sc2/DOWNSAMPLED/image/jpeg/ac368b17f18feac874b877717355b529/sc2.jpg https://s3.amazonaws.com/prod-ucs-content-store-us-east/content/pii:S2468823117300226/sc2/DOWNSAMPLED/image/jpeg/ac368b17f18feac874b877717355b529/sc2.jpg sc2 sc2.jpg jpg 49423 603 696 IMAGE-DOWNSAMPLED 1-s2.0-S2468823117300226-mmc1.doc https://s3-eu-west-1.amazonaws.com/prod-ucs-content-store-eu-west/content/pii:S2468823117300226/mmc1/MAIN/application/msword/780fba6aeae1f51b22c18084c13daa8e/mmc1.doc https://s3.amazonaws.com/prod-ucs-content-store-us-east/content/pii:S2468823117300226/mmc1/MAIN/application/msword/780fba6aeae1f51b22c18084c13daa8e/mmc1.doc mmc1 mmc1.doc doc 628224 APPLICATION MCAT 72 S2468-8231(17)30022-6 10.1016/j.mcat.2017.01.027 Elsevier B.V. Scheme 1 Synthesis of ionic liquids in this study. Scheme 1 Scheme 2 The proposed mechanism. Scheme 2 Fig. 1 Assignments of NMR signals of the 3. Fig. 1 Fig. 2 Assignments of NMR signals of the 4. Fig. 2 Fig. 3 Catalyst recycles studies in coupling carbon dioxide with epichlorohydrin: epichlorohydrin 0.30mol, catalyst 0.3mol%, CO2 pressure 0.5MPa, temperature 90°C, time 12h. Fig. 3 Fig. 4 Kinetic analysis of epichlorohydrin. Reaction conditions: CO2 0.5Mpa, IL 4 0.3mol%, 130°C. (a) Line A (blue): n[epichlorohydrin]=0.008mol, k =61.6222, R2 =0.9904; line B (red): n[epichlorohydrin]=0.024mol, k =178.4164, R2 =0.9934; line C (green): n[epichlorohydrin]=0.06mol, k =380.2477, R2 =0.9934; line D (Purple): n[epichlorohydrin]=0.08mol, k =471.6381, R2 =0.9945. (b) Kinetic curve of epichlorohydrin. y=5662.1836 x+29.5070. R2 =0.9917. (For interpretation of the references to colour in this figure legend, the reader is referred to the web version of this article.) Fig. 4 Fig. 5 Kinetic analysis of IL 4. Reaction conditions: epichlorohydrin 0.06mol, CO2 0.5Mpa, 130°C. (a) line A (blue): n[IL 4]=0.05mol%, k =296.6331, R2 =0.9956; line B (red): n[IL 4]=0.3mol%, k =380.2477, R2 =0.9934; line C (green): n[IL 4]=0.4mol%, k =427.3089, R2 =0.9993; line D (purple): n[IL 4]=0.5mol%, k =452.4987, R2 =0.9951. (b) Kinetic curve of IL 4. y=354.0894x+278.5192. R2 =0.9914. (For interpretation of the references to colour in this figure legend, the reader is referred to the web version of this article.) Fig. 5 Fig. 6 13C NMR spectra of IL 4 before and after reaction of CO2. Fig. 6 Table 1 1H NMR data of IL 3 in d6-DMSO (δ, ppm). Table 1 H(1,2) H(3,4,5) H(6) H(7) H(8) H(9) H(10) H(11) H(12) 3.89(4H,m) 3.42(6H,m) 3.18(1H,m) 3.12(3H,s) 2.13(2H,m) 1.84(1H,m), 1.72(1H, m) 1.65(2H,m) 1.25(10H,m) 0.84(3H,t) Ca Cb Cc Cd Ce Cf Cg Ch Ci Cj Ck Cl Cm Cn Co 14.24 21.08 22.38 26.09 27.34 28.83 31.50 35.52 46.16 54.64 59.2 60.22 64.29 171.86 177.30 13C NMR data of IL 3 in d6-DMSO (δ, ppm). Table 2 1H NMR data of IL 4 in d6 -DMSO (δ, ppm). Table 2 H(1) H(2) H(3) H(4) H(5) H(6) H(7) H(5×CH2) H(9) H(10) H(11) 10.28(1H,s) 8.85(1H,d) 8.58(1H,d) 8.51(1H,d) 8.31(1H,d) 8.21(1H,t) 8.03(1H,t) 4.75(2H,t)1.98(2H,m)1.26(6H,m) 3.30(1H,m) 2.41(1H,m), 2.21(1H, m) 0.80(3H,t) Ca Cb Cc Cd Ce Cf Cg Ch Ci Cj Ck Cl Cm Cn Co Cp Cq 14.00 22.04 25.33 30.80 37.44 52.33 60.84 125.10 127.42 130.69 131.21 135.24 136.87 136.97 150.31 171.96 174.73 13C NMR data of IL 4 in d6-DMSO (δ, ppm). Table 3 Selected IR (KBr) data [cm−1] for ILs 3–4. Table 3 ν(RCH) ν(CN)ν(CC) δMe(CH) ν(CH) δ(CH) ν(COC) ν(CH) ν(CO) ν(CN) ν(CC) 3 2926m2862m 1270w 1341w 1393m 1115m 1600m 4 2917m2873m 1262w 1319w 1385m 3072m 1607m 1638w 1508w Table 4 Screening the Reaction Conditions. Table 4 Entry a ILs Time (h) Temp (°C) P (MPa) Yield (%) b TOF (h−1) c 1 None 12 130 0.5 Trace – 2 1 2 130 0.5 48 80.0 3 1 5 130 0.5 84 56.0 4 1 8 130 0.5 93 38.8 5 1 12 130 0.5 98 27.2 6 1 12 150 0.5 99 27.5 7 1 12 110 0.5 89 24.7 8 1 12 130 2 97 26.9 9 1 12 130 3 97 26.9 10 1 12 130 1 98 27.2 11 2 12 130 0.5 98 27.2 12 3 12 130 0.5 99 27.5 13 4 12 130 0.5 98 27.2 14 2 5 130 0.5 97 64.7 15 3 5 130 0.5 98 65.3 16 4 5 130 0.5 96 64.0 17 [bmim][Br] 5 130 0.5 80 53.3 18 [mor1,8][Br] 5 130 0.5 93 62.0 19 [HiQuin][Br] 5 130 0.5 90 60.0 20 [bmim][Br] 12 130 0.5 98 27.2 21 [mor1,8][Br] 12 130 0.5 98 27.2 22 [HiQuin][Br] 12 130 0.5 97 26.9 a All reactions were run with epichlorohydrin (0.06mol), and the catalysts loadings were set as 0.3 mol% to epichlorohydrin. b Isolated yield. Determined by GC and TOF-MS. The selectivity kept at high level (99%) in all cases. c Moles of chloropropene carbonate per mole ionic liquids per hour. Table 5 Summary of data for cycloaddition reactions between CO2 and the epoxides. Table 5 Reference Catalyst Co- Catalyst Epoxide Reaction conditions Yield(%) Our work Epichlorohydrin (0.06mol), IL(0.3 mol%), CO2 0.5MPa, 130°C, 5hPropylene oxide (0.06mol), IL(0.3 mol%), CO2 0.5MPa, 130°C, 12h 9896 Liu et al. [65] Propylene oxide (0.0345mol), IL(1 mol%), CO2 1.5MPa, 130°C, 3h 97 Roshan et al. [66] Epichlorohydrin (0.0355mol), IL(0.28 mol%), CO2 0.6MPa, 120°C, 6h 71 Wu et al. [67] Propylene oxide (0.0286mol), IL(0.003 mol%), CO2 4MPa, 130°C, 18h 96 Wu et al. [50] Epichlorohydrin (0.02mol), IL(0.1 mol%), CO2 1MPa, 120°C, 1h 90 Yue et al. [68] propylene oxide (0.07mol), IL(1 mol%), CO2 1.5MPa, 120°C, 1.5hEpichlorohydrin (0.07mol), IL(1 mol%), CO2 1.5MPa, 120°C, 2h 9297 Xiao et al. [69] propylene oxide (0.0702mol), IL(2 mol%), CO2 1.5MPa, 110°C, 2.0h 96 Gong et al. [70] Et3N Epichlorohydrin (0.016mol), IL(1 mol%), Et3N(1 mol%), CO2 0.1MPa, 90°C, 24h 95 Liu et al. [71] EG propylene oxide (0.0345mol), IL(0.4 mol%), EG(2 mol%), CO2 2.0MPa, 120°C, 4.0h 96 Table 6 Substrate Scope for the Catalyst [bmim][ASP]. Table 6 Entry a Epoxide Product Yield [%] b Select. [%] 1 96 99 2 99 99 3 97 99 4 98 99 5 99 99 a Reaction conditions: [bmim][ASP] (0.3 mol%, relative to the substrate), 0.5MPa, reaction temperature 130°C, 12h. b Isolated yield. Determined by GC and TOF-MS. Amino acid-based ionic liquids for CO2 conversion to form cyclic carbonate under solvent-free conditions Shuang Yue a ⁎ Xiu-Jia Hao b Ping-Ping Wang b Jun Li b a Institute of Rare and Scattered Elements Chemistry, Liaoning University, Shenyang 110036, China Institute of Rare and Scattered Elements Chemistry Liaoning University Shenyang 110036 China b College of Chemistry, Liaoning University, Shenyang 110036, China College of Chemistry Liaoning University Shenyang 110036 China ⁎ Corresponding author. Graphical abstract The amino acid ionic liquids of 1-butyl-3-methylimidazolium aspartic acid [bmim][ASP], 1-butyl-3-methylimidazolium glutamic acid [bmim][Glu], N-octyl-N-methylmorpholinium glutamic acid [mor1,8][Glu] and N-hexylisoquinolinium aspartic acid [HiQuin][ASP] have been synthesized and characterized by 1H NMR, 13C NMR and IR spectroscopy. The catalytic performance of the amino acid ionic liquids for the coupling of various epoxides and CO2 to produce cyclic carbonates was studied. The influence of anion type, catalyst dose, reaction temperature, reaction time and CO2 pressure on the yields of cyclic carbonates was examined. The synthesized ionic liquids were found to be single component bifunctional catalysts in good yields and selectivity, no additional organic solvent required and halogen free. Furthermore, this system provides a reasonably environmentally benign chemical process in terms of potential industrial application. Keywords Amino acid ionic liquids Cyclic carbonates Carbon dioxide Epoxides Catalysis 1 Introduction Carbon dioxide is an attractive C1 building block in organic synthesis as it is easily available, non-toxic, economical and inexpensive C1 resource [1–5], Therefore, the utilization of CO2 as a feedstock for chemicals is a good idea. Currently, the synthesis of cyclic carbonates via the cycloaddition of CO2 to epoxides is the most common utilize [6–8]. Cyclic carbonates can be used in many applications areas such as industrial raw materials, aprotic polar solvents, electrolytic elements of lithium secondary batteries, monomers for synthesizing polycarbonates, and intermediates for the pharmaceutical and fine chemical industries [9–11]. The reaction of epoxides with CO2 has attracted much attention. In the last decades of the 20th century, a large number of catalysts have been exploited, such as vary from alkali metal salts or metal oxides [12–14], molecular sieves [15], transition metal complexes [16–22], quaternary ammonium salts [23], metal-organic frameworks [24–26], main-group organometallic compounds [27,28], phosphonium salts [29–33], gold nanoparticles or cross-linked polymeric nanoparticles [34,35] and ionic liquids [36–44]. In particular, ionic liquid is an ideal catalyst for the cycloaddition of CO2 with epoxides [45–50], because they possess some of the most important features. Notably, Deng Sun et al. [36] showed imidazolium functional ionic liquids were a good choice for the synthesis of cyclic carbonates from carbon dioxide and epoxides. What's more, with imidazolium cations and halogen anions for cyclic carbonate synthesis, the catalytic activity of ionic liquids could be greatly enhanced by the presence of Lewis acidic co-catalysts [51]. While it is not vastly accepted as a “green” reaction because the halogen ionic liquid is harmful to the environment [52,53]. Hence it is one of the most attractive topics on the research of the bio-renewable natural compounds partly being ions of ionic liquids. The amino acid ionic liquids (AAILs) consisting of amino acid anions have unique properties such as containing multi-functional groups, chirality, high thermal stability, low cost, biodegradable and biocompatible [54]. Therefore, we have successfully synthesized single component bifunctional amino acid-based ionic liquids in which [bmim][ASP] and [bmim][Glu] are reported in the literatures [55,56]. Moreover, the synthsized ionic liquids have been utilized as halogen-free catalysts for the synthesis of cyclic carbonates from CO2 and epoxides (Scheme 1 ), which requires no additional organic solvent. 2 Experimental 2.1 General remarks All preparations were performed under laboratory atmosphere. All reagents and solvents employed were commercially available and were of analytical grade. [L-Glu](99.99%) was purchased from Sinopharm Chemical Reagents Co. Ltd of China. Anion-exchange resin (type 717) was purchased from Shanghai Chemical Reagent Co. Ltd. and activated by the usual method. IR spectra were recorded on a Nicolet 5700 FT-IR spectrometer using KBr as the IR matrix. 1H NMR and 13C NMR were measured in DMSO with a mercury-VX 300 spectrometer and bruker avance Ⅲ 600MHz. Thermogravimetry coupled with mass spectroscopy (TG-MS) was conducted utilizing a Netzsch TG209 system; typically about 10mg of each sample were heated from 25°C to 800°C at 10 Kmin−1. The analyses of organic products were conducted with gas chromatography on a CP 3800 instrument equipped with a FID and a capillary column (30m×320μm×1μm) CP-Sil 19 CB. TOF-MS spectra were measured on a Bruker micrOTOF_Q. 2.2 Preparation of the ionic liquids 2.2.1 General preparation of ionic liquids 1-2 1-Butyl-3-methylimidazolium aspartic acid [bmim][ASP](1) and 1-butyl-3-methylimidazolium glutamic acid [bmim][Glu](2) were synthesized according to literature processes [55,56]. 2.2.2 General preparation of ionic liquid 3 N-Octyl-N-methylmorpholinium bromide [mor1,8][Br] was synthesized according to literature processes [57]. A total of 5g of [mor1,8][Br] passed through the anion-exchange resin (type 717) [58], to prepare the [mor1,8][OH] solution. The [mor1,8][OH] solution was reacted with a slight excess of Glu (2.5g) through neutralization at room temperature for 24h. Subsequently, water was removed by rotary evaporation. To this reaction mixture was added 90mL of acetonitrile and 10mL of methanol, and it was stirred vigorously. The mixture was then filtered to remove excess Glu. Filtrate was evaporated to remove solvents. Finally, the products were dried at 80°C under vacuum for 12h before being used for further characterization and using. 2.2.3 General preparation of ionic liquid 4 N-Hexylisoquinolinium bromide [HiQuin][Br] was synthesized according to literature processes [59]. A total of 5g of [HiQuin][Br] passed through the anion-exchange resin(type 717), to prepare the [HiQuin][OH] solution. Then [HiQuin][OH] solution was reacted with a slight excess of ASP (2.5g) through neutralization at room temperature for 24h. Subsequently, water was removed by rotary evaporation. To this reaction mixture was added 90mL of acetonitrile and 10mL of methanol, and it was stirred vigorously. The mixture was then filtered to remove excess ASP. Filtrate was evaporated to remove solvents. Finally, the products were dried at 80°C under vacuum for 12h before being used for further characterization and using. 2.3 Characterization ILs 1–4 were characterized by FT-IR, 1H NMR, 13C NMR spectroscopy and can be found in the Supporting Information. C12H21N3O4(271.1).1H NMR (DMSO, 300MHz, RT): δ =9.43 (1H, s), 7.84 (1H, s), 7.78 (1H, s), 4.20 (2H, t), 3.88 (3H, s), 3.24 (1H, m), 2.32 (1H, m), 2.15(1H, m), 1.75 (2H, m), 1.24 (2H, m), 0.90 (3H, t); 13C NMR (75.5MHz, DMSO-D6): δ =13.49, 18.97, 31.61, 35.91, 37.20, 48.65, 52.32, 122.43, 123.78, 137.01, 171.81, 174.75; IR (KBr): ν=1601cm−1 (CO). C13H23N3O4(285.1).1H NMR (DMSO, 600MHz, RT): δ =9.43 (1H, s), 7.79 (1H, s), 7.73 (1H, s), 4.15 (2H, t), 3.85 (3H, s), 3.27 (1H, m), 2.11 (2H, m), 1.88 (1H, m), 1.74(1H, m), 1.71 (2H, m), 1.19 (2H, m), 0.82 (3H, t); 13C NMR (75.5MHz, DMSO-D6): δ =13.50, 19.00, 27.44, 31.64, 35.90, 36.05, 48.67, 54.72, 122.48, 123.83, 137.13, 171.96, 177.38; IR (KBr): ν=1621cm−1 (CO). C18H36N2O5(354.3).1H NMR (DMSO, 600MHz, RT): δ =3.89 (4H, m), 3.42 (6H, m), 3.18 (1H, m), 3.12 (3H, s), 2.13 (2H, m), 1.84 (2H, m), 1.72(1H, m), 1.65 (2H, m), 1.25 (10H, m), 0.84 (3H, t); 13C NMR (75.5MHz, DMSO-D6): δ =14.24, 21.08, 22.38, 26.09, 27.34, 28.83, 31.50, 35.52, 46.16, 54.64, 59.20, 60.22, 64.29, 171.86, 177.30; IR (KBr): ν=1600cm−1 (CO). C19H26N2O4(346.3).1H NMR (DMSO, 600MHz, RT): δ =10.28 (1H, s), 8.85 (1H, d), 8.58 (1H, d), 8.51 (1H, d), 8.31 (1H, d), 8.21 (1H, t), 8.03 (1H, t), 4.75 (2H, t), 1.98 (2H, m), 1.26 (6H, m), 3.30 (1H, m), 2.41 (1H, m), 0.80 (3H, t); 13C NMR (75.5MHz, DMSO-D6): δ =14.00, 22.04, 25.33, 30.80, 37.44, 52.33, 60.84, 125.10, 127.42, 130.69, 131.21, 135.24, 136.87, 136.97, 150.31, 171.96, 174.73; IR (KBr): ν=1607cm−1 (CO). 2.4 Representative procedure for the cycloaddition reaction In a typical reaction, the cycloaddition reaction was carried out in a 50mL stainless steel autoclave and a magnetic stirrer. The ionic liquid as a catalyst (0.3mol% with regard to epoxide) was introduced into a reactor containing epoxide (5.0mL) at room temperature without using any co-solvent and co-catalyst. The reactor vessel was placed under a constant pressure of carbon dioxide and then heated to 130°C for 12h. After the reaction, the reactor was cooled to room temperature, and the excess of CO2 was vented, and the mixture was evaporated under vacuum. The residuals were purified using silica gel column chromatography (eluent: dichloromethane) to give the corresponding cyclic carbonate. The cycloaddition products are known compounds and were characterized by TOF-MS. 2.5 Representative procedure for catalyst recycling After the reaction, the catalyst ([bmim][ASP]) was recovered and separated by vacuum distillation, dried at 80°C for 12h under vacuum, and then reused for the next run. 3 Results and discussion 3.1 Characterization The amino acid ILs 1–4 (seeTables 1-2and Supporting Information) were synthesized via exchange of bromide by hydroxide anions on an ion exchange resin, subsequent addition of amino acid and stirring at room temperature for 24h. All four ILs were characterized by FT-IR, 1H NMR and 13C NMR (see Experimental section). All ILs can be handled in atmosphere and stored in desiccators prior to use without decomposition. 3.1.1 NMR spectroscopic characterization The ILs 1–4 were characterized by 1H NMR and 13C NMR spectroscopy (in d6-DMSO). The spectra of 1–4 show no impurities detectable by 1H NMR and 13C NMR. For the ILs 1–2, the chemical shifts are in agreement with the report in the literatures [55,56]. For the IL 3 (Fig. 1 ), methylene (–CH2–) protons adjacent to the nitrogen atom appear in the range 3.42ppm and the methyl (–CH3) protons adjacent to the nitrogen atom appear in the range 3.12ppm.In 1H NMR spectrum of 4 (Fig. 2 ), the isoquinoline ring protons are observed in the 8.03–10.28ppm ranges due to the conjugated effect of phenyl ring and pyridine ring. Similarly, some 13C NMR shift changes for the carbon atoms in ILs 3–4 can be observed (Tables 1 and 2 ). These shift changes are in agreement with a changed coordination situation. 3.1.2 Vibrational spectroscopy FT-IR spectra were used to clarify the structure of the amino acid anions. All four ILs show similar IR spectra with respect to CO bond stretching (seeTable 3and Supporting Information). The CO vibrations are found in the region 1600cm−1. The values are in good accordance with those published in the literature [60]. The ν(CH) stretching vibrations of the morpholine CH groups are located in the region 1393cm−1. The methylene groups can be observed in the region 2862–2926cm−1. The characteristic band at 1341cm−1 is mainly assigned to methyl. The morpholine ring CC and CN stretching vibrations are found in the region 1270cm−1. In addition, the IR spectra of the 3 show another new band at 1115cm−1, which is assigned to stretching vibration of COC group in the morpholine ring [61,62] (Table 3). The isoquinoline ring CC stretching vibration is found in the region 1508cm−1. The isoquinoline ring CN stretching vibration is found in the region 1638cm−1. Band at 3072cm−1 is attributed to the ν(CH). The new peaks appeared at 1319cm−1 and 2873∼2917cm−1, these are the characteristic absorption peaks of mainly methyl and methylene groups. The isoquinoline ring CC and CN stretching vibration bands are observed at 1262cm−1 [63] (Table 3 ). 3.2 Effect of reaction conditions To optimize the reaction conditions, the effects of various reaction parameters were tested, and the results are summarized in Table 4 . It can be observed that no product was detected in the absence of catalyst under the applied reaction conditions (entry 1). The influence of reaction temperature on chloropropene carbonate yield was investigated (entries 5–7, Table 4). The results show that the yield of chloropropene carbonate was increased with increasing the reaction temperature and the optimal performance was achieved at 150°C. Therefore, higher temperature favors the epoxide ring opening and insertion of carbon dioxide into the CO bond of epoxide is converted to cyclic carbonate. Although the [bmim][ASP] as catalyst at 150°C has high catalytic activity, 130°C could be considered to be an appropriate reaction temperature from an economic standpoint. It was indicated amino-functional ionic liquids can be stable, and used at up to 150°C temperature, being well agreement with the heatresistant property(see Supporting Information Fig. S1–4), labelled as one of this type AAILs’ advantages. The effect of CO2 pressure on the reaction was also evaluated (entries 5, 8–10, Table 4). The yield of chloropropene carbonate was decreased by an increase the pressure, but the yield of chloropropene carbonate changes little, while would decrease to 97% when further increasing the pressure up to 3MPa (entry 9). The results show that the pressure has little effect on the yield of chloropropene carbonate. Additionally, the influence of reaction time on the chloropropene carbonate yield was given in Table 4 (entries 2–5). It was observed that the reaction time had a remarkable effect on the reaction. From the results, it can be seen that the yield of chloropropene carbonate was increased with increasing the reaction time, and almost quantitative yield (98%) could be achieved after 12h. That is to say, [bmim][ASP] could be an effective catalyst for synthesis of cyclic carbonate. Therefore, the suitable reaction time would be 12h. Under our standard reaction conditions (130°C, 0.5MPa, 12h, 0.3mol% catalyst relative to epoxide), the four amino acid ionic liquids obtained in high yields (more than 98%). We compared the yield of the reaction after 5h on the [bmim][ASP] and [bmim][Glu] (entries 3, 14, Table 4). The results show that the [bmim][Glu] (yield 97%) has high yield of chloropropene carbonate than [bmim][ASP] (yield 84%), this might be because Glu has one more carbon. The result indicates that anion carbon chain growth will help yield improving. Furthermore, we also compared the yield of [bmim][Glu] and [mor1,8][Glu] (entries 14, 15, Table 4) under the same conditions. We found that the yield of chloropropene carbonate almost unchanged. The result suggested that cation has little effect on the reaction. Moreover, we studied the catalytic activity of the precursors of the ionic liquids 1-4 ([bmim][Br], [mor1,8][Br], [HiQuin][Br]) when the reaction time is 5h and 12h respectively. Comparatively, amino-functional ionic liquids ILs 1–4 exhibited a superior activity to traditional halide-based ILs, a raising(about 5%) on the yield of chloropropene carbonate was observed when the reaction time is 5h (entries 3, 14–19). However, prolonging the reaction time to 12h, the yields of chloropropene carbonate were almost same. (entries 5, 11–13, 20–22). Table 5 compares the results of carbonate synthesis using various ionic liquids as catalysts reported in the literatures. Previously reported systems required the halogen ionic liquid or co-catalyst to accomplish satisfactory results. However, the negative effect of halogen on surroundings is one of the main causes for those ionic liquids with halogen anion being challenged as ‘green’ candidates. Although a direct comparison between the various efficient ionic liquids for cyclic carbonate synthesis is tedious owing to the differences in the reaction conditions, we noticed that single component bifunctional amino acid-based ionic liquids could be utilized as halogen-free, cocatalyst-free, and solvent-free catalysts for the synthesis of cyclic carbonates from CO2 and epoxides in good yields and selectivity under mild conditions. 3.3 Scope of the reaction Under the optimized reaction conditions (130°C, 0.5MPa, 12h, 0.3mol% catalyst relative to epoxide), the scope of application of the catalyst was examined. A series of epoxides were explored for cyclic carbonate synthesis in the presence of [bmim][ASP] and the results are depicted in Table 6 . The catalyst was found to be applicable to various terminal epoxides to provide the corresponding cyclic carbonates in high yields (more than 96%) with excellent selectivity (up to 99%). And the activities of the substrates were not sensitive to the properties of the substituent in the substrates. 3.4 The Reusability of the Catalyst For a potential application in a green and economic process the recyclability of a catalyst plays an important role. To examine the stability and the longevity of the catalytic system, the reaction of CO2 with epichlorohydrin was carried out under the reaction conditions (T=90°C, t=12h, P(CO2)=0.5MPa). The recovery of the catalyst is easily achieved by vacuum distillation. As shown in Fig. 3 , the activity of the catalytic system remains the same for at least five catalytic cycles and no obvious decrease of chloropropene carbonate yield was observed. The results indicate that the prepared catalysts exhibit good stability for CO2 cycloaddition reaction to carbonate. 3.5 Catalytic kinetics study and mechanistic investigation Insight into the reaction mechanism was obtained from a series of kinetic studies. The synthesis of chloropropene carbonate was chosen as the model reaction to investigate the kinetics of the IL 4 reaction. For the synthesis of cyclic carbonates, it is credible that CO2 is first order according to the previous study [71–73]. Therefore, the rate equation for a reaction can be written as Eq. (1). in which k represents the rate constant, [epoxide], [CO2] and [IL 4] represent the epichlorohydrin, CO2 and the catalyst concentrations, respectively; a and b represent the orders of the reactants. Since the concentrations of CO2 were kept constant in our experiments, Eq. (1) can be expressed as Eq. (2) or Eq. (3) as needed. (1) r = k [CO2] [epoxide] a [IL 4] b (2) r = k obs1[epoxide]a, k obs1 = k [CO2][IL 4] b (3) r = k obs2[IL 4] b , k obs2 = k [CO2] [epoxide] a To determine the reaction order of epichlorohydrin, experiments were carried out at four different epichlorohydrin concentrations, as shown in Fig. 4 . All the kinetic experiments showed good fits to first order kinetics, implying that the reaction is first order for epichlorohydrin. The same method was used to determine the order with respect to the catalyst. The reaction was carried out under varying concentrations of catalyst and comparison of the observed rate constants for the four experiments indicated a first-order reaction in catalyst (Fig. 5 ). This is consistent with a rate-determining step involving both catalyst, epoxide, and CO2. The kinetics studies showed that the synthesis of chloropropene carbonate catalyzed by IL 4 obeys the rate shown in eqn (4) as follows: (4) r = k [CO2] [epoxide][IL 4] In addition, for the synthesis of cyclic carbonates, pioneering studies have shown that the amine group of ionic liquid was inclined to react reversibly with CO2 to afford the ammonium carbamate as reactive intermediate[67,74,75]. 13C NMR was adopted to verify the CO2 reaction state (see Fig. 6 ). In addition to the peaks of pure IL 4, no new peaks appeared. And The C chemical shifts in IL 4 before and after CO2 reaction are almost unchanged. The results seem to indicate that CO2 inserts directly into the ring-opened intermediate. Based on previous report [50,64–70,76–80] and the results in our study, a possible mechanism was proposed, as shown in Scheme 2 . The epoxide molecule may be activated by the cation in the bifunctional catalyst via interaction of the cation with the oxygen atom, therefore the amino acid anion might simultaneously attack the less hindered carbon of the epoxide, hence resulting the ring-openning. While insertion of CO2 into the ON bond may give anion to the alkyl carbonate, which might leading subsequent cyclization via an intramolecular nucloephilic attack, and accordingly, realized the formation of cyclic carbonate and regeneration of the catalyst. Accordingly, the catalyst showed cooperative effect of both amino acid anion and cation on the catalytic activity. 4 Conclusions The single component bifunctional catalysts were developed to be effective catalysts for the synthesis of cyclic carbonates from carbon dioxide and epoxides under green and economic conditions. And the activities of the substrates were not sensitive to the properties of the substituent in the substrates. The catalysts showed high thermal stability and selectivity, and moreover, the catalysts could be applicable to other terminal epoxides. These characteristics make them ideal catalysts in terms of potential industrial application in the synthesis of cyclic carbonates from epoxides and CO2. Acknowledgements Shuang Yue thanks the National Science Foundation of China (21101084) and Liaoning Provincial Department of Education Innovation Team Projects (LT201012) for financial support.' Appendix A Supplementary data Supplementary data associated with this article can be found, in the online version, at http://dx.doi.org/10.1016/j.mcat.2017.01.027. Appendix A Supplementary data The following is Supplementary data to this article: References [1] A. Behr Carbon dioxide as an alternative C1 synthetic unit: activation by transition-metal complexes Angew. Chem. Int. Ed. 27 1988 661 678 [2] M. Mikkelsen M. Jorgensen F.C. Krebs The teraton challenge. A review of fixation and transformation of carbon dioxide Energy Environ. Sci. 3 2010 43 81 [3] Y. Kuwahara H. Yamashita A new catalytic opportunity for waste materials: Application of waste slag based catalyst in CO2 fixation reaction J. CO2 Util. 1 2013 50 59 [4] I. Omae Recent developments in carbon dioxide utilization for the production of organic chemicals Coord. Chem. Rev. 256 2012 1384 1405 [5] N.A.M. Razali K.T. Lee S. Bhatia A.R. Mohamed Heterogeneous catalysts for production of chemicals using carbon dioxide as raw material: a review Renew. Sustain. Energy Rev. 16 2012 4951 4964 [6] M.E. Boot-Handford J.C. Abanades E.J. Anthony M.J. Blunt S. Brandani N. Mac Dowell J.R. Fernandez M.C. Ferrari R. Gross J.P. Hallet R.S. Haszeldine P. Heptonstall A. Lyngfelt Z. Makuch E. Mangano R.T.J. Porter M. Pourkashanian G.T. Rochelle N. Shah J.G. Yao P.S. Fennel Carbon capture and storage update Energy Environ. Sci. 7 2014 130 189 [7] R. Ma L.N. He Y.B. Zhou An efficient and recyclable tetraoxo-coordinated zinc catalyst for the cycloaddition of epoxides with carbon dioxide at atmospheric pressure Green Chem. 18 2016 226 231 [8] T. Sakakura K. Kohno The synthesis of organic carbonates from carbon dioxide Chem. Commun. 2009 1312 1330 [9] A.A.G. Shaikh S. Sivaram Organic carbonates Chem. Rev. 96 1996 951 976 [10] B. Schäffner F. Schäffner S.P. Verevkin A. Börner Organic carbonates as solvents in synthesis and catalysis Chem. Rev. 110 2010 4554 4581 [11] J.H. Clements Reactive applications of cyclic alkylene carbonates Ind. Eng. Chem. Res. 42 2003 663 674 [12] N. Kihara N. Hara T. Endo Catalytic activity of various salts in the reaction of 2,3-epoxypropyl phenyl ether and carbon dioxide under atmospheric pressure J. Org. Chem. 58 1993 6198 6202 [13] J.W. Huang M. Shi Chemical fixation of carbon dioxide by NaI/PPh3/PhOH J. Org. Chem. 68 2003 6705 6709 [14] K. Yamaguchi K. Ebitani T. Yoshida H. Yoshida K. Kaneda Mg-Al mixed oxides as highly active acid-base catalysts for cycloaddition of carbon dioxide to epoxides J. Am. Chem. Soc. 121 1999 4526 4527 [15] Z.Z. Xie M.Q. Zhu A. Nambo J.B. Jasinski M.A. Carreon Microwave-assisted synthesized SAPO-56 as a catalyst in the conversion of CO2 to cyclic carbonates Dalton Trans. 42 2013 6732 6735 [16] F. Castro-Gomez G. Salassa A.W. Kleij C. Bo A DFT study on the mechanism of the cycloaddition reaction of CO2 to epoxides catalyzed by Zn (Salphen) complexes Chem. Eur. J. 19 2013 6289 6298 [17] P. Yan H.W. Jing Catalytic asymmetric cycloaddition of carbon dioxide and propylene oxide using novel chiral polymers of BINOL-salen-cobalt(III) salts Adv. Synth. Catal. 351 2009 1325 1332 [18] F.W. Li C.G. Xia L.W. Xu W. Sun G.X. Chen A novel and effective Ni complex catalyst system for the coupling reactions of carbon dioxide and epoxides Chem. Commun. 2003 2003 2042 2043 [19] L.N. Saunders N. Ikpo C.F. Petten U.K. Das L.N. Daw C.M. Kozak F.M. Kerton Coupling of carbon dioxide with neat propylene oxide catalyzed by aminebisphenolato cobalt (II)/(III) complexes and ionic co-catalysts Catal. Commun. 18 2012 165 167 [20] D.S. Bai S.H. Duan L. Hai H.W. Jing Carbon dioxide fixation by cycloaddition with epoxides, catalyzed by biomimetic metalloporphyrins ChemCatChem 4 2012 1752 1758 [21] Z.L. Wu H.B. Xie X. Yu E.H. Liu Lignin-based green catalyst for the chemical fixation of carbon dioxide with epoxides to form cyclic carbonates under solvent-free conditions ChemCatChem 5 2013 1328 1333 [22] S. Kumar S.L. Jain B. Sain Metal acetylacetonates as highly efficient and cost effective catalysts for the synthesis of cyclic carbonates from CO2 and epoxides Catal. Lett. 142 2012 615 618 [23] G. Rokicki W. Kuran Cyclic carbonates obtained by reactions of alkali metal carbonates with epihalohydrins Bull. Chem. Soc. Jpn. 57 1984 1662 1666 [24] Y. Xie T.T. Wang X.H. Liu K. Zou W.Q. Deng Capture and conversion of CO2 at ambient conditions by a conjugated microporous polymer Nat. Commun. 4 2013 1960 1966 [25] O.V. Zalomaeva A.M. Chibiryaev K.A. Kovalenko O.A. Kholdeeva B.S. Balzhinimaev V.P. Fedin Cyclic carbonates synthesis from epoxides and CO2 over metal-organic framework Cr-MIL-101 J. Catal. 298 2013 179 185 [26] T. Lescouet C. Chizallet D. Farrusseng The origin of the activity of amine-functionalized metal-organic frameworks in the catalytic synthesis of cyclic carbonates from epoxide and CO2 ChemCatChem 4 2012 1725 1728 [27] J. Martínez J.A. Castro-Osma A. Earlam C. Alonso-Moreno A. Otero A. Lara-Sάnchez M. North A. RodríguezDiéguez Synthesis of cyclic carbonates catalysed by aluminium heteroscorpionate complexes Chem. Eur. J. 21 2015 9850 9862 [28] J.A. Castro-Osma M. North W.K. Offermans W. Leitner T.E. Müller Unprecedented carbonato intermediates in cyclic carbonate synthesis catalysed by bimetallic aluminium (salen) complexes ChemSusChem 9 2016 791 794 [29] V. Caló A. Nacci A. Monopoli A. Fanizzi Cyclic carbonate formation from carbon dioxide and oxiranes in tetrabutylammonium halides as solvents and catalysts Org. Lett. 4 2002 2561 2563 [30] Y.Y. Zhang L. Chen S.F. Yin S.L. Luo C.T. Au Low-cost polymer-supported quaternary ammonium salts as high-efficiency catalysts for cycloaddition of CO2 to epoxides Catal. Lett. 142 2012 1376 1381 [31] J. Tharun D.W. Kim R. Roshan Y. Hwang D.W. Park Microwave assisted preparation of quaternized chitosan catalyst for the cycloaddition of CO2 and epoxides Catal. Commun. 31 2013 62 65 [32] X. Zhou Y. Zhang X.G. Yang L.Z. Zhao G.Y. Wang Functionalized IRMOF-3 as efficient heterogeneous catalyst for the synthesis of cyclic carbonates J. Mol. Catal. A Chem. 362 2012 12 16 [33] J.Q. Wang K. Dong W.G. Cheng J. Sun S.J. Zhang Insights into quaternary ammonium salts-catalyzed fixation carbon dioxide with epoxides Catal. Sci. Technol. 2 2012 1480 1484 [34] F. Shi Q.H. Zhang Y. Ma Y. He Y. Deng From CO oxidation to CO2 activation: an unexpected catalytic activity of polymer-supported nanogold J. Am. Chem. Soc. 127 2005 4182 4183 [35] Y.B. Xiong H. Wang R.M. Wang Y.F. Yan B. Zheng Y.P. Wang A facile one-step synthesis to cross-linked polymeric nanoparticles as highly active and selective catalysts for cycloaddition of CO2 to epoxides Chem. Commun. 46 2010 3399 3401 [36] J.J. Peng Y. Deng Cycloaddition of carbon dioxide to propylene oxide catalyzed by ionic liquids New J. Chem. 25 2001 639 641 [37] L.F. Xiao D.W. Lv W. Wu BrΦnsted acidic ionic liquids mediated metallic salts catalytic system for the chemical fixation of carbon dioxide to form cyclic carbonates Catal. Lett. 141 2011 1838 1844 [38] S. Ghazali-Esfahani H.B. Song E. Paunescu F.D. Bobbink H.Z. Liu Z.F. Fei G. Laurenczy M. Bagherzadeh N. Yan P.J. Dyson Cycloaddition of CO2 to epoxides catalyzed by imidazolium-based polymeric ionic liquids Green Chem. 15 2013 1584 1589 [39] H.J. Choi M. Selvaraj D. Park Catalytic performance of immobilized ionic liquid onto PEG for the cycloaddition of carbon dioxide to allyl glycidyl ether Chem. Eng. Sci. 100 2013 242 248 [40] W.G. Cheng X. Chen J. Sun J.Q. Wang S. Zhang SBA-15 supported triazolium-based ionic liquids as highly efficient and recyclable catalysts for fixation of CO2 with epoxides Catal. Today 200 2013 117 124 [41] F.W. Li L.F. Xiao C.G. Xia B. Hu Chemical fixation of CO2 with highly efficient ZnCl2/[BMIm]Br catalyst system Tetrahedron Lett. 45 2004 8307 8310 [42] L.F. Xiao F.W. Li J.J. Peng C.G. Xia Immobilized ionic liquid/zinc chloride: Heterogeneous catalyst for synthesis of cyclic carbonates from carbon dioxide and epoxides J. Mol. Catal. A Chem. 253 2006 265 269 [43] W.L. Dai B. Jin S.L. Luo X.B. Luo X.M. Tu C.T. Au Functionalized phosphonium-based ionic liquids as efficient catalysts for the synthesis of cyclic carbonate from expoxides and carbon dioxide Appl. Catal. A Gen. 470 2014 183 188 [44] P. Agrigento S.M. Al-Amsyar B. Sorée M. Taherimehr M. Gruttadauria C. Aprile P.P. Pescarmona Synthesis and high-throughput testing of multilayered supported ionic liquid catalysts for the conversion of CO2 and epoxides into cyclic carbonates Catal. Sci. Technol. 4 2014 1598 1607 [45] L.F. Xiao D. Su C.T. Yue W. Wu Protic ionic liquids: a highly efficient catalyst for synthesis of cyclic carbonate from carbon dioxide and epoxides J. CO2 Util. 6 2014 1 6 [46] H.Y. Zhao B. Lu X.P. Li W.X. Zhang J.X. Zhao Q.H. Cai Hydroxyl-functionalized ionic liquid for activation and conversion of CO2 and methanol into dimethyl carbonate J. CO2 Util. 12 2015 49 53 [47] J.M. Sun S.I. Fujita M. Arai Development in the green synthesis of cyclic carbonate from carbon dioxide using ionic liquids J. Organomet. Chem. 690 2005 3490 3497 [48] Q. He J.W. O’Brien K.A. Kitselman L.E. Tompkins G.C.T. Curtisa F.M. Kerton Synthesis of cyclic carbonates from CO2 and epoxides using ionic liquids and related catalysts including choline chloride-metal halide mixtures Catal. Sci Technol. 4 2014 1513 1528 [49] T. Sakakura K. Kohno The synthesis of organic carbonates from carbon dioxide Chem. Commun. 131 2009 1321 1330 [50] S. Wu B.S. Wang Y.Y. Zhang E.H.M. Elageed H.H. Wu G.H. Gao Phenolic hydroxyl-functionalized imidazolium ionic liquids: highly efficient catalysts for the fixation of CO2 to cyclic carbonates J. Mol. Catal. A: Chem. 418–419 2016 1 8 [51] Y.J. Kim R.S. Varma Tetrahaloindate (III)-based ionic liquids in the coupling reaction of carbon dioxide and epoxides to generate cyclic carbonates: H-bonding and mechanistic studies J. Org. Chem. 70 2005 7882 7891 [52] C.W. Cho T.P.T. Pham Y.C. Jeon Y.S. Yun Influence of anions on the toxic effects of ionic liquids to a phytoplanktonSelenastrum capricornutum Green Chem. 10 2008 67 72 [53] K.S. Egorova V.P. Ananikov Toxicity of ionic liquids: eco(cyto)activity as complicated but unavoidable parameter for task-specific optimization ChemSusChem 7 2014 336 360 [54] S.J. Zhang J. Sun X.C. Zhang J.Y. Xin Q.Q. Miao J.J. Wang Ionic liquid-based green processes for energy production Chem. Soc. Rev. 43 2014 7838 7869 [55] Y. Wei Y. Jin Z.J. Wu Y. Yang Q.G. Zhang Z.H. Kang Synthesis and physicochemical properties of amino acid ionic liquid 1-butyl-3-methylimidazolium aspartate and binary mixture with methanol J. Chem. Eng. Data. 58 2013 349 356 [56] Z.C. Yu H.Y. Gao H.J. Wang L.W. Chen Thermodynamic properties of binary mixtures of the amino acid ionic liquids [Bmim][Glu] or [Bmim][Gly] with methanol at T=298.15 to 313.15K J. Solut. Chem. 41 2012 173 186 [57] Y. Baran H. Ozay H. Esener M. Turkyilmaz Spectroscopic and structural properties of N-(acetamide) morpholinium bromide Spectrochim. Acta Part A 81 2011 99 103 [58] K. Fukumoto M. Yoshizawa H. Ohno Room temperature ionic liquids from 20 natural amino acids J. Am. Chem. Soc. 127 2005 2398 2399 [59] U. Domańska M. Zawadzki M. Zwolińska Thermophysical properties and phase equilibria study of the binary systems {N-hexylquinolinium bis (trifluoromethylsulfonyl)imide+aromatic hydrocarbons, or an alcohol} J. Chem. Thermodyn. 43 2011 775 781 [60] H.Z. Zhang X.Q. Kong C.S. Cao G.S. Pang Y.H. Shi An efficient ternary catalyst ZnBr2/K2CO3/[Bmim]Br for chemical fixation of CO2 into cyclic carbonates at ambient conditions J. CO2 Util. 14 2016 76 82 [61] S. Choi K.S. Kim H. Lee J.S. Oh B.B. Lee Synthesis and ionic conductivities of lithium-doped morpholinium salts J. Chem. Eng. 22 2005 281 284 [62] L. Fu W. Lin P. Xu Y.K. Xi M.M. Wang D.Q. Shi Novel and efficient synthesis of substituted quinoline-1-oxides and the complex compounds SnL2Cl2 (L=2-aminoquinoline-1-oxides) with the aid of stannous chloride Tetrahedron 68 2012 7782 7786 [63] S. Yue D.W. Fang J. Li S.L. Zang M.D. Zhou B. Zhang I.I.E. Markovits M. Cokoja F.E. Kühn Synthesis and characterization of imidazolium perrhenate ionic liquids Z. Naturforsch 68 2013 598 604 [64] M.S. Liu L. Liang X. Li X.X. Gao J.M. Sun Novel urea derivative-based ionic liquids with dual-functions: CO2 capture and conversion under metal-and solvent-free conditions Green Chem. 18 2016 2851 2863 [65] K.R. Roshan T. Jose D. Kim K.A. Cherian D.W. Park Microwave-assisted one pot-synthesis of amino acid ionic liquids in water: simple catalysts for styrene carbonate synthesis under atmospheric pressure of CO2 Catal. Sci. Technol. 4 2014 963 970 [66] F. Wu X.Y. Dou L.N. He C.X. Miao Natural amino acid-based ionic liquids as efficient catalysts for the synthesis of cyclic carbonates from CO2 and epoxides under solvent-free conditions Lett. Org. Chem. 7 2010 73 78 [67] C.T. Yue D. Su X. Zhang W. Wu L.F. Xiao Amino-functional imidazolium ionic liquids for CO2 activation and conversion to form cyclic carbonate Catal. Lett. 144 2014 1313 1321 [68] L.F. Xiao D.W. Lv D. Su W. Wu H.F. Li Influence of acidic strength on the catalytic activity of BrØnsted acidic ionic liquids on synthesizing cyclic carbonate from carbon dioxide and epoxide J. Clean. Prod. 67 2014 285 290 [69] Q. Gong H.D. Luo J. Cao Y.H. Shang H.B. Zhang W.J. Wang X.H. Zhou Synthesis of cyclic carbonate from carbon dioxide and epoxide using amino acid ionic liquid under 1atm pressure Aust. J. Chem. 65 2012 381 386 [70] M.S. Liu K.Q. Gao L. Liang F.X. Wang L. Shi L. Sheng J.M. Sun Insights into hydrogen bond donor promoted fixation of carbon dioxide with epoxides catalyzed by ionic liquids Phys. Chem. Chem. Phys. 17 2015 5959 5965 [71] W. Clegg R.W. Harrington M. North R. Pasquale Cyclic carbonate synthesis catalysed by bimetallic aluminium-salen complexes Chem. Eur. J. 16 2010 6828 6843 [72] B. Chatelet L. Joucla J.P. Dutasta A. Martinez K.C. Szeto V. Dufaud Azaphosphatranes as structurally tunable organocatalysts for carbonate synthesis from CO2 and epoxides J. Am. Chem. Soc. 135 2013 5348 5351 [73] B. Zou L. Hao L.Y. Fan Z.M. Gao S.L. Chen H. Li C.W. Hu Highly efficient conversion of CO2 at atmospheric pressure to cyclic carbonates with in situ-generated homogeneous catalysts from a copper-containing coordination polymer J. Catal. 329 2015 119 129 [74] B.H. Lv G.H. Jing Y.H. Qian Z.M. Zhou An efficient absorbent of amine-based amino acid-functionalized ionic liquids for CO2 capture: High capacity and regeneration ability Chem. Eng. J. 289 2016 212 218 [75] A.R. Hajipour Y. Heidaria G. Kozehgary Nicotine-derived ammonium salts as highly efficient catalysts for chemical fixation of carbon dioxide into cyclic carbonates under solvent-free conditions RSC Adv. 5 2015 61179 61183 [76] M.S. Liu X. Li X.L. Lin L. Liang X.X. Gao J.M. Sun Facile synthesis of [urea-Zn]I2 eutectic-based ionic liquid for efficient conversion of carbon dioxide to cyclic carbonates J. Mol. Catal. A: Chem. 412 2016 20 26 [77] J. Sun S.J. Zhang W.G. Cheng J.Y. Ren Hydroxyl-functionalized ionic liquid: a novel efficient catalyst for chemical fixation of CO2 to cyclic carbonate Tetrahedron Lett. 49 2008 3588 3591 [78] J.Q. Wang W.G. Cheng J. Sun T.Y. Shi X.P. Zhang S.J. Zhang Efficient fixation of CO2 into organic carbonates catalyzed by 2-hydroxymethyl-functionalized ionic liquids RSC Adv. 4 2014 2360 2367 [79] M.S. Liu B. Liu L. Shi F.X. Wang L. Liang J.M. Sun Melamine-ZnI2 as heterogeneous catalysts for efficient chemical fixation of carbon dioxide to cyclic carbonates RSC Adv. 5 2015 960 966 [80] M.S. Liu K.Q. Gao L. Liang J.M. Sun L. Sheng M. Arai Experimental and theoretical insights into binary Zn-SBA-15/KI catalysts for the selective coupling of CO2 and epoxides into cyclic carbonates under mild conditions Catal. Sci. Technol. 6 2016 6406 6416",
      "scopus-id": "85026531784",
      "coredata": {
        "eid": "1-s2.0-S2468823117300226",
        "dc:description": "The amino acid ionic liquids of 1-butyl-3-methylimidazolium aspartic acid [bmim][ASP], 1-butyl-3-methylimidazolium glutamic acid [bmim][Glu], N-octyl-N-methylmorpholinium glutamic acid [mor1,8][Glu] and N-hexylisoquinolinium aspartic acid [HiQuin][ASP] have been synthesized and characterized by 1H NMR, 13C NMR and IR spectroscopy. The catalytic performance of the amino acid ionic liquids for the coupling of various epoxides and CO2 to produce cyclic carbonates was studied. The influence of anion type, catalyst dose, reaction temperature, reaction time and CO2 pressure on the yields of cyclic carbonates was examined. The synthesized ionic liquids were found to be single component bifunctional catalysts in good yields and selectivity, no additional organic solvent required and halogen free. Furthermore, this system provides a reasonably environmentally benign chemical process in terms of potential industrial application.",
        "openArchiveArticle": "false",
        "prism:coverDate": "2017-05-31",
        "openaccessUserLicense": null,
        "prism:aggregationType": "Journal",
        "prism:url": "https://api.elsevier.com/content/article/pii/S2468823117300226",
        "dc:creator": [
          {
            "@_fa": "true",
            "$": "Yue, Shuang"
          },
          {
            "@_fa": "true",
            "$": "Hao, Xiu-Jia"
          },
          {
            "@_fa": "true",
            "$": "Wang, Ping-Ping"
          },
          {
            "@_fa": "true",
            "$": "Li, Jun"
          }
        ],
        "link": [
          {
            "@_fa": "true",
            "@rel": "self",
            "@href": "https://api.elsevier.com/content/article/pii/S2468823117300226"
          },
          {
            "@_fa": "true",
            "@rel": "scidir",
            "@href": "https://www.sciencedirect.com/science/article/pii/S2468823117300226"
          }
        ],
        "dc:format": "application/json",
        "openaccessType": null,
        "pii": "S2468-8231(17)30022-6",
        "prism:volume": "433",
        "prism:publisher": "Elsevier B.V.",
        "dc:title": "Amino acid-based ionic liquids for CO2 conversion to form cyclic carbonate under solvent-free conditions",
        "prism:copyright": "© 2017 Elsevier B.V. All rights reserved.",
        "openaccess": "0",
        "prism:issn": "24688231",
        "dcterms:subject": [
          {
            "@_fa": "true",
            "$": "Amino acid ionic liquids"
          },
          {
            "@_fa": "true",
            "$": "Cyclic carbonates"
          },
          {
            "@_fa": "true",
            "$": "Carbon dioxide"
          },
          {
            "@_fa": "true",
            "$": "Epoxides"
          },
          {
            "@_fa": "true",
            "$": "Catalysis"
          }
        ],
        "openaccessArticle": "false",
        "prism:publicationName": "Molecular Catalysis",
        "openaccessSponsorType": null,
        "prism:pageRange": "420-429",
        "prism:endingPage": "429",
        "pubType": "fla",
        "prism:coverDisplayDate": "May 2017",
        "prism:doi": "10.1016/j.mcat.2017.01.027",
        "prism:startingPage": "420",
        "dc:identifier": "doi:10.1016/j.mcat.2017.01.027",
        "openaccessSponsorName": null
      },
      "objects": {
        "object": [
          {
            "@category": "thumbnail",
            "@height": "88",
            "@width": "219",
            "@_fa": "true",
            "$": "https://api.elsevier.com/content/object/eid/1-s2.0-S2468823117300226-fx1.sml?httpAccept=%2A%2F%2A",
            "@multimediatype": "GIF image file",
            "@type": "IMAGE-THUMBNAIL",
            "@size": "4005",
            "@ref": "fx1",
            "@mimetype": "image/gif"
          },
          {
            "@category": "thumbnail",
            "@height": "88",
            "@width": "219",
            "@_fa": "true",
            "$": "https://api.elsevier.com/content/object/eid/1-s2.0-S2468823117300226-fx10.sml?httpAccept=%2A%2F%2A",
            "@multimediatype": "GIF image file",
            "@type": "IMAGE-THUMBNAIL",
            "@size": "2483",
            "@ref": "fx10",
            "@mimetype": "image/gif"
          },
          {
            "@category": "thumbnail",
            "@height": "88",
            "@width": "219",
            "@_fa": "true",
            "$": "https://api.elsevier.com/content/object/eid/1-s2.0-S2468823117300226-fx11.sml?httpAccept=%2A%2F%2A",
            "@multimediatype": "GIF image file",
            "@type": "IMAGE-THUMBNAIL",
            "@size": "3011",
            "@ref": "fx11",
            "@mimetype": "image/gif"
          },
          {
            "@category": "thumbnail",
            "@height": "88",
            "@width": "219",
            "@_fa": "true",
            "$": "https://api.elsevier.com/content/object/eid/1-s2.0-S2468823117300226-fx12.sml?httpAccept=%2A%2F%2A",
            "@multimediatype": "GIF image file",
            "@type": "IMAGE-THUMBNAIL",
            "@size": "2613",
            "@ref": "fx12",
            "@mimetype": "image/gif"
          },
          {
            "@category": "thumbnail",
            "@height": "88",
            "@width": "219",
            "@_fa": "true",
            "$": "https://api.elsevier.com/content/object/eid/1-s2.0-S2468823117300226-fx13.sml?httpAccept=%2A%2F%2A",
            "@multimediatype": "GIF image file",
            "@type": "IMAGE-THUMBNAIL",
            "@size": "2532",
            "@ref": "fx13",
            "@mimetype": "image/gif"
          },
          {
            "@category": "thumbnail",
            "@height": "88",
            "@width": "219",
            "@_fa": "true",
            "$": "https://api.elsevier.com/content/object/eid/1-s2.0-S2468823117300226-fx14.sml?httpAccept=%2A%2F%2A",
            "@multimediatype": "GIF image file",
            "@type": "IMAGE-THUMBNAIL",
            "@size": "3620",
            "@ref": "fx14",
            "@mimetype": "image/gif"
          },
          {
            "@category": "thumbnail",
            "@height": "88",
            "@width": "219",
            "@_fa": "true",
            "$": "https://api.elsevier.com/content/object/eid/1-s2.0-S2468823117300226-fx15.sml?httpAccept=%2A%2F%2A",
            "@multimediatype": "GIF image file",
            "@type": "IMAGE-THUMBNAIL",
            "@size": "2525",
            "@ref": "fx15",
            "@mimetype": "image/gif"
          },
          {
            "@category": "thumbnail",
            "@height": "88",
            "@width": "219",
            "@_fa": "true",
            "$": "https://api.elsevier.com/content/object/eid/1-s2.0-S2468823117300226-fx16.sml?httpAccept=%2A%2F%2A",
            "@multimediatype": "GIF image file",
            "@type": "IMAGE-THUMBNAIL",
            "@size": "2546",
            "@ref": "fx16",
            "@mimetype": "image/gif"
          },
          {
            "@category": "thumbnail",
            "@height": "88",
            "@width": "219",
            "@_fa": "true",
            "$": "https://api.elsevier.com/content/object/eid/1-s2.0-S2468823117300226-fx17.sml?httpAccept=%2A%2F%2A",
            "@multimediatype": "GIF image file",
            "@type": "IMAGE-THUMBNAIL",
            "@size": "3529",
            "@ref": "fx17",
            "@mimetype": "image/gif"
          },
          {
            "@category": "thumbnail",
            "@height": "88",
            "@width": "219",
            "@_fa": "true",
            "$": "https://api.elsevier.com/content/object/eid/1-s2.0-S2468823117300226-fx18.sml?httpAccept=%2A%2F%2A",
            "@multimediatype": "GIF image file",
            "@type": "IMAGE-THUMBNAIL",
            "@size": "2554",
            "@ref": "fx18",
            "@mimetype": "image/gif"
          },
          {
            "@category": "thumbnail",
            "@height": "88",
            "@width": "219",
            "@_fa": "true",
            "$": "https://api.elsevier.com/content/object/eid/1-s2.0-S2468823117300226-fx19.sml?httpAccept=%2A%2F%2A",
            "@multimediatype": "GIF image file",
            "@type": "IMAGE-THUMBNAIL",
            "@size": "3635",
            "@ref": "fx19",
            "@mimetype": "image/gif"
          },
          {
            "@category": "thumbnail",
            "@height": "88",
            "@width": "219",
            "@_fa": "true",
            "$": "https://api.elsevier.com/content/object/eid/1-s2.0-S2468823117300226-fx2.sml?httpAccept=%2A%2F%2A",
            "@multimediatype": "GIF image file",
            "@type": "IMAGE-THUMBNAIL",
            "@size": "1621",
            "@ref": "fx2",
            "@mimetype": "image/gif"
          },
          {
            "@category": "thumbnail",
            "@height": "88",
            "@width": "219",
            "@_fa": "true",
            "$": "https://api.elsevier.com/content/object/eid/1-s2.0-S2468823117300226-fx20.sml?httpAccept=%2A%2F%2A",
            "@multimediatype": "GIF image file",
            "@type": "IMAGE-THUMBNAIL",
            "@size": "2542",
            "@ref": "fx20",
            "@mimetype": "image/gif"
          },
          {
            "@category": "thumbnail",
            "@height": "88",
            "@width": "219",
            "@_fa": "true",
            "$": "https://api.elsevier.com/content/object/eid/1-s2.0-S2468823117300226-fx21.sml?httpAccept=%2A%2F%2A",
            "@multimediatype": "GIF image file",
            "@type": "IMAGE-THUMBNAIL",
            "@size": "3590",
            "@ref": "fx21",
            "@mimetype": "image/gif"
          },
          {
            "@category": "thumbnail",
            "@height": "88",
            "@width": "219",
            "@_fa": "true",
            "$": "https://api.elsevier.com/content/object/eid/1-s2.0-S2468823117300226-fx22.sml?httpAccept=%2A%2F%2A",
            "@multimediatype": "GIF image file",
            "@type": "IMAGE-THUMBNAIL",
            "@size": "2538",
            "@ref": "fx22",
            "@mimetype": "image/gif"
          },
          {
            "@category": "thumbnail",
            "@height": "88",
            "@width": "219",
            "@_fa": "true",
            "$": "https://api.elsevier.com/content/object/eid/1-s2.0-S2468823117300226-fx23.sml?httpAccept=%2A%2F%2A",
            "@multimediatype": "GIF image file",
            "@type": "IMAGE-THUMBNAIL",
            "@size": "3599",
            "@ref": "fx23",
            "@mimetype": "image/gif"
          },
          {
            "@category": "thumbnail",
            "@height": "88",
            "@width": "219",
            "@_fa": "true",
            "$": "https://api.elsevier.com/content/object/eid/1-s2.0-S2468823117300226-fx24.sml?httpAccept=%2A%2F%2A",
            "@multimediatype": "GIF image file",
            "@type": "IMAGE-THUMBNAIL",
            "@size": "2546",
            "@ref": "fx24",
            "@mimetype": "image/gif"
          },
          {
            "@category": "thumbnail",
            "@height": "88",
            "@width": "219",
            "@_fa": "true",
            "$": "https://api.elsevier.com/content/object/eid/1-s2.0-S2468823117300226-fx25.sml?httpAccept=%2A%2F%2A",
            "@multimediatype": "GIF image file",
            "@type": "IMAGE-THUMBNAIL",
            "@size": "2745",
            "@ref": "fx25",
            "@mimetype": "image/gif"
          },
          {
            "@category": "thumbnail",
            "@height": "88",
            "@width": "219",
            "@_fa": "true",
            "$": "https://api.elsevier.com/content/object/eid/1-s2.0-S2468823117300226-fx26.sml?httpAccept=%2A%2F%2A",
            "@multimediatype": "GIF image file",
            "@type": "IMAGE-THUMBNAIL",
            "@size": "2375",
            "@ref": "fx26",
            "@mimetype": "image/gif"
          },
          {
            "@category": "thumbnail",
            "@height": "88",
            "@width": "219",
            "@_fa": "true",
            "$": "https://api.elsevier.com/content/object/eid/1-s2.0-S2468823117300226-fx27.sml?httpAccept=%2A%2F%2A",
            "@multimediatype": "GIF image file",
            "@type": "IMAGE-THUMBNAIL",
            "@size": "3017",
            "@ref": "fx27",
            "@mimetype": "image/gif"
          },
          {
            "@category": "thumbnail",
            "@height": "88",
            "@width": "219",
            "@_fa": "true",
            "$": "https://api.elsevier.com/content/object/eid/1-s2.0-S2468823117300226-fx28.sml?httpAccept=%2A%2F%2A",
            "@multimediatype": "GIF image file",
            "@type": "IMAGE-THUMBNAIL",
            "@size": "2474",
            "@ref": "fx28",
            "@mimetype": "image/gif"
          },
          {
            "@category": "thumbnail",
            "@height": "88",
            "@width": "219",
            "@_fa": "true",
            "$": "https://api.elsevier.com/content/object/eid/1-s2.0-S2468823117300226-fx29.sml?httpAccept=%2A%2F%2A",
            "@multimediatype": "GIF image file",
            "@type": "IMAGE-THUMBNAIL",
            "@size": "2760",
            "@ref": "fx29",
            "@mimetype": "image/gif"
          },
          {
            "@category": "thumbnail",
            "@height": "88",
            "@width": "219",
            "@_fa": "true",
            "$": "https://api.elsevier.com/content/object/eid/1-s2.0-S2468823117300226-fx3.sml?httpAccept=%2A%2F%2A",
            "@multimediatype": "GIF image file",
            "@type": "IMAGE-THUMBNAIL",
            "@size": "3273",
            "@ref": "fx3",
            "@mimetype": "image/gif"
          },
          {
            "@category": "thumbnail",
            "@height": "88",
            "@width": "219",
            "@_fa": "true",
            "$": "https://api.elsevier.com/content/object/eid/1-s2.0-S2468823117300226-fx30.sml?httpAccept=%2A%2F%2A",
            "@multimediatype": "GIF image file",
            "@type": "IMAGE-THUMBNAIL",
            "@size": "2819",
            "@ref": "fx30",
            "@mimetype": "image/gif"
          },
          {
            "@category": "thumbnail",
            "@height": "88",
            "@width": "219",
            "@_fa": "true",
            "$": "https://api.elsevier.com/content/object/eid/1-s2.0-S2468823117300226-fx31.sml?httpAccept=%2A%2F%2A",
            "@multimediatype": "GIF image file",
            "@type": "IMAGE-THUMBNAIL",
            "@size": "2046",
            "@ref": "fx31",
            "@mimetype": "image/gif"
          },
          {
            "@category": "thumbnail",
            "@height": "88",
            "@width": "219",
            "@_fa": "true",
            "$": "https://api.elsevier.com/content/object/eid/1-s2.0-S2468823117300226-fx32.sml?httpAccept=%2A%2F%2A",
            "@multimediatype": "GIF image file",
            "@type": "IMAGE-THUMBNAIL",
            "@size": "2308",
            "@ref": "fx32",
            "@mimetype": "image/gif"
          },
          {
            "@category": "thumbnail",
            "@height": "88",
            "@width": "219",
            "@_fa": "true",
            "$": "https://api.elsevier.com/content/object/eid/1-s2.0-S2468823117300226-fx33.sml?httpAccept=%2A%2F%2A",
            "@multimediatype": "GIF image file",
            "@type": "IMAGE-THUMBNAIL",
            "@size": "2090",
            "@ref": "fx33",
            "@mimetype": "image/gif"
          },
          {
            "@category": "thumbnail",
            "@height": "88",
            "@width": "219",
            "@_fa": "true",
            "$": "https://api.elsevier.com/content/object/eid/1-s2.0-S2468823117300226-fx34.sml?httpAccept=%2A%2F%2A",
            "@multimediatype": "GIF image file",
            "@type": "IMAGE-THUMBNAIL",
            "@size": "2182",
            "@ref": "fx34",
            "@mimetype": "image/gif"
          },
          {
            "@category": "thumbnail",
            "@height": "88",
            "@width": "219",
            "@_fa": "true",
            "$": "https://api.elsevier.com/content/object/eid/1-s2.0-S2468823117300226-fx35.sml?httpAccept=%2A%2F%2A",
            "@multimediatype": "GIF image file",
            "@type": "IMAGE-THUMBNAIL",
            "@size": "2193",
            "@ref": "fx35",
            "@mimetype": "image/gif"
          },
          {
            "@category": "thumbnail",
            "@height": "88",
            "@width": "219",
            "@_fa": "true",
            "$": "https://api.elsevier.com/content/object/eid/1-s2.0-S2468823117300226-fx4.sml?httpAccept=%2A%2F%2A",
            "@multimediatype": "GIF image file",
            "@type": "IMAGE-THUMBNAIL",
            "@size": "2750",
            "@ref": "fx4",
            "@mimetype": "image/gif"
          },
          {
            "@category": "thumbnail",
            "@height": "88",
            "@width": "219",
            "@_fa": "true",
            "$": "https://api.elsevier.com/content/object/eid/1-s2.0-S2468823117300226-fx5.sml?httpAccept=%2A%2F%2A",
            "@multimediatype": "GIF image file",
            "@type": "IMAGE-THUMBNAIL",
            "@size": "2463",
            "@ref": "fx5",
            "@mimetype": "image/gif"
          },
          {
            "@category": "thumbnail",
            "@height": "88",
            "@width": "219",
            "@_fa": "true",
            "$": "https://api.elsevier.com/content/object/eid/1-s2.0-S2468823117300226-fx6.sml?httpAccept=%2A%2F%2A",
            "@multimediatype": "GIF image file",
            "@type": "IMAGE-THUMBNAIL",
            "@size": "2421",
            "@ref": "fx6",
            "@mimetype": "image/gif"
          },
          {
            "@category": "thumbnail",
            "@height": "88",
            "@width": "219",
            "@_fa": "true",
            "$": "https://api.elsevier.com/content/object/eid/1-s2.0-S2468823117300226-fx7.sml?httpAccept=%2A%2F%2A",
            "@multimediatype": "GIF image file",
            "@type": "IMAGE-THUMBNAIL",
            "@size": "2573",
            "@ref": "fx7",
            "@mimetype": "image/gif"
          },
          {
            "@category": "thumbnail",
            "@height": "88",
            "@width": "219",
            "@_fa": "true",
            "$": "https://api.elsevier.com/content/object/eid/1-s2.0-S2468823117300226-fx8.sml?httpAccept=%2A%2F%2A",
            "@multimediatype": "GIF image file",
            "@type": "IMAGE-THUMBNAIL",
            "@size": "2976",
            "@ref": "fx8",
            "@mimetype": "image/gif"
          },
          {
            "@category": "thumbnail",
            "@height": "88",
            "@width": "219",
            "@_fa": "true",
            "$": "https://api.elsevier.com/content/object/eid/1-s2.0-S2468823117300226-fx9.sml?httpAccept=%2A%2F%2A",
            "@multimediatype": "GIF image file",
            "@type": "IMAGE-THUMBNAIL",
            "@size": "2647",
            "@ref": "fx9",
            "@mimetype": "image/gif"
          },
          {
            "@category": "thumbnail",
            "@height": "32",
            "@width": "219",
            "@_fa": "true",
            "$": "https://api.elsevier.com/content/object/eid/1-s2.0-S2468823117300226-gr1.sml?httpAccept=%2A%2F%2A",
            "@multimediatype": "GIF image file",
            "@type": "IMAGE-THUMBNAIL",
            "@size": "1603",
            "@ref": "gr1",
            "@mimetype": "image/gif"
          },
          {
            "@category": "thumbnail",
            "@height": "26",
            "@width": "219",
            "@_fa": "true",
            "$": "https://api.elsevier.com/content/object/eid/1-s2.0-S2468823117300226-gr2.sml?httpAccept=%2A%2F%2A",
            "@multimediatype": "GIF image file",
            "@type": "IMAGE-THUMBNAIL",
            "@size": "1596",
            "@ref": "gr2",
            "@mimetype": "image/gif"
          },
          {
            "@category": "thumbnail",
            "@height": "147",
            "@width": "219",
            "@_fa": "true",
            "$": "https://api.elsevier.com/content/object/eid/1-s2.0-S2468823117300226-gr3.sml?httpAccept=%2A%2F%2A",
            "@multimediatype": "GIF image file",
            "@type": "IMAGE-THUMBNAIL",
            "@size": "7113",
            "@ref": "gr3",
            "@mimetype": "image/gif"
          },
          {
            "@category": "thumbnail",
            "@height": "77",
            "@width": "219",
            "@_fa": "true",
            "$": "https://api.elsevier.com/content/object/eid/1-s2.0-S2468823117300226-gr4.sml?httpAccept=%2A%2F%2A",
            "@multimediatype": "GIF image file",
            "@type": "IMAGE-THUMBNAIL",
            "@size": "3602",
            "@ref": "gr4",
            "@mimetype": "image/gif"
          },
          {
            "@category": "thumbnail",
            "@height": "77",
            "@width": "219",
            "@_fa": "true",
            "$": "https://api.elsevier.com/content/object/eid/1-s2.0-S2468823117300226-gr5.sml?httpAccept=%2A%2F%2A",
            "@multimediatype": "GIF image file",
            "@type": "IMAGE-THUMBNAIL",
            "@size": "3490",
            "@ref": "gr5",
            "@mimetype": "image/gif"
          },
          {
            "@category": "thumbnail",
            "@height": "133",
            "@width": "219",
            "@_fa": "true",
            "$": "https://api.elsevier.com/content/object/eid/1-s2.0-S2468823117300226-gr6.sml?httpAccept=%2A%2F%2A",
            "@multimediatype": "GIF image file",
            "@type": "IMAGE-THUMBNAIL",
            "@size": "4120",
            "@ref": "gr6",
            "@mimetype": "image/gif"
          },
          {
            "@category": "thumbnail",
            "@height": "90",
            "@width": "219",
            "@_fa": "true",
            "$": "https://api.elsevier.com/content/object/eid/1-s2.0-S2468823117300226-sc1.sml?httpAccept=%2A%2F%2A",
            "@multimediatype": "GIF image file",
            "@type": "IMAGE-THUMBNAIL",
            "@size": "2819",
            "@ref": "sc1",
            "@mimetype": "image/gif"
          },
          {
            "@category": "thumbnail",
            "@height": "164",
            "@width": "189",
            "@_fa": "true",
            "$": "https://api.elsevier.com/content/object/eid/1-s2.0-S2468823117300226-sc2.sml?httpAccept=%2A%2F%2A",
            "@multimediatype": "GIF image file",
            "@type": "IMAGE-THUMBNAIL",
            "@size": "4843",
            "@ref": "sc2",
            "@mimetype": "image/gif"
          },
          {
            "@category": "standard",
            "@height": "200",
            "@width": "500",
            "@_fa": "true",
            "$": "https://api.elsevier.com/content/object/eid/1-s2.0-S2468823117300226-fx1.jpg?httpAccept=%2A%2F%2A",
            "@multimediatype": "JPEG image file",
            "@type": "IMAGE-DOWNSAMPLED",
            "@size": "18741",
            "@ref": "fx1",
            "@mimetype": "image/jpeg"
          },
          {
            "@category": "standard",
            "@height": "200",
            "@width": "500",
            "@_fa": "true",
            "$": "https://api.elsevier.com/content/object/eid/1-s2.0-S2468823117300226-fx10.jpg?httpAccept=%2A%2F%2A",
            "@multimediatype": "JPEG image file",
            "@type": "IMAGE-DOWNSAMPLED",
            "@size": "7864",
            "@ref": "fx10",
            "@mimetype": "image/jpeg"
          },
          {
            "@category": "standard",
            "@height": "200",
            "@width": "500",
            "@_fa": "true",
            "$": "https://api.elsevier.com/content/object/eid/1-s2.0-S2468823117300226-fx11.jpg?httpAccept=%2A%2F%2A",
            "@multimediatype": "JPEG image file",
            "@type": "IMAGE-DOWNSAMPLED",
            "@size": "9430",
            "@ref": "fx11",
            "@mimetype": "image/jpeg"
          },
          {
            "@category": "standard",
            "@height": "200",
            "@width": "500",
            "@_fa": "true",
            "$": "https://api.elsevier.com/content/object/eid/1-s2.0-S2468823117300226-fx12.jpg?httpAccept=%2A%2F%2A",
            "@multimediatype": "JPEG image file",
            "@type": "IMAGE-DOWNSAMPLED",
            "@size": "8342",
            "@ref": "fx12",
            "@mimetype": "image/jpeg"
          },
          {
            "@category": "standard",
            "@height": "200",
            "@width": "500",
            "@_fa": "true",
            "$": "https://api.elsevier.com/content/object/eid/1-s2.0-S2468823117300226-fx13.jpg?httpAccept=%2A%2F%2A",
            "@multimediatype": "JPEG image file",
            "@type": "IMAGE-DOWNSAMPLED",
            "@size": "8021",
            "@ref": "fx13",
            "@mimetype": "image/jpeg"
          },
          {
            "@category": "standard",
            "@height": "200",
            "@width": "500",
            "@_fa": "true",
            "$": "https://api.elsevier.com/content/object/eid/1-s2.0-S2468823117300226-fx14.jpg?httpAccept=%2A%2F%2A",
            "@multimediatype": "JPEG image file",
            "@type": "IMAGE-DOWNSAMPLED",
            "@size": "8279",
            "@ref": "fx14",
            "@mimetype": "image/jpeg"
          },
          {
            "@category": "standard",
            "@height": "200",
            "@width": "500",
            "@_fa": "true",
            "$": "https://api.elsevier.com/content/object/eid/1-s2.0-S2468823117300226-fx15.jpg?httpAccept=%2A%2F%2A",
            "@multimediatype": "JPEG image file",
            "@type": "IMAGE-DOWNSAMPLED",
            "@size": "6209",
            "@ref": "fx15",
            "@mimetype": "image/jpeg"
          },
          {
            "@category": "standard",
            "@height": "200",
            "@width": "500",
            "@_fa": "true",
            "$": "https://api.elsevier.com/content/object/eid/1-s2.0-S2468823117300226-fx16.jpg?httpAccept=%2A%2F%2A",
            "@multimediatype": "JPEG image file",
            "@type": "IMAGE-DOWNSAMPLED",
            "@size": "6232",
            "@ref": "fx16",
            "@mimetype": "image/jpeg"
          },
          {
            "@category": "standard",
            "@height": "200",
            "@width": "500",
            "@_fa": "true",
            "$": "https://api.elsevier.com/content/object/eid/1-s2.0-S2468823117300226-fx17.jpg?httpAccept=%2A%2F%2A",
            "@multimediatype": "JPEG image file",
            "@type": "IMAGE-DOWNSAMPLED",
            "@size": "8215",
            "@ref": "fx17",
            "@mimetype": "image/jpeg"
          },
          {
            "@category": "standard",
            "@height": "200",
            "@width": "500",
            "@_fa": "true",
            "$": "https://api.elsevier.com/content/object/eid/1-s2.0-S2468823117300226-fx18.jpg?httpAccept=%2A%2F%2A",
            "@multimediatype": "JPEG image file",
            "@type": "IMAGE-DOWNSAMPLED",
            "@size": "6235",
            "@ref": "fx18",
            "@mimetype": "image/jpeg"
          },
          {
            "@category": "standard",
            "@height": "200",
            "@width": "500",
            "@_fa": "true",
            "$": "https://api.elsevier.com/content/object/eid/1-s2.0-S2468823117300226-fx19.jpg?httpAccept=%2A%2F%2A",
            "@multimediatype": "JPEG image file",
            "@type": "IMAGE-DOWNSAMPLED",
            "@size": "8289",
            "@ref": "fx19",
            "@mimetype": "image/jpeg"
          },
          {
            "@category": "standard",
            "@height": "200",
            "@width": "500",
            "@_fa": "true",
            "$": "https://api.elsevier.com/content/object/eid/1-s2.0-S2468823117300226-fx2.jpg?httpAccept=%2A%2F%2A",
            "@multimediatype": "JPEG image file",
            "@type": "IMAGE-DOWNSAMPLED",
            "@size": "8138",
            "@ref": "fx2",
            "@mimetype": "image/jpeg"
          },
          {
            "@category": "standard",
            "@height": "200",
            "@width": "500",
            "@_fa": "true",
            "$": "https://api.elsevier.com/content/object/eid/1-s2.0-S2468823117300226-fx20.jpg?httpAccept=%2A%2F%2A",
            "@multimediatype": "JPEG image file",
            "@type": "IMAGE-DOWNSAMPLED",
            "@size": "6232",
            "@ref": "fx20",
            "@mimetype": "image/jpeg"
          },
          {
            "@category": "standard",
            "@height": "200",
            "@width": "500",
            "@_fa": "true",
            "$": "https://api.elsevier.com/content/object/eid/1-s2.0-S2468823117300226-fx21.jpg?httpAccept=%2A%2F%2A",
            "@multimediatype": "JPEG image file",
            "@type": "IMAGE-DOWNSAMPLED",
            "@size": "8287",
            "@ref": "fx21",
            "@mimetype": "image/jpeg"
          },
          {
            "@category": "standard",
            "@height": "200",
            "@width": "500",
            "@_fa": "true",
            "$": "https://api.elsevier.com/content/object/eid/1-s2.0-S2468823117300226-fx22.jpg?httpAccept=%2A%2F%2A",
            "@multimediatype": "JPEG image file",
            "@type": "IMAGE-DOWNSAMPLED",
            "@size": "6239",
            "@ref": "fx22",
            "@mimetype": "image/jpeg"
          },
          {
            "@category": "standard",
            "@height": "200",
            "@width": "500",
            "@_fa": "true",
            "$": "https://api.elsevier.com/content/object/eid/1-s2.0-S2468823117300226-fx23.jpg?httpAccept=%2A%2F%2A",
            "@multimediatype": "JPEG image file",
            "@type": "IMAGE-DOWNSAMPLED",
            "@size": "8314",
            "@ref": "fx23",
            "@mimetype": "image/jpeg"
          },
          {
            "@category": "standard",
            "@height": "200",
            "@width": "500",
            "@_fa": "true",
            "$": "https://api.elsevier.com/content/object/eid/1-s2.0-S2468823117300226-fx24.jpg?httpAccept=%2A%2F%2A",
            "@multimediatype": "JPEG image file",
            "@type": "IMAGE-DOWNSAMPLED",
            "@size": "6253",
            "@ref": "fx24",
            "@mimetype": "image/jpeg"
          },
          {
            "@category": "standard",
            "@height": "200",
            "@width": "500",
            "@_fa": "true",
            "$": "https://api.elsevier.com/content/object/eid/1-s2.0-S2468823117300226-fx25.jpg?httpAccept=%2A%2F%2A",
            "@multimediatype": "JPEG image file",
            "@type": "IMAGE-DOWNSAMPLED",
            "@size": "10473",
            "@ref": "fx25",
            "@mimetype": "image/jpeg"
          },
          {
            "@category": "standard",
            "@height": "200",
            "@width": "500",
            "@_fa": "true",
            "$": "https://api.elsevier.com/content/object/eid/1-s2.0-S2468823117300226-fx26.jpg?httpAccept=%2A%2F%2A",
            "@multimediatype": "JPEG image file",
            "@type": "IMAGE-DOWNSAMPLED",
            "@size": "5982",
            "@ref": "fx26",
            "@mimetype": "image/jpeg"
          },
          {
            "@category": "standard",
            "@height": "200",
            "@width": "500",
            "@_fa": "true",
            "$": "https://api.elsevier.com/content/object/eid/1-s2.0-S2468823117300226-fx27.jpg?httpAccept=%2A%2F%2A",
            "@multimediatype": "JPEG image file",
            "@type": "IMAGE-DOWNSAMPLED",
            "@size": "8698",
            "@ref": "fx27",
            "@mimetype": "image/jpeg"
          },
          {
            "@category": "standard",
            "@height": "200",
            "@width": "500",
            "@_fa": "true",
            "$": "https://api.elsevier.com/content/object/eid/1-s2.0-S2468823117300226-fx28.jpg?httpAccept=%2A%2F%2A",
            "@multimediatype": "JPEG image file",
            "@type": "IMAGE-DOWNSAMPLED",
            "@size": "7126",
            "@ref": "fx28",
            "@mimetype": "image/jpeg"
          },
          {
            "@category": "standard",
            "@height": "200",
            "@width": "500",
            "@_fa": "true",
            "$": "https://api.elsevier.com/content/object/eid/1-s2.0-S2468823117300226-fx29.jpg?httpAccept=%2A%2F%2A",
            "@multimediatype": "JPEG image file",
            "@type": "IMAGE-DOWNSAMPLED",
            "@size": "7539",
            "@ref": "fx29",
            "@mimetype": "image/jpeg"
          },
          {
            "@category": "standard",
            "@height": "200",
            "@width": "500",
            "@_fa": "true",
            "$": "https://api.elsevier.com/content/object/eid/1-s2.0-S2468823117300226-fx3.jpg?httpAccept=%2A%2F%2A",
            "@multimediatype": "JPEG image file",
            "@type": "IMAGE-DOWNSAMPLED",
            "@size": "10795",
            "@ref": "fx3",
            "@mimetype": "image/jpeg"
          },
          {
            "@category": "standard",
            "@height": "200",
            "@width": "500",
            "@_fa": "true",
            "$": "https://api.elsevier.com/content/object/eid/1-s2.0-S2468823117300226-fx30.jpg?httpAccept=%2A%2F%2A",
            "@multimediatype": "JPEG image file",
            "@type": "IMAGE-DOWNSAMPLED",
            "@size": "8268",
            "@ref": "fx30",
            "@mimetype": "image/jpeg"
          },
          {
            "@category": "standard",
            "@height": "200",
            "@width": "500",
            "@_fa": "true",
            "$": "https://api.elsevier.com/content/object/eid/1-s2.0-S2468823117300226-fx31.jpg?httpAccept=%2A%2F%2A",
            "@multimediatype": "JPEG image file",
            "@type": "IMAGE-DOWNSAMPLED",
            "@size": "5238",
            "@ref": "fx31",
            "@mimetype": "image/jpeg"
          },
          {
            "@category": "standard",
            "@height": "200",
            "@width": "500",
            "@_fa": "true",
            "$": "https://api.elsevier.com/content/object/eid/1-s2.0-S2468823117300226-fx32.jpg?httpAccept=%2A%2F%2A",
            "@multimediatype": "JPEG image file",
            "@type": "IMAGE-DOWNSAMPLED",
            "@size": "6587",
            "@ref": "fx32",
            "@mimetype": "image/jpeg"
          },
          {
            "@category": "standard",
            "@height": "200",
            "@width": "500",
            "@_fa": "true",
            "$": "https://api.elsevier.com/content/object/eid/1-s2.0-S2468823117300226-fx33.jpg?httpAccept=%2A%2F%2A",
            "@multimediatype": "JPEG image file",
            "@type": "IMAGE-DOWNSAMPLED",
            "@size": "5522",
            "@ref": "fx33",
            "@mimetype": "image/jpeg"
          },
          {
            "@category": "standard",
            "@height": "200",
            "@width": "500",
            "@_fa": "true",
            "$": "https://api.elsevier.com/content/object/eid/1-s2.0-S2468823117300226-fx34.jpg?httpAccept=%2A%2F%2A",
            "@multimediatype": "JPEG image file",
            "@type": "IMAGE-DOWNSAMPLED",
            "@size": "6076",
            "@ref": "fx34",
            "@mimetype": "image/jpeg"
          },
          {
            "@category": "standard",
            "@height": "200",
            "@width": "500",
            "@_fa": "true",
            "$": "https://api.elsevier.com/content/object/eid/1-s2.0-S2468823117300226-fx35.jpg?httpAccept=%2A%2F%2A",
            "@multimediatype": "JPEG image file",
            "@type": "IMAGE-DOWNSAMPLED",
            "@size": "6309",
            "@ref": "fx35",
            "@mimetype": "image/jpeg"
          },
          {
            "@category": "standard",
            "@height": "200",
            "@width": "500",
            "@_fa": "true",
            "$": "https://api.elsevier.com/content/object/eid/1-s2.0-S2468823117300226-fx4.jpg?httpAccept=%2A%2F%2A",
            "@multimediatype": "JPEG image file",
            "@type": "IMAGE-DOWNSAMPLED",
            "@size": "8672",
            "@ref": "fx4",
            "@mimetype": "image/jpeg"
          },
          {
            "@category": "standard",
            "@height": "200",
            "@width": "500",
            "@_fa": "true",
            "$": "https://api.elsevier.com/content/object/eid/1-s2.0-S2468823117300226-fx5.jpg?httpAccept=%2A%2F%2A",
            "@multimediatype": "JPEG image file",
            "@type": "IMAGE-DOWNSAMPLED",
            "@size": "7697",
            "@ref": "fx5",
            "@mimetype": "image/jpeg"
          },
          {
            "@category": "standard",
            "@height": "200",
            "@width": "500",
            "@_fa": "true",
            "$": "https://api.elsevier.com/content/object/eid/1-s2.0-S2468823117300226-fx6.jpg?httpAccept=%2A%2F%2A",
            "@multimediatype": "JPEG image file",
            "@type": "IMAGE-DOWNSAMPLED",
            "@size": "7867",
            "@ref": "fx6",
            "@mimetype": "image/jpeg"
          },
          {
            "@category": "standard",
            "@height": "200",
            "@width": "500",
            "@_fa": "true",
            "$": "https://api.elsevier.com/content/object/eid/1-s2.0-S2468823117300226-fx7.jpg?httpAccept=%2A%2F%2A",
            "@multimediatype": "JPEG image file",
            "@type": "IMAGE-DOWNSAMPLED",
            "@size": "8010",
            "@ref": "fx7",
            "@mimetype": "image/jpeg"
          },
          {
            "@category": "standard",
            "@height": "200",
            "@width": "500",
            "@_fa": "true",
            "$": "https://api.elsevier.com/content/object/eid/1-s2.0-S2468823117300226-fx8.jpg?httpAccept=%2A%2F%2A",
            "@multimediatype": "JPEG image file",
            "@type": "IMAGE-DOWNSAMPLED",
            "@size": "10010",
            "@ref": "fx8",
            "@mimetype": "image/jpeg"
          },
          {
            "@category": "standard",
            "@height": "200",
            "@width": "500",
            "@_fa": "true",
            "$": "https://api.elsevier.com/content/object/eid/1-s2.0-S2468823117300226-fx9.jpg?httpAccept=%2A%2F%2A",
            "@multimediatype": "JPEG image file",
            "@type": "IMAGE-DOWNSAMPLED",
            "@size": "8561",
            "@ref": "fx9",
            "@mimetype": "image/jpeg"
          },
          {
            "@category": "standard",
            "@height": "92",
            "@width": "640",
            "@_fa": "true",
            "$": "https://api.elsevier.com/content/object/eid/1-s2.0-S2468823117300226-gr1.jpg?httpAccept=%2A%2F%2A",
            "@multimediatype": "JPEG image file",
            "@type": "IMAGE-DOWNSAMPLED",
            "@size": "10533",
            "@ref": "gr1",
            "@mimetype": "image/jpeg"
          },
          {
            "@category": "standard",
            "@height": "62",
            "@width": "527",
            "@_fa": "true",
            "$": "https://api.elsevier.com/content/object/eid/1-s2.0-S2468823117300226-gr2.jpg?httpAccept=%2A%2F%2A",
            "@multimediatype": "JPEG image file",
            "@type": "IMAGE-DOWNSAMPLED",
            "@size": "8388",
            "@ref": "gr2",
            "@mimetype": "image/jpeg"
          },
          {
            "@category": "standard",
            "@height": "215",
            "@width": "320",
            "@_fa": "true",
            "$": "https://api.elsevier.com/content/object/eid/1-s2.0-S2468823117300226-gr3.jpg?httpAccept=%2A%2F%2A",
            "@multimediatype": "JPEG image file",
            "@type": "IMAGE-DOWNSAMPLED",
            "@size": "14040",
            "@ref": "gr3",
            "@mimetype": "image/jpeg"
          },
          {
            "@category": "standard",
            "@height": "251",
            "@width": "715",
            "@_fa": "true",
            "$": "https://api.elsevier.com/content/object/eid/1-s2.0-S2468823117300226-gr4.jpg?httpAccept=%2A%2F%2A",
            "@multimediatype": "JPEG image file",
            "@type": "IMAGE-DOWNSAMPLED",
            "@size": "32616",
            "@ref": "gr4",
            "@mimetype": "image/jpeg"
          },
          {
            "@category": "standard",
            "@height": "253",
            "@width": "716",
            "@_fa": "true",
            "$": "https://api.elsevier.com/content/object/eid/1-s2.0-S2468823117300226-gr5.jpg?httpAccept=%2A%2F%2A",
            "@multimediatype": "JPEG image file",
            "@type": "IMAGE-DOWNSAMPLED",
            "@size": "31736",
            "@ref": "gr5",
            "@mimetype": "image/jpeg"
          },
          {
            "@category": "standard",
            "@height": "457",
            "@width": "753",
            "@_fa": "true",
            "$": "https://api.elsevier.com/content/object/eid/1-s2.0-S2468823117300226-gr6.jpg?httpAccept=%2A%2F%2A",
            "@multimediatype": "JPEG image file",
            "@type": "IMAGE-DOWNSAMPLED",
            "@size": "32416",
            "@ref": "gr6",
            "@mimetype": "image/jpeg"
          },
          {
            "@category": "standard",
            "@height": "231",
            "@width": "565",
            "@_fa": "true",
            "$": "https://api.elsevier.com/content/object/eid/1-s2.0-S2468823117300226-sc1.jpg?httpAccept=%2A%2F%2A",
            "@multimediatype": "JPEG image file",
            "@type": "IMAGE-DOWNSAMPLED",
            "@size": "22675",
            "@ref": "sc1",
            "@mimetype": "image/jpeg"
          },
          {
            "@category": "standard",
            "@height": "603",
            "@width": "696",
            "@_fa": "true",
            "$": "https://api.elsevier.com/content/object/eid/1-s2.0-S2468823117300226-sc2.jpg?httpAccept=%2A%2F%2A",
            "@multimediatype": "JPEG image file",
            "@type": "IMAGE-DOWNSAMPLED",
            "@size": "49423",
            "@ref": "sc2",
            "@mimetype": "image/jpeg"
          },
          {
            "@category": "standard",
            "@_fa": "true",
            "$": "https://api.elsevier.com/content/object/eid/1-s2.0-S2468823117300226-mmc1.doc?httpAccept=%2A%2F%2A",
            "@multimediatype": "Microsoft Word file",
            "@type": "APPLICATION",
            "@size": "628224",
            "@ref": "mmc1",
            "@mimetype": "application/word"
          }
        ]
      },
      "link": {
        "@rel": "abstract",
        "@href": "https://api.elsevier.com/content/abstract/scopus_id/85026531784"
      }
    }
  }
}